place_id,name,address,latitude,longitude
"ChIJl1dIh6_A1DsRhstHirAhrJU","IndianOil","near Medical College Road, Medical Chowk, Untkhana, Nagpur","21.1313601","79.098524"
"ChIJ11B9zO7A1DsRWFLKVkOeHR0","IndianOil","Ground Floor, RBI Square, Sitabuldi, Nagpur","21.1522853","79.08127350000001"
"ChIJwbhZROTA1DsRGffili9GJrA","IndianOil","Residency Road, Sadar, Nagpur","21.160225","79.079399"
"ChIJd2QlVrjA1DsR2nOG_alEyxw","Hindustan Petroleum Corporation Limited","Ground Floor, Agramdevi Chowk, near Agyaram Devi Mandir, Nagpur","21.143251","79.095421"
"ChIJ2SQrw7BQ2jsRkZ26VLnlCRA","Hindustan Petroleum Corporation Limited","Survey No 135 Aurangabad, Express Hwy, APMC Market, Nagpur","21.1426435","79.08090100000001"
"ChIJk1qAYZHA1DsRpS-MADLkXkk","IndianOil","Ground Floor, Panchsheel Square, Nagpur","21.1385853","79.0792733"
"ChIJx-So_brA1DsRIzhS4ADivh8","Nagulwar Bharat Petroleum","43PW+G89, Baidyanath Square, Bus Stand, Rambagh, Nagpur","21.136299","79.0958696"
"ChIJSVZUOMnA1DsRikzxVLS4S5E","Bharat Petrol Pump","Central Avenue, Chhota Loharpura, Gandhibagh, Nagpur","21.150954","79.10243009999999"
"ChIJuyHf6kgU1DsRhHGOIZASqC4","IndianOil","Ground Floor, Wardha Road, Arvi","21.1341234","79.0758578"
"ChIJt8aQKLLA1DsRmbNHWfBcUkU","BPCL - Ramesh Petroleum","44P3+JPM, Great Nag Road, Ashok Square, Near Durga Temple, Siraspeth, Nagpur","21.1365764","79.10428189999999"
"ChIJl6l6honA1DsRjTPTBh_AyoI","Hindustan Petroleum Corporation Limited","Ground Floor, near Alankar Talkies, North Ambazari Road, Nagpur","21.137461","79.066651"
"ChIJ6VcVeV_A1DsRPdOb0zIunZ8","Hindustan Petroleum Corporation Limited","Ground Floor, near RTO Office, Amravati Road, Gorepeth, Nagpur","21.146761","79.064111"
"ChIJCYPBuWPA1DsRsPcT5trU7F0","Bharat Petroleum","1 West High Court Road, North Ambazari Road, Shankar Nagar, Nagpur","21.1357011","79.0609229"
"ChIJFTWBxTvA1DsRfWBXy6UpCi0","Bharat Petroleum, Petrol Pump -Marwah & Company","LAW COLLEGE SQUARE, A'VATI, Nagpur","21.1464421","79.0615624"
"ChIJu_HJSRzB1DsRhbiNTGH_bXM","Bharat Petrol Pump","Koradi Road, Opp Poonam Chamber, Chhaione, Rajnagar, Nagpur","21.1714399","79.0799102"
"ChIJLwD5PCnB1DsRAGct0COY7Rk","IndianOil","5, Kamptee Road, Near Indora Chowk, Nagpur","21.1736917","79.1014206"
"ChIJJ_pqcirH1DsR0IVA36dXfpg","IndianOil","P No 931, Vaishali, Mouza, Binaki, Nagpur","21.1694152","79.1135278"
"ChIJyVRC4Km41DsRKjCm1h5rGMk","IndianOil","Ayurvedic Layout, Solanki Patil Wadi, Nagpur","21.123213","79.116638"
"ChIJccXQf3-_1DsRXU0XBJ9FCWU","IndianOil","Khasra No, 34 & 3, Surendra Nagar, Ajni, Nagpur","21.1170743","79.0644085"
"ChIJm2DhG9bG1DsRTDs4LkWvo0g","Bharat Petroleum Vishwakarma Petroleum","2, Itwari Station Road, Sugat Nagar, Binaki, Nagpur","21.1707593","79.11618349999999"
"ChIJLcWOx9y91DsR_7pn4i89-qw","Nayara Petrol Pump","Jamtha","21.0137662","79.0461179"
"ChIJv_0lRW--1DsR0iI23GB8UtM","IndianOil","No 119, Central Avenue, Amravati Road, Nagpur","21.041848","79.0518101"
"ChIJPWsk0Fy-1DsRwG2Z5qDjPt0","Bharat petroleum Amin Khapri","Chandrapur - Nagpur Road, Nagpur","21.0523421","79.0537974"
"ChIJVVWSDrnPADsRofIaXn5st-w","Reliance Petroleum","No 40/3B, 4 & 10 Thiruparankundram Road, National Highway 44, Pasumalai, Madurai","21.0229385","79.04738789999999"
"ChIJm-hzZwC_1DsR6lRnLdBtlic","IndianOil","Ground Floor, Amravati Road, Wardha Road, Parsodi","21.032718","79.05230700000001"
"ChIJ51REegC_1DsR_92AxSDvTsk","Hindustan Petroleum Corporation Limited","Ground Floor, near National Cancer Institute, Outer Ring Road, Jamtha","21.0290286","79.0311329"
"ChIJu0ek7uq91DsROMLfPnxo3w4","IndianOil","National Highway 44, Jamtha","21.0025104","79.0402077"
"ChIJtWiDzri_1DsRuw3ktubLSqs","Petrol Pump","tuli petrol pump, Khapri","21.042637","79.05176159999999"
"ChIJEdxgwha_1DsRRqg6UYh9dUU","MODERN FUEL LINKS","23X3+92M, National Highway 44, nipor","21.04846749999999","79.0525613"
"ChIJZYfw6Jy_1DsR0S3-qSaVkEk","NINAVE CL1","Outer Ring Road, Nagpur","21.0342108","79.0769078"
"ChIJcdOZVQC_1DsRV_054HENkYw","J.k Farm","Tal. dindori, Dahegaon","21.0409412","79.0249516"
"ChIJ6fJPCXq91DsR-zf31bg2xeU","Bharat Petroleum, Petrol Pump -Industrial Explosives Pvt. Ltd.","DONGARGAON, Wardha Road, NAGP","20.9908465","79.0316067"
"ChIJKdlGTFa_1DsRqCyvGt6TIUY","Bharat Petroleum Petrol Pump , AMIN TRANSPORT PVT LTD ADHOC","MADC, Mihan, Nagpur","21.053421","79.03956900000001"
"ChIJN_mZdgC_1DsRwB4m-_Tb0ZU","Refilling station of clean hydrogen","332C+64X, Nagpur","21.049651","79.069372"
"ChIJOzprbrS_1DsRe7a24RDUc_0","Hindustan Petroleum Corporation Limited","Khasra No 157/2, Chinchbhavan, near Narayana School, Chandrapur - Nagpur Road, Khapri","21.0631567","79.05759239999999"
"ChIJg1A-h_WX1DsRXzG4X2U7H9Q","Hindustan Petroleum Corporation Limited","Ground Floor, opposite Rachana Hospital, Butibori","20.927601","78.99998099999999"
"ChIJA4zIJh-Y1DsRwxPl3rz368U","IndianOil","Ground Floor, Dudhala, opposite Bus Stand, Nagpur","20.92260199999999","78.999811"
"ChIJcQdhRQCX1DsRWRXxZL35mts","Nayara Energy Retail Outlet","P-23, Satgaon, Bori","20.9285107","79.00068189999999"
"ChIJM4b5Sq6X1DsRMwKZ5yOYvpI","AUK Hotels Pvt ltd","Plot no p23, MIDC, Butibori","20.9284148","79.0005215"
"ChIJj6xV1faX1DsRYPun6k620uc","IndianOil","No 56/B, Tapovan Complex Wardha Road, Khamla, Somalwada, Nagpur","20.93376259999999","79.0053629"
"ChIJxaCJHYqX1DsRiSrUgnIkVI4","IndianOil","Plot No 72 MIDC, Narendra Nagar, Butibori","20.927977","78.9909776"
"ChIJEZwUosOe1DsRmS9fp-LmsEc","Hindustan Petroleum Corporation Limited","Ground Floor, Nagpur Hyderabad Road, NH 7, Chandrapur - Nagpur Road, Sonegaon","20.8118629","78.9593675"
"ChIJt5pUdlOf1DsR1FKWafh2HWo","Borkhedi Fuels","National Highway 44, Nagpur","20.8283366","78.9597963"
"ChIJze8NW36Z1DsRR4lLXGAC_7U","BCIC BPCL Petrol Pump","Aurangabad - Nagpur Road, Dhawalpeth","20.8721353","78.9310813"
"ChIJ66IwyWyb1DsRt8b06jIT10o","Suraj Petroleum","VW89+8JC, National Highway 361","20.8658146","78.9190107"
"ChIJdyNN73if1DsRq9ff-Cjb22w","Hindustan Petroleum Corporation Limited","near Kondhali Nagpur Chandrapur Highway, Gat No 223, A/PA, NH 44 Kandhali, near Kondhali Nagpur Chandrapur Highway, Hydrabad Hwy, Samudrapur","20.744678","78.935609"
"ChIJAUwKt3Kf1DsR1Ucm1pWpEMo","VIVANN PETROLEUM- BPCL PUMP","QW3R+Q7, Barbadi","20.7543878","78.9407043"
"ChIJVanPDRKe1DsR3GamMkAE75M","Bharat Petroleum","India","20.7543898","78.9407031"
"ChIJBVnSrBtj0zsRjrM1jdoZAas","BP RAMPUR, Bharat Petroleum GHAR (COCO) Retail Outlet","NH44, Srinagar - Kanyakumari Highway, Rampur","20.7109929","78.9263024"
"ChIJq2ySSgCf1DsRwZiAp9U8vnU","Jio BP Petrol Pump","QW7W+W5, Barbadi","20.7648419","78.9454398"
"ChIJeVw0OACf1DsRonIY54jVKos","Jio BP","QW7W+W5, Barbadi","20.7648419","78.9454978"
"ChIJOwP-IwJk0zsRq6BZIpg_Hnw","Bharat Petroleum","India","20.6344153","78.9270758"
"ChIJUQy5RgBl0zsRsGNeAAnLVoU","DNR FUEL POINT BPCL","JWMG+PW6, Dahegaon","20.6342872","78.9272806"
"ChIJYcVyswNk0zsR9U8_xrjjA20","Hindustan Petroleum Corporation Limited","Ground Floor, near Jambu Square, NH 7, Nagpur Hyderabad Road, Jamb","20.632446","78.9259837"
"ChIJ-VIfhZ9m0zsRYQEd5SQ5L1U","Hindustan Petroleum Corporation Limited","Survey No 352, Plot No 01, Samudrapur","20.6271621","78.9262931"
"ChIJ9TvoActj0zsR_SuiNClgSMg","IndianOil","Ground Floor Ajada, Samudrapur","20.6616085","78.924752"
"ChIJ89s7qaJn0zsRh3ST2A9oUpU","Bharat Petroleum, Petrol Pump -S R Automobiles","NH 7 JAMB,WARDHA, WARDHA","20.616323","78.9316992"
"ChIJ8xjWB7hm0zsR4xPv_g34raw","Essar Petrol Pump","JXJ3+G8X","20.6313588","78.953346"
"ChIJdanB0BJl0zsR_EM78GppD1g","Jio-bp","Survey No 27, NH 7, Hyderabad Rd, Hinganghat","20.5669404","78.8701751"
"ChIJI446WkVl0zsRfdSmwDS-gG0","Petrol Pump","HV32+M23, Sindhi Colony, Hinganghat","20.55414","78.8500423"
"ChIJQzCcmghw0zsRigApCV6mU04","Bharat Petroleum Petrol Pump","SH-243, Pandharkawda Road, Jawade, Hinganghat","20.5363649","78.8263862"
"ChIJVTEZJCll0zsRTSTa-keZ7UA","Hindustan Petroleum Corporation Limited","Ground Floor, Nandori Road, Hinganghat","20.5522105","78.8571968"
"ChIJM8kTGgBl0zsRidNMNi8Hhk4","K. B. Board mill colony","HV8F+76J, Rimdoh","20.5653574","78.8731063"
"ChIJA8Ln_Kll0zsRLgtlBrhYX6I","IndianOil","Santlock No 11005 Nandori Chowk, Hinganghat, Wela","20.550785","78.848342"
"ChIJn9BZhWtl0zsRw1nOX0F8GMg","M/s. Jai Bhole Petroleum","in front of vittal kamat, mauja, Ajanti","20.5729198","78.8819335"
"ChIJW52bJ9Jl0zsR4ibU3h7G5lo","IndianOil","Gut No 232/1B Ajanti, Hinganghat","20.5742305","78.88269079999999"
"ChIJLb0MN_xv0zsRI3h2Lhs023c","Hindustan Petroleum Corporation Limited","near KVR, Ground Floor Satephal, Satefal, near KVR, Nagri Road, Hinganghat","20.5339721","78.8417101"
"ChIJj4vgD2lx0zsR-vfDQBb34hg","Nayara Petrol Pump - Maa Durga Petroleum","NH-07, At post, tah, Daroda","20.4809483","78.7773069"
"ChIJ5--Vyl1x0zsRqS8OSgT9zrw","Essar Petrol Pump,M/s Maa Durga Petroleum","FQJG+JXW, Daroda, Hinganghat","20.4816206","78.777464"
"ChIJb-a2f6Fx0zsRFCTSt7bxHoQ","Kanishk petrol Pump, (BPCL)","On NH 44, Ghatsavli","20.4886863","78.7812415"
"ChIJRXt2N_xx0zsRhYY4VWxRT80","Hindustan Petroleum Corporation Limited","Gat No 45/2/1, NH 44, Nagpur Hyderabad Hwy, Daroda","20.46634509999999","78.76763319999999"
"ChIJp-ZDs8Bx0zsRhJF7TDkEaL8","Hindustan Petroleum Corporation Limited","Survey No 288/1, NH 44, Nagpur Hyderabad Road, Hinganghat, Ghatsavli","20.497885","78.7856992"
"ChIJZfAmdABx0zsREtUcXfHLVXQ","ARs Energy Retails HPCL Petrol Pump","Hinganghat","20.4595085","78.7639107"
"ChIJzX5ZuQ510zsRcvcPudRUVYg","IndianOil","Survey No 89, Bothuda, Gangapur","20.4094626","78.7414246"
"ChIJSzfL_L6u0zsRsF4TJLkrc4w","BPCL DJ & Sons Petrol Pump","National Highway 44, Srinagar - Kanyakumari Highway, Konghara","20.4311161","78.7444684"
"ChIJ35Av6QcM0zsRRhU2aRoKBnQ","Atram Automobile Petrol Station","NH-07, WADKI, Yavatmal","20.2968156","78.71471319999999"
"ChIJhdOdki4L0zsR1DAmnGGQekQ","Bharat petroleum Aksha petroleum wadaki","Zullar","20.288166","78.7176525"
"ChIJ4fLPqWus0zsR0jyvJW-ugO0","IndianOil","Ground Floor, Akhada Ward, Pandharkawada","20.2864539","78.7194178"
"ChIJF8KAPQAL0zsRAd0d8im9SK8","Bharat Petroleum, Petrol Pump -Shaun Enterprises","WADKI,HYD ROAD,YAVATMAL, YAVATMAL","20.282115","78.719568"
"ChIJb9DxFC4L0zsRHeU6rzXpTZ0","AHILYA INDANE GRAMIN VITRAK WADKI","Khasara No 63, near Kakde Complex, A1, Khairi Road, Yavatmal","20.2748103","78.72114739999999"
"ChIJL6zXnKkL0zsRLfhEucq_V8c","IndianOil","Ground Floor, Ralegaon, Wadki","20.2729135","78.7150928"
"ChIJF40cBgAL0zsRUVscRclsV-g","Nayara Energy Shingare Petroleum","Bori-Ichod","20.2685157","78.7143158"
"ChIJV8YLt54J0zsR3UtT5mjoUnY","Bharat Petroleum, Petrol Pump -Sai Sarthak Petroleum","KINHI, YAVATMAL","20.230264","78.6984738"
"ChIJvXWWfAAJ0zsRp2LAVNon0Q8","युरिया पंप","Wadki","20.2057356","78.6838473"
"ChIJF_DMuMcJ0zsRSUE-Ya7Q9a4","Nayara Petrol Pump - Kanchan Petrolum","Survey No 127/2-B,Plot No.01 at post kinhi(Jawade, Ralegaon","20.2212477","78.6919156"
"ChIJyd4_3voJ0zsR2zSnI2LiX_U","IndianOil","Survey No 61, 2 Kinhi, Ghodkhindi, Yavatmal","20.233686","78.69557580000001"
"ChIJdfLQPwAJ0zsRogLzxqYyHbQ","OM Sai Ram Petrolium","6MMV+MQH, Kinhi Jawade","20.23419419999999","78.69447070000001"
"ChIJo_1rmm-o0zsR3Y2J_aIBTLI","bhasakar auto service ( Bpcl)","Pandharkawada, Yavatmal, NH-930, Wani Yavatmal Highway, Kelpur","20.1379519","78.6243422"
"ChIJL3tW7Nup0zsRxkgBTWmeylc","Shri Jagdamba Bharat Petroleum","4J82+QP, Mangi","20.1166429","78.6018678"
"ChIJAdFPxFGp0zsRwUzmW0Xlnlc","Bharat Petroleum, Petrol Pump- DAWARE SONS","Before Karanji Traffic Police Check Post On LHS Nagpur to Hyderabad Highway NH44, Mangi","20.124286","78.6085495"
"ChIJU91ctL6t0zsR4Mirm5Qoi1o","IndianOil","Ground Floor, Kelapur, Dharna","20.1093176","78.57961039999999"
"ChIJQ6iRI3Wt0zsR5nnhE3VDo1A","R.B MOTORS","main Line main Line","20.0369339","78.5482074"
"ChIJy3CBamus0zsR77-lUtalqgU","Hindustan Petroleum Corporation Limited","Ground Floor, Pandharkawada","20.02721009999999","78.54780099999999"
"ChIJa1nJlyit0zsRXtNyYK1J2LI","Bharat Petroleum, Petrol Pump -D J & Sons Pandarkawda","Pandharkawada","20.0267423","78.54712810000001"
"ChIJRx93qGus0zsRzsMz5Nb_6Xo","IndianOil","Sheet No 8B, Plot No 4/5, Akhada Road, Pandharkawada","20.02571","78.546745"
"ChIJyxdHbpOt0zsR3fkYirUn1-Q","IndianOil","Ground Floor Hnuman Ward, Pandharkawada","20.0181765","78.5406309"
"ChIJf-ZxaVOt0zsRvDkT4U3SLwo","IndianOil","Ground Floor, Hnuman Ward, Pandharkawada","20.0181765","78.5406309"
"ChIJ0zWEFgCv0zsR3hnCSTA2-Tk","Jio BP","3G3W+WFP, Pimpari Road","20.05423279999999","78.5473209"
"ChIJ5_jctcmv0zsRVaes7Km1960","IndianOil","Ground Floor, Akhada ward, Pimpri Road, Kelapur, Pandharkawada","20.0545493","78.5461632"
"ChIJ-7iDsnSv0zsRkz2YC9S1id8","Tamilnadu petrol pump","3G3W+WFP, Pimpari Road","20.0548406","78.54620539999999"
"ChIJ_yG94r6u0zsR2VyhZWoMuBI","Bharat Petroleum DJ & SONS PETROL PUMP KONGHARA","NH 7, POST, PIMPRI, Konghara","20.0724766","78.5472298"
"ChIJi-cfavFT0jsRYMFunY_gUq4","Hindustan Petroleum Corporation Limited","Survey No 43/2, Kelapur, Patanbori, Warha","19.881733","78.558897"
"ChIJQWZHUuRX0jsRJn8uFdPSwS0","Nayara Petrol Pump M/s Shree Ganesh Fuel Station","RHXC+QWF, Pimpari","19.8494472","78.572299"
"ChIJ8QrtJwBX0jsR-ZknTXoI6Ao","BHARAT PETROLEUM,BPCL PETROL PUMP- VARDHAMAN PETROLEUM","VH5C+VXG, National Highway 44, Bori","19.8596921","78.57244539999999"
"ChIJo8krYR1U0jsRZMYm4Ki-65w","IndianOil","Bori","19.8668549","78.5790504"
"ChIJDTEoGwBR0jsR26D8sZGgxF4","Hindustan Petroleum Corporation Limited","RH86+M6W, Kamai","19.8167353","78.5605843"
"ChIJoexc1iBX0jsRHKz9YIkomng","Hindustan Petroleum Corporation Limited","Survey No 27, Jainad, Kamai","19.807111","78.56844099999999"
"ChIJreKDODla0jsR6Q_gza6pvVw","Digital Meeseva Center","PGQX+G37, Bhoraj","19.7387927","78.5476712"
"ChIJbeVMaEpa0jsRBIDtTt-CThA","IndianOil","Lock No D1271 & A3, Collectorate, Adilabad","19.7270001","78.541901"
"ChIJN7KemLFb0jsRyCLWpMPQ21U","Bharat Petrol Pump","PIPPARWADA (ADB OSTS2), KM, Adilabad","19.7414856","78.5473737"
"ChIJ2wL9wxla0jsR-ghPAI4fZAo","IndianOil","India","19.7517607","78.55578249999999"
"ChIJcWtUOgBb0jsRgu8ES9O16Pg","Bhoraj bus Stop","PGRW+9Q, Fouzpur","19.7409427","78.54692759999999"
"ChIJBzJbRxdb0jsRfWsOuLR11xc","IndianOil","Lock No T3/11, C/4/2, Pusai","19.7623032","78.5640008"
"ChIJNdPg37Rb0jsRLuqrvg4diOU","Reliance","India","19.7218024","78.54045099999999"
"ChIJPUPlDfRc0jsRuekChewrINs","IndianOil","L No T3/197, D1/27, No D/1/5, Dasnapur, Adilabad","19.64677529999999","78.5155999"
"ChIJI7t1qSpd0jsR17utni1zxd4","Bharat Petroleum, Petrol Pump -Tirumala Filling Station","SY NO, DASANAPUR, Teachers Colony, Adilabad","19.658908","78.5241999"
"ChIJZbQ9Wm9d0jsRiv2xySFJ6Lc","BPC Sri Vinayaka filling station( Bharat petroleum )","Khoja Colony, Adilabad","19.6432402","78.51353309999999"
"ChIJU2CUKn5c0jsRP_nKdx2-56A","IndianOil","Sy No 31/3, Arhar Bhikhapur,Adilabad Collectorate, Adilabad","19.6695396","78.5219517"
"ChIJt3gwc8ld0jsRt5Ibs6kOBF4","Hindustan Petroleum Corporation Limited","Survey No 13/1, Mavala","19.639182","78.509912"
"ChIJ54ryFKRd0jsRMBVJDg-YfL4","Varun petrol plaza","JGQ5+9RM, Unnamed Road, Khoja Colony, Adilabad","19.63846449999999","78.5095545"
"ChIJKQ5FYexd0jsRxKjNGTHBGmg","NAYARA Petrol Pump","MG8J+X4R, Muncipal Quarters, Ravindra Nagar Colony, Adilabad","19.6675327","78.5300065"
"ChIJDZGBak1d0jsRwIDMlpeF9Ak","BPCL- Srinivasa Fuel Station","behind Basaveshwara statue, Vidya Nagar, Adilabad","19.67249439999999","78.5275486"
"ChIJP5sHh3lc0jsRPsff5G4P6gM","indian mobile","MG9H+XV8, Ponnar, Ravindra Nagar Colony, Adilabad","19.6699245","78.5297001"
"ChIJRban7Q9b0jsRVu4u4t-z4Vs","BPCL - Sri Hari Hara Sai Filling Station","SY NO55/B, Rampur Road, Bhuktapur","19.68117699999999","78.51803500000001"
"ChIJP-Vk4npb0jsRALrlbW8ivB0","HP PETROL PUMP - MEENAKSHI PET.AGENCY SAVARGAON","OFF Rural Police Station Rampur RD Battisavargaon Village","19.6833","78.51120999999999"
"ChIJDUnWqIFb0jsRyHTyjKxXLJU","IndianOil","near Adilabad, Lock No IG386, Survey No 46/3/2/2 Bhuktapur, near Adilabad, Collectorate, Adilabad","19.6787657","78.5231105"
"ChIJt5pYi6db0jsRg22NsLFZwuo","Hindustan Petroleum Corporation Limited","Ground Floor Adilabad Ponnari, Road, Bhattisavargaon","19.6834098","78.5111901"
"ChIJYdQz9yFb0jsRSAqzo312BP4","BSR FILLING STATION Bharat petroleum","road, Sunkidi, Ponnari","19.67719109999999","78.48240539999999"
"ChIJsZ1CZgBd0jsRE1c6vypW3hU","Bharat petroleum","Masood Chowk, Brahmanwadi, Adilabad","19.6702683","78.53743829999999"
"ChIJWcxcjnFb0jsRw8CB-NfZ6I4","IndianOil","Lock No D2, 39/40/41/42/A/7/2 NH 7, Collectorate, Adilabad","19.6771792","78.5336023"
"ChIJMUKDDlBb0jsRGUpOGebO9iI","IndianOil","AA, Sy No 40/AA546E/48, Poosai","19.6592286","78.54223689999999"
"ChIJ1z9o05pb0jsRUgnAztkh5w0","Hindustan Petroleum Corporation Limited","Ground Floor, Adilabad - Nagpur Road, Adilabad","19.682901","78.542091"
"ChIJy6F36Yhb0jsRSBj2xWQwp78","Bharat Petroleum, Petrol Pump -Bp-Adilabad","BHORAJ, NEAR BHORAJ CHECKP, Adilabad","19.6850647","78.5436208"
"ChIJoakHWTZn0jsRWePzf7ZQQQw","IndianOil","Lock No Ig 12009 Lock No/93, D1, National Highway 44, Gudihathinur","19.5382037","78.5125893"
"ChIJU-cFF3pn0jsRU08AbCYTnrs","Hindustan Petroleum Corporation Limited","Survey No 31, Utnoor Road, Gudihathinur","19.537501","78.519785"
"ChIJ6eQfe8Bn0jsRXFbfKNOg7UQ","RAHUL KRISHNA FILLING STATION BPCL GUDIHATNOOR","near new hanuman temple, Xroad, near new hanuman temple, Gudihathinur","19.53421819999999","78.5149055"
"ChIJMXmKVatn0jsRHCqFlbejjCM","Bharat Petroleum","India","19.5342502","78.5149701"
"ChIJ7XjY1Atd0jsREdtRdVOiw-Y","Dharvi Petroleum Bharat Petroleum","Sy no 13, kamalapur, Gudihathinur","19.5882165","78.49115130000001"
"ChIJr4RYNltd0jsRuyewJHpF8_A","Hindustan Petroleum Corporation Limited","Survey No 14/B, Gudihathinur","19.590621","78.489892"
"ChIJ76eXwURd0jsRU-HaE5P6Pwk","Hindustan Petroleum Corporation Limited","Survey No 85, Adilabad Hyderabad Road, Talamadugu, Pangadpipri","19.592495","78.490622"
"ChIJ_YJzJLFn0jsRcehyM6GMMpM","IndianOil","L No 410/11/D1/F, National Highway 44, Kamalapur","19.497295","78.500962"
"ChIJVW9NbHJm0jsR9NErn3FVE_Q","IndianOil","Gudihathinur","19.497246","78.5019281"
"ChIJf67xbgBx0jsRhW8oWQT5NRM","Def filling station TATA LEYLAND etc","9C8M+2HF, Kupti (Khurd)","19.36505159999999","78.43393619999999"
"ChIJI5tkQsFv0jsREzDJ-ltAhkY","Indian Oil","India","19.4075771","78.44814319999999"
"ChIJiWA6QsFv0jsRPvpZh7DdF9Q","Bharat Petroleum BP Petrol Pump / Gas Station","National Highway 44, Adegaon Buzurg","19.4076414","78.44810679999999"
"ChIJa3GdixNv0jsRi9JOiAW14IM","SSV filling station","Shop No 2233, Ichoda","19.413527","78.4503842"
"ChIJs9L77b9v0jsRTmDtF_JL7Yo","Hindustan Petroleum Corporation Limited","S No 10, E Ichoda, Adegaon Buzurg","19.413461","78.45136099999999"
"ChIJBwxPIXNv0jsRACAkm6uQWoQ","IndianOil","Survey No 104/5, Adegaon, Ichoda","19.421284","78.451143"
"ChIJJ3B8mqJv0jsRD7rCNRdZg0k","SAI SRINIVASA FILLING STATION","","19.4264419","78.4517786"
"ChIJ2Xdf9aVv0jsRnmtpzAgdEIE","Hindustan Petroleum Corporation Limited","Sy No 59, A/5, Ichoda Bazarhatnoor Road, Ichoda, Adegaon","19.428178","78.441215"
"ChIJMXjq3q5v0jsR6fHCwXAL954","Bharat Petroleum","India","19.4282325","78.4379941"
"ChIJnbbIQgBx0jsRpQ2BPq_vos0","Barath petroleum pump","8C44+FQM, Neradigonda 2","19.306233","78.40693999999999"
"ChIJRTinOWhx0jsRioIzYMO8qRQ","Hindustan Petroleum Corporation Limited","Survey No 23, 5/2, Neradigonda 2","19.3162315","78.4112652"
"ChIJ3XEQLA6JzTsRwkvT3YcCgXY","Hindustan Petroleum Corporation Limited","Survey No 11, E Mamda, Burugupalle","19.157188","78.464171"
"ChIJizAOdQCJzTsRpujDOK7JVEY","DEF Filling Station","5F46+8P, Gayadpalle","19.1559206","78.46202629999999"
"ChIJO8cHSAWJzTsRYkvYNRtEXoM","IndianOil","Lock No T3/96/C/6/3 Nirmal Bypass, NH7, Burugpally, Buggaram","19.1559031","78.46226899999999"
"ChIJTSEfmjKPzTsRjxwKAYtmDPQ","JK FILLING STATION NAYARA PETROLEUM","3CP6+W77, Nirmal - Mancherial Road","19.0872778","78.4106791"
"ChIJRWBGfpCPzTsRxPE8VgfqK2E","Hindustan Petroleum Corporation Limited","Sy No 222, Nirmal, Khanapur Road, Ratnapurkandla","19.085589","78.422586"
"ChIJCXXPTPWNzTsRFkB_Uak3PuY","Hindustan Petroleum Corporation Limited","Survey No 1086, Nirmal - Mancherial Road, Venkatapur","19.086198","78.351012"
"ChIJR7M9e2-MzTsRz3I8eVHlLjo","New Maruthi Petrol","India","19.0864334","78.35056159999999"
"ChIJhy7lGwCNzTsR1a2UG6AE3SM","Hindustan Petroleum Corporation Limited","Ground Floor, Adilabad Road, Nirmal","19.0956918","78.34336789999999"
"ChIJeTIZL7uNzTsRBkAI0EF3Tsc","Bharat Petroleum, Petrol Pump -Chitkeshi Vishwanath Narsimhlu","NIRMAL TOWN (CVN), NIRMAL, ADILABAD","19.0888185","78.34544950000002"
"ChIJB6mAh5qNzTsRaC56YLxqXjA","KAMAL NAYAN DHANANIWALA NIRMAL","Shop No 07, Indira Nagar, Nirmal","19.0909959","78.34441029999999"
"ChIJuw4WWHuMzTsR4f49uAUesqc","IndianOil","Lock No D177, A4/2, National Highway 44, Bangalpet, Nirmal","19.091101","78.344201"
"ChIJAU_xQVuNzTsRbwckruqOq44","IndianOil","Lock No 74/75, D1, D, National Highway 44, Bangalpet, Nirmal","19.086201","78.346501"
"ChIJRboh-IKLzTsRjjM-HQon3GA","Hindustan Petroleum Corporation Limited","Survey No 2215, Bhail Bazar, Budhwarpet, Nirmal","19.110018","78.340856"
"ChIJExs7T7WNzTsRU2AN87azuQU","Bharat Petroleum, Petrol Pump -Aishwarya Filling Station","3CMJ+4X6, Kanakapur","19.0115055","78.3679788"
"ChIJcZW9Gb-NzTsRM9t7HB12C8w","IndianOil","Survey No 815/Aa, Bangalpet, Kadthal","19.0359614","78.3590737"
"ChIJsyRnpiWSzTsR2YMQFs4znbc","Hindustan Petroleum Corporation Limited","Survey No 324/1, NH 44, Nagpur Road, Pochampad, Hyderabad","18.9766091","78.3759642"
"ChIJPT78CrGNzTsR6fKnVY_XZwA","Hindustan Petroleum Corporation Limited","Survey No 176, Hyderabad Road, AA/2, Soan","19.058681","78.352217"
"ChIJodzXfO2TzTsR5Zhf45ZZntQ","Bharat Petroleum COCO Pump, BP MUPKAL","W9F6+8RF, Asian Highway 43, Nallur","18.9233021","78.362055"
"ChIJOWRybouTzTsR0s_qvgMh3nE","IndianOil","BADDAM MUTHYAM REDDY,MUPKAL, National Highway 44, Ratnapur","18.919802","78.35943549999999"
"ChIJiWC-FymTzTsRhBm0-Xwog6c","Hindustan Petroleum Corporation Limited","Survey No 87/3A, NH 44, Hyderabad Nagpur Road, Mupkal","18.9263411","78.3637473"
"ChIJj2EizqaTzTsRH3th6kDCQ_s","Charitha Fuel Station","87/3a, Nallur","18.9264435","78.3637396"
"ChIJKZIFI2-UzTsRY1kq38jItok","Hindustan Petroleum Corporation Limited","Survey No, 990 & 991, Road, Balkonda, Kisannagar","18.8982487","78.35237099999999"
"ChIJQTCN64GVzTsRTTOv4UvGkns","IndianOil","Survey No 50/60E, Beside Pochamma Temple, 50/6A, Balkonda, Fathepur","18.84665099999999","78.30890200000002"
"ChIJ84-y1mOVzTsRL3ICuC1LO7M","Hindustan Petroleum Corporation Limited","Survey No 1522/A, 1519 & 1521/EE, Balkonda","18.8544201","78.33126109999999"
"ChIJmc9ua96_zTsRM_R4lqGYnqA","Bharat Petroleum, Petrol Pump -Sri Laxmi Filling Station","PERKIT MAHILAPRANGANAM, NIZAMABAD","18.8139659","78.3177278"
"ChIJLbriJQGVzTsR9-qSkaM1M1A","IndianOil","Ground Floor, Balkonda","18.861676","78.33540599999999"
"ChIJt5zCfAC_zTsRh03pwqfzlgk","CNG armor","R837+HPW, National Highway 44","18.803742","78.314463"
"ChIJrZxLtOm_zTsRk123SJ_37qk","Pervez Filling Station | BPCL and CNG Station","PERKIT, NIRMAL ROAD, NH-7, NIZAMABAD","18.8036952","78.3142936"
"ChIJoSzMgJ-_zTsRvmVaipPNkgw","Hindustan Petroleum Corporation Limited","Survey No 367 & 368, Armoor Road, Perkit","18.7987066","78.3112762"
"ChIJp9gcTrbrzTsRWZSZ9B17-cw","IndianOil","No 815/1/2, Pipri","18.821154","78.2839515"
"ChIJQQNqcMjBzTsRVivseyC_l3E","IndianOil","National Highway 44, Argul","18.75494789999999","78.28145529999999"
"ChIJtRcwVBjBzTsRSKOfJvZbCf0","Bharat Petroleum Petrol Pump , GORTHARAJANNA & SON FILLING STATION","SY NO 276, National Highway 44","18.7579803","78.2839065"
"ChIJtfJAYP7BzTsRfVo1ArMy9s4","IndianOil","Mamidipally, Ground Floor NH 7, Armur","18.765555","78.29043899999999"
"ChIJww7W-WXBzTsRKY_8QOhMzxs","M/s Balaji Filling Station, Mamidipally ,Armoor","Q78R+CGH, National Highway 44, Armur","18.7660617","78.2913725"
"ChIJr2H263-_zTsRcDU96VY3nxE","IndianOil","Ground Floor, Ankapur","18.769634","78.294339"
"ChIJGXjD8ZrBzTsRY_2PHgBYzGw","Hindustan Petroleum Corporation Limited","Survey No 761, A2 & A3, NH 44, Hyderabad Nagpur Road, Jakranpalle","18.7253591","78.2740455"
"ChIJG_wcILrHzTsRfQ3riwXrwGM","IndianOil","Ground Floor Argul, Andhra Pradesh, Jakranpalle","18.7249741","78.2731976"
"ChIJV8aQAtPBzTsRn7eWxUHpEAM","Kanka Lakshmi Narasimha Kisan Seva Kendra","5-7, Morthad Villege Road, Suresh Colony, Morthad","18.7823719","78.2873877"
"ChIJYfvwYYPBzTsRKIXVftBOYlc","NAVANATHA FILLING STATION","National Highway 63, Armur","18.7865725","78.2841993"
"ChIJHa_FQgLBzTsRCFr3-zea0sk","IndianOil","S No 559, Ankapoor Road, Armur","18.774672","78.252332"
"ChIJyyCj6lPAzTsReFYI59Q7LJM","Fuelpoint, Ankapur Petrol Bunk","NH 16, Ankapur","18.7750005","78.2520533"
"ChIJoXRyZI-_zTsREWw59gja6xQ","Hindustan Petroleum Corporation Limited","Survey No 110, near Raja Ramesh Theatre, NH 7, Hyderabad Nagpur Road, Mamidipally, Armur","18.7830254","78.30074599999999"
"ChIJS79jh3PAzTsR5K5OWy8fLko","IndianOil","Ground Floor NH 16, Ankapur","18.788794","78.28946599999999"
"ChIJ4agA8DrBzTsRiH_WB5w4XKY","Bharat Petroleum, Petrol Pump -Mohd. Saleh & Co.,","SY NO 431/3, Armur","18.7899094","78.28783399999999"
"ChIJy4Uxoi6_zTsRsoUuDz9r6MM","Kanaka Lakshmi Narasimha Kisan Seva Kendra","5-8 Nizamabad To, Nizamabad - Koratla Road, Suresh Nagar Colony, Nizamabad","18.7883037","78.2998298"
"ChIJ9ZBIJvbFzTsRT-aRP7i-Nk0","IndianOil","Sy No 430, Chakarnpalli, A & 431/Aa, Nizamabad","18.623718","78.187086"
"ChIJDx2eKWzGzTsRBl0A9Jq44Yc","Hindustan Petroleum Corporation Limited","Survey No 567/Ru, Hyderabad Nagpur Road NH 44, Dichpalle, Mentrajpalle","18.6539604","78.2168724"
"ChIJd5CtgQbGzTsR6jzoTvxtd_k","IndianOil","Survey No 652/A, Suddapalli","18.633186","78.207645"
"ChIJP-a0e9nFzTsRifu-1txZKY0","RAGAVA Enterprises Bharat Petroleum & CNG","Nadipalli, Nadepalle","18.6246909","78.1870275"
"ChIJEe0DwL7FzTsRJaQTnLkRD9w","KABS AUTOLINES HPCL","Dichpally","18.63591659999999","78.1775729"
