place_id,name,address,latitude,longitude
"ChIJYzHwDRyQ4TgRdptkkdl_dLo","United Service Station ( BHARAT PETROLEUM CORPORATION LTD.","National Highway 1A, Srinagar","34.06733000000001","74.77535639999999"
"ChIJp55zpneP4TgRj3MDnGEbOL8","Bharat Petroleum","3RGH+MX3, Gupkar Road, Srinagar","34.076647","74.8299165"
"ChIJUTQzMHKP4TgRXscaU8NxR0Y","Bharat Petroleum Petrol Filling Station","3RFP+7MR, National Highway 1A, Srinagar","34.0732485","74.836641"
"ChIJufBKwRmF4TgRiBpPqYF5fV8","Hindustan Petroleum Corporation Limited","No 11 Noushera, Srinagar","34.1204917","74.8078927"
"ChIJZYmee_SP4TgRp-nqjyktjLM","IndianOil","Ground Floor, Srinagar","34.080849","74.800507"
"ChIJnUltxGiP4TgR9TaKuPgbilM","BP Petrol Pump","3QJQ+P7Q, Srinagar","34.0818294","74.7882224"
"ChIJEUrM7_GP4TgRpt7lUsor0XU","Blitz Filling Station","3QGW+4WC, Srinagar","34.0753012","74.79728089999999"
"ChIJMXmb5fGP4TgRKWZ4rLqo5J0","Hindustan Petroleum Corporation Limited","Ground Floor, Amira Kadal Bridge, Karan Nagar Road, Srinagar","34.07493339999999","74.7971429"
"ChIJgyaUoUCP4TgRDddpxy1m5UI","IndianOil","Ground Floor, Srinagar","34.0738699","74.80062989999999"
"ChIJtTS944aP4TgRTg3c1J6T_Cw","IndianOil","Bab E Dam, Srinagar","34.0852957","74.81950669999999"
"ChIJRU68cz2b4TgRyo9A53suHW4","IndianOil","Chathabal, Baramulla Road, Srinagar","34.091798","74.77677369999999"
"ChIJ-_lKNIiP4TgR164g85SUxN0","HUSSAINI PETROL PUMP","245, Arigam","34.0624341","74.80278179999999"
"ChIJ9WQCtueR4TgR2EsFFLuXgxQ","Issar Service Station","Police Line, Srinagar","34.0686766","74.7783252"
"ChIJX8y38mmP4TgRP1mGUeNJG9A","IndianOil","Bypass, Srinagar","34.063843","74.783441"
"ChIJz_5VYHmF4TgRZC6piF5IKeE","Rainawari Petrol Pump","3RWC+5FQ, near petrol pump, Shiraz road, Srinagar","34.0954562","74.82122129999999"
"ChIJA3Yfbv6b4TgRAGpSAMuCK24","Bharat Petroleum Petrol Pump , SHYAM LALL & CO.","CHATTABAL, Srinagar","34.095996","74.773698"
"ChIJjVMVA52P4TgRFOPzvPCD_n0","Hindustan Petroleum Corporation Limited","Ground Floor, Hotel Road, Maulana Azad Road, Srinagar","34.075801","74.82470099999999"
"ChIJD4_5Yh6Q4TgRltlU5ffXbQ8","AFCO FILLING STATION","Ground Floor, NH Bypass, Srinagar","34.0657333","74.7777395"
"ChIJXU2fmBuQ4TgRJdq6Br_vr4s","IndianOil","Bemina Bridge, Bypass Main Road Bemina, Srinagar","34.068546","74.773048"
"ChIJ1S1CCs2F4TgRfOo54l14Ijs","Bharat Petroleum, Petrol Pump -Pamposh Filling Station","RAINAWARI ON HAZARATBAL R, Srinagar","34.0934432","74.825429"
"ChIJawid_LYf4jgRMtN0aI3_BKw","IndianOil","Ground Floor Padgampora, Awantipur, City","33.9002001","74.9947"
"ChIJRWLyZiIg4jgRuv2y78fzkXU","Bharat Petroleum Barsoo","BARSOO ON NH44 DIST.PULAW, Pulwama","33.9432893","74.9922641"
"ChIJwRXbFyEg4jgRnm1ABFGNjUU","IndianOil","Ground Floor, Awantipora","33.939502","74.99533699999999"
"ChIJY7qodXeL4TgRgqM77tA-RQU","IndianOil","Ground Floor NH 44, Lethipora","33.9555431","74.9779914"
"ChIJIXYn5Igf4jgRDbCqsqmge-g","Hindustan Petroleum Corporation Limited","Ground Floor, NH 1A, Awantipora","33.9329804","75.0000143"
"ChIJrTUM1gsf4jgRkCrkXttzH44","IndianOil","Ground Floor Awantipur, Anantnag","33.911532","75.017702"
"ChIJYZhkAekb4jgRF_K41BBougs","IndianOil","National Highway 44 Sangam, Bijbehara","33.8223047","75.07468349999999"
"ChIJX_Igarwb4jgR9MkvEJyTvI8","IndianOil","Ground Floor, Sangam","33.82219389999999","75.0739596"
"ChIJva3CcwAb4jgRCvMgF8vqD_A","South kashmir filling station","R3HC+2R4, Sangam","33.8275058","75.07206560000002"
"ChIJqVt09EQb4jgRgzYXDvfcg8Q","IndianOil","JN,DIST, Anantnag","33.8262464","75.06856619999999"
"ChIJsz0Tx2Ic4jgRJubPteTW1yo","IndianOil","Ground Floor, Pulwama Sangam Road, Shopian Road, Watchi","33.8129001","75.0486"
"ChIJX6ynQ54d4jgR_i-4yQr0kxk","Self Business","150, Melahura","33.8063717","75.05144059999999"
"ChIJrffjZBcb4jgRCWOocLnk7nE","Bijbehara Petrol Pump","Q3XW+J7W, NH1A, Bijbehara","33.79911749999999","75.0956934"
"ChIJb8DnfQAd4jgRRuKZrIh3Fmg","Bhat filling station","R3R3+25V, Dogri Pora","33.8401016","75.0529256"
"ChIJ-ZuiQhgb4jgRid25Ao_mDXY","IndianOil","opposite PHE Office, Ground Floor, Bijbehara, opposite PHE Office, Arwani","33.7973044","75.0983372"
"ChIJncNzPxcb4jgRPKM8oVGKQbk","HP PETROL PUMP - R K AUTOCARE","NH-1A, Bijbehara","33.797314","75.09835749999999"
"ChIJf8302mMb4jgR3G-dyS4swQQ","IndianOil","Ground Floor, Bijbehara","33.78750009999999","75.06179999999999"
"ChIJXy5CFekd4jgRq1kGHpRmfrw","Akhtar filling station (Bharat Petroleum - भारत पेट्रोलियम)","NH44 Sethar, Sangam","33.85025509999999","75.0519466"
"ChIJ_aPqutEb4jgRJ8XH_xPe74k","IndianOil","No 1546/421, Bijbehara","33.79481369999999","75.1120933"
"ChIJ24BhVpYd4jgRsfrXfY-RjB0","IndianOil","Ground Floor, Satter, Halmolabijbhera,Arwani","33.8536001","75.04939999999999"
"ChIJa16_AKge4jgRJ9L1E6iDCGs","Crescent Filling Station","Pathan Mohalla, Pulwama NH-1A, Srinagar Jammu, Highway, Bijbehara","33.85568600000001","75.049523"
"ChIJcRHtK8sb4jgRF1Pqdt08Av4","Parray","123, Parraypora","33.7810129","75.0978416"
"ChIJAwqhehAF4jgRvNUjM3hVdCo","Hyder Filling Station","near police post Mir bazar, 20 kulgam road, Anantnag","33.69113209999999","75.1125158"
"ChIJmetnH9YF4jgRKHRzSI-w-h0","Hindustan Petroleum Corporation Limited","Ground Floor, near Jammu Srinagar Road, NH 1A Mir Bazaar Road, Nepora","33.6884917","75.114778"
"ChIJ7z9y8kcH4jgRMwqr7-1ACFs","IndianOil","Ground Floor Nipora, NH 1A Manjmoh","33.687348","75.11616099999999"
"ChIJdagiRwAH4jgRIAYS7whew7U","Bhat Fuel Station Akhran","Akhran","33.6756553","75.10677489999999"
"ChIJNQ_Q1nEF4jgR-xHpSfR5QqU","IndianOil","Ground Floor, Monghal, Acchabal,Brinal Lamar, Achabal","33.7057168","75.129965"
"ChIJ5S6RX0sE4jgRkpACXwzgCos","Hindustan Petroleum Corporation Limited","Ground Floor, NH 1A, near Jammu, Srinagar - Kanyakumari Highway, Laram Jangi Pora","33.7149609","75.10649769999999"
"ChIJhapQSQAH4jgR5Wo9jbshbyw","Naik Fuel Centre","Bhan","33.68152190000001","75.07894569999999"
"ChIJdxSHXScF4jgR1hNR9b0QGv4","HP petrol pump","P4G3+WRW, National Highway 444, Wanpoh","33.72735179999999","75.10458290000001"
"ChIJT4yaTgAF4jgRpy25AvqsNMA","IndianOil","Ground Floor, Wanpoh","33.72748319999999","75.10360709999999"
"ChIJdQi4hwYH4jgRExSMJNv91sg","REZWAN MUSHTAQ","Near Main Road, Mandhole","33.6588423","75.11494929999999"
"ChIJY72Wll0E4jgRmrGv_N-lIRk","Hindustan Petroleum Corporation Limited","Ground Floor, Wanpoh Kulgam Road, Khudwani","33.7216234","75.08568"
"ChIJN2J8ZgAP4jgRPcFI2fCAT50","Abu Hamzah Properties","P524+84P, Bon Dialgam","33.7008408","75.1553319"
"ChIJsx3IbEYG4jgRkol9t5SNJKw","Hasina Filling Station CHECK RAJ WALI Bharat patrol","M45G+C9P, National Highway 44","33.6585883","75.12594279999999"
"ChIJOTxllFcP4jgRN_msVTdGMFs","Hindustan Petroleum Corporation Limited","No 2, Ground Floor ADV Road, Dialgam, near KM Stone, Bon Dialgam","33.7036506","75.1562189"
"ChIJ5fOtqlYP4jgR_hQEzG-pDqs","IndianOil","Ground Floor, Bondalagam, Anantnag","33.6997927","75.160294"
"ChIJjSPgGMQF4jgR2g9stf-4WFc","IndianOil","Ground Floor Khannabal Road, Janglat Mandi, Anantnag","33.7350559","75.1179988"
"ChIJC417YQP3HTkRzQElQ1ssKCM","IndianOil","Ground Floor, Mundah","33.558102","75.1958235"
"ChIJ-eZdGgD3HTkRSRdO4BFb1us","Genuine D.E.F","4, Qazigund","33.5904683","75.175637"
"ChIJo6egw3H3HTkRzoccE34gE_8","Shahabad filling station, chambran dooru","Chambran dooru, 192211","33.5672808","75.20758769999999"
"ChIJ74ZYFgD3HTkRJFktIC54HxQ","Aroush'Z Filling Station","H5VW+JWX, Kreeri, Doru Shahabad","33.5941135","75.1973739"
"ChIJgab1fwD3HTkR6x4zzl5bwPA","DEF STATION AD BLUE PUMP","Ziyarat Sharif, Chaimullah bypass, Qazigund","33.5926972","75.1658388"
"ChIJ6Z7SS1r2HTkRJUMP6tFLpL0","Hindustan Petroleum Corporation Limited","Ground Floor, ADV Road, Doru Shahabad","33.5767544","75.21549759999999"
"ChIJA9l3xuD2HTkRz3OJ5tlDc6M","Jehlum Filling Station Bharat Petroleum","Lower Munda, Kulgam NH-1A, Srinagar, Highway, Jammu","33.548415","75.206206"
"ChIJ19gGNyH3HTkRWAcMuptTFCc","Shahabad filling station chambran dooru","Doru anantnag Kashmir Chambran, Dooru Road, Doru Shahabad","33.5758343","75.2214575"
"ChIJiR-gf_n3HTkRJ72ciuzhnJw","IndianOil","Ground Floor, Manjmoh, Manzmoh","33.59846099999999","75.15999599999999"
"ChIJq-zJ6xb3HTkRVM3zc4s5VRA","HP GAS QAZIGUND","near 100 YARDS DEPARTMENTAL STORE, SHAMPORA, near 100 YARDS DEPARTMENTAL STORE, Qazigund","33.59987229999999","75.1590828"
"ChIJ0VF2qfP3HTkRBlFMo-EZ1OA","M/S .White Hill Filling Station","Kuri Gam","33.5993973","75.155536"
"ChIJBxyFyEX3HTkRSZqeOTkTdCo","Alamdar Filling Station","Dooru Road, Doru Shahabad","33.5610625","75.22993749999999"
"ChIJP67_czzxHTkRWzDLkLoNm4s","Hindustan Petroleum Corporation Limited","Ground Floor, NH 1A Jammu Srinagar Highway, Ramban","33.4371174","75.1954652"
"ChIJkxDqHyrwHTkRf8juNGqS2F8","Shafa Pani Filling Station","Banihal","33.4353923","75.1959074"
"ChIJLd6LRgDxHTkRXVBYA9vT74Y","Petrol pump","C5WR+QP9, Banihal","33.4469055","75.1918549"
"ChIJrZG99wvxHTkRIsHMAIM8HOA","Rahil HP Gas Agency Lamber","F5FJ+667, Rd","33.4730374","75.1805466"
"ChIJKYIqelDDHTkR9crmqlWfe2M","Indian Oil Samaa Filling Station","Ground Floor, Kowbagh, Bhatni, Kawbagh Road, Kawbagh","33.24248","75.23198"
"ChIJb2F1L97BHTkR3wGsAq9JXU0","Sultan Filling Station","45, Ramban","33.20339620000001","75.2919825"
"ChIJkaGGIaTBHTkRQyGNYsX8yOI","IndianOil","Ground Floor, Chanderkote","33.2021685","75.2917271"
"ChIJR5Z0M_jBHTkRZe0s1jKSOl0","Sultan Filling Station","Sultan Filling Station, Ramban","33.1938316","75.29956580000001"
"ChIJoe6FC_fBHTkRU5TqzeMC6ns","Bharat Petroleum, Petrol Pump -Jagat Filling Station","VILL NEERA ON NH-44,RAMBAN, Ramban","33.2255703","75.25678769999999"
"ChIJ7XBr-K_PHTkR6sTRpfdNlUE","IndianOil","Ground Floor Udhampur Ramban, Road, Narsooh","33.020278","75.246527"
"ChIJHdAnhrPSHTkRDqhpNx0p7i4","IndianOil","Ground Floor, Dhar Road, Udhampur","32.90450269999999","75.13723759999999"
"ChIJLScfS6XSHTkRJblzYxU5h20","Bharat Petroleum","W47V+J5G, National Highway 1A, Udhampur","32.9140588","75.14296519999999"
"ChIJT6iQiZDSHTkRUhW4yPYaE6o","IndianOil","Ground Floor Domail, near JK Bank ATM, Udhampur","32.932122","75.14142389999999"
"ChIJp7-fgVwtHDkRw0yq5SRvI1M","HP PETROL PUMP - SURI SERVICE CENTRE","Ground Floor, Dhar - Udhampur Road, Udhampur","32.8859956","75.145505"
"ChIJbTJeeifTHTkReqpNB8XkfOE","Nand Filling Station","Udhampur","32.90893750000001","75.1340625"
"ChIJIS7q8_XTHTkR27CswKdQ-wM","HP DURGA FILLING STATION.","NH-1A NEAR DAK BUNGLOW, Udhampur","32.9159847","75.1416173"
"ChIJ_V5PpOPTHTkR_I4_P56h5BI","M/S HIGHWAY HP CARE","NH 44 Bali nallaha, Udhampur","32.91632499999999","75.14189449999999"
"ChIJawmNQETTHTkR0O5LkZJUuAM","Kalra Auto Fuels","Unnamed Road, Udhampur","32.9121589","75.12198269999999"
"ChIJSZeR7WjTHTkRyJr-d6zU7qU","HP Petrol Pump","near trikuta ice factory, nh1a, near trikuta ice factory, Udhampur","32.92228699999999","75.1255015"
"ChIJHz0CRLjTHTkR3eH5uEm21OQ","Hindustan Petroleum Corporation Limited","Ground Floor Jammu Udhampur Road, Omara, Morh, Udhampur","32.9194306","75.1216441"
"ChIJR9Z_J93SHTkRBAHx8VRdhUo","Hindustan Petroleum Corporation Limited","opposite Sheri Kashmir Police Academy, Ground Floor NH 1A, opposite Sheri Kashmir Police Academy, Udhampur","32.9181832","75.118589"
"ChIJMTTKjpDSHTkRmd37o6gC2rc","Jay Em Garage","Na 1 A, Udhampur","32.9317007","75.1418807"
"ChIJUXWYhZrSHTkRu9k98matbE8","Bharat Petroleum Vasudev Petrol Pump","W4JV+WCW, Dhar Road, Udhampur","32.9326933","75.1435018"
"ChIJzS4g65rSHTkRbYHNAjvn3QE","IndianOil","Ground Floor NH 1A, Udhampur","32.93350199999999","75.144352"
"ChIJH4cYbnLTHTkRRayizeSK4Xc","IndianOil (Khajuria Filling Station)","NH-44, Udhampur","32.9345553","75.1525321"
"ChIJS6QXx3otHDkREANGwFYFfZk","HIGHWAY FUELS HPCL","opp. ROYAL ENFIELD UDHAMPUR, NH44 BATTAL, opp. ROYAL ENFIELD UDHAMPUR, JAMMU SRINAGAR HIGHWAY, Balian","32.8764984","75.118909"
"ChIJJ-JnxwEtHDkR5AQlPps9QQQ","Hindustan Petroleum Corporation Limited","Ground Floor NH44, Srinagar - Kanyakumari Highway, Jammu","32.8763958","75.11909849999999"
"ChIJgdc8JqwtHDkRQI6G6NAO30g","Hindustan Petroleum Corporation Limited","Ground Floor, Dhar - Udhampur Road, Dhal Par","32.82019269999999","75.1528963"
"ChIJjflXLwAzHDkRFjGJznm_neU","Vaid Petro Mart","R5C4+MXQ, Dhar - Udhampur Road, Dhal Par","32.8223578","75.15814189999999"
"ChIJBXgQc1EvHDkR3okKp56BbnI","RAHIBA FUEL HUB","Khasra no 1278, Manwal","32.7728648","75.1520718"
"ChIJZxTwyY47HDkRtxQaOhZYj1A","Krishana filling station baryalta","MAJALTA","32.7152893","75.1761257"
"ChIJ0cP26PovHDkRHi_JwCjqMlc","Hindustan Petroleum Corporation Limited","Ground Floor, Road, Buttal","32.7350811","75.144931"
"ChIJYfu-dmo_HDkR6GSw2YK0c_g","IndianOil","Ground Floor, Ramkot","32.6495903","75.3143346"
"ChIJ58zKWAA5HDkR7zpCFhV7pvc","Bharat petroleum","M7F5+V7P, Deot","32.6747204","75.2582151"
"ChIJwSnqBQAVHDkRO5d7LmIB7O8","Baba Sidh Goriya Filling Station [BPCL Petrol Pump]","Pakka kotha, Challa-Dayalachak Road, Dhalta","32.5128118","75.3314587"
"ChIJ_-scS5MVHDkRGIdicTAP1yg","M/S GEETA FUELS","Pakka Kotha, Village Challan Road, Chak Dayala","32.51240930000001","75.33040179999999"
"ChIJiURPkp1rHDkRmyqqrURtM7M","Hindustan Petroleum Corporation Limited","Ground Floor, Dayalachak Challan Road, Challa","32.54362820000001","75.3508978"
"ChIJJYJVI757HDkRbUgt3JrbjPI","Madhopur Filling Station","MADHOPUR ON PTKT-KATHUA N, Pathankot","32.3624006","75.5968322"
"ChIJqYdbsYB6HDkRvouLjpjyhDo","Bharat Petroleum","no 14, Hatli More Road, Kathua","32.3743227","75.533097"
"ChIJ6UhREZ56HDkRm0BXz31WQps","Petrol Pump","National Highway 1A, Kathua","32.3904848","75.5287367"
"ChIJdYAr4kN7HDkR-SGTNtCQ7m0","Saroop's point","near RTO, NH44, near RTO, Lakhanpur","32.3795726","75.58073639999999"
"ChIJO1azTqh7HDkRJJODkoXFN-4","IndianOil","Ground Floor NH 1A, Lakhenpur","32.379574","75.580765"
"ChIJG5x1__96HDkRofvr6fqo5R4","IndianOil","Ground Floor, Hatli More, Lakhanpur","32.37839099999999","75.57421099999999"
"ChIJn0jLTcF7HDkRHW3ninrwSWo","IndianOil","Ground Floor, Lakhenpur","32.38290010000001","75.5929"
"ChIJWelryxt7HDkR6QPI7Z5BAr8","Bharat Petroleum (NATIONAL TRADING CO)","NH-44, Lakhenpur","32.382164","75.59351339999999"
"ChIJj6Bdhlh6HDkReAXnJudwTmk","Hindustan Petroleum Corporation Limited","Ground Floor, near Hatli Morh, Kathua","32.375821","75.55943599999999"
"ChIJ2Rv1hil7HDkRxgcRLJDZPeo","Hindustan Petroleum Corporation Limited","Ground Floor, near Hatli Morh, Kathua","32.375821","75.55943599999999"
"ChIJyS6GBfZ6HDkRVXC_zhN9b9c","JOGINDER SERVICE STATION","","32.3768476","75.557284"
"ChIJxRIGu5d7HDkR_6JMrtxN-wk","IndianOil","Ground Floor Jammu, Raod, Madhopur","32.367966","75.599357"
"ChIJKTk9V8J7HDkRH4yZ7pcfAOE","Bharat Petroleum, Petrol Pump -Aar Kay Filling Station","CHHAK SAJJAN,ON NH44,KATH, Kathua","32.3802465","75.55524249999999"
"ChIJE-y-x5p7HDkR1EqdvSZj1yQ","IndianOil","Ground Floor, NH 1A Taranagar, Hately","32.378807","75.55360399999999"
"ChIJnTu5v5J6HDkR2FHzIHdqIPg","Hindustan Petroleum Corporation Limited","Ground Floor, Industrial Estate, Chak Khuni, Kathua","32.387613","75.5496039"
"ChIJZ3NxguV5HDkRq5zpgP-mVwE","IndianOil","Ground Floor, Ferozepur, Behria, Pathankot","32.3535262","75.5706807"
"ChIJDXlFwXh7HDkRt9eetXr34K0","Hindustan Petroleum Corporation Limited","Ground Floor, Govindsar, Gaiterwan, near IID Centre, Kathua","32.403865","75.563761"
"ChIJc_o9kjh7HDkRiXf-HISsMVU","IndianOil","Chek Shekhian, Ground Floor NH 1A, Kathua","32.3834694","75.54464589999999"
"ChIJlYhOhIF7HDkR5Xat-_DW5Ro","KATHUA BHARAT GAS AGENCY (BPCL) LPG GODOWN","9GHR+JPP, Kathua","32.3790839","75.5418268"
"ChIJzYCMXgB7HDkRHfK_Ne5V14o","Indane - Tharial Gramin Vitrak","Old, Water Supply Road, Tharyal","32.3502199","75.6075235"
"ChIJhR8_tMB4HDkRr1lufL7CdJI","Bharat Petroleum","NH 154, Malikpur","32.27164390000001","75.6029793"
"ChIJd5yyVOZ4HDkRFF2eUjzsDkE","IndianOil","Ground Floor Pathankot, Jammu Road, Malikpur, Bharoli","32.2832001","75.5946001"
"ChIJGXrHjcB4HDkRl_V3cbdjpPw","IndianOil","Ground Floor Pathankot, Choti Nahar, Malikpur, Bharoli Kalan, Gurdaspur","32.271338","75.60094099999999"
"ChIJrxA-euV7HDkRSLnR5cjYiTo","Tharial Indane Gramin Vitrak","Main Road, Tharyal","32.31370319999999","75.6004741"
"ChIJabMjiEB5HDkR4jiZMyfYxss","IndianOil","Ground Floor, Jammu Raod, Bhabber, Sujanpur","32.315424","75.60031"
"ChIJTbqFvI94HDkRB4TPVq-5Xyc","IndianOil","Ground Floor Sarna, Pathankot Amritsar, Road, Bharoli","32.258933","75.583979"
"ChIJ1ZcfNkd_HDkRBqdAPC4CA00","IndianOil","Ground Floor, Amritsar Pathankot Road, Abrol Nagar, Pathankot","32.2732001","75.6375001"
"ChIJS-1uDj1_HDkRXjZZ85oItl4","Nirmal Fuel's","Rara, Circular Road","32.2839611","75.642206"
"ChIJz2_ZAIZ4HDkREA276SqZtKI","IndianOil","Ground Floor, NH 15 Sarna, Amritsar, Rd, Pathankot","32.2565995","75.5800146"
"ChIJuenrDGZ_HDkRu5cqGsylMvw","IndianOil","Ground Floor, Road, Dhaki, Pathankot","32.2630704","75.6344383"
"ChIJMa-bASF5HDkRn1TIfAK5rgA","IndianOil","Bhabber, Sujanpur","32.301418","75.601654"
"ChIJz9T4OCN5HDkR_z4JdJ6DT1A","Reliance Petroleum","Ground Floor, Madhopur Road, near Ms 7, Nh 44, Jammu Kalihari, Sujanpur","32.3027684","75.6018006"
"ChIJHXELHWN5HDkRqUjsCzFtGkU","Jio-bp pulse","2/4, Plot No 40, Jammu Kalihari, Pathankot","32.30292770000001","75.601491"
"ChIJ484pApF_HDkRyxohno7iok0","Satish & Company","Malikpur","32.2767915","75.59160969999999"
"ChIJn6rqsO54HDkRnFjFrPJk5nA","Hindustan Petroleum Corporation Limited","Ground Floor, Jammu Gurdaspur Road, Malikpur, Gurdaspur","32.2756201","75.5913601"
"ChIJYcAG-zF5HDkR6WZ1-XaN9C8","Hindustan Petroleum Corporation Limited","Ground Floor, Pathankot Road, Malikpur, Sujanpur","32.3056196","75.6145942"
"ChIJt6mkhJF4HDkR52r8DroN_F8","Hindustan Petroleum Corporation Limited","Ground Floor, Sarna, Gurdaspur","32.262656","75.58834499999999"
"ChIJaRywJKt5HDkRLrpVZFOrqzk","IndianOil","Ground Floor, Amritsar Jammu Road, Sarna, Bharoli","32.261601","75.58556"
"ChIJyz6ed1J_HDkR6JLLrqfn4D0","Dhadwal filling station","MORADPUR ON MALIKPUR-S'CH, Pathankot","32.2809263","75.55824129999999"
"ChIJmXXltmd5HDkRYDJJRUsnKPU","IndianOil","Ground Floor, Sujanpur Jammu Raod,Bhabber, Sujanpur","32.3267001","75.5953001"
"ChIJT3TPs2yBGzkRBg_EdSawWDY","IndianOil","Ground Floor, NH 1A, Pathankot - Jalandhar Road, Nangal","32.186882","75.650787"
"ChIJ_Yh6VCqCGzkR_AucxMhh-dE","IndianOil","Ground Floor Bye Attrian, Indora, Kandrori","32.16466","75.670761"
"ChIJ7RbMdAOEGzkRdAjGnKJcpQw","IndianOil","Ground Floor, Pathankot - Jalandhar Road, Kaunterpur","32.16519179999999","75.6190178"
"ChIJ_wS09P6AGzkRwyGwJl4h1u4","IndianOil","Ground Floor, NH 1A, Pathankot - Jalandhar Road, Damtal","32.2137001","75.663201"
"ChIJh-w9MvmAGzkR_VF6hlyiNPw","IndianOil","Ground Floor Jalandhar Pathankot Road, Damtal,Mohatli, NH 1A, Mohtali","32.21661609999999","75.6638938"
"ChIJcYrOBVmBGzkRHhwpHe7p96Y","Mukesh Petroleum","5MV4+H76, Pathankot - Jalandhar Road, Toki","32.19391989999999","75.6556454"
"ChIJC1u9QQCBGzkRU60lQbkbV8c","RAM RAKHI RAM CHAND PETRO STATION","National Highway 44, Chhanni","32.200879","75.659244"
"ChIJgaYoM2l3GzkRHZgaL1R4LaA","Hindustan Petroleum Corporation Limited","Ground Floor, Sheikhupura","32.176652","75.669167"
"ChIJN2r9aLiBGzkR7YULIgzKTx8","IndianOil","Ground Floor, Indora, Chhanni","32.2015079","75.6595157"
"ChIJa08xRACFGzkRB6koq9Bn3Vs","Rudransh Fuels Adhoc","5J46+GP4, NH 44, Kaunterpur","32.1563061","75.611784"
"ChIJp0JyUkuBGzkRULrfgovwW-M","Nayara Petrol Pump- WS PATHANIA Filling Station","705/414, Changrara","32.1700124","75.6960398"
"ChIJjU7hX_GAGzkRhDess1-Zry8","Hindustan Petroleum Corporation Limited","Ground Floor, NH 44, Damtal","32.227006","75.660141"
"ChIJXzZhDwiFGzkRySVZFpdX2qQ","Davinder Filling Station","National Highway 44, Mirthal","32.10465779999999","75.60959020000001"
"ChIJ-aL5gK-FGzkR24mbYlgBZ4c","IndianOil","Ground Floor, NH 1A, Pathankot - Jalandhar Road, Meelwan","32.0755001","75.6156"
"ChIJYW4COq2FGzkRfX0gNeBDlE8","Kangra Ji Fuels","On NH44, Jalandhar to, Pathankot - Jalandhar Road, Dhamota","32.0739576","75.61398109999999"
"ChIJodheWwCFGzkR7TRFkxJwNxs","Maa chintpurni filling station","Ghatota","32.0719375","75.6141875"
"ChIJg93u5n-DGzkRfsoDxrHUuDE","IndianOil","Ground Floor, Mirthal - Kathgarh Road, Mirthal","32.115883","75.621399"
"ChIJjfKbFWKEGzkRHXxLdZGb4UY","IndianOil","Ground Floor, NH 1A Mirthal, Pathankot Amritsar, Road, Ghiala","32.116623","75.604706"
"ChIJt93nVQCDGzkRywJ_FNgwrUc","Mahadev Filling Station","V.P.O, Tehsil, Kathgarh","32.11842819999999","75.62636069999999"
"ChIJo1VSuvmbGzkRhVNUYJi7m8w","Hindustan Petroleum Corporation Limited","Ground Floor, Harse Mansar","32.061436","75.6137761"
"ChIJ2coCUy2ZGzkRzSKlWIDLWlU","IndianOil","Ground Floor Talwara Road, Hoshiarpur Kalota, State Highway 25, Gandhi Colony, Tikhowal, Mukerian","31.949821","75.620483"
"ChIJU_6t8w6fGzkRKPH39PrM47o","IndianOil","Ground Floor, Dugri Rajputan, Hoshiarpur Kalota","31.920787","75.621877"
"ChIJpZKtOY2ZGzkR06rq5_4L-WE","Hindustan Petroleum Corporation Limited","Ground Floor, NH 44, Chak Alla Baksh","31.9269924","75.62007899999999"
"ChIJuenLSwCfGzkRv2nPOzC50Q8","Bharat petroleum isl","WJGC+W76, NH 44, Mukerian","31.9274817","75.6209133"
"ChIJAaP_YiqZGzkRXQP7wYkB74w","IndianOil","44054/46856, Pathankot - Jalandhar Road, Mukerian","31.93955","75.61755"
"ChIJEVL1ZxWfGzkRnYlkDjjjN_Y","IndianOil","Mansoorpur Mansoorpur, Kalota","31.9208724","75.6446906"
"ChIJu0RrTSOfGzkRBwzURBZrSK4","Cheema Petro Zone","Khanpur , NH 44, To, Pathankot - Jalandhar Road, Mukerian","31.9018764","75.628297"
"ChIJqxIvupmZGzkRGpq_wnY1JCA","Bharat Petroleum, Petrol Pump -Mukerain Petrol Filling Station","GT road, NH44, Mukerian","31.9428144","75.6163504"
"ChIJdcPYaeyYGzkRy_k4y2dxXfs","IndianOil","Ground Floor, Dhanoa Rd, Mukerian Tanda Ram Sahai, Hoshiarpur Kalota","31.91687599999999","75.590323"
"ChIJn3EDCgCZGzkRoXD61dLBndA","Preet filling station","234, Pathankot - Mukerian - Jalandhar Road, Friends Colony, Mukerian","31.9586117","75.6114217"
"ChIJ860luDeZGzkRMJfB6a3KgbE","IndianOil","Ground Floor, GT Road, Mukerian","31.9586001","75.6111001"
"ChIJc0OMmnKfGzkRZpcbNYAPv8Q","IndianOil","Ground Floor Galarian, Mukerian Talwara Road, Kalota, Mukerian","31.95442199999999","75.647331"
"ChIJjcaI7QiZGzkRwUuPCSYEs1w","IndianOil","Ground Floor, Golrah, Mukerian","31.94717200000001","75.580063"
"ChIJM4ZLgT6nGzkRbEydNgSgv3Y","Hindustan Petroleum Corporation Limited","QMVP+W3V, Ground Floor Dasuya Garhdiwala, Road, Bajwa","31.79314999999999","75.6861572"
"ChIJ0_Obq8KmGzkRZiJGBue-HXE","Hindustan Petroleum Corporation Limited","Ground Floor, Bodal","31.78444099999999","75.6552887"
"ChIJw_tRCsunGzkRGVZYS-_O3bU","Jio-bp","Ms 53/799, Nh 1A, Pathankot - Jalandhar Road, Dasuya","31.793549","75.656685"
"ChIJ0XEllUCnGzkRFrkoX4yDF7Y","IndianOil","Block Tehsil:, Village:, Jhingar Khurd","31.77664450000001","75.65680569999999"
"ChIJ54TVNdKmGzkR3rolR0otBz0","Gill Petrol Pump","NH 1A, Dharmpura, Dasuya","31.8053078","75.65835679999999"
"ChIJ37KuabOmGzkRQh-AE6kGwTw","IndianOil","Ground Floor, Miani Road, Kaintha, Dasuya","31.805381","75.637473"
"ChIJDdtWg9GhGzkRszDQMwrwTmo","Bharat Petroleum, Petrol Pump -Jaswant Singh Bajwa Filling Station","DASUYA ON HAZIPUR ROAD LH, HOSHIARPUR","31.8133903","75.6456894"
"ChIJ39dNsammGzkRPaEiZycr5Fc","Hindustan Petroleum Corporation Limited","Ground Floor, Jhingar Kalan","31.797521","75.62265099999999"
"ChIJWbBTai-hGzkRFjWtTT8yVQY","IndianOil","Ground Floor Dasuyajal, Pathankot - Jalandhar Road, Dasuya","31.819653","75.65984999999999"
"ChIJQfJ_SAChGzkR0PZdwPiaJ-w","Cheema filling station dasuya","RM97+W5X, Adarsh Nagar, Dasuya","31.8198638","75.6629928"
"ChIJS_EEHPqnGzkRvLQonJRKWg8","IndianOil","Ground Floor, Hoshiarpur Dasuya Road Nussa, Randhawa","31.778287","75.70585899999999"
"ChIJd-nnalyhGzkRLnCFRQV1DV4","IndianOil","Ground Floor Jand, Chhangla, Dasuya","31.824101","75.62821199999999"
"ChIJbWibcN-gGzkRZ4uSbbev_mE","D.I.G J.S Bajwa filling station","Village Bhatti Da Pind, Hajipur Road, Dasuya","31.82915899999999","75.667976"
"ChIJdYpZqeGrGzkRvm3eOoDNj4U","IndianOil","Ground Floor, Kurala Kalan","31.6264978","75.6404271"
"ChIJ53o22z2vGzkRB8vcRC8OhVY","IndianOil","near Jai Industrial Corporation, Ground Floor Tanda Srihari Govindpur Road, Shahbazpur, near Jai Industrial Corporation, Hoshiarpur","31.684403","75.604078"
"ChIJIcgMaRmpGzkRTwWpRW2wYpI","IndianOil","Ground Floor Rasulpur, Tanda, Rd, Kurala Kalan, Oharpur","31.66741399999999","75.649147"
"ChIJtybrawCpGzkRX2gumTBT21k","Petrol pump","MJGM+4H8, Urmar Tanda","31.67529499999999","75.6339512"
"ChIJQTHR8DapGzkRe8Aumy1SEes","Hindustan Petroleum Corporation Limited","Ground Floor, NH 44, Urmar Tanda","31.675385","75.646906"
"ChIJX7OhHNSoGzkRKmIjVzdS9nk","IndianOil","Ground Floor, GT Road, Urmar Tanda","31.67679499999999","75.6261893"
"ChIJs0S34JWpGzkRiRoTttwb88o","Madaan petroleum","Village Baincha, to, Hoshiarpur road, Tanda","31.6537684","75.6737006"
"ChIJ12F0wZipGzkREXK9Af_Fr-g","Hindustan Petroleum Corporation Limited","Ground Floor, Tanda Hoshiarpur Road, Baich","31.653661","75.673974"
"ChIJkywf0sOoGzkRweHxmgqGR54","IndianOil","Ground Floor, Hoshiarpur Bypass, Urmar Tanda","31.689699","75.640648"
"ChIJXddgZbKpGzkRK4lXdg5Yswc","IndianOil","Ground Floor Jhawan, Tanda, Budhi Pind","31.674877","75.679855"
"ChIJ38RKUMCoGzkRSKIV99VYZ9Y","IndianOil","Ground Floor, Tanda Dasuya Road, NH 1A, Tanda","31.6980855","75.6418647"
"ChIJPffCO0CrGzkRDU2Z23IjwS4","Hindustan Petroleum Corporation Limited","Ground Floor, GT Road, Bhogpur","31.56110099999999","75.642201"
"ChIJSdLESIpVGjkRO5KkTOJLUrg","IndianOil","Ground Floor Pachranga, Bhogpur, Behram Sarista, Jalandhar","31.517414","75.63556799999999"
"ChIJie3h4QFVGjkRLSUGfsrLST4","S.D. Petropoint Bharat Petroleum","Bhogpur - Moga Road, JALANDHAR","31.5287575","75.6371187"
"ChIJ-3tgZLRUGjkRh1njAyRxa0o","IndianOil","Ground Floor, Jalandhar Road Sadda Chak, Bhogpur, Behram Sarishta","31.53610600000001","75.639122"
"ChIJ25Y1SNFUGjkRPipvMiDCuik","IndianOil","Ground Floor, Bhogpur Adampur Road Binpalke, Behram Sarishta","31.535006","75.660873"
