place_id,name,address,latitude,longitude
"ChIJ0RDLVKqQxzsRvxtAeMvsGck","IndianOil","near Almatti Dam, Ground Floor Bijapur, near Almatti Dam, Site, Almatti","16.3355966","75.902796"
"ChIJSXOoMXKaxzsRB2uTSLSj6Kw","IndianOil","Survey No 41/P1, Sitimani","16.3100971","75.8906073"
"ChIJD74NlnyaxzsRP-4ZMWK7dGI","Hindustan Petroleum Corporation Limited","RS No 7/1, Almatti Road, Rampur","16.293715","75.8907333"
"ChIJHeUlp2CXxzsRheVvcKzwjvw","Shree Durga Petroleums Nayara","near KSRTC BUS STAND, Nidgundi","16.3543254","75.9351513"
"ChIJ7bBmBhCMxzsRfyG024g1vDE","Hindustan Petroleum Corporation Limited","Ground Floor, near 182 Km Stone, NH 13, Kudalasangama Cross, Huvanur","16.182444","75.998223"
"ChIJAQAAAB-MxzsRzXAZJu9HBp8","Ary Petrol Pump","National Highway 50, Nandanoor","16.1811484","75.9956673"
"ChIJ_Yhh-g-MxzsR35Qg-0Yhjs8","IndianOil","Sy No 66/2, Old Rs 66/1A, Hungund, NH 13, Kudalsangam Cross, Bhagavati, Nandanoor","16.1742586","76.0033146"
"ChIJyx_OGDx1uDsRxhKZlrjAZAM","IndianOil","Ground Floor Ilkal, Raichur - Bagalkote Road, Hungund","16.0445814","76.0667546"
"ChIJrf8zHSZ1uDsR3FRRLIbD8Bk","IndianOil","Ground Floor, NH13, Hungund","16.0333053","76.0738921"
"ChIJ7Xj9kkB1uDsRZoizSaVXJUo","Hindustan Petroleum Corporation Limited","No 356/1/A, NH 13, Solapur Chitradurga Road, Hungund","16.038881","76.070748"
"ChIJZxYnwC91uDsRAt6J8dVCqmQ","APPAJI PETROLEUM- BHARAT PETROLEUM","State Highway 20, Hungund Rural","16.0517158","76.0631592"
"ChIJr_W-idJ1uDsROBl-oc2KHKs","Modern Gas Spaire","near Vijay Mahantesh circle, Hungund","16.0599976","76.0594998"
"ChIJDQ5PJkH_uDsR4tYK5Q_dhKA","Jio-bp","Truck Stop, Rs No 69/3 Hungund, near Illkal, National Highway 50, Tondihal","15.988843","76.09941119999999"
"ChIJd1qjYavTuTsRRtjXBdAOSWw","IndianOil","Bhairapura Survey No 175/5, Sholapur Chitradurga Road, Hosahalli","15.3044143","76.3190013"
"ChIJe3f2okLTuTsRgkSakEMCR1k","Hindustan Petroleum Corporation Limited","Ground Floor, NH 50, Hitnal","15.3201179","76.31090879999999"
"ChIJISAhlv_SuTsRYnggZW9Oo6s","IndianOil","Ground Floor NH15, Cross, Hitnal","15.3110282","76.31539240000001"
"ChIJQ_mqSrvTuTsRZOun_vtF8sU","Bharat Petroleum Petrol Pump , H R S PETROLEUM","SY NO 188/2, HOSAHALLIAT POST, Hosahalli","15.308268","76.31539699999999"
"ChIJZSvs1aLTuTsRyUtu8kGKEZw","Aradhya Enterprises I Blue Fuel Station","Shop no 1 , N H 50 Hiway, near Reliance petrol Bunk, I R B, Police sarvees road, Hosahalli","15.3061036","76.3174761"
"ChIJK2OsylTSuTsRmzVLOwyyNVk","Reliance","8848+6X6, State Highway 130, Hosahalli","15.3055384","76.3174019"
"ChIJUQW5MwDTuTsRz5xOZ7GvM3Q","VIJAYASHREE PETROLEUM","Sy.No, NH-50, 175/5, Hospet Road, Hosahalli","15.3043955","76.3191398"
"ChIJKdxmzYLTuTsRH2R7cioRI88","SANVI PETROL PUMP","Hanumanahalli - Kotturu - Joladakudligi Road, Huligi","15.304434","76.3372933"
"ChIJjyt2QADTuTsRL5bS_LpBtRc","ಯಲಮಂಚಿರಿ ಪೆಟ್ರೋಲ ಪಂಪ ಮುನಿರಬಾದ","882Q+X3V, Munirabad Rural","15.3024752","76.33767859999999"
"ChIJuSebHHZbpTsR97SoYQ0UL7k","IndianOil","Survey No 233/3, Mudlapur, Huligi - Gangavathi Road, Agalkera","15.3056211","76.3416441"
"ChIJv5bjl1jNuTsR_QNBLv_MlJ8","IndianOil","Survey No 15, 678 & 9, National Highway 67, Kanakapur","15.3370538","76.2702434"
"ChIJNdhC-ZzNuTsRBvJPGFpBl-E","Bharat Petroleum, Petrol Pump -Sri Mahima Agencies","GINIGERA,NH - 63,KOPPAL, Koppal","15.339257","76.2673768"
"ChIJI9rhPrHWuTsRwjJ4REj82fY","IndianOil","Lock No 313, Veerupakshanayaka Circle, Sy No 129/A, opposite New Traffic Police Station, NCC, Hosapete","15.2616629","76.3725474"
"ChIJWYgJgwLUuTsRMAbUiG-vHW4","Total Gas Filling Station","Rajeev Nagar, Arvind Nagar, Patel Nagar, Hosapete","15.2676608","76.3729"
"ChIJbY3xFeLTuTsRBfTQAEC8K3Q","IndianOil","Lock No 317, near Abheraj Baldota Road, NH 50, Ballari - Hubballi Road","15.267182","76.347533"
"ChIJpdDGCKDWuTsRJtMozheu2wE","Hindustan Petroleum Corporation Limited","Ground Floor, Hosapete Bypass Road, near Galemma Temple, Abheraj Baldota Road, Hosapete","15.2679551","76.3860401"
"ChIJLeyXqZ3WuTsRi_M8-mHJlJY","IndianOil","Lock No 319, Bellary Road, Hosapete","15.2665309","76.3954519"
"ChIJx6VuDsXTuTsRfykq_2LLtrI","Hindustan Petroleum Corporation Limited","Ground Floor, NH 50, Munirabad","15.278385","76.33106099999999"
"ChIJ08cecCPRuTsR1MQ4GWI-xvg","petrol bunk","7926+33V, National Highway 50, Hosapete","15.2502295","76.36016459999999"
"ChIJ03qOnrHRuTsRwEwkkaJtlxs","SADDHARMA CNG GAS STATION","National Highway 50, Hosapete","15.2507726","76.36089609999999"
"ChIJb-1uypbRuTsRkKSpyaExlfc","P BALASUBBA SETTY AGENCIES","DOOR NO, 226, Hospet - Harihar Road, Hosapete","15.2449118","76.3612157"
"ChIJ8ZkbGmDRuTsRFUZzFhLclDg","SRI AYYAPPA PETROLEUMS","NH 50 LHS TOWARDS, TO, Chitradurga - Hospet Road, Hosapete","15.2587175","76.3515094"
"ChIJLwCK7K_WuTsROXGG_qSpoMM","Hindustan Petroleum Corporation Limited","Ground Floor, Harihar Road, Hosapete","15.257281","76.374391"
"ChIJCyXC9VHXuTsRakg5yBo9tGQ","Go gas auto lgp station,hosapete","796F+6H, Hosapete","15.2607764","76.3743008"
"ChIJfYPcGP3XuTsRHVgIcJ_HvOU","Bharat Petroleum, Petrol Pump -Venkateshwara Petroleum","HOSPET (TB DAM ROAD), BELLARY","15.261314","76.3739988"
"ChIJ8VKDk6vXuTsR__g_2x9PhJQ","IndianOil","Lock No, opposite Pdit Engg College, 309, NCC, Rajiv Nagar, Bellari, Hosapete","15.2642761","76.37307109999999"
"ChIJ_Uo_3EnXuTsRciF1fLSGd0A","Bharat Petroleum, Petrol Pump -Sneha Petroleum","HOSPET, BELLARY","15.2607758","76.3789311"
"ChIJPQl5Bv_XuTsRGd_vhBsk3tw","Hindustan Petroleum Corporation Limited","Ground Floor, NH 67, Chitradurga - Hospet Road, Hosapete","15.2474844","76.384269"
"ChIJeYKoIF_XuTsRGOHqXlRq85g","Reliance Petroleum","S No 215/E/1, 216/A4, Dam Road, Hosapete","15.2614453","76.37976549999999"
"ChIJM7I2uL_WuTsRi_DDSYLA79U","IndianOil","No 61/C, Lock No 322, Ananthashayanagudi, Sandur Road, Jambunathahalli, Hosapete","15.2473354","76.3853151"
"ChIJM7I6OWfXuTsR79-4GtK9q3A","Vijaykumar T","13C/1A T S S E PETROLIUM, P K Halli Ballari Hospet Road Hospet Vijayanagar District, Hosapete","15.2633186","76.3828875"
"ChIJT-PbbZTWuTsRb7ei6A19-XY","IndianOil","Ground Floor, Jambunath, Halli, Ananthashayanagudi, Chitradurga - Hospet Road, Hosapete","15.2491258","76.38899289999999"
"ChIJY2JCcmn9uTsRyday0kV4nb0","R.V.G Petroleums (Indian Oil)","Vijayanagara District, NH-50,(Towards Chitradurga). Banavikallu-583126 Kudligi Taluk","14.7530215","76.4447878"
"ChIJC4-WgexVtzsRsd9C5eLEEmY","Bharat Petroleum Petrol Pump , SRI LAXMI VENKATESHWARA PETROLEUM","SY.NO, 260CHIKKAJOGIHALLI VILLAGE, Chikkajogihalli","14.723272","76.481163"
"ChIJly7iNtBVtzsRBKpwxlkLcyI","IndianOil","Survey No 312, Bannikal, Chikkajogihalli","14.722627","76.48775499999999"
"ChIJv2E6PZoLujsR52FvAJkqWkM","Sri mookambika filling station BPCL","NH 50, Madanayakanahalli, Chitradurga","14.3505084","76.38447359999999"
"ChIJRf693eALujsRPK3JSHatiAQ","harat Petroleum","India","14.3505245","76.38446119999999"
"ChIJQfk7rAwazzsRRc1-OmoqzBk","IndianOil","Survey No 55, 5, National Highway 50, Chikkagondanahally","14.3573266","76.37799609999999"
"ChIJmf5zCwALujsRZAhkw-OAlXE","Chaman sha vali dargah","89HR+CQJ, Madanaikanahalli","14.3285956","76.39189139999999"
"ChIJCVWPANwLujsRHwmCOKUHcx4","BHARAT PETROLEUM (SREE SNR PETRO AGENCY)","Madanaikanahalli","14.3280423","76.39491629999999"
"ChIJWTCN4U4JujsRTMLdTOnGt-k","Bharat Petroleum - Maheswar service station","999C+RW4, Chitradurga","14.3695046","76.3723179"
"ChIJA-_qWx8LujsRmYNzmT1qAmk","Hindustan Petroleum Corporation Limited","Survey No 175, Turuvanur, Madanayakanahalli, Chitradurga","14.3185022","76.3992505"
"ChIJYbC6JOULujsRlc-z5207Kjw","Hindustan Petroleum Corporation Limited","Ground Floor, Madanaikanahalli","14.317829","76.39841899999999"
"ChIJacYiWj-HsDsRNoD6pvu0_dE","Shankar Fuels MRPL Hi-Q","1023, National Highway 48, Metikurke","14.0019259","76.5878383"
"ChIJm8CfcBKHsDsRZjGXfSCdn4M","Bharat petroleum Hiriyur (Veerabhadreshwara fuel)","NH 48, Hiriyur, to, Chitradurga road, Metikurke","13.9973361","76.5884322"
"ChIJudOKNwqFsDsRhcU99UvGxXk","Hindustan Petroleum Corporation Limited","Ground Floor, near Hotel Athithya, Hiriyur","14.021329","76.581521"
"ChIJRWCcCFqGsDsRMudYPeC_TlI","IndianOil","Lock No 163, S No 72/2, Hosadurga Road, Hiriyur","13.969608","76.60155499999999"
"ChIJtQL4DA-GsDsR_emIgz3dNBk","IndianOil","Lock No 166, Sy No 31/8P1, New No 31/9, Hiriyur - Challakere Road","13.9967822","76.6283289"
"ChIJ2WVQXACHsDsRhA6YennJC-g","Bharat petrol pump","sha gopichand nagara, 08, near thaha school, NH4, service road, Hiriyur","13.9651831","76.6082403"
"ChIJIfO6EwBhsDsRg2BjhYYec6E","FOUR BROTHER FILLING STATION","RPQQ+RHH, Javagondnahalli","13.840371","76.739682"
"ChIJOYCeDQBhsDsRuuarLM0dJfM","NAYARA ENERGY","RPQQ+RHH, Javagondnahalli","13.840371","76.739682"
"ChIJjQNRKp9hsDsR5nQg_Hzh44Y","INDANE GAS DELIVERY MAN","RPQV+7R4, Chitradurga","13.8381375","76.74457810000001"
"ChIJgdXpJgBhsDsRYUAXxXFp1TY","PS FUELS STATION","RPPQ+Q2, Javagondnahalli","13.836921","76.73750849999999"
"ChIJI1wVO2JhsDsRStxg3-M50qA","Sri Vijaya Sarathi Petrol Pump","RPRM+JHM, Anesidri","13.84171","76.734016"
"ChIJfSou1tZhsDsR-0m_xKyorW4","Hindustan Petroleum Corporation Limited","Ground Floor, PB Road, Hiriyur, Javagondnahalli","13.8411033","76.73380829999999"
"ChIJQ0yqaH9DsDsRrq0bZ2yqzls","Bhagawan Sri Balaji fuels- Indianoil","Ground Floor, NH 4, Tumkur-Sira Road, Yemmarahally, Bandakunte","13.7034435","76.9136761"
"ChIJ1V4j5n5DsDsRTxEePpr-5dU","BP COCO bunk","India","13.7058195","76.9141238"
"ChIJIacfnBhDsDsRFsdHxjm3tUo","COCO Bharat Petroleum, BP SIRA MAFAH","SIRA II, TUMKUR","13.7061012","76.91495060000001"
"ChIJmzOS8ztDsDsRjFrI7Zzg6TM","IndianOil","Survey No 76/3, Kadavigere","13.6732335","76.9167111"
"ChIJtYc3XgBFsDsRKdB_t9pTdlg","AJITH PETROS - Bharat Petroleum","MWC9+CG, Kadavigere","13.6710909","76.91882939999999"
"ChIJk1npHQBDsDsR80RyqK9znUU","Hongirana fuel station","PW87+6GC, Gummanahally","13.716103","76.913726"
"ChIJrcRdC4FDsDsR9YjygUy5Hh0","PRABHU ENTERPRISES Indane Gas Distributors","PW97+QM, Gummanahally","13.719428","76.9141976"
"ChIJv_ymu1tDsDsRXQXpjv-Neyc","NAYARA","India","13.7326208","76.9105026"
"ChIJedUahxNDsDsR0EV4ucKcxvs","Hindustan Petroleum Corporation Limited","Ground Floor, Tumkur-Sira Road, Sira","13.7334217","76.9101716"
"ChIJgSoG1BhDsDsRNVUAcwhWFas","Hindustan Petroleum Corporation Limited","Survey No 137/2, Muddigere","13.7252852","76.8878649"
"ChIJj2S0WAA3sDsRhz5ottY3Kh4","Honnaganga petroleum (IOCL)","F2V8+F7F, Devarahalli","13.4936758","77.0156639"
"ChIJ_VsUPMQwsDsRBaheD95IPYo","IndianOil","Ground Floor, NH 4, Nelahalu, Brahmasandra, Giriyanahalli","13.492157","77.01667900000001"
"ChIJHQwgEkI3sDsRh3VB2M9KUCc","Straton","India","13.5037173","77.0265788"
"ChIJqQDwNbo3sDsR2-YBTJVUHd8","IndianOil","Plot No 159, Vasanthanarasapura","13.5040002","77.026523"
"ChIJs-1gECI3sDsR0vm6QcKdrbI","Deepthi Petroleum- Bharat petroleum","F2PG+HQ5, Service Road, Nagenahalli","13.4863771","77.0269915"
"ChIJCQDC9OoxsDsRaQYDYHzxGoo","Bharat petroleum Padmashree fuel park petrol Bunk","Vasanthanarasapura,Pune-Sira highway sira NH4,Near VRL hotel,Vasanthanarasapura, industrial area, Tumakuru","13.4713268","77.0369051"
"ChIJV6-1RcQwsDsR8NGNa28eA74","Hindustan Petroleum Corporation Limited","Sy No 19/4 Kora, Hobli, Vasanthanarasapura","13.4681102","77.0403485"
"ChIJeytcM1oxsDsRjeoXxj_Z5ns","IndianOil","Survey No 1, Khatha No 16/16, Kora, Hobli, Vasanthanarasapura","13.4673754","77.0403303"
"ChIJzTaeSQA3sDsR3fKmISgoreA","Viya farm house","G334+P5, Sangenahalli","13.504305","77.05543899999999"
"ChIJd3KZXQA5sDsRBPRg6Qj-KQc","Adblue DEF Shop","GXQW+2X, Saluparahalli","13.537518","76.997391"
"ChIJFZ20_JM5sDsRjKhl3NYnukg","यूरिया पंप","GXQW+2X, Saluparahalli","13.5375625","76.99743749999999"
"ChIJuzPXW3wssDsRMz3a3V-AAjw","Hindustan Petroleum Corporation Limited","Ground Floor, Siddaganga Mata Road, Math, Kyathasandra","13.3150517","77.14487240000001"
"ChIJ4___70MssDsR6wAzr4RyUu4","BG SHIVAPRAKASH MIRJI PETROL BUNK BHARAT PETROLEUM","NH 206, Batawadi, Tumakuru","13.328381","77.1307186"
"ChIJ9Ztw8kwssDsRpfRLA7yGM-U","IndianOil","Ground Floor, Belagumba, Tumakuru","13.3489008","77.1340063"
"ChIJqbcQky4ssDsRZL-A5ypU37g","Bharat Petroleum, Petrol Pump -Sree Shiva Shankari Fuels","Kotitopu, Tumakuru","13.3433452","77.1101876"
"ChIJX576eT0rsDsRSbPWdBwqJTk","Bharat Petroleum, Petrol Pump -Siddalinga Petrol & Diesel Bunk","Kyathasandra","13.3137918","77.14670749999999"
"ChIJr88oiJstsDsR5HYh0GFpKZk","KK1 TM ENTERPRISES","847X+322, Indira Nagar, Kyathasandra","13.3126355","77.1475243"
"ChIJcb_ykyotsDsRHv5j1_JRavA","Hindustan Petroleum Corporation Limited","Survey No 98/6, Outer, Ring Road, Kyathasandra","13.307924","77.147819"
"ChIJw_DVVh0tsDsRQDnyAgmTwps","SRJ Indian petroleum","Bangalore-Shimoga Bypass Road, Gokula Extension, Tumakuru","13.3097135","77.1345048"
"ChIJkRFCn84tsDsRUnAged0EnJg","Go gas","84FM+MV8, Chandana Complex, Tumakuru","13.323877","77.13478409999999"
"ChIJ847Ke4UtsDsRmLa8rl9b_34","Byraveshwara fuels","Ring Road, Tumakuru","13.3108753","77.1314025"
"ChIJ_c9oEwAtsDsRsL97WDObCJk","Hindustan Petroleum Corporation Limited","Survey No 75, 1A/12 & 13, Baddi Halli Main Road, Kasaba Hobli, Shetty Halli, Tumakuru","13.311561","77.12806200000001"
"ChIJlZ6KdgAtsDsR8IpqSTdcAVA","SHIVSHAKTIPETROLEUMS","849H+R38, 80 Feet Road, TUDA Layout, Tumakuru","13.3195321","77.1276977"
"ChIJEeYozcYtsDsRz4Sq7EluK3Y","IndianOil","Survey No 31, 5 & 33/2, Circle, Batawadi, Agalagurki","13.3190973","77.12747089999999"
"ChIJ9Sp3vXQssDsR_SEekbsekk8","IndianOil","Ground Floor, Ring Road, Shetty Halli, Tumakuru","13.31055","77.1268734"
"ChIJ4SSTRmUtsDsRu_NNhRkFuc8","Jai Bhajarangi fuel station","Shettihalli Main Road, Jayanagar East, Tumakuru","13.3133207","77.1215763"
"ChIJ3XhCSu0tsDsRSPWNXoGe-SM","Sri Balaji Fuel Zone","Shettihalli Main Road, Jayanagar West, Tumakuru","13.3192248","77.1207431"
"ChIJxXCh_DQtsDsRB4kExEuD-Yk","Hindustan Petroleum Corporation Limited","Ground Floor, Kasaba, Tumakuru","13.3286208","77.1220158"
"ChIJh70CvpEusDsRAbeBqLH7D_4","Aegis Autogas - Sri Someshwara Autogas","8479+432, Bypass Road, Danah Nagar, Jayanagar West, Tumakuru","13.3127698","77.1176517"
"ChIJbyCqgKktsDsRJU8_RoPy8UM","Hindustan Petroleum Corporation Limited","Ground Floor, near Jayanagar Extension, Outer Ring Road, Jayanagar West, Tumakuru","13.313253","77.115871"
"ChIJn6tOB8gtsDsR0b9-SVhZrAI","Hindustan Petroleum Corporation Limited","Survey No 31/4, Upparahalli Main Road, Geddalahalli, Tumakuru","13.317564","77.108781"
"ChIJr7_-zHQlrjsRKO0l91UhiC8","Hindustan Petroleum Corporation Limited","Survey No 166, NH 48, Nelamangala Road, Arasinakunte","13.089602","77.4010191"
"ChIJa4DTxmklrjsRY1_ghmrc7lw","NAYARA FUEL STATION (SHREE SIDDAGANGA SERVICE STATION)","No 109/2, Mallapura, Kasaba, Hobli, Nelamangala Town","13.0711122","77.3938324"
"ChIJR51rVkcurjsRfrvYZ-HIaJ0","IndianOil","No 96/1, College Road, Mahadevapura","13.0844618","77.4127597"
"ChIJ8xbtEDklrjsRS_M0y2CyVu0","Hindustan Petroleum Corporation Limited","Sy No 126/2B1, Nelamangala Road, Arasinakunte","13.0856216","77.4152968"
"ChIJOeH3xQ4lrjsRZooxOFxFli0","IndianOil","Sy No 117/1 Arasinakunte, Nelamangala, Mahadevapura","13.0871691","77.4088706"
"ChIJ38HOlA4lrjsRWT34n2tHGao","Reliance","India","13.0864765","77.4084858"
"ChIJtYtnOcglrjsRH-Yj2S2dZIc","H.K.M.C PUNCTURE POINT AND TYRE WORKS","NH 04 Tumkur Road Nelmagala, Nelmagala, Arasinakunte","13.081005","77.4227588"
"ChIJs4ZN1BclrjsRA2ZWbnJS3Tk","Shell Petrol Bunk Nelamangala","PANCHAYAT, ARISHINAKUNTE, Nelamangala Town","13.0922836","77.4076637"
"ChIJ-S0Jmh0lrjsR9rzUsOAK7FE","Hindustan Petroleum Corporation Limited","Survey No 517/1, NH 48, Tumkur Road, Nelamangala, Bengaluru","13.0796927","77.4232801"
"ChIJcbttKeMlrjsRjcfFJ3Pkev4","Bharat petroleum Hanuman Fuels","3CW3+2P7, B.H ROAD COLONY ,NEXT BHARATH PETROLEUM NELAMANGALA, Saraswathipura, Sadashiva Nagara, Bengaluru","13.095049","77.4042891"
"ChIJbz6LobwlrjsRbDcXjnj3zgw","MATHA FUEL STATION","Banawadi Village Soluru, No 30, Shivagange Main Road, Budihal","13.0954625","77.4033812"
"ChIJBxi5SWolrjsRyjOLMk2_o5g","MATHA FUEL STATION","No 29/7, Shivagange Main Road, Banawadi Village, Budihal","13.1002275","77.419738"
"ChIJMd3WKR0VrjsR4QdTaYs03Vc","Hindustan Petroleum Corporation Limited","4790/10 4791/11, Nanjappa Layout, Vijayanagar, Nelamangala Town","13.0923418","77.3967303"
"ChIJC9EEclElrjsRrwcuJMxFjzA","Bharat Petroleum Corporation ltd","near Acharya Parampara School, Survey No 25/6 Dasanapura, NH 4, Devannapalya, near Acharya Parampara School, Bengaluru","13.077761","77.4319531"
"ChIJqd_BOpklrjsRnclnKUUrprI","SLS FUEL STATION","Mallapura, Cross, Bengaluru","13.0839904","77.392529"
"ChIJF0e_NG4lrjsRxjjwJ-W5w_Y","SREE NANDA ROADLINES","Nelamangala Road, Vijaya Vittala Nagar, Bengaluru","13.0805581","77.3928014"
"ChIJt351KW8lrjsRvh3RkQKMv2Y","IndianOil","Survey No 66, Kasaba Hobli, Sampangiram Nagar, Mallarabanavadi","13.076451","77.392494"
"ChIJCwXcfJ0lrjsR0Lc9FgvTGUs","IndianOil","Survey No 269, Mahadevapura","13.0929887","77.3917948"
"ChIJjVmLJIMlrjsRhbkVDUvbVaw","GANESHA OIL MILL","Raghavendra Layout, near Kunigal Bypass, opp. Anjaneya Statue, Kuvempu Road, Nelamangala Town","13.0961904","77.3888703"
"ChIJDePIgYQlrjsR7_xmcSnmQQA","IOC - Deepa Service Station","4/3, Kunigal Bypass, Indiranagar, Vishveswarapura","13.098458","77.387204"
"ChIJHys44ic_rjsRLgP5h3CbIA0","Shell","15/3-15/4, Kengeri Ring Road, Kengeri Satellite Town, Bengaluru","12.91564","77.48171700000002"
"ChIJHfn0_ss4rjsR8GfDSo0rfdQ","Hindustan Petroleum Corporation Limited","Survey No 232, Mysore Road, Babusapalya, Hobli, Kengeri, Bengaluru","12.8985548","77.4646233"
"ChIJrX01Dsg4rjsR1jifn7cNytU","IndianOil","Khata No 6079, No 42/5, Nagadevanahalli Main Road, Kengeri Hobli, Bengaluru","12.9325795","77.4888093"
"ChIJi9aASsI-rjsR9GoPjM_Yr9g","IndianOil","40/6, Outer Ring Road, Nagdevanahalli, Bengaluru","12.9327646","77.4902615"
"ChIJs6BvUsc_rjsR_fgMJn37S5w","ESSAR","WFQV+723, Devaraj Arash Layout, Sonnenahalli, Nagdevanahalli, Bengaluru","12.9381401","77.4925533"
"ChIJFerJruU-rjsRezEC81kotNE","IndianOil","Sy No 36, Kengeri Pattanagere, Mysore Road, Hobli, Rajarajeshwari Nagar, Bengaluru","12.9260529","77.5017163"
"ChIJvRbJWr04rjsRPasySYdQB8Q","Hindustan Petroleum Corporation Limited","Survey No 20/45 & 19/10, Mysore Road, Kengeri Hobli, Bengaluru","12.8818678","77.447938"
"ChIJVSOWow8_rjsRgX4LplTb4hE","IndianOil","Khata No 2563, Sy No 25/2/B1, 25B, Mylasandra, Kengeri, Reflex Housing Layout, Hemmigepura Ward 198, Rajarajeshwari Nagar, Bengaluru","12.904101","77.506783"
"ChIJe5bQlwU-rjsRjAIi6WyW6us","Shell","Mysore Road, Kengeri Hobli, Bengaluru","12.906804","77.473185"
"ChIJE50TVAA_rjsRLTyrh_0njis","GAIL CNG agency","WF5G+25M, BSM Extension, Kengeri, Bengaluru","12.9075883","77.4754197"
"ChIJbbIrCAA_rjsRFSihvNCJ5cY","Ather power grid","WF4F+6J2, Kengeri, Bengaluru","12.9055092","77.4740252"
"ChIJnZa67Gk5rjsR3QmVF5kXI0Q","Nayara petrol bunk amba fuels","Sy. No. 272/2, Nice Road Junction, Bangalore, State Highway 17, Bengaluru","12.9018326","77.46912809999999"
"ChIJQ_yP98w4rjsRsnzgPxvQPk4","Usk Auto Gas","nice road junction, nr. sai palace, Mysore Road, Bengaluru","12.9009792","77.4674847"
"ChIJba4v3ic_rjsRgpxlQvA7KPs","IOC - Srinivasa Service Station","Ring Road, Kengeri Satellite Town, Bengaluru","12.9151661","77.4820125"
"ChIJJziTD9g-rjsRKVPu8CCt1vI","ESSAR P.G.","India","12.91721","77.4824474"
"ChIJ9Z4q_N45rjsRpKSgORG5ohE","NAYARA Petrol Pump - Hunasemaradapalya","WF82+79W, Hunasemaradapalya, Bheemanakuppe","12.9157357","77.45094279999999"
"ChIJs1N9hCM_rjsR8Po0U98Ehg4","Bidadi petroleum","near Sbi Bank, 01, Railway Parallel Road, Upanagara, Kengeri, Bengaluru","12.9187337","77.4840701"
"ChIJgTcF5AE5rjsRAZWvoHsQnmU","Shri Beereshwara petroleum","Vaisnavi ngar bausahebara pakya, Kengeri","12.8974466","77.4678424"
"ChIJMSsUxVU_rjsRcjY3p2p5nKk","Bharat Petroleum Corporation ltd","Survey No, opposite Krishnapriya Convention Hall, 46, Mysore Road, Kengeri, Bengaluru","12.9121714","77.4847353"
"ChIJbx3s7iY_rjsROKWWA27EEi8","Hindustan Petroleum Corporation Limited","Survey No 39/1, Mysore Road, Kengeri, Bengaluru","12.9127633","77.48553919999999"
"ChIJmyebbW9ArjsR2hgLof72rDI","IndianOil","NH 209, Kanakapura Main Road, Talaghattapura, Bengaluru","12.8588467","77.52888999999999"
"ChIJc9Hsd_JqrjsR5J6xbX6N-8c","Bharat Petroleum Corporation ltd","No 17, near Kolifarm Gate, 1A1, Bannerghatta Road, Basavanapura, Bengaluru","12.8426982","77.5884688"
"ChIJ1-MIrcZqrjsRzFby7mDaDRA","IndianOil","opposite Lakshmi Theatre, 23/1, Gottigere - Kengeri Road, Kalena Agrahara, Bengaluru","12.8601744","77.5899585"
"ChIJBQJrlfVqrjsRiTnD11euAWc","IndianOil","No 36 & 37, Anekal Bannergatta Road, Bannerughatta, Kalkere","12.832959","77.589218"
"ChIJCxSFuXpBrjsRf8lYXDGKDkw","IndianOil","Survey No 307, 1308/1 Pattareddy Palya, Kanakapura Main Road, Bolare","12.8864567","77.56467339999999"
"ChIJZ5Ce13FArjsRV8TqizGg8mM","Shell","Kanakapura Main Road, Uttarahalli Hobli, Bengaluru","12.862863","77.53117999999999"
"ChIJ0U1mKQBBrjsRKC2tUOmoXlE","Nayara Petrol Pump","Site No, 1 & 2, 80 feet Road, Anjanapura Village, Uttrahalli Hobli, Bengaluru","12.8548498","77.5544555"
"ChIJD5g8ZaRqrjsRpUxPx8ZRAyc","Prakash petrol bunk","Banarghatta, Main Road, Anjanapura Township, Bengaluru","12.8594608","77.57004599999999"
"ChIJVaoEUM5rrjsRQo5GD62pcsw","Nayara Petrol Pump (Nandana Enterptises)","Sy. No. 18, Khata 350, Site No. 10,11,12,13,14 & 15, Kambathalli Village, Uttarahalli Hobli, Bangalore South Taluka","12.8531754","77.57620159999999"
"ChIJj2CNPwBrrjsRyyiLwpRjCPU","USK auto gas","Block 11, Anjanapura Twp, 1, Kembathalli, Lal Bahadur Shastri Nagar, Bengaluru","12.85456","77.57659559999999"
"ChIJvcPtbKlqrjsRDnCwSt9GSDQ","Bharat Petroleum Corporation ltd","No 34/37, opposite Avalahalli Telephone Exchange, Anjanapura Main Road, JP Nagar 9th Phase, J. P. Nagar, Bengaluru","12.8686374","77.56588649999999"
"ChIJ_5i5bc5BrjsRJqVtedrS1-o","Uday Fuel station","p, Shanubhoganahalli, Prop NO. 31, Anekal Taluk, Khata No. 596","12.8269596","77.5593322"
"ChIJf2adAAJrrjsREGqZT9jIbdo","Bharath Petroleum Galaxy fuel","VH3J+4P8, Nada Prabhu Kempegowda Road, South Avenue, Gottigere, Bengaluru","12.8527834","77.5818189"
"ChIJSYp3_MVrrjsREZeKnUYn_d0","CNG Gail Gas station","VHF8+9PV, JP Nagar 9th Phase, J. P. Nagar, Bengaluru","12.8734977","77.5668105"
"ChIJ6SEPcblrrjsRoL0XJyIu3Wk","JRB Fuel Junction","opp. Royal County Park, Jambusavari Dinne Main Road, 8th Phase, Bengaluru","12.8617062","77.5804661"
"ChIJ95_zNDVBrjsR-l8v1LVZwwA","Bharat Petroleum SRK Fuel Park,","Kanakapura Main Road, Bengaluru","12.8654145","77.533452"
"ChIJHZllGQBrrjsRNkmdPCUyOkM","Rathana","1719, 5th Main Road, BDA Layout, South Avenue, Gottigere, Bengaluru","12.8616948","77.5817253"
"ChIJESH0G_lrrjsRCxG6ZKo97xo","MRPL R R PETROLEUM","VHFC+J42, JP Nagar 9th Phase, J. P. Nagar, Bengaluru","12.8740187","77.5702599"
"ChIJTdGtjpFBrjsRJ3aafiJ0sk0","Gail Gas CNG Station","VGFR+84R, Vajarahalli","12.8733673","77.5402694"
"ChIJT8YrYBM_rjsRRgktGo6F74o","NAYARA Kanakpura main road","Kanakapura Main Road, Raghuvanahalli, Bangalore City Municipal Corporation Layout, Bengaluru","12.8746335","77.5423459"
"ChIJuSCRwk1rrjsRMit8cJkex6w","IndianOil","Sy No 65, next to Manipal County Road, Singasandra, Bengaluru","12.8741093","77.6411957"
"ChIJh7f9zL8UrjsR4bORFlPBtHI","IndianOil","13/1, Hosur Road, Singasandra, Bengaluru","12.8812099","77.64530169999999"
"ChIJc9iyb7RsrjsRV2RKK0b2Vv4","IndianOil","Ground Floor, Junction, Naganathapura, Rayasandra, Bengaluru","12.8761804","77.67152200000001"
"ChIJOSjGmh9rrjsR65H79G5Anvk","IndianOil","Sy No 76, 2 & 72/6, Begur Hobli, Mylasandra, Bengaluru","12.842356","77.618515"
"ChIJb1hsjl4TrjsRrMoKvgpnQT0","IndianOil","Site No 3839 & 40, RRR Group, Haralur","12.8990184","77.6584068"
"ChIJPaf9zL8UrjsRx2CA0u4t_pM","Shell","near Shell Petrol Pump, 137 20th Main, Hosur Road, Bommanahalli, Bengaluru","12.9005571","77.6335166"
"ChIJeVq-lEATrjsRrE6lRyUNM_A","Shell","Hosa Rd, Hobli, Srvyno25/1, Varthur","12.899336","77.675489"
"ChIJC0MKdwtrrjsRLenRWx2ynhw","Joseph Fuel","City Main Road, Basapura Village Road, Bengaluru","12.8579733","77.64613779999999"
"ChIJgaQFqhVtrjsR9OfRaogNTJo","Gail CNG point","7, Service Road, Pragathi Nagar, Electronic City, Bengaluru","12.8661762","77.655884"
"ChIJ_TPeb4ptrjsR3YFPSqiNwzE","IndianOil","S No 215, 2, National Highway 44, Beerpalli, Krishnagiri","12.8650262","77.65785199999999"
"ChIJDTuN0NBtrjsR8O2qbAJw86g","Hindustan Petroleum Corporation Limited","Survey No 5/6, Begur, Beratena Agrahara","12.863594","77.65884199999999"
"ChIJ70cGDO9trjsRn9R88WKCQ9E","Sudarshan Fuel Station","H P AVENUE, road, Konappana Agrahara, Bengaluru","12.8554211","77.663529"
"ChIJHUhBv6ZtrjsRkpTfh64EGzs","Sudharshan Emission Testing Centre","near Indian Oil Petrol Pump, 16thain, near Indian Oil Petrol Pump, Konappana Agrahara, Agaraha, Bengaluru","12.8556795","77.6637701"
"ChIJNYdlZwBrrjsR8pt7PVlLMx4","Jio BP EV Charging Station","130, 7th Cross Road, Celebrity Paradise Layout, Doddathoguru, Electronic City Phase I, Electronic City, Bengaluru","12.8469117","77.65087079999999"
"ChIJtX_lIvcUrjsRWwrMigDGXv4","Gurukrupa Service Station Bharat Petroleum","58/1, Hosur Road, Singasandra, Bengaluru","12.8751831","77.64851639999999"
"ChIJDQjUmLNtrjsRENbEHzrEYTY","Khokon Gazi","Anekal taluk, Hosur Road, Neraluru","12.8539184","77.6660751"
"ChIJo_ABXgBtrjsRdseMNnrhRvI","Bharat petrol Bunk","VM79+V88, Doddanagamangala Road, Konappana Agrahara, Rayasandra, Bengaluru","12.8649186","77.6676549"
"ChIJzY4jU6psrjsRSyg5M_hAi-U","Sri Ram Enterprises","1, Hosa Road, Bengaluru","12.8764396","77.6564074"
"ChIJdx3rt2ptrjsRzYKz7u_q4Lk","Bharat Petroleum","KV Krishna Reddy Building, 157/1 ,1st floor, K V, Hosur Mail, Road, Konappana Agrahara, Electronic City, Bengaluru","12.8531969","77.66694679999999"
"ChIJ37l3NM9rrjsR4-6vjh_DLf4","Hindustan Petroleum Corporation Limited","Sy No 193/191/192/189 Hosur Main Road, Begur, Singasandra, Bengaluru","12.877031","77.647744"
