place_id,name,address,latitude,longitude,open_now
"ChIJ687YsOrlKDoRx-rEkJDoBfY","Hindustan Petroleum Corporation Limited","No 387/3 & 387/7, NH 200, Raipur - Bilaspur Expressway, Charoda","21.3869746","81.66997649999999","true"
"ChIJa3eVRUXuKDoRysBFe-scY6c","HP PETROL PUMP - DHARAM FUELS","Ground Floor Saragaon, Road, Dharsiva","21.4275139","81.7468157","true"
"ChIJRbGWK2_lKDoRRn6b8HDtYqQ","Hindustan Petroleum","Kapsada NH-200, Highway, Raipur","21.429212","81.678049","true"
"ChIJHeLqTADvKDoRi37mT4JoK6o","Kurud silyari","CPFV+C76, Kurud, Siliyari","21.4235448","81.743149",""
"ChIJpSxmRfnvKDoRXD0nnNQ-tZw","Bharat Petroleum Petrol Pump , MANAS FUELS","S.NO. 185/3MALAUD, Raipur","21.435104","81.75263199999999",""
"ChIJp6gaKBnvKDoRVGQ2prmVbYc","IndianOil","Ground Floor, Raita, Raipur","21.439048","81.712291","true"
"ChIJ00_ibDPvKDoR62IiDtk5kF4","Hindustan Petroleum Corporation Limited","Ground Floor, Kapsada","21.435091","81.700732","true"
"ChIJQWRhJXDvKDoRGS10lEwoHUg","Hindustan Petroleum Corporation Limited","Khasra No 357/1, Kutharail","21.44728199999999","81.741501","true"
"ChIJ-64pO5vlKDoRstqwsyWQwGw","SHRI VAIBHAV PETROLEUM (BPCL)","India","21.4034078","81.679341","true"
"ChIJ2fjBtpDdKDoRTL_pHdfdJbo","Reliance Jio Bp Petrol Pump","B R COMMERCIALS RELIANCE JIO-BP PETROL PUMP PLOT NO. 438/1, SILTARA DHARSIVA BYPASS NH-30, RAIPUR BILASPUR EXPRESS WAY, DIST, VILAGE, Dharsiwa","21.4084066","81.6768795","true"
"ChIJHeQkdiXlKDoRkrdLk3uj--k","IndianOil","Ground Floor NH 30, Kunra","21.434659","81.679541","true"
"ChIJv0j_rBzlKDoRgN5jeiwpk8E","IndianOil","Ground Floor, Kunra","21.436178","81.67996699999999","true"
"ChIJp09HXnflKDoRkNFQzV9523g","IndianOil","Ground Floor, Dharsiva","21.4405977","81.68244949999999","true"
"ChIJb2HSuaXlKDoRhKugYdhuf9w","Hindustan Petroleum Corporation Limited","Ground Floor, NH 30, Raipur - Bilaspur Expressway, Dharsiwa","21.41202239999999","81.6721214","true"
"ChIJAR0TcXXlKDoRVG9o8lHgWcE","JIGYASA FUELS","CM6C+VJ3, Bilaspur Rd, Dharsiwa","21.4121304","81.6715321","false"
"ChIJRRninfvlKDoR0xdkkZjw3EM","Hindustan Petroleum Corporation Limited","PH No 18/91, Khasra No 36, 1/2, Dharsiwa","21.4122421","81.6707325","true"
"ChIJYznZ9dvxKDoRKhRK6Opzdzs","IndianOil","Ground Floor, Tilda, Raipur","21.469475","81.75133699999999","true"
"ChIJ0cVRRNDlKDoR9dIFFh8siPE","IndianOil","Ground Floor, Kayabandha, near NRDA Office, Raipur","21.3849769","81.6695955","true"
"ChIJNduPGgDlKDoRA8Dre1jdoM4","SUPER FUELS SILTARA (BPCL)","9MG8+FJ, Akoli-2","21.37622829999999","81.6665517","true"
"ChIJufN76oDlKDoRia2jM9V_r7E","Jio-bp","Survey No 434/1, 437/1 & 438/1, Dharsiwa","21.374107","81.6670801","true"
"ChIJf6zgId3lKDoReGwnNfNhiOE","Hindustan Petroleum Corporation Limited","Phz 2, CSIDC, No 527 & 531/7/P, Amenity C, NH 200, Raipur - Bilaspur Expressway, Siltara","21.374001","81.6662001","true"
"ChIJM_SKQPPrKDoR35b786K9HEE","Hindustan Petroleum Corporation Limited","Ground Floor, State Highway 9, Saragaon","21.3629066","81.7992532","true"
"ChIJPylbAdTtKDoRvhXw8KzIsKA","Hindustan Petroleum Corporation Limited","Ground Floor Baraunda, near Management College, Raipur","21.382073","81.824184","true"
"ChIJp9g-awDtKDoR-zu7kjbNaMQ","VINAYAK FUELS, Bharat Petroleum","9RXW+378, Bangoli","21.3976607","81.84570310000001",""
"ChIJKbhysovrKDoRCZqqnOfo5mQ","HP PETROL PUMP - SHRI BALAJI PETROLEUM","Hpcl Retail Outlet, State Highway 9, Saragaon","21.367088","81.80402699999999","true"
"ChIJTcBYCMTsKDoRM7-2OxgxmSI","IndianOil","Ground Floor, Tilda, Bangoli, Bangoli","21.403001","81.850201","true"
"ChIJm2TeAii1KDoRLfrW6yl44Xg","IndianOil","Ground Floor, Rajim, Baronda","21.374538","81.8308047","true"
"ChIJKXh0jAGDKDoRj4ketB0phrQ","IndianOil","Ground Floor, Saragaon, Dondekhurud,Latuwa, Baloda Bazar","21.3612947","81.7964952","true"
"ChIJ4V4KdQvtKDoRY-QpwZvtZFA","Hindustan Petroleum Corporation Limited","Ground Floor NH 130B, Raipur Kharora, Road, Bangoli","21.397557","81.854124","true"
"ChIJWQiaxADtKDoReyF4xsItulA","Hindustan Petroleum Corporation Limited","Ground Floor NH 130B, Raipur Kharora, Road, Bangoli","21.397557","81.854124","true"
"ChIJU_otlIftKDoRSy8iZLqs77k","Aastha Fuels","FR5J+PRX, Raikheda","21.4593544","81.83209649999999",""
"ChIJE22SeJSTKDoRLKDp4ZZ3uEg","Hindustan Petroleum Corporation Limited","Ground Floor, Tilda, Mura","21.439741","81.869575","true"
"ChIJzbero0GTKDoRLHZNG9hKvrs","IndianOil","Ground Floor Tilda, Mohrenga","21.434869","81.892127","true"
"ChIJBRcNeXaTKDoRbyVch4vm-Nk","IndianOil","Ground Floor Math, Kharora","21.392901","81.90730099999999","true"
"ChIJe6Sh43KTKDoR9-RjoIEUs9Q","IndianOil","Ground Floor Tilda, Raipur","21.458181","81.86885099999999","true"
"ChIJJXm8XL2TKDoROFo6PaLn938","IndianOil","Ground Floor, Tilda, Kharora, Kharora","21.40043499999999","81.921852","true"
"ChIJOacVnZeTKDoRt2IF7wxuIwQ","IndianOil","Ground Floor, near New Bus Stand, Kharora","21.396802","81.9214989","true"
"ChIJX5T_U8eTKDoRY6caXbtjxMc","R S FUELS","KHARTORA, ROAD, ROHASI","21.3977431","81.9284509",""
"ChIJg5fpB-yTKDoRnGzHX91ZJcw","Hindustan Petroleum Corporation Limited","Ground Floor, Kharora","21.394471","81.93649099999999","true"
"ChIJDS1_7GHxKDoRfzYCQcBdGeg","Hindustan Petroleum Corporation Limited","Ground Floor, Dharsiwan, Tilda, Tarpongi","21.494672","81.696753","true"
"ChIJcZbADNjdKDoRzp9-xhHfAQw","IndianOil","Ground Floor Tilda, Saddu, Tilda","21.50843489999999","81.6924128","true"
"ChIJ6bV8DzrxKDoRyFgalNldunE","RADHA RANI PETROLEUM","GM5R+GW9, NS30, Raipur","21.5087868","81.69235499999999",""
"ChIJ3TYUsJ3xKDoRav9SzAcOGGQ","Bharat Petroleum Petrol Pump , JAI AMBE FUELS","VILLAGE SADDU, NH30(OLD NH 200, Bilaspur Road, Raipur","21.51645139999999","81.6941068","true"
"ChIJR3xlDQDxKDoRLV92uuksujQ","Ajay filling station jota","GQGG+7CW, Jota","21.5257369","81.776085",""
"ChIJ_7zotgzxKDoRKTKY82YOtIg","IndianOil","Ground Floor, Tilda Road, Jota","21.535206","81.770881","true"
"ChIJP7FdcwDxKDoRn9MdvVqlriE","संकरा, छत्तीसगढ़ भारत गैस","GMWW+MV, Sankara","21.546704","81.697176",""
"ChIJA705VBXxKDoRd13vkSeXIKc","IndianOil","State Highway 2, Sankara","21.5475113","81.69772259999999","true"
"ChIJbUZQ4yrzKDoR2kXYLbL3PwY","IndianOil","Ground Floor, Tilda, Bartori","21.509955","81.8203601","true"
"ChIJr7AxQfjzKDoRbIICEemKn2A","Hindustan Petroleum Corporation Limited","Ground Floor, Neora, Tarasiw, Raipur","21.483691","81.84453599999999","true"
"ChIJm2uXYwDzKDoRta6iyQffWk8","Yadav Ji Fuels","SH 20, Tilda Simga Road, Kharora","21.5262831","81.808067","true"
"ChIJle0a6urzKDoRFx3a8n9q4n0","Hindustan Petroleum Corporation Limited","Kharora Road, Tilda","21.5375515","81.7992854","true"
"ChIJx6CGF-vzKDoRWfBOrVSRkLU","Mangalam Fuels","GQQX+QJV, Tilda","21.5394907","81.7990604",""
"ChIJa7BduZ3zKDoRn-onqRseGSI","IndianOil","Ground Floor, Tulsi, Raipur","21.5402806","81.8056213","true"
"ChIJKXegdvTzKDoRYFDOPJv0W6c","IndianOil","Ground Floor, near Railway Station, Tilda","21.553401","81.796801","true"
"ChIJe2ymMTLzKDoRvRs4kAxvxHs","Bharat Petroleum, Petrol Pump -Mangalam Fuels","NEVRA TILDA, RAIPUR","21.5552042","81.79733300000001",""
"ChIJJSMrhjjzKDoRxsbMDwLnD-M","HP PETROL PUMP - SHRI SAIKRIPA FUELS","Hpcl Retail Outlet Village- Mura Tehsil- Tilda, Raipur","21.537656","81.852313",""
"ChIJlfVJ5sWNKDoRDPXmEwONXaE","Petrol Pump","493195, Mohra","21.5057486","81.93770620000001",""
"ChIJEe5qXO2NKDoRKfYfwvrUhQA","Hindustan Petroleum Corporation Limited","Ground Floor Mura, Marg, Suhela","21.506942","81.937843","true"
"ChIJ9WpnV5v3KDoRomH3vrir7LE","Hindustan Petroleum Corporation Limited","Ground Floor, NH 2000 Raipur Bilaspur Road, Simga, Aurethi","21.6080532","81.7030231","true"
"ChIJRfK64Qb3KDoRmH5a-p_pajg","Hindustan Petroleum Corporation Limited","Ground Floor, Sarora Road, Tilda","21.5585228","81.75849269999999","true"
"ChIJcXneYOX3KDoRft3It2DuLcA","Ushara Fuel Station ( भारत पेट्रोलियम )","Raipur - Bilaspur, National Highway 30, Bhumiya","21.5648954","81.70025869999999","true"
"ChIJU1VVJPTzKDoRufn3TPrfVPQ","IndianOil","Ground Floor, Boria Khurd, Neora","21.56060099999999","81.78190099999999","true"
"ChIJS_8AoIzzKDoRBfN4Rhha5WQ","Hindustan Petroleum Corporation Limited","Khasra No 100, Infront of Pursue Turn, 8 Sasaholi, Simga Road, Tilda","21.55682669999999","81.7861135","true"
"ChIJzVOMVADzKDoR6lcBAdSF9eU","Lal Fuels Indian oil petrol pump","Ground Floor, Tulsi, Raipur","21.5713697","81.7893376","true"
"ChIJ_bXuWJv3KDoR3wgQRTRoMik","HP PETROL PUMP - SOMNATH FUELS","HP Petrol Pump Raipur Bilaspur NH 2000 Village Aurethi, Simga, Bilaspur Road, Raipur","21.6082291","81.7026219","true"
"ChIJ68RaeAD1KDoRL7DvtALCJyk","Hindustan Petroleum Corporation Limited","280/1, Plot No 274/1, Tilda","21.566002","81.806231","true"
"ChIJOQlC4hDzKDoRsqW_F9S7pD8","Hindustan Petroleum Corporation Limited","Ground Floor, Tilda Newra","21.560972","81.83315800000001","true"
"ChIJdyF6VuTzKDoRWWmGl0FqOjY","SHRI GYAN FUELS","manpur road, Kota","21.5609816","81.8332622","true"
"ChIJQy90BwCLKDoR-sl8iD9ORrg","Shree Shambhu Dayal Fuels","JV8G+MF, Pousari","21.616749","81.876243",""
"ChIJDa6fsxOLKDoRlj6cCBCKHzg","Hindustan Petroleum Corporation Limited","Ground Floor Simga, Road, Hathbandh","21.617302","81.8666401","true"