place_id,name,address,latitude,longitude
"ChIJ0wLeTvcVrjsRu-8tKDtwW-w","Shell","opp. Ramaka Mandir, 127 Bull Temple Rd, opp. Ramaka Mandir, Channi Rd, Bengaluru","12.953503","77.56741"
"ChIJ9dYp7yo-rjsREBm4keC1FN8","IndianOil Petrol Pump","near Rani Chennamma Circle, 281, 100 Feet Ring Road, Padmanabhanagar, Banashankari, Bengaluru","12.9222146","77.5600343"
"ChIJsxM8vgkWrjsRz5F_o-Kaie8","MAHENDRA ASSOCIATES","54, Sadar Patrappa Road, Bengaluru","12.9648033","77.58095639999999"
"ChIJ29IXwZYVrjsRNwZ47ylafp4","Bharat Petroleum Corporation ltd","Southend Circle, Jayanagar, Bengaluru","12.9365547","77.5805109"
"ChIJ7_yVpv0VrjsRKywZCmCeCAQ","Bharat Petroleum Corporation ltd","No.24, opposite CCB Office, 1, Mysore Road, Briand Circle, Bengaluru","12.9640549","77.57043829999999"
"ChIJWTaEpt0VrjsRENUxu2byMSE","Gogas Auto LPG","5, Lal Bagh Main Road, Vinobha Nagar, Sudhama Nagar, Bengaluru","12.9586423","77.5868661"
"ChIJ44s6Cd4VrjsRP1mBJiI7Ro4","TotalGaz LPG Station","9th Floor, G9, 1st Cross Road, Sampangi Rama Nagara, Sampangi Rama Nagar, Bengaluru","12.9615297","77.5856386"
"ChIJQULpUesVrjsRM6CUe5BNwG4","Hindustan Petroleum Corporation Limited","45, Vanivilas Road, Basavanagudi, Bengaluru","12.9480351","77.5733845"
"ChIJl9gekMMVrjsR5swhlPHpHQg","IndianOil","No 2, Dr MH, Marigowda Road, Sudhama Nagar, Bengaluru","12.9521491","77.5892154"
"ChIJeZ1kGMQVrjsR6y3GbpW6TP4","Shell","Hosur Road, Mavalli, Bengaluru","12.9496054","77.5928571"
"ChIJpZ7N3HkWrjsRoHK39_xMVH4","Shell","next to UB City, 24, Vittal Mallya Road, Bengaluru","12.971323","77.59702999999999"
"ChIJK43lk5QVrjsRMkYnPCA_KS0","IndianOil","Ground floor, Rashtriya Vidyalaya Road, Basavanagudi, Bengaluru","12.941932","77.580376"
"ChIJG0yR0L8VrjsRwx3OMQkH1_U","Sipani Total Gaz","10, T Mariappa Road, Jaya Nagar 1st Block, Jaya Nagar East, Jayanagar, Bengaluru","12.9420477","77.5854052"
"ChIJ0Y9u9XoWrjsRB0_j1PSoQl8","Hindustan Petroleum Corporation Limited","6, Kasturba Road, Bengaluru","12.975903","77.5978703"
"ChIJK_ylv8cVrjsRMov1DipUcWo","Aegis Autogas","Reliance TimeOut Corner, Wilson Garden, Hosur Main Road, Arekempanahalli, Hombegowda Nagar, Bengaluru","12.9461189","77.5949792"
"ChIJBRGQa8QQrjsR16GIvG6C9Hw","Bharat Petroleum Corporation ltd","93 5th Cross, near Central School, Dr, Doctor Rajkumar Road, SSI Industrial Area, Bengaluru","12.9805953","77.5571782"
"ChIJL4JG6ccVrjsRYyIKr0k7jv4","Bharat Petroleum Corporation ltd","opposite 10th Cross Road, 53, Hosur Main Road, Arekempanahalli, Wilson Garden, Bengaluru","12.9457943","77.5952751"
"ChIJm4eH54oVrjsRc0JCLrQaEh4","Hindustan Petroleum Corporation Limited","Survey No, 73/7, 3rd Cross Road, Mount Joy Extension, Hanumanthnagar, Bengaluru","12.9415087","77.5641517"
"ChIJVVqFEG8WrjsR_MNU-VrDwXI","Hindustan Petroleum Corporation Limited","5, Raj Bhavan Road, Bengaluru","12.982293","77.59411589999999"
"ChIJ-Ug8qvE9rjsRmG7nP01mbnw","IndianOil","10, 3rd Cross, Doctor Rajkumar Road, S.S.I.Area, 6th Block, Rajajinagar, Bengaluru","12.981062","77.55828009999999"
"ChIJwa_kgJkUrjsRzRYAfG7YFFM","IndianOil","No Ca/11, A19, Th Main Road, Sector 2, HSR Layout, Bengaluru","12.90729","77.644684"
"ChIJh7f9zL8UrjsR4bORFlPBtHI","IndianOil","13/1, Hosur Road, Singasandra, Bengaluru","12.8812099","77.64530169999999"
"ChIJPaf9zL8UrjsRx2CA0u4t_pM","Shell","near Shell Petrol Pump, 137 20th Main, Hosur Road, Bommanahalli, Bengaluru","12.9005571","77.6335166"
"ChIJuSCRwk1rrjsRMit8cJkex6w","IndianOil","Sy No 65, next to Manipal County Road, Singasandra, Bengaluru","12.8741093","77.6411957"
"ChIJb1hsjl4TrjsRrMoKvgpnQT0","IndianOil","Site No 3839 & 40, RRR Group, Haralur","12.8990184","77.6584068"
"ChIJP0sKWY4UrjsRELVEEJYOlW4","Hindustan Petroleum Corporation Limited","opposite JSS Public School, CA Site No 1, 14th Main Road, Sector 4, HSR Layout, Bengaluru","12.9152997","77.6383182"
"ChIJr7nwVIYUrjsRIO5kkegWuMM","IndianOil","Survey No 38, Ring Road, Sector 4, HSR Layout, Bengaluru","12.9210236","77.6448992"
"ChIJc9iyb7RsrjsRV2RKK0b2Vv4","IndianOil","Ground Floor, Junction, Naganathapura, Rayasandra, Bengaluru","12.8761804","77.67152200000001"
"ChIJeVq-lEATrjsRrE6lRyUNM_A","Shell","Hosa Rd, Hobli, Srvyno25/1, Varthur","12.899336","77.675489"
"ChIJb-eKI3ATrjsRW3lacy-te3o","Hindustan Petroleum Corporation Limited","Sy No 23, Haralur Main Road, Ambalipura, Sarjapura, Bengaluru","12.914749","77.666963"
"ChIJw-oNKn4UrjsRB7KutfyqOIg","IndianOil","Khata No 267, No 97, 6/1, Sarjapur Road, Agara Village, Bengaluru","12.9247825","77.65069319999999"
"ChIJNV9Qw2MUrjsRPamWXVRqje4","Nayara Petrol Pump","1st Main Road, Koramangala, Bengaluru","12.9280599","77.6372119"
"ChIJq3NPE1YUrjsRRc7yY3L8wFc","SUPERGAS Auto LPG Station - Sapthagiri Enterprises","2/26, BEML Main Road, Maruthi Nagar, Madiwala, Bengaluru","12.924324","77.614532"
"ChIJqZyY1sgUrjsRd0_mGFZv5KQ","IndianOil","4, 6th Main Road, BTM 2nd Stage, Bengaluru","12.9163592","77.605283"
"ChIJ9wejXwAVrjsR7oZFbCYiVkM","lpg auto gas bunk","1, Kudlu Main Road, Krishna Reddy Industrial Area, Hosapalaya, Muneshwara Nagar, Bengaluru","12.8903348","77.6436655"
"ChIJY0S4ahoVrjsRj4FKKuhJIVs","IndianOil","Survey No 82/2, Singasandra, Bengaluru","12.8854131","77.6418443"
"ChIJW4tDPkEVrjsR9psowcBuaMA","Shell petrol pump","49 Hosur Road Begurhobli, Situated at, Singasandra, Bengaluru","12.883492","77.642851"
"ChIJYfoEvkAVrjsR7_xcTOoBAQw","CHIDANAND R Service","VJVP+J5R, 29, Hosur Road, Papannareddy Layout, Garebhavipalya, Garvebhavi Palya, Bengaluru","12.8940455","77.6353132"
"ChIJY3qvDOUVrjsRwHUQbvkuPe0","Manu gas agency","VJWM+495, Om Shakthi Layout, Hongasandra, Bengaluru","12.8952523","77.6334749"
"ChIJ7XRcSwAVrjsRBCO7yNaGk7Y","GAIL CNG PUMP","267, Mico Layout, Garvebhavi Palya, Bengaluru","12.8965042","77.6349718"
"ChIJfzfjs9ZtrjsRXOdftINDNeI","IndianOil","Sy No 95, Chandapura- Anekal Road, Bengaluru","12.7977114","77.7060523"
"ChIJERsGlUlsrjsRK2tpzQOP_Rs","Total LPG Gas station","Tranquil City, Bommasandra Village, Bengaluru","12.8153247","77.6924116"
"ChIJtXBwXzNsrjsRxKzJUEid0cg","IndianOil","Amenity, next to ESI, Plot No 145/B, Hosur Road, Bommasandra Industrial Area, Bengaluru","12.8151733","77.6913872"
"ChIJGwGwRnptrjsRYiMKcNFhFnY","Don 4","RP52+3GF, Unnamed Road, Tranquil City, Bommasandra Village, Bengaluru","12.8076859","77.70128380000001"
"ChIJkWlsXzNsrjsRnrXN_4uGtKg","IndianOil","Plot No 240/C, Hosur Road, Bommasandra Industrial Area, Bengaluru","12.8083477","77.69811039999999"
"ChIJEQPIEdJtrjsRQDyKoXKQArw","Gowtham Oil","India","12.8021879","77.7042074"
"ChIJMfHudoxtrjsR_2Fkk1FycSk","IndianOil","Sy No 121/3, Hobli, Chandapura, Attibele","12.8053291","77.7063127"
"ChIJwTOplKBtrjsRxl-qp5Z5nHw","MITHUN Mistry","RM8W+MXV, Bommasandra","12.8167303","77.6974369"
"ChIJC2Wx9mJurjsRjvyC77twneM","Hindustan Petroleum Corporation Limited","S No 77, Chandapura- Anekal Road, Chandapura, Iggalur","12.7945563","77.706521"
"ChIJNcTIxh5trjsRYCbPSAmiT4g","Shell Petrol Bunk Chandapura","Hale, Terracon Doctors Enclave, Chandapura, Bengaluru","12.8000258","77.71383879999999"
"ChIJpyrFWxptrjsRZRXUvCiXa6Y","SAKALASPUR ENTERPRISES","near Dmart, Hosur Road, Bengaluru","12.8168964","77.6914194"
"ChIJn99ZJoltrjsRvW9mx13GxMo","IndianOil","233A, Bommasandra Industrial Area, Hosur Road, Muthanallur, Anekal","12.8169517","77.69107489999999"
"ChIJDwrUHbxtrjsRCrpPBlumbSw","BHARATH PETROLEUM , PETROL PUM - RK FUEL STATION","HAL, Chandapura, Bengaluru","12.7993738","77.7165083"
"ChIJ1a-uDgBtrjsRo3HEgj_a7fA","RK FUEL STATION","opposite Nisagara Keerthana Apartments, Hosur Road, Biotech Park, Chandapura, Bengaluru","12.7991444","77.7166261"
"ChIJAS-sgh9trjsRPu8hraiRFjM","Anjanadri Fuels Nayara Petrol Bunk","RM7M+RJJ, Canara Bank Road, Bommasandra Industrial Area, Bommasandra","12.8145954","77.6840264"
"ChIJ-UItnyxtrjsRwJp20JJkFDo","S4 Staffing","NTOA, Hosur Road, ATTIBELE, Thirumagondanahalli, Bengaluru","12.7963034","77.7181351"
"ChIJG4cFz2dtrjsR6sn7GmncWBE","Bharat Petroleum Corporation ltd","NH 7, Anekal, Chandapura, Bengaluru","12.7956695","77.718532"
"ChIJPe1EREFsrjsRsaBXr2k4TDU","SHELL - BOMMASANDRA","5c/1, Bommasandra Jigani Link Road, Bommasandra Industrial Area, Bengaluru","12.8179","77.68128829999999"
"ChIJk7aJxn9prjsRt1YcNlQeAmo","Shell","47/D APC Circle Road Bridge Jigani Link Road, Hosur Road, Jigani","12.817917","77.68127799999999"
"ChIJAU3n8zZvrjsRT-h4yWDgiMo","IndianOil","Sy No 176/3 Bidaragere, Attibele Hobli, Anekal, Bengaluru","12.8175421","77.6777486"
"ChIJH3pd7d5trjsRe-psDBsaKI4","Hindustan Petroleum Corporation Limited","Survey No 33, Chandapura, Attibele","12.776084","77.769616"
"ChIJ7yAwZ6dxrjsR5s_jNosVQzw","IndianOil","No 18, opposite Ashok Leyland Plan, 1, CIDCO, State","12.765539","77.790925"
"ChIJFVjv2y5yrjsRXWUchLdbSKQ","Dhathri Fuels (NAYARA Petrol Pump)","Survey No.268/4 (Old No.268/2, Bidaraguppe, Attibele","12.8022034","77.78277"
"ChIJ41r5a_txrjsRO2t2zXZfbag","IndianOil","Survey No 2 Krinasagara, Anekal, Attibele","12.784407","77.752113"
"ChIJMwLn9P1xrjsRNuIZNMy6GfM","PEARL VALLEY FILLING CENTRE","near Sk Bar Guest Line, 01, near Sk Bar Guest Line, Bengaluru","12.7866582","77.74545599999999"
"ChIJ-4AoustxrjsRpz11oRbt2A4","Bharat Petroleum, Petrol Pump -Lake Side Fuels","Zuzuvadi","12.7706501","77.7864967"
"ChIJRRmFYwBxrjsRj2KfbheV0Y4","Hindustan Petroleum Corporation Limited","Bengaluru, Survey No 45/3 NH 44, Anekal, Attibele Near Attibele Toll","12.774789","77.781121"
"ChIJw2YAOBlxrjsRoDbXqGfbLnM","Bharat Petroleum, Petrol Pump -Shri Lakshmi Venkateshwara Fuels","ATTIBELE ON ANEKAL RD, BANGLAORE URB","12.7717768","77.7709236"
"ChIJC8UXDr9xrjsR12VkbSEjMvo","IndianOil","Sy No 188, 1, Chandapura - Anekal Road, Attibele","12.7687632","77.769848"
"ChIJPfi0OARxrjsR-mp68KV66e4","Bharat Petroleum BP Petrol Pump","QQ5X+C5X, Sipcot Ph. I, Hosur","12.7586034","77.7979797"
"ChIJO_kTEjpxrjsRmnGgCxBMUlI","RAGHUVEER fuel service station","3, Attibele - Anekal Road, Kuvempu Nagar, Attibele","12.768538","77.7697706"
"ChIJjTizTwBxrjsRA-MH0CFijmc","AREHALLI COMCO HPCL","QQ6C+VQ, Arehalli","12.762133","77.771986"
"ChIJb9-2bQBxrjsRmxVS_nd9nt0","Emission testing centre","QQ5X+78M, Sipcot Ph. I, Hosur","12.758306","77.79834579999999"
"ChIJv4IgxY1xrjsR7Il0fuEjJEc","MRPL HIQ (SHRUDU FUEL STATION)","105/2, TVS ROAD, AREHALI VILLAGE, Bengaluru","12.7607852","77.7724478"
"ChIJoea-K7FxrjsRPQZfOAvqUF8","IndianOil","Hissa No 294, Sy No 118, Anekal, Hobli, Ballur, Attibele","12.758001","77.774101"
"ChIJwyOv7NhxrjsRb1FqSRAiDMw","IndianOil","Survey No 1/1, Hobli, Indlabele, Sampangiram Nagar, Attibele","12.7921413","77.777632"
"ChIJqbcmrvlwrjsRAunJ9XCebyM","Sai Fuels","PQXV+635, ESI Ring Road, Mookondapalli","12.7480028","77.7927279"
"ChIJ3W26VQBxrjsRC_Z4wkNto-o","Nayara Energy Petrol Pump","PQWJ+G84, State Highway 85, NRI Center City, Hosur","12.7466435","77.7809668"
"ChIJuXn1rK1xrjsRCeXZWQLBOpA","Essar Petrol Bunk","Attibele-Rayakottai Road, NRI Center City, Hosur","12.7466439","77.7806717"
"ChIJ25uv0ONwrjsR3afK22PoN_0","NATIONAL SERVICE STATION","near Chennai silks, Bangalore main road, Hosur","12.7480647","77.80787339999999"
"ChIJ_zXYHoJ3rjsRct3KAiEZYR8","Hindustan Petroleum Corporation Limited","Electronic Complex, Plot No 20, Dharmapuri-Bengaluru Road, Sipcot Phase II Industrial Complex, Krishnagiri","12.715701","77.883701"
"ChIJo2lsqP15rjsRcU1W6iq7URI","Hindustan Petroleum Corporation Limited","S No 25/17, 25/18 A & 24/10B2, Rayakotta Road, Naligabetta Agraharam","12.705801","77.845201"
"ChIJ09OMN_t5rjsRysubrbZ8KWA","IndianOil","Rs No 579/1B Onnalvadi, Rayakotta Road, Avalapalli","12.7010847","77.84760279999999"
"ChIJHwdtv-p5rjsRNqRAi1iO8ao","Essar Petrol Bunk","MVP5+V86, Rayakotta Road","12.687158","77.8582565"
"ChIJC_j-wKx3rjsRBLDvcpiIGuE","Muneswara Chekken Center","Ashook Lailand, Uned 2, Ganthinagar, Hosur","12.7253949","77.8751425"
"ChIJfz-5YgB3rjsRen4RwWcGP5A","Iocl","PVF6+V6J, Service Road, Moranapalli","12.7250198","77.8608936"
"ChIJY-uNfYN3rjsRyATxrLYDfl8","Ankit","Fuel Pump, Krishnagiri","12.7260032","77.85459279999999"
"ChIJxSo3bwB3rjsR4WqDyolypRE","Popular fuels","PVG3+CJG, Service Road, Maruthi Nagar, Moranapalli","12.7257512","77.8540664"
"ChIJFys6sdJ3rjsRtLbpEOfjY1Y","Bharat Petroleum, Petrol Pump -T.V.Sundram Iyengar & Sons Ltd","PERANDAPALLI, NH-7 HOSU, KRISHNAGIRI","12.711809","77.89564639999999"
"ChIJE_iI2-N3rjsRvMjCIK0Kg5A","IndianOil","Lock No 11006, 635 109, 11007, Nh 7, Perandapalli, Hosur","12.7100878","77.89718739999999"
"ChIJobpjLgt3rjsRbakG1x35EWU","Anand Fuels","S No 419/1A, Lock No Ig 7107 Mornapalli, Avalapalli","12.7270169","77.851435"
"ChIJ3bsS9EZ3rjsRft6Q23vgNXs","IndianOil","S No 419/1A, Lock No Ig 7107 Mornapalli, Avalapalli","12.7272759","77.8512068"
"ChIJZ7jvG_x3rjsRswO7R3Vp9_8","Havish Petroleum (HP)","196/2, Bangluru road, Dommasandra, Sarjapura Hobali,Anekal, Dommasandra, Bengaluru","12.7267786","77.8497921"
"ChIJH5AKz153rjsRxhVWWeVDGdo","Essar Petrol Bunk","PRPW+363, Gnanasekar Layout Road, Hosur","12.7351329","77.8455357"
"ChIJ76zXviN3rjsRm26rUshwPBQ","Metablue AdBlue Filling Station","1/74-2B Athimugham Main Road Perandapalli Hosur Tamil Nadu 635109 Perandapalli","12.7247131","77.90849159999999"
"ChIJZcO6Wqd5rjsRbQm-kyekr8U","SLN FUELS","Rayakootai Road, Haleseebam","12.6870681","77.89515279999999"
"ChIJ91inYLl5rjsRFGjMYkkpR3g","Essar fuel station","MVHG+VF, Gudisaganapalli","12.6797218","77.8762489"
"ChIJZdajprNwrjsRtrfFa4oBFdE","Pioneer Roadways Petrol Bunk","State Highway 17, Old Rayakottah Hudco, Hosur","12.7226438","77.8334543"
"ChIJo5sT3MpwrjsR4i-MPfovOAw","IndianOil","Lock No 1100111002 & 22007, Rayakotta Road, Avalapalli","12.7324479","77.8354678"
"ChIJ_d2gCgB5rjsRQJtUCvVJ6kc","SREE ANAND ENERGY STATION","SH 17, Onalvadi","12.6763828","77.86587349999999"
"ChIJGVH2wnR4rjsRkmeSmQWJYG8","Hindustan Petroleum Corporation Limited","Ground Floor, near Bangalore Highway, National Highway 44, Shoolagiri, Kamandoddi","12.687201","77.92620099999999"
"ChIJg2wcQ9nWrTsRSuOhs7BZA90","Hindustan Petroleum Corporation Limited","Sy No 351, 2B & 351/SC, Hosur - Krishnagiri Road, Shoolagiri","12.6652786","78.0036449"
"ChIJ3V3OZQDXrTsRJivyFsppHlw","LIANO ENTERPRISES (AdBlue Filling Station)","Vasantham Complex, K/10, Koneripalli","12.6788065","77.9609564"
"ChIJMdpBmgPXrTsRD9U2atpT99c","IndianOil - SWAGAT","Ground Floor, NH 44, opposite Tab India Granites, Koneripalli","12.6802759","77.9571078"
"ChIJByBtUkF3rjsR_qxFJCShhEg","IndianOil","S No 192/3A, Hosur, Addakurukki","12.6807474","77.9523111"
"ChIJ73zY0_rXrTsRN59j1Xk8pT8","Jio-bp","SURVEY NO 322/1B, 2B, 3B, VILLAGE NALLAGANAKOTHAPALLI, HOSUR KRISHNAGIRI ROAD, S, VILLAGE NALLAGANAKOTHAPALLI, HOSUR KRISHNAGIRI ROAD, S, Hosur","12.6710187","77.9799592"
"ChIJAUGg2nR4rjsRSsP0AFxr3UE","Jio-bp","S No 1224, Nh 7, 1 & 2 & 256/1 & 257/1, Hosur 2, Kamandoddi","12.6882775","77.926934"
"ChIJp29fJNnWrTsRX6u7ShoC8I0","HPCL","M283+F5Q, शूलागिरी,Shoolagiri","12.6662226","78.00298579999999"
"ChIJO3qgONnWrTsRkqQUP0_02I4","Petrol Pump And Way Side Amenities","M283+89R, Shoolagiri","12.6658577","78.0034034"
"ChIJa-E-h-DXrTsRyVxrU2SMsf0","Sri Balaji Fuels, Essar Oil","Samanapalli","12.6373125","77.97693749999999"
"ChIJTUIZvnfRrTsRFP9xFjYqE5c","Bharat Petroleum GHAR COCO Outlet","J3R7+6HX, Chennekothapalli Road, Chinnar","12.6406098","78.0639989"
"ChIJT9dB9rnXrTsRQiDr9rGdt1g","IndianOil","Ground Floor NH 7, Gollapalli, Soolagiri, Chappadi","12.6494347","78.0352679"
"ChIJDerrX2fRrTsRMjowOa595wY","Cube Stop Highway Rest Area","NH 44, Bangalore, Shoolagiri, to, Bengaluru - Chennai Highway, BP, Hosur","12.64057","78.064487"
"ChIJwUev9UXRrTsRei0q0T5Z43c","IndianOil","Sy No 30/1B3 30/1B4, Devarkuttapalli, Chappadi, Krishnagiri","12.6363142","78.07104609999999"
"ChIJiWOq43HRrTsRLfcNcZRLHXo","Hindustan Petroleum Corporation Limited","Survey No 67, 2B & 2C, National Highway 44, Chennapalli","12.6438506","78.0540564"
"ChIJl738Dc3RrTsRyVVrYsoL4ig","Motodef adblue","Immidinayaganapalli","12.6435081","78.0533348"
"ChIJfXB0vT_RrTsR4cJijAGiMdY","IndianOil","Sy No 83/3A1A, Sennapalli,Chappadi, Chennapalli","12.646497","78.04638899999999"
"ChIJBdLWRQDTrTsRZ1ZsgALMopQ","Motodef adblue filling station Immidinayakanapalli shoolagiri","J3FJ+R2Q, Mallasandiram","12.6248764","78.0800388"
"ChIJRfibYgDRrTsRQDuRzcQ4N7c","Metablue Adblue® / DEF Filling Station","Hosur NH, Sundagiri","12.6461875","78.0444375"
"ChIJOQ30MgvRrTsRrgaRcYiKb2c","QBlue DEF (AdBlue), filling station","J2XP+R4, Gollapalli","12.6496348","78.0355823"
"ChIJVda-sDPRrTsRkPIGDaIjKho","Hindustan Petroleum Corporation Limited","SF No 234/1, Hosur - Krishnagiri Road, B/1, Salem","12.6543452","78.0252797"
"ChIJB4IKdqjNrTsRuSiiI7Gzut0","BP Petrol Pump - SUPER FILLS","bus stop, NH-7 bangalore highway sikkarimedu, village, Kurubarapalli","12.5876444","78.1448727"
"ChIJz96QPcDMrTsRX464yKliEz0","IndianOil","SF No 236/1 Bkundarapalli, Ramapuram, Beerpalli","12.564037","78.178015"
"ChIJBw4y5BbNrTsRqzIx1kMQCL4","Hindustan Petroleum Corporation Limited","6A, 5B1 & 6B1, near Krishnagiri Bangalore Road, SF No 291/5A, National Highway 44, Periyapulivarsai, Billanakuppam","12.5819943","78.15782569999999"
"ChIJ9yv0UsTNrTsRlJQQAhhOEYc","ADNAN FUELS NAYARA PETROL STATION","Survey No: 260, 5GA, Polupalli","12.580647","78.16116339999999"
"ChIJGZhb-evMrTsRmAM_wXunctI","IndianOil","S No 215, 2, National Highway 44, Kundarapalli","12.5703358","78.174089"
"ChIJZ_i2iqPNrTsRPSbajwrAD3I","ESSAR Petrol pump puliyanchery","J44J+62V, Puliyanchery, Gollapalli","12.6056064","78.13004959999999"
"ChIJI8M_-JTMrTsRlwaYdhOCZKU","Hindustan Petroleum Corporation Limited","SF No 258/2B, Kundarapalli","12.5689076","78.18207389999999"
"ChIJFyyGhpHNrTsRUA91UL5obH4","IndianOil","Ground Floor, NH 7, Kurubarapalli","12.6015899","78.1244595"
"ChIJ1WtOgAzNrTsRn6cr-3UK2nA","IndianOil","Ground Floor, NH 7, Kundarapalli","12.5604575","78.1829012"
"ChIJSzKECjA1rDsR6713vhB3rG4","Indian Oil Petrol Pump","Subedhar Naidu, Chennai Bypass Road, Krishnagiri","12.5186113","78.2137365"
"ChIJZU6sU5Q0rDsRXTKDSNoHrp4","Hindustan Petroleum Corporation Limited","13/43 J, Salem Main Road, Krishnagiri","12.518801","78.221501"
"ChIJ_xQ-ALs0rDsR115rDhn74lg","HP PETROL PUMP - AYESHA FUELS","HPC Dealers S.f.no.15/7, T.b.road Oldpet, Krishnagiri, Coimbatore","12.5300189","78.2164781"
"ChIJlXdxWKM0rDsRij-ZEbDReVw","Bharat Petroleum","Sp Vikkram Fuel Agencies, near Central Theatre, near Forest office, Bangalore Road, Londenpet, Krishnagiri","12.5270723","78.212684"
"ChIJT4HYVac0rDsRVdfN3dHjjcM","Hindustan Petroleum Corporation Limited","Survey No 35/1, Rayakottai Road, Kathujuganapalli","12.5270429","78.2021606"
"ChIJEX0XaBI0rDsR2IcFbqbaSF8","Hindustan Petroleum Corporation Limited","Ground Floor Pananthoppu, BUS Stop, Sundekuppam","12.472891","78.21494899999999"
"ChIJA1_orY00rDsRHrD2g7UhqNU","Bharat Petroleum BP Petrol Pump - BKPM Sons","G65C+7FP, NH-7, Bangalore Road, Krishnagiri","12.5081189","78.22131949999999"
"ChIJ3-vf-Ng1rDsRnawS5BTaVic","IndianOil","SF No 453, 1B & 453/2B, Agraharam, Agasipalli","12.5051279","78.223666"
"ChIJuRvvrI81rDsRnPBqDbBEd5g","Indian Oil(CNG) - Aavin Fuel Station","G63F+5J4","12.503668","78.22394039999999"
"ChIJs12vhoo0rDsRIDC6GpJ5qrI","IndianOil","Ground Floor Devasamudram Ma,thur, Agraharam, Krishnagiri","12.501544","78.223018"
"ChIJrSX19lE1rDsR1S8LGZldXMc","S.P.Vikkram Fuel Agencies, Bharat Petroleum Dealer CNG","KRISHNAGIRI TOWN, Krishnagiri","12.5014842","78.2226778"
"ChIJ-2W9g5I0rDsR5Gh4jmqcnIg","K A K C Petrol Bunk","Lock No 11020, Salem Main Road, Agraharam, Krishnagiri","12.5141065","78.2220262"
"ChIJyZIZ1-o0rDsRWsn8cDIGj-Q","Hindustan Petroleum Corporation Limited","51, Madras High Road, Krishnagiri","12.519501","78.224701"
"ChIJ0Q5nWiQ1rDsRW6_-PaZAbGg","Bharat Petroleum Petrol Pump , SHRI MAHAALAKSHMI FUEL PARK","Thiruvannamalai Road, Krishnagiri","12.515296","78.23292000000001"
"ChIJf491XUY1rDsRdQDRnskDnkE","Bharat Petroleum COCO Outlet Krishnagiri","NH44, Bangalore, Salem Highway, Krishnagiri","12.4949218","78.2207573"
"ChIJiV5G_5U0rDsRX24ahAVv6t0","KNS Agency","KNS Agency, opposite to Indian bank, Bangalore Road, New Pet, Krishnagiri","12.5217425","78.2194336"
"ChIJsXQSRnk1rDsRSrMRxr4veTg","IndianOil","Sy No 11/1B2, Boganapalli","12.5212528","78.228003"
"ChIJZact_b00rDsRW9rJ1_ze890","IndianOil","S No 103/1B, Boyanapalli, Beerpalli","12.5226473","78.21914040000001"
"ChIJ0x_AEao0rDsRg5kN_V-4eEk","IndianOil","Lock No 11010, NH 7, Bangalore Road, Agraharam, Krishnagiri","12.5230667","78.217286"
"ChIJ-bjAqKk1rDsRndLcgXQGmnY","Hindustan Petroleum Corporation Limited","SF No 15/7, TB Road, Old Pet, Krishnagiri","12.530049","78.2164816"
"ChIJh6KKQjFLrDsRwiTXvWVkGhA","IndianOil","SF No 413, 7414/1, Krishnagiri Main Road, Barugur","12.5437759","78.3544726"
"ChIJ6yEWxTZLrDsR_CzWXWgsc-c","Hindustan Petroleum Corporation Limited","Ground Floor, opposite Main Bus Stand, Krishnagiri Main Road, Bargur","12.542801","78.356701"
"ChIJZ5ahoDVLrDsRABGDWd9XZYI","K.S.K FUEL AGENCIES","Chinna Bargur, Bargur","12.5476169","78.3595725"
"ChIJAUGtZspKrDsR6TMtLbuFF2g","Hindustan Petroleum Corporation Limited","Survey No 793, 6B & 793/4 NH 46, Madepalli, Kandikuppam","12.545453","78.31709300000001"
"ChIJO0P3uKdKrDsRnZgDEzLvcWE","IndianOil","S No 388, Orappam","12.5346782","78.2949512"
"ChIJSXrNYAC1rTsRDMoR7TnBxak","LOGAN FUELS BHARAT PETROLEUM","POST AND TALUK, H82V+G37, Madepalli Road, NH 48, MADEPALLI VILLAGE, CHENNAI, TO, KRISHNAGIRI HIGHWAY, Bargur","12.5510912","78.34320679999999"
"ChIJ7wszz2W1rTsR-xqeX8r3NYg","IndianOil","No 657/4B659/2B659/3A, Varatanapalli","12.5771788","78.3023267"
"ChIJ3akxJ9K0rTsR9Xx6QKMOwY4","KANAKADASA FUELS","Salinayanapalli","12.5555617","78.34827779999999"
"ChIJlQ-JSyc1rDsRq-wP6C14Qrk","SHREE MAHAGANAPATHY AGENCIES","Orappam","12.5355007","78.28130519999999"
"ChIJA4yc5xhLrDsRYKXHTZSruHA","IndianOil","S No 469/1, Barugur, Mallapadi","12.524753","78.3458873"
"ChIJxTJ6ylVLrDsR59Mws6iCK5w","Essar Petrol Bunk","G8FW+F25","12.5236353","78.345118"
"ChIJBwclz93LrTsR_V0NIDN7JOg","Hindustan Petroleum Corporation Limited","SF No 984/2, Palepalle","12.5694051","78.286512"
"ChIJp7UnpJo1rDsRZUFHZO0PhNU","UMT fuels (ESSAR FUEL STATION)","Orappam Village, Taluk, Bargur","12.5357583","78.2715504"
"ChIJfcRKWTRNrDsRVD5uB25T5wk","Hindustan Petroleum Corporation Limited","Ground Floor, Mumbai Highway, Chennai","12.551082","78.448662"
"ChIJSwfJ7S1NrDsR0yMlqdB59Ao","Hindustan Petroleum Corporation Limited","SF No, near Krishnagiri Chennai Highway, B/1, NH 46, Ankinayanapalli, Krishnagiri","12.535587","78.3940538"
"ChIJF0jtHqRNrDsRDl-KkcIoEug","Metablue Adblue® / DEF Filling Station - Barugur","National Highway, Ankinayanapalli, Chennai","12.5350263","78.3877617"
"ChIJ-3tT7Z9NrDsRpkWT5oREjWE","IndianOil","No 354/1A2, Velakkalnatham, Bengaluru - Chennai Highway, Bandarapalli","12.5481579","78.4323967"
"ChIJTXp-zwVNrDsRrKy1vfQ1jg0","JONE ENTERPRISES QBLUE DEF FILLING STATION","near Indian petrol bunk, near R.R.HOTEL, to, Bangalore Highway, Velakalnatham, Chennai","12.5482773","78.4331436"
"ChIJdUsvWY9MrDsR76g_4pssV_c","IndianOil","Sy No 28/B2, Barugur, Sigaralapalli","12.5129574","78.3965772"
"ChIJk2-kkNBNrDsRUAa9pKL3bUU","IndianOil","Muchanimedu, thapalmedu, Mallapadi","12.5151395","78.3922694"
"ChIJI40ru6RNrDsRAoHuD4A2pmQ","SHELL PETROL PUMP","Barugur - Thirupattur Road, Sigaralapalli","12.5033167","78.4103932"
"ChIJl-wgNn5LrDsRL1vI2mwWZb4","HP Petrol Bunk","G9P9+4C6, TPT Road, State Highway 131, Bargur","12.5352774","78.36852379999999"
"ChIJvX0AIx1LrDsRgD_eikxN2Jk","Hindustan Petroleum Corporation Limited","SF No 42/3A, Mallapadi","12.535406","78.368431"
"ChIJNaViSBCtrTsRegN1JX6cRYk","IndianOil","Lock No 05433, No 20S, No 99, Rd, 2Ei/P Sorakkayal, Natham","12.5892534","78.507178"
"ChIJm0g6AwOtrTsRzUKkEm918WI","Bharat Petroleum","Natarampalli, Vellore, NH-46, Chennai Bengaluru New Bypass Road, Vellore, Vellore","12.5933821","78.51768349999999"
"ChIJGZDYrY-yrTsRy1yVQ4MT8yg","IndianOil","No 59/1A2 Pazhayapettai Rd, Pachur, Bandarapalli","12.5911601","78.46126009999999"
"ChIJyZlkfACtrTsRT3e1gCT11T8","Thoppalagunda","HGR7+J2M, Natrampalli","12.5915819","78.5125455"
"ChIJh9vZPqWtrTsRxqFmBGxvQIw","Hindustan Petroleum Corporation Limited","Ground Floor, NH 48, Pachoor","12.5754443","78.4821206"
"ChIJbzRwXcutrTsRx34wERrKtwE","IndianOil","S No 75, 2 & 75/4, Natrampalli - Kuppam Road, Jangalapuram","12.601901","78.503782"
"ChIJrTs2nYetrTsRF7dZVffupb0","Bharat Petroleum, Petrol Pump -P.S.S.Agencies","Vellore Road, VELLORE AMBEDKR","12.5891584","78.5202147"
"ChIJxZeC9Y2trTsRPqC2CfktUYo","HP Petroleum Bunk (COCO)","Natrampalli","12.5750625","78.4796875"
"ChIJY_I6CQCtrTsRyXXOq-_j-T8","Motodef adblue filling station Muthanapalli","Motodef adblue filling station, Muthanappalli, Natrampalli","12.5707237","78.4762092"
"ChIJXXRyP8ytrTsR-5qd-UUHA5A","SRI RAMA ACHANAIA WORK SHOP","JF6X+WQV, Natrampalli - Kuppam Road, Nayanaseruvu","12.6123543","78.4994304"
"ChIJibdG5kNTrDsRJawVr4LpcIU","IndianOil","5/152, Natrampalli Road, Kollakottai, Agraharam, Achamangalam","12.5512846","78.5077785"
"ChIJR_6Rnm2zrTsRvNKNx-stNKI","PMS FUEL'S, Bharath Petroleum Fuel Station","Mumbai Highway, Pachoor","12.5653413","78.4698928"
"ChIJoTW-9PasrTsRYfYVDexYaXw","IndianOil","near Toll Gate, Mumbai Hwy, District Vellore, near Toll Gate, Natrampalli","12.6007287","78.5362921"
"ChIJnR8VAaerrTsR-xvRIyTe0_w","Hindustan Petroleum Corporation Limited","Ground Floor, Mandalavadi","12.608555","78.5970632"
"ChIJXdNLCJ2prTsRSg_Iz9aPuZM","IndianOil","2/2, Blk No 27, Lk 05432, Chettiyappanur, NH 46, WN F, Govindapuram, Vaniyambadi","12.666045","78.61348699999999"
"ChIJF6f0BgCrrTsRGU5bXypGN3U","MRPL HiQ Bethakallupalli (SRI BALAJI FUELS)","JHQ9+6RC, Thekkupattu","12.6380606","78.56951409999999"
"ChIJMUOPN_WrrTsRhjDnjMZBzPI","BP Petrol Pump","BHARAT PETROLEUM NH46, krishnagiri ranipet road, kethandapatti village po,, Vaniyambadi","12.624976","78.56618619999999"
"ChIJAVJeuHWsrTsRtf0uMCj6Mo0","Hindustan Petroleum Corporation Limited","Ground Floor, NH 48, near Bangalore, Chennai Highway, Vaniyambadi, Kethandapatty","12.6227732","78.5641201"
