place_id,name,address,latitude,longitude
"ChIJ04zmF6KNUjoRefng1oSZFHo","Bharat Petroleum, Petrol Pump -T P R S Fuels","IRUNGATTUKOTTAI, KANCHIPURAM","13.001651","79.9915075"
"ChIJi3Bn4EmLUjoRdhkstm8ZoZ4","IndianOil","No 198/1A2, Kundrathur - Sriperumbudur Road, Irungattukottai","12.9849479","80.01132900000002"
"ChIJ9Yyq7s2LUjoR7JuFEiOw-DY","SRI Kamatchi Enterprise - Bharath Petrol Bunk","VOC Street, Thirumazhisai","13.0605318","80.0494216"
"ChIJXfHlzsyLUjoRzlf62lJs-eI","Bharat Petroleum cng","3353+86W, Voyalanallur","13.0583642","80.0530685"
"ChIJb-8kSMRhUjoRqEWk0R0PysA","IndianOil","474, Trunk Road, Indrani Nagar, Karayanchavadi, Chennai","13.0453399","80.1133371"
"ChIJg3-cqcBhUjoRJYzWYwQdE7A","Aegis Auto Gas Station Poonamallee","14, Poonamallee High Road, Kumananchavadi, Chennai","13.0484363","80.1204305"
"ChIJT-x-WdxhUjoRa1V_iua_fhM","Shell","Poonamallee High Road, Vill, Poonamallee, Chennai","13.04935","80.10623"
"ChIJN3Xn5DlhUjoRW0uFKWjtDZQ","Bharat Petroleum, Petrol Pump -N.A.Agency","Thiruverkadu, Chennai","13.0681222","80.1279943"
"ChIJ_RELnQyKUjoRfs3vHgA8nag","Bharat Diesel","333V+R2M, Bajanai Koil Street, Aria Maruthanallur, Poonamallee, Chennai","13.0545886","80.0925589"
"ChIJUYuKMrBhUjoRFYGK1sOfg-0","IndianOil","Lk No 1165, 2/254, Mount Poonamallee Road, Iyyappanthangal, Chennai","13.040283","80.131192"
"ChIJA2cXzZ1hUjoRd3K6XSK7eRM","Hindustan Petroleum Corporation Limited","52B, Poonamallee High Road, Velappanchavadi, Tiruvallur","13.0609401","80.14017009999999"
"ChIJ27orP65hUjoRhLJ8Miv41cY","Bharat Petroleum Bunk","2, Trunk Road, VGN Nagar, Iyyappanthangal, Chennai","13.0388117","80.1328812"
"ChIJW8qK8Z1hUjoRTT6xEY4Ss-4","IndianOil","Lock No 1095/122 93/2, PH Rd, Velappanchavadi, Ayappakkam, National Highway 4","13.0611332","80.1422072"
"ChIJR8QUBSRiUjoRTGCiuebgkZ0","IndianOil","Lock No 1178, 121 Ambattur, Tiruverkadu Link Road, Koladi, Tiruvallur","13.0829989","80.1265988"
"ChIJfdx7BjJgUjoRrO_qpHy_rNs","IndianOil","S 365/3A1, Mangadu Kundrathur Road, Mangadu Road, Sriperumbudur","13.0253786","80.1096232"
"ChIJsylOxg9iUjoRv_e9OirEwV4","Shell","Poonamallee - Avadi High Road, Avadi","13.0893286","80.1082065"
"ChIJ5RbjOw5iUjoRTARWD9MkERk","Nayara Petrol Pump","34R5+H7Q, Paruthippattu, Avadi","13.0914692","80.1082306"
"ChIJnY1u20OKUjoRziapOkk7o84","Hindustan Petroleum Corporation Limited","Ground Floor, Poonamallee High Road, Nazarathpettai","13.045564","80.071882"
"ChIJkQBUmGdhUjoRW3jd1uIAO00","Bharat Petroleum, Petrol Pump -Sundaram Motors","Senneer Kuppam, TIRUVALLUR","13.0584642","80.11380129999999"
"ChIJ3b5tMOlhUjoRZGGnNtsf5Gc","The Chennai Industrial Services","No. 3/389, Poonamallee - Avadi High Road, Senneer Kuppam, Poonamallee, Chennai","13.0583932","80.11295009999999"
"ChIJO_Dvw9VhUjoRNYuxbmwuThA","Bharat petroleum","Sri Saravana Complex, Mount Poonamallee Road, Kumananchavadi, Chennai","13.0594242","80.1132962"
"ChIJD05hye5hUjoR5eEjTH3HXOI","TVS Petrol Pump","3457+R83, State Highway 55, Thiruverkadu, Avadi","13.0595114","80.1132836"
"ChIJcwEcBuphUjoRiexFQlD6SwQ","Bharath Agencies CNG GAS STATION","Chennai","13.0619734","80.1131315"
"ChIJiVHYhRhhUjoRndFrSO897fY","Go GAS AUTO LPG BUNK","3427+64J, Poonamallee - Avadi High Road, Senneer Kuppam, Chennai","13.0505924","80.1127666"
"ChIJjxmGiLBmUjoRqIUqbp8p0yU","IndianOil","Lock No 1106, 122, Kaliamman Koil Street, Koyambedu, Chennai","13.0648488","80.1978264"
"ChIJN0IgE9pgUjoRFyJkc77HEQc","IndianOil","Lock No 1038, 42/62, Nelson Manickam Road, Aminjikarai, Chennai","13.072632","80.2213884"
"ChIJXc8XzYRmUjoRBShLegn5Lrs","IndianOil","New No 141, Old No 25 Arumbakkam, Aminjikarai, Puliyur","13.06054","80.2116058"
"ChIJN3ppTvhjUjoRecc4qn6JFE4","Bharat Petroleum COCO Outlet","Ambattur Estate Road, TS Krishna Colony, Chennai","13.0882632","80.18514309999999"
"ChIJh4IfJ1BhUjoRYgnjTj6gpn4","Hindustan Petroleum Corporation Limited","opposite Lbear Mat School, 147/B, Poonamallee High Road, Nerkundram, Chennai","13.072751","80.18878099999999"
"ChIJH6emy2pkUjoR9AdMq-77ElI","Bharat Petroleum, Petrol & CNG pump","VILLIVAKKAM (NR PADI JN.), Chennai","13.1028366","80.2081924"
"ChIJtUaQ9plmUjoRd6nwqp5E7RU","Hindustan Petroleum Corporation Limited","Block No 22, CP20, Main Road, MMDA Colony, Arumbakkam, Chennai","13.069641","80.215201"
"ChIJnzK6FHlmUjoRzG-jGt1MDv8","Kumaran Service Station HP Petrol Pump","Poonamallee High Road, Dasspuram, Chetpet, Chennai","13.0767004","80.2391004"
"ChIJQbTSa6VmUjoRXK1rYH1toHc","IndianOil","opposite Flower Market, No 4793/4678, Lock 1188/122, opposite Flower Market, Koyambedu, Chennai","13.069619","80.199821"
"ChIJj188KQ5kUjoRIANrF_4-HlU","IndianOil","P No 1381, Lock No 1172/122 W Extnch, B, Anna Nagar, Chennai","13.094107","80.19837199999999"
"ChIJqRvGG9VlUjoRVMy90eJnc94","Hindustan Petroleum Corporation Limited","26, New Avadi Road, Kilpauk, Chennai","13.083091","80.233871"
"ChIJa8pgnJ9mUjoRjOJpyC6k5-4","Total Gas,Visu fuel Hub","Ols #71,Opposite Panchaliamman Koil, 313, Poonamallee High Road, Arumbakkam, Chennai","13.0772986","80.2107142"
"ChIJW0Y_SJZmUjoRI8JFHl7Mpjo","IndianOil","Lock No 1135, No.12, 122, Jawaharlal Nehru Salai, Arumbakkam, Chennai","13.0731729","80.20974559999999"
"ChIJ2TWXnKRmUjoR21slGcUU9aM","SUPERGAS - Auto LPG Station - Noblegas LPG Services","208/24, Jawaharlal Nehru Salai, Jai Nagar, Arumbakkam, Chennai","13.0703618","80.2039492"
"ChIJcYcErSVkUjoRUc4c1Bg-rfo","Hindustan Petroleum Corporation Limited","No E, 1, Anna Nagar 3rd Main Road, Chennai","13.088151","80.21833099999999"
"ChIJlWhxSwRkUjoR6vHZEr-iK3I","Hindustan Petroleum Corporation Limited","No R21/2, Ambattur Industrial Estate, Chennai","13.087567","80.19482099999999"
"ChIJH05Jy4BmUjoRC078mASeFMA","IndianOil","Lock No 1013, 122, Poonamallee High Road, Shenoy Nagar, Aminjikarai, Chennai","13.0750061","80.2304573"
"ChIJHR_BtYBmUjoRxpREPLS36Og","Hindustan Petroleum Corporation Limited","near PACHAIYAPPAS COLLEGE, 737, Poonamallee High Road, Chennai","13.075221","80.230841"
"ChIJNW0ofX5mUjoRuO_7jbgqTwo","Bharat Petroleum","310, Poonamallee High Road, Chetpet, Chennai","13.0757611","80.2347508"
"ChIJHUHJke1mUjoRpeMlU7fryjE","IndianOil","Lock 1199/121, S No 163, Sivan Kovil South Street, Stpuliyur, Kodambakkam, Chennai","13.0536321","80.2202519"