place_id,name,address,latitude,longitude,open_now
"ChIJw8QZQWWw1jsRe_e7Gc8yXO0","Hindustan Petroleum Corporation Limited","Ground Floor, Badnera Road, Pala, Amravati","20.826201","77.709701","true"
"ChIJczFWlViw1jsR3qePdAfwud4","Shreyanshi PUC BHARAT PETROL PUMP","Kolkata - Mumbai Highway, Morgaon","20.80747689999999","77.700466","true"
"ChIJL-qLYQC71jsRGGUMhMgkC2E","Arhant Automotive Indian Oil Petrol Pump","RPXF+33Q, Akola - Amravati Road, new town, Badnera, Amravati","20.8477242","77.72273440000001","true"
"ChIJEVQ7xMm71jsRAFFvaLJ81vg","Mamarde Auto LPG Gas Pump","Vilage Sy. No. 8/5, Lontek Batkuli Road SH.No. 200, Amravati","20.9060916","77.69427739999999","true"
"ChIJLxIZg3i71jsR3cAotruOovM","Bharat Petroleum, Petrol Pump -Kasturi Fuels","BADNERA, AMRAVATI RD, AMRA, Amravati","20.864809","77.7315443","true"
"ChIJG4DJ5uC71jsR-dHo4VkM0Zk","Hindustan Petroleum Corporation Limited","Ground Floor, Pandhri, Bhatkuli, Amravati","20.907404","77.657647","true"
"ChIJzcIfPI271jsRFu8sSFI2PfA","Indian Auto Gas","VP9P+H6X, Maharashtra Major State Highway 6, Juni Basti, Amravati","20.8689887","77.7356026","true"
"ChIJc4r258m61jsRPJFs5wFvmBo","IndianOil","Ground Floor, Badnera, Amravati","20.865305","77.738205","true"
"ChIJD4WFfwC71jsRW4_3BiBj9Cw","Parimal Servo Petroleum Indian Oil","WP2C+RMC, Ring Road, Navsaari, Amravati","20.9020692","77.7216335","true"
"ChIJ0WPknliw1jsR6msW9Z9QNZ4","IndianOil","Ground Floor Belora, Nagziri Phata, NH 6, Belora, Shivaji Nagar, Amravati","20.807418","77.699446","true"
"ChIJKX51XgCx1jsR4_sBJPoGLqA","NILANJAY SERVICE Bharat petrol Pump","Ground Floor Belora, Nagziri Phata, NH 6, Belora, Shivaji Nagar, Amravati","20.8076418","77.70081040000001","true"
"ChIJI1KgJ_iw1jsRCvc7zC6atz0","LPG GAS STATION CAR","RM3W+4XW, Nagpur - Chhatrapati Sambhaji Nagar Highway, Morgaon","20.8028678","77.6974419",""
"ChIJI6nfheql1jsRl6x3VAY1Cw8","Bharat Petroleum, Petrol Pump -Amravati Highway Petrocarbon","AMRAVATI BYPASS ROAD ,AMRA, Amravati","20.8697566","77.7486033","true"
"ChIJsyp7D2-l1jsRKzp2LK6y2TQ","Hindustan Petroleum Corporation Limited","Survey No 13, Plot No 9/10A/B, MIDC Road, Badnera, Amravati","20.872677","77.74986799999999","true"
"ChIJY0G3Ucql1jsR_Ol2jaZs0ls","Bharat Petroleum Petrol Pump , JAIKA MOTORS","Badnera Road, Amravati","20.892672","77.74713899999999","true"
"ChIJm69ONXyl1jsRaxTMbRW94-E","Purti gass pump","Badnera Road, Guruchhaya Colony, Gopal Nagar, Amravati","20.8936166","77.7474235",""
"ChIJB1IDPwC51jsRfl_unq9FH8k","Mauli Indian Oil Petrol Pump","WJ49+5G, Kaliche Khede","20.9054371","77.6188657",""
"ChIJl-EpZaKx1jsRekPc1ZaKgZA","Bharta tyre service","R p bhagwat petroleum, NH...6, Loni","20.79219","77.680097",""
"ChIJ-4-G7lml1jsRoaY7gNLFctk","Hindustan Petroleum Corporation Limited","Ground Floor, NH 53, Amravati Bypass, Badnera, Amravati","20.867459","77.756198","true"
"ChIJnzuv_Tml1jsRhtZzX01F-zw","IndianOil","G No 14/2&10/1Aa, Amravati Bypass, Mouza, Amravati","20.8711435","77.75713809999999","true"
"ChIJ3cV_Xsmk1jsRvIoKjds03cg","Hindustan Petroleum Corporation Limited","Mouje Peth, Ground Floor, Old Bypass Road, SH 46, Badnera Road, Amravati","20.907781","77.75128099999999","true"
"ChIJ04Kfxuqk1jsRjXYElqJ3msI","Hindustan Petroleum Corporation Limited","Ground Floor, MIDC Road, Yashoda Nagar, Dastur Nagar, Amravati","20.913881","77.770541","true"
"ChIJ7zRJ_KKk1jsRk8zGnfIrqIs","Hindustan Petroleum Corporation Limited","Sheet No 40C, opposite Bus Stand, Plot No 2/9, Road, Rukmini Nagar, Amravati","20.927551","77.76556099999999","true"
"ChIJAaGaKaak1jsRfnZdGGCKemA","M/S S D ASORIYA ADHOC, Bharat Petroleum Petrol Pump","Amravati","20.9327975","77.7567002","true"
"ChIJGWZGy56k1jsRz-dqUurxWN8","Police Kalyan Petrol Pump","WQJC+JR6, Maltekdi, Amravati","20.9315419","77.7720183","true"
"ChIJRcXu81ml1jsRodJUD5pi6fg","Lad Petroleum- Essar Oil Limited Nayara oil limited","Mhasala","20.847921","77.757784","true"
"ChIJ1_nJptyk1jsR6A1r_PVzRyA","IndianOil","Jewadparagne, Dastur Nagar, Amravati","20.900299","77.762703","true"
"ChIJdYCUzM2k1jsR6blmmIa-vbk","IndianOil","Badnera Road, Saturna, Amravati","20.903503","77.749977","true"
"ChIJveLT2r2l1jsRmwEfwKvRqEQ","Bharat Petroleum station","WP7X+6J7, Krishnarpan Colony, Kanwar Nagar, Guruchhaya Colony, Sharda Vihar, Amravati","20.9130456","77.7490566",""
"ChIJyVK1Hrel1jsRx-zI50XmBkM","IndianOil","Pharsi Stop, Bapu Colony, Amravati","20.9140156","77.7600563","true"
"ChIJSXZTbUGl1jsRQfkyMtFuyrU","Yash Shop","Shop, Road Number 1, Ravi Nagar, Sharda Vihar, Amravati","20.9151593","77.74824660000002",""
"ChIJtcfDFgCl1jsREpe6QImxdIA","Samruddhi Puc Center","WQ79+2X2, MIDC Road, Yashoda Nagar, Dastur Nagar, Amravati","20.9125146","77.76989189999999","true"
"ChIJD_PZ0Lak1jsR1oR3j0zY2As","Bharat Petroleum","WQ83+P8M, Badnera Road, Amravati","20.916836","77.7532896",""
"ChIJofD-5i6w1jsRIHLAsreSVCE","Nayara Energy Petrol Pump","Survey No.61/2, Village –Jula, Taluka –Nandgaon Khandeshwar, Amravati","20.8019542","77.7378336","true"
"ChIJoRA1vnCl1jsRGeVmJAbw-88","JAGTAP PETROLEUM","40/A Joglekar Plot Rukhmini Nagar, Congress Nagar Road, Amravati","20.9281806","77.7627821","true"
"ChIJ76bFhqOk1jsRXMyWgQu9g1Y","Bharat Petroleum","WQH7+72X, Congress Nagar Road, Vivekanand Colony, Amravati","20.928248","77.7626094",""
"ChIJoRdMxqik1jsRVrgf1vUo2IU","Hindustan Petroleum Corporation Limited","Ground Floor, Jaistambh Chowk, Amravati","20.9312801","77.755101","true"
"ChIJVRvWq6el1jsRbPRVnHAU3tw","Om Namahashivaya Esatet Ajency","Shop No 2, Wasudev Nagar, Amravati","20.9319855","77.7523037",""
"ChIJj7x5NKqk1jsR_3EeUTABaCQ","Gajadhar Beniprasad Jajodia Petrol Pump","WPMX+5WM, Maharashtra Major State Highway 6, Amravati","20.9329675","77.74979619999999","true"
"ChIJNdK1eACl1jsR1OCiSuJCS8M","SRPF PETROL PUMP","WQHW+984, SRPF Colony, Amravati","20.9283338","77.7965428",""
"ChIJz1qe2R-91jsR2kbM4XE0h-k","Bharat Petroleum","XPJC+74W, Maharashtra Major State Highway 6, Sultanpur, Amravati","20.9807321","77.7203402","true"
"ChIJa-z8ww-91jsRO2OxL8Sgrsw","Hindustan Petroleum Corporation Limited","Ground Floor, Amravati Walgaon Road, Walgaon, Warwad","20.992801","77.709801","true"
"ChIJKQQAdgC91jsR0mcO_KlT6FI","KK PETROLLUM","RELINCE JIO PB, KK PETROLUM, Ring Road","20.960635","77.7270709",""
"ChIJ7xaO6cS81jsRUf0RX4JwZZU","Jio bp","India","20.967829","77.7298691",""
"ChIJyc8hFqq91jsRgK4F7yDn3og","NAYARA PETROL PUMP","XP2Q+XFX, Transport Nagar, Amravati","20.9524346","77.7386308",""
"ChIJu5Nh0U291jsRu7heayfriXg","Indian Auto Gas Lpg","WPXR+X6M, opposite Darga, Walgaon Road, Greenpark colony, Transport Nagar, Amravati","20.9499639","77.7405543",""
"ChIJ3VYgR6u81jsRiPhpZ9TkEvI","Asoriya Petrol Pump","MSH6, Zakir Colony, Amravati","20.9398801","77.7442894","true"
"ChIJWZTXGI51ujsRoum5L_ggJfI","IndianOil","Ground Floor, SH 6, Amravati Walgaon Road, Rewasa, Amravati","20.9807336","77.7203361","true"
"ChIJpWHUBKa91jsRdJkdkhakvjU","S.D.Asoriya Petrol Pump (Changapur Fata) CNG Pump","Paratwada Road, Amravati","20.9794097","77.7229315","true"
"ChIJU5ZXiC-91jsRAyUIN38sKZQ","Hindustan Petroleum Corporation Limited","Survey No 98 Achalpur, Road, Amravati","20.9851025","77.7166345","true"
"ChIJYZMP3ni91jsRm4qas3Z2qLE","Sid's Fuels LLP","Tq & Dist :, Plot No 153/2 Mouje Pimpalvihir On Amravati Nagpur NH -53, Amravati","20.9564321","77.7450447","true"
"ChIJ-T726Q-91jsRig-OKIsNqe8","HP Petrol Pump- S.N.KALANTRI","SH 194, Warwad Post, Walgaon, Nagpur","20.9931793","77.7096969","true"
"ChIJv-zMlGqj1jsRdFa_31ivZjM","Sai gajanan Oil centre","Shop No, 2, VMV Road, Cotton Green Colony No-01, Amravati","20.9611344","77.750909",""
"ChIJTVhWMGej1jsRjfEjTUneVZE","IndianOil","Ground Floor, Morshi Road, Amravati","20.943619","77.77008099999999","true"
"ChIJ0RKHVESi1jsRPfMlaAB1Zik","DATTATRAYA KOLHATKAR TRAVELLING SERVICES DEALERS BHARAT PETROLEUM CORPORATION LIMITED WITH CNG STATION","NEAR ITC CHOWPAL SAGAR NAGPUR ROAD NH 6 NANDGAOPETH, Amravati","20.996311","77.78516309999999","true"
"ChIJmaYFSwyl1jsRPLB0d8KiR9I","Bharat Petroleum, Petrol Pump -G. M. Agarwal","IRWIN CHOWK,NH6,AMRAVATI, Amravati","20.9349456","77.7618499","true"
"ChIJGe-QoqCk1jsRh44ztv4LfRk","Hindustan Petroleum Corporation Limited","Ground Floor, Morshi Road, Amravati","20.936201","77.763801","true"
"ChIJ_____z-51jsRIeZruSkFKvM","Agrasen Petroleum Amravati","WQP7+GJJ, near Irwin Chowk, beside Hotel Shripad Continental, Nagpur Road, Amravati","20.93632819999999","77.7640296","true"
"ChIJHZ251Vqj1jsR5v0m-Tvh-q8","Hindustan Petroleum Corporation Limited","Infront of, Ground Floor College Road, New Cotton Market Road, Sahakar Nagar, Amravati","20.947863","77.75938400000001","true"
"ChIJ6bSxczCj1jsRms0DNcSxUhQ","NAYARA Petrol Pump","Susanyog Colony, near Gajanan Maharaj Temple, Amravati","20.9696272","77.7560158","true"
"ChIJX_U3pUij1jsReB9kACBUo7k","Lokhande Petroleum","Lokhande Petroleum, opp. Golden Leaf Hall, Ring Road, Rahatgaon, Nagpur","20.9760789","77.7652837","true"
"ChIJmyCODwCj1jsR6bI8_qqNrgY","Bharat Petroleum,Petrol Pump","XQG7+JGF, Amravati","20.9762655","77.76524979999999",""
"ChIJSVf_ktCi1jsRsql0dai4LdY","IndianOil","Survey No 60, 2/A & 63/2, Kathora","20.9907202","77.7557074","true"
"ChIJi9T7Uouj1jsRDo8bVwgP-hM","Hindustan Petroleum Corporation Limited","Ground Floor, SH 30/3, Amravati Khura Road, Rajura, Amravati","20.9455901","77.813701","true"
"ChIJi0xEt6yj1jsRribw6Py62mc","Nayara Petrol Pump","XQPX+555, Morshi Road, Rahatgaon, Amravati","20.9853802","77.7979694","true"
"ChIJNxIERBWh1jsRHUvcuBclhiQ","Aarya Petroleum Amravati","Mardi Road, Parsoda","20.9515374","77.8544009","true"
"ChIJs8JQGWij1jsR2N7e_KBQW14","Anuradha Petrol Pump","Shop No 1 Near By Golden Restaurant And Bar, Opp Of Bappu Ka Dhaba Amravati- Nagpur, National Highway, Borgaon Dharmale","20.9968554","77.8025278",""
"ChIJxcFgalKi1jsR_yLQfJmhdfo","IndianOil","Ground Floor, Borgaon","20.997269","77.803037","true"
"ChIJLXurPSaj1jsRUWsy8gxLAtc","Essar Petrol Pump, Nandgaon Peth","2R24+FHP, Walki","21.0012231","77.8064495",""
"ChIJr3UFbACj1jsR9ogiD6UukBQ","Nayara petroleum","2R24+HJM, Walki","21.0014604","77.8065524",""
"ChIJdU10U0Si1jsRN-TPj_rpwKs","Bharat Petroleum","India","21.0014603","77.8057092",""
"ChIJFxftFna91jsRux89glLX4eg","IndianOil","Survey No 408/2, New Cotton Market, Plot No 2 & 12, Walgaon, Amravati","21.0094845","77.70040010000001","true"
"ChIJP92TA_mX1jsRCG71aNh8j-Y","Nayara Petrol Pump - Paras Petroleum","Survey No-325, Walgaon-Paratwada road,Walgaon Walgaon","21.0249877","77.6793308","true"
"ChIJx86FyBK91jsR2H8PHWA5K4A","Bharat Petroleum, Petrol Pump -S D Asoriya Walgaon Road","WALGAON ROAD ,AMRAVATI, Amravati","21.011425","77.7064063","true"
"ChIJ9afvNgCV1jsRGuwFtbQBiak","Durga Petroleum BPCL","Near, Paratwada - Amravati Road, Ashti","21.0528014","77.6530385","true"
"ChIJW1VqHAC_1jsR00UlVbUIB94","Jyoti Petrol pump","XJVC+CCX, Daryapur - Amravati Road","20.9936157","77.62110679999999","true"
"ChIJ5WJqz2GV1jsROkp8JK-7v1c","ARK ENTERPRISES","Ashti","21.0574059","77.6480486","true"
"ChIJTc0gPBCi1jsRCBYIk6E__eM","Hindustan Petroleum","Nadgaon Peth, NH-6, Mumbai Nagpur Highway, Amaravati","21.0220432","77.82318959999999","true"
"ChIJe2-OBFCj1jsRYybJzbUMtXU","Laxmi Aqua","2Q98+PQP, Unnamed Road, Takli jaha","21.0193451","77.7669531",""
"ChIJ-VyJtRyj1jsRL71lLAwTn6w","Hindustan Petroleum Corporation Limited","Ground Floor, NH 6, Nandgaon Peth","21.0121701","77.8152901","true"
"ChIJDaVtPhCi1jsRXeKXWytzaKU","Hindustan Petroleum Corporation Limited","Ground Floor, NH 53, Nandgaon Peth","21.0219601","77.8237601","true"
"ChIJw461nVOj1jsRd6c9NGs4F2g","Bharat Petroleum, Petrol Pump -D.K.Travelling Services","NANDGAON PETH, NH 6, AMRAV, Amravati","21.02262199999999","77.823802",""
"ChIJB06-Evah1jsRbj702913oo8","Hindustan Petroleum Corporation Limited","Ground Floor, NH 53, Nagpur - Chhatrapati Sambhaji Nagar Highway, Amravati","21.019381","77.838111","true"
"ChIJPQ9D0Skg1DsRWVaDr6oW3pM","IndianOil","Ground Floor, Kothoda, Nandgaon Peth","21.023338","77.8351137","true"
"ChIJnQNSpC-j1jsRak7IlySXc-Y","Bharat Petroleum, Petrol Pump -Agarwal Auto Service","POST NANDGAONPET,NH6,AMRAV, Amravati","21.02490999999999","77.8283285","true"
"ChIJpcmGDgSi1jsRVvtHCiJok_U","Agrawal Petrol Pump","2RHJ+955, NH 6, Nandgaon","21.0283879","77.8304905","true"
"ChIJ9c9yDgCh1jsR5iYIXK7t_ic","D petroleum BPCL","2V83+MW, Jamthi","21.0166272","77.8548469","true"
"ChIJDQSG43uf1jsRDuEtLX99F6s","Hindustan Petroleum Corporation Limited","No 175/3 MIDC, Nandgaon Peth, Narayanpur","21.0424218","77.8447185","true"