place_id,name,address,latitude,longitude,open_now
"ChIJIffbZVPr3TsRB5-knYU-gB0","Hindustan Petroleum Corporation Limited","near Hotel Gateway, Plot No P8, MIDC Ambad, Nashik","19.953481","73.754291","true"
"ChIJdfWHL5Ps3TsRlnoyX9Tji4E","Nayara petrol pump","Amad Nea, Radha Swami, Neer, Amad, Ashok Nagar Road, Bajrang Nagar, Ashoknagar, Nashik","19.9801149","73.7249839","true"
"ChIJAQAAAH3s3TsRTsrrOa9k4mE","IndianOil Petrol Pump (Satpur Colony)","Plot No 109, MIDC, Satpur Colony, Nashik","19.991127","73.732574","true"
"ChIJZ-aQOz_r3TsR_S_f1DHF6rA","IndianOil Petrol Pump (Rajiv Nagar)","Survey No 882/1A, Plot No 5, Rajiv Nagar, Nashik","19.9715424","73.7734996","true"
"ChIJU2D_vBCT3TsR6WpXo_MXuJw","HP Petrol Pump","S NO, 89/1, Agra - Mumbai Highway, MIDC Ambad, Vilholi","19.9178277","73.7132522","true"
"ChIJN97QJJWT3TsRI47h_wWvOak","Hindustan Petroleum Corporation Limited","No 17/2, opposite Sanjivani Resort, NH 3, Agra - Mumbai Highway, Vilholi","19.9338981","73.7285469","true"
"ChIJrbhqEw6T3TsRrOiHTULEVUM","Shivneri Petroleum Services BPCL","SURVEY NO. 19/2A National Highway NH3 MUMBAI - AGRA VILHOLI, SHIVAR, Nashik","19.934059","73.73097729999999","true"
"ChIJ5eY_5iuT3TsRH2AN2yhskVc","Nashik CNG opp D mart","WPPJ+7V7, Mumbai - Nashik Expressway","19.9356683","73.7321783","true"
"ChIJf7noXRKT3TsRJk-tbsa8E3s","MNGL CNG Station","Mumbai - Nashik Expressway, Nashik","19.9357034","73.7322428","true"
"ChIJWY3owlyT3TsRVn540DT1Kcw","Hindustan Petroleum Corporation Limited","Gut No 42, NH 3, Agra - Mumbai Highway, Rajur Bahula","19.9099045","73.7046369","true"
"ChIJz46YbjyT3TsRc8HOAPtjQkg","Bharat Petroleum, Petrol Pump -N.L.Gandhi & Co.","RAJUR ( NH3 ), Nashik","19.9061572","73.7008602","true"
"ChIJW6IqlwKT3TsRjab5LDUJELE","IndianOil Petrol Pump (Akrale)","Gut, No 64/1/ P, Akrale, Rajur Bahula","19.9029937","73.70032479999999","true"
"ChIJDQFJKwDt3TsRepXbBi9im7Y","Shivshakti engineering","XP2P+MFV, MIDC Ambad, Nashik","19.9517471","73.7361734",""
"ChIJ0xJXAIjt3TsRhcd34xEwYd4","IndianOil","Plot No X1, MIDC Ambad, Nashik","19.9502578","73.7378502","true"
"ChIJE5K5BmXt3TsRC_EtpDCX3Fw","IndianOil Petrol Pump (MIDC Ambad)","Plot No 10/1, MIDC Ambad, Nashik","19.9502601","73.7378501","true"
"ChIJ2Sn-mDST3TsR6qwYLg8XYXU","Prathamesh Petroleum Authorised HPCL Dealership","opp. Eaton Ltd, MIDC Ambad, Nashik","19.9464855","73.7409603","true"
"ChIJjXN6_KaT3TsRkXyv3zsgkks","Hindustan Petroleum Corporation Limited","opposite Blue Cross Ltd, Plot No P/33, Ambad Satpur Link Road, MIDC Ambad, Nashik","19.946821","73.740944","true"
"ChIJo3Pbpjft3TsRvDfkXlFr-Mc","SHREE SHYAM ENTERPRISES","Okay Transport, Gat No 05 Plot No 16 Sanjiv Nagar Ambad Link Road, Ambad Link Road, Nashik","19.9668152","73.72881079999999",""
"ChIJR2BsePrt3TsRkhCba2Tn--Q","Hindustan Petroleum Corporation Limited","D, Plot, Gut No 230/A to, near Mahindra Cie Company, 24, Ambad Kamatwade Road, Ambad Khurd, Nashik","19.966356","73.740371","true"
"ChIJ6Uh5Cp_t3TsRcrgvA9hEF0g","IndianOil Petrol Pump (Chunchale)","Plot No 26/27, Ambad Satpur Link Road, Chunchale, Nashik","19.9718057","73.72988529999999","true"
"ChIJ7XWbIQDt3TsRw_k_-4neLOU","Mahalaxmi Nagar","3259, Kamod Rd, Sanjay Nagar, Kazipura, Nashik","19.966801","73.74043390000001",""
"ChIJ76OwLwCV3TsR9-uAUBewgCc","BheemaShankar BPCL Petrol Pump","WQX4+WHF, Samruddhi Park Road, Girdhar Nagar, Damodar Nagar, Pathardi Phata, Nashik","19.9497087","73.75611529999999",""
"ChIJfyPTJwDt3TsRCBktvEt0dVk","Indian Oil Petrol Diesel Cng Pump","XPFH+39P, Sanjeev Nagar, Nashik","19.9727056","73.72843999999999",""
"ChIJneG5clHr3TsRMcWqLdg_On4","Bharat Petroleum, Petrol Pump -Namrata Petroleum","opp. TAJ HOTEL, Nashik","19.9589169","73.7559928","true"
"ChIJ9abgQq_t3TsReNouXGiXsGY","Hindustan Petroleum Corporation Limited","9C, Plot, No 1, Gut No 222/4C/A/1, To, Ambad Kamatwade Road, Ambad, Nashik","19.968657","73.743627","true"
"ChIJ79LeIwDt3TsRc9nT3jo-ZfE","Shivanjali petrol pump","XP9V+QCP, ITI Ambad Road, Murari Nagar, Nashik","19.96946","73.7435855","false"
"ChIJtzg3XqTt3TsRJKyM5f7LXZs","Hindustan Petroleum Corporation Limited","Ground Floor, near Mahindra Warehouse, Trimbakeshwar Road, Belgaon Dhaga, Nashik","19.9747105","73.6900821","true"
"ChIJr-ZxfR3t3TsRGzSpX430kvk","Bharat Petroleum, Yash Petroleum","Belgaon Dhaga, Nashik","19.9789643","73.7006409","true"
"ChIJE9zs15Ls3TsR-NuDiobPjf0","DURA AUTO LPG GAS","XPJF+8W8, Ambad Link Road, Medage Nagar, Nashik","19.9807783","73.7248389",""
"ChIJb_EvxuGV3TsRRgmfGSD-5Sg","Vidya Fuel Station","5, Narhari Nagar Road, Narhari Nagar, Prashant Nagar, Pathardi Phata, Nashik","19.952005","73.76344250000001",""
"ChIJN_vRQZ_t3TsR6Af6rKFeoac","Bharat Petroleum, Petrol Pump -Shri Sai Petroleum","Kamatwade, Nashik","19.9734305","73.7464316","true"
"ChIJKYqylPLs3TsRU-gkJV_CRY4","IndianOil Petrol Pump (Satpur Colony)","Gut No 476, No 47, No 2/1/2/3/1/4/1/4/2, Plot No 2, Trambakeshwar Road, Satpur Colony, Nashik","19.9847742","73.7223733","true"
"ChIJG3MQFdnt3TsRdaBgDF0Nv_Q","Mangalyam Petroleum, BPCL","near papaya nursery, Link Road, Ambad, Trimbak","19.984954","73.7240822","true"
"ChIJ-7g7SfXt3TsRBuBd-WyCTqs","Hindustan Petroleum Corporation Limited","Ground Floor, opposite Sandip University, Trambakeshwar Road, Nashik","19.969827","73.671286","true"
"ChIJBdk9-PyV3TsR7XzohlEaV5c","IndianOil Petrol Pump (Pathardi Phata)","Survey No 325/1/2B/1, Plot No 1, Pathardi Shivar, Nashik","19.9525049","73.76848369999999","true"
"ChIJcemDaeOV3TsRLB6KILGMJvQ","Shell Petrol Pump","Pathardi Deolali Link Road, Pathardi Phata, Nashik","19.9490746","73.77073109999999","true"
"ChIJnRJY4Izs3TsRv_uhKJdI5gw","Bharat Petroleum, Petrol Pump -Rohit Petroleum Service","Trambakeshwar Road, Satpur Colony, Nashik","19.9867769","73.72590819999999","true"
"ChIJZ0xIRQDt3TsRrGv7E0vvvT4","Sabir tyre work","Rohit petroleum pump, Nagad Road, Chalisgaon","19.9870199","73.72587349999999",""
"ChIJ-2h3CjyV3TsRHtWvifXjbho","Hindustan Petroleum Corporation Limited","Gut No 308/A/104, Plot No 104, Deolali Road, Pathardi Phata, Nashik","19.945327","73.773466","true"
"ChIJL-uikUPr3TsRH7vmzD-_GP0","Mahadev petroleum","Raj Kamal Row Houses, Raj Kamal Row Houses, 2, Vidya Road, Samarth Nagar, Dnyaneshwar Nagar, Pathardi Phata, Nashik","19.95471809999999","73.76995529999999","true"
"ChIJFwtZlUrr3TsRCJSWZ8LUyr8","Bharat Petroleum","XQ4C+447, Dnyaneshwar Nagar Road, Dnyaneshwar Nagar, Pathardi Phata, Nashik","19.9552769","73.7703039",""
"ChIJc6V1kciU3TsRrNUC4EwWn7M","Hindustan Petroleum Corporation Limited","near Pathardi Gaon, Gut No 1/6 Deolali Road, Pathardi, near Pathardi Gaon, Circle, Nashik","19.943212","73.775364","true"
"ChIJQ7RyQkeV3TsRqFlV3YIW6kQ","LAXMI PETROLEUM","Pathardi - Vadner Dumala Road, Pathardi Gaon, Pathardi Phata, Nashik","19.9429271","73.7755572","true"
"ChIJT8vrLwDr3TsRm-N1aKeqpOA","Jio BP","Jio BP Petrol Pump, Rane Nagar, Nashik","19.9605854","73.7683935","true"
"ChIJuUiDRACV3TsRa6Nyaeo9G_E","Tuljabhavani peteolium","WQRH+X46, Pathardi - Vadner Dumala Road, Pathardi Gaon, Pathardi Phata, Nashik","19.9424217","73.7777754",""
"ChIJKU_EKJTt3TsRX6GAfmaFrwI","Shell Petrol Pump Ashok Nagar","Plot No: 7 & 8, Gut No:, 202/A, Gangapur - Satpur Link Road, Pimpalgaon Bahula, Nashik","19.9929249","73.7113542","true"
"ChIJqYLfK7vr3TsR8GjoppP99h8","H P Gas Agency office","HP Gas, Bhagwati Gas Agency, Chetana nagar, Rane Nagar, Nashik","19.9658408","73.7685345",""
"ChIJEzJv5P_t3TsR6SrBHAhLtfQ","Driveri","Mh15jm0906, Nashik","19.9903496","73.7346048",""
"ChIJZ6UKKIns3TsRXqYlQO3ay5Y","Kaushalya Petrol Pump","no 167, Trambakeshwar Road, Satpur Colony, Nashik","19.9908343","73.7329864",""
"ChIJk70Xgzzr3TsRGNTWJTC-LCQ","KUNDAN FUEL PLAZA","289,290 At Post Chinchave, 03, Agra - Mumbai Highway, Nimbait","19.9669711","73.76981549999999",""
"ChIJxY9-C0fr3TsRYmgm7PJQEW8","Hindustan Petroleum Corporation Limited","Survey No 883, opposite Old SBI, 1/2, Rajiv Nagar, Nashik","19.9678938","73.76967730000001","true"
"ChIJ35ECCgDr3TsRz02JMIUOu-k","Suman Petrol Pump HPCL DEALER","1/2, Yogakshem LIC Colony, Rajiv Nagar, Nashik","19.9680158","73.7696361","true"
"ChIJmTcFTADr3TsRPt9EPxgY39g","SUMAN PETROLEUM","Suman Petrol Pump, next to Ashoka Hotel, Service Road, Yogakshem LIC Colony, Rane Nagar, Nashik","19.9678437","73.7698681","true"
"ChIJJbiQPH3r3TsR8o7BAkovFrs","IndianOil Petrol Pump (Khutawad Nagar)","Survey No 37/4, opp. CITU Mall, Kamatwade Gaon, Nashik","19.98724349999999","73.7498845","true"
"ChIJ1-MjYgCV3TsR6s25oJ6AZog","Ananta Energies","15/1, Pathardi - Vadner Dumala Road, Nashik","19.9411527","73.78419459999999",""
"ChIJDUPgF73t3TsR9X78iySPUoU","Shell Petrol Pump","near BLVD, Trimbakeshwar Road, Satpur","19.9916298","73.7430517",""
"ChIJRxBLSO7t3TsRKGzYF8pGqo4","varsha petroleum","city central road, Nashik","19.9991941","73.706594",""
"ChIJ9U0pS2Xr3TsRGxaJZyEkySk","Hindustan Petroleum Corporation Limited","Scheme, Untawadi, CIDCO 4, Ground Floor, near Datta Mandir Stop, Trimurti Chowk, Cidco, Nashik","19.98668049999999","73.7582881","true"
"ChIJ3z7qRrLr3TsRdyoYFfF2cy0","Bharat Petroleum, Petrol Pump -Gayatri Seva","CIDCO NASIK, Nashik","19.9870827","73.7580328","true"
"ChIJ9anJCQDt3TsRXs0OeqdOKgc","Trikaya Petroleum","Plot No.92P, Road, MIDC, Satpur Colony, Nashik","20.0015177","73.72111459999999",""
"ChIJYaEZZE-V3TsRH-ccLscvgas","Hindustan Petroleum Corporation Limited","S No 57/6/7/8/9/1, Jai Bhavani Road, Nashik Road, Nashik","19.9472354","73.82613669999999","true"
"ChIJ5xYCT1G53TsRNwurkr1gQi4","IndianOil Petrol Pump (Amgaon)","Gut No 29, Deolali, Sinner, NH 50, Amgaon","19.957265","73.82239","true"
"ChIJ635plmaV3TsRPO426Dxek7k","BP Petrol Pump","Lam Road, Road, Nashik","19.93125","73.83444","true"
"ChIJcfbeAT7r3TsRYXKM3HH-y3U","IndianOil Petrol Pump (Lekha Nagar)","Lock No I85, Lekha Road, Agra - Mumbai Highway, Nashik","19.9769181","73.77688739999999","true"
"ChIJH8IyPGeV3TsRL75zmai5O_I","Hindustan Petroleum Corporation Limited","SF No 22/1, Lam Road, Vihitgaon, Nashik","19.934181","73.8345701","true"
"ChIJlRt6WB7r3TsRfyJBS-mFG00","KALIKA PETROLEUM SERVICES BPCL","Wadala, Pathardi Road, Vinay Nagar, Indira Nagar, Nashik","19.9820488","73.79194919999999","true"
"ChIJa3Ip9MLq3TsRxCNU5olqpQs","Bharat Petroleum Customer Relation Centre","XRH5+6PX, Samta Nagar, Nashik","19.9781233","73.8093458","true"
"ChIJp2kPD1SV3TsRPja_-d2WWBk","IndianOil Petrol Pump (Deolali Gaon)","Survey No 11/1B/2A/2/1, Plot No 678, Deolali Gaon, Nashik","19.9542663","73.83599869999999","true"
"ChIJa-2p36rq3TsRWJ63n6eKkeA","IndianOil Petrol Pump (Government Colony)","Ground Floor, Jail Road, Nashik","19.960852","73.839371","true"
"ChIJuSd1ZnDr3TsRkDKtJvOZhtA","IndianOil Petrol Pump (Tidke Nagar)","Ground Floor, Untwadi, Nashik","19.9890633","73.76053619999999","true"
"ChIJt-Hf3QLr3TsRlZtJGlPBpGE","Hindustan Petroleum Corporation Limited","Ground Floor, near Holy Cross Chapel, Old, Agra - Mumbai Highway, Trimbak Naka, Nashik","19.996577","73.78192489999999","true"
"ChIJIwUZWAjr3TsRq01UkbTkYVU","Hindustan Petroleum Corporation Limited","Ground Floor, Trambakeshwar Road, Trimbak Naka, Police Staff Colony, Nashik","19.9975467","73.7809146","true"
"ChIJ6_uU43br3TsR8VaG-mWB1qA","IndianOil Petrol Pump (Parijat Nagar)","Trambakeshwar Road, Mahatma Nagar, Nashik","19.993746","73.7509785","true"
"ChIJp8xEzXjr3TsRJOGkAGiRq2I","Essar Petrol Pump","XQW3+8GF, Mahatma Nagar, Parijat Nagar, Nashik","19.9958021","73.7538117",""
"ChIJKZivDACV3TsRMkAo37-3AVA","Hindustan Petroleum Corporation Limited","near Radhakrishna Hotel, Ground Floor, Pathardi Road Pathardi, near Radhakrishna Hotel, Pathardi - Vadner Dumala Road, Vadner Dumala, Nashik","19.9431848","73.7912829","true"
"ChIJocrhIcCV3TsROtIla4c2L_U","Tuljabhavani Petroleum CNG Station","Tuljabhavi Petroleum, Pathardi - Vadner Dumala Road, Wadner","19.94304259999999","73.7977394","true"
"ChIJSzzzNgCV3TsRDSdpqG66NpA","Hindustan Petroleum Corporation Limited","Survey No, 160/3/2, Vadner Pathardi Road, Road, Vadner Dumala, Nashik","19.9430945","73.7977046","true"
"ChIJj_whfhSV3TsR6s9xN1NZoEo","IndianOil Petrol Pump (Deolali Gaon)","Survey No, 170/2, Pathardi - Vadner Dumala Road, Nashik","19.9416583","73.8043125","true"
"ChIJ3Q0foQyV3TsRguhJdBqzgLw","Army Petrol Pump","WR88+WV3, KSP Petrol Pump Deolali cantt, Deolali","19.9172622","73.81717859999999",""
"ChIJpV8xAdnq3TsRslpPyt-ukTY","Hindustan Petroleum Corporation Limited","Ground Floor, near IT Park, Canal Road, Wadala Gaon, Nashik","19.970431","73.79812009999999","true"
"ChIJ3-0OIE-V3TsR2rZQ_iUe8wY","Gaikwad Petroleum","opposite STATE BANK OF INDIA, GAIKWAD PETROLEUM ARTILLERY CENTER ROAD, opposite STATE BANK OF INDIA, NASHII ROAD, Nashik","19.9494796","73.8258256","true"
"ChIJMdKkTADr3TsRHh35z0sZm0c","Kokni Faiz Energy Station","Plot no 4, 67/3/5/1, Param Pujya Ravishankarji Marg, Wadala Gaon, Nashik","19.972241","73.801401","true"
"ChIJozEQkhfr3TsRQFaAYkHUknc","Gs Caltex","India","19.9791435","73.7823013",""
"ChIJ-8v4VwDr3TsR395A7Px0nKE","Bharat Petroleum, Petrol Pump","19, Ashoka Marg, kalpataru, NagarNashik, Kalpataru Nagar, Nashik","19.9783441","73.80139",""
"ChIJ9SX7-F3r3TsRRcmGkNHQLMQ","Khode Petroleum","Wadala Road, Nashik","19.9808667","73.7924482",""
"ChIJy9FcH4WV3TsRhyDUgSmD4rQ","IndianOil Petrol Pump (Deolali Gaon)","Lock No 13011, Deolali Camp Housana, Road, Nashik","19.903885","73.831696","true"
"ChIJC3ToD07r3TsR0AHjGWlMJbk","Bharat Petroleum, Petrol Pump -Prakash Automobiles","NASIK ( NR NASERDI BRIDGE, Nashik","19.9834839","73.78224","true"
"ChIJvej0BQbr3TsRzOG053tT9JE","IndianOil Petrol Pump (Rehnuma Nagar)","Survey No 864/4/5/1 Plot, No 1B, Rehnuma Nagar, Nashik","19.9827999","73.7924917","true"
"ChIJh7JWMK6_3TsRPAeoxat6gWc","IndianOil Petrol Pump (Adgaon)","Ground Floor, NH 60, Adgaon, Nashik","19.9252981","73.8781632","true"
"ChIJgUvMHAC_3TsRRKFoM5BPLAc","MGNL CNG PUMP","WVQ3+QRR, Nashik - Pune Road, Chehdi, Nashik","19.9394753","73.8545024","true"
"ChIJ9584k7m_3TsRX1Mn5V2CD6g","HP Petrol Pump","Nashik","19.9292852","73.8702994","true"
"ChIJH0bOi3a_3TsRYKx9faVjPv0","Hindustan Petroleum Corporation Limited","Gut No 1447, opposite Gupta Hospital, Palse, Nashik","19.929574","73.870334","true"
"ChIJyWh5SgC_3TsRJwjMd2OyXhg","NISARG PETROLEUM","Nisarag Lawns, Aute Nagar, Bridge Nagar, Nashik","19.9458604","73.8490739",""
"ChIJc2NSR--_3TsRilSYIP26nx4","Sakshi Petrol Pump","near Sinnar Phata, Gut No 190 Pune Road, near Sinnar Phata, Samangaon Road, Nashik","19.9469788","73.847388","true"
"ChIJuc3HGVSV3TsRD1mjX5auktc","Bharat Petroleum, Petrol Pump -B.Shanker Petroleum","NASIK ROAD ( NR RLY STN ), Nashik","19.947912","73.840788",""
"ChIJ4U9E81eV3TsRFK05pkG19Fk","Hindustan Petroleum Corporation Limited","Ground Floor, Ambedkar Road, Nashik Road, Nashik","19.94848499999999","73.84060459999999","true"
"ChIJm-bf6leV3TsRp8TD494i_Lg","Hindustan Petroleum Corporation Limited","Ground Floor, near Railway Station, Ambedkar Road, Nashik Road, Nashik","19.9493737","73.84055049999999","true"
"ChIJx1ZmXMiV3TsRw-TQ9pQaPjg","Bharat Petroleum, Petrol Pump -R.H.Thorat & Company","Jail Road, Kala Nagar, Nashik","19.9601587","73.83912169999999","true"
"ChIJId-x_Ci_3TsRe_bRwZJPi7k","Bharat Petroleum, Petrol Pump -Janseva Transport","SHINDE,SAIKHEDA RD, Nashik - Pune Road, Nashik","19.919475","73.88833819999999","true"
"ChIJjRbVA42V3TsRJi9_RYt_JJE","Nayara Meher Petrol Pump","Lam Road, Deolali Camp, Nashik","19.8921506","73.832894",""
"ChIJJ3sO7Kfq3TsRa7-UyTKz9PM","श्री स्वामी समर्थ ग्राफिक्स","India","19.9724371","73.8408402",""
"ChIJzwhW3W3A3TsRqzR-n6FfRDE","IndianOil Petrol Pump (Adgaon)","Ground Floor Deolali, Adgaon, Eklahare","19.9750126","73.8704328","true"
"ChIJCdyhMADB3TsRtEYHGq8rRbU","Siddhai petroleum","XVH3+5Q4, Pawar Wadi, Nashik","19.9778822","73.854468",""
"ChIJp4OKmAnr3TsREzDgv9Z5Nj0","Hindustan Petroleum Corporation Limited","S No 70/3, Takli Road, Adhav Mala, Dasak, Nashik","19.977546","73.8318318","true"
"ChIJuQ4PhTaV3TsRbGsNbokHtNE","Bharat Petroleum Petrol Pump , OM SAI DATTA PETROLEUM","S. NO, 4/1C, Lam Road, Nashik","19.87901829999999","73.8378242","true"
"ChIJ2yPLfx_A3TsR4MKFZskPNxY","Bharat Petroleum Adhav Petroleum CNG","SURVEY NO 3A/3F/3, PLOT NO 1/1, Jail Road, ROA, Dasak, Nashik","19.9831347","73.845049","true"
"ChIJXyN1LiDA3TsRUP0FPH3Md7s","Hindustan Petroleum Corporation Limited","Ground Floor, near Nasik Road, Jail Road, Dasak, Nashik","19.983828","73.844501","true"
"ChIJs3-Fth-_3TsRXB4EMsZLzpQ","Hindustan Petroleum Corporation Limited","GAT No 474/4, Plot No 1 SH 37, Saikheda Rd, Jakhori, Shinde","19.9218401","73.910574","true"
"ChIJfXMvBea-3TsRABF2PGu4cUk","IndianOil Petrol Pump (Kaudasar)","Lock, 12031, Nashik - Pune Road, Kaudasar, Nashik","19.90854","73.9069877","true"
"ChIJKXctXOi-3TsR10eAeNlQtck","Hindustan Petroleum Corporation Limited","Ground Floor, Nashik - Pune Road, Shinde","19.90633099999999","73.909751","true"
"ChIJOQNNLwC_3TsR2XuOuGJ5Lr8","Hindustan Petroleum Corporation Limited","Ground Floor, Road, Chandgiqri, Chandgiri","19.931242","73.91643599999999","true"
"ChIJm0oKKye_3TsRboVzMNH6hmw","Saishraddha kisan seva Petroleum","Jakhori","19.9233485","73.918407",""
"ChIJs9r9RwDr3TsRtGEE7vUeMfs","DLK Petroleum","Takli Road, Samta Nagar, Nashik","19.9848502","73.819447","true"
"ChIJ8b7_L0Tr3TsRStaJfdG6y8Q","Hindustan Petroleum Corporation Limited","Survey No 12, 3 Agartakli, Takli Road, Samta Nagar, Nashik","19.9851168","73.8193139","true"
"ChIJ75lCrQCW3TsR3j6KO4dNDPI","IndianOil Petrol Pump (Bhagur)","Ground Floor, Rahuri","19.8661295","73.8360675","true"
"ChIJMf6EUgeW3TsRbRIw48nMkEY","Gajanan Maharaj KSK","Bhagur - Vinchuri Dalvi - Pandhurli Road","19.8660994","73.83587659999999","true"
"ChIJY3Tt4yjr3TsRIRnCjCKTApc","IndianOil Petrol Pump (Dwarka)","Lock No 12029, Pune Highway, Bodhale Nagar, Nashik","19.980472","73.8067793","true"
"ChIJKVC2VADB3TsRPKqbWcpEwog","Sai Pandhari CNG Station","800m from, Sambhajinagar Highway, Nandur Naka, Nashik","19.9983932","73.8509754","true"
"ChIJr1FTumXr3TsRHr-qOoW49I0","Bharat Petroleum, Petrol Pump -H.L.Dhatrak & Sons","NASHIK, NR VIJAY MAMTA, Nashik","19.9822175","73.8045664","true"
"ChIJqadMdbzB3TsRWXtoYADl7_U","Sai Enterprises (BPCL Petrol Pump)","near Nandur Naka, Aurangabad Road, Madsangavi, Nashik","19.9993734","73.8617663","true"
"ChIJt83FkNPt3TsR9NJGwQf290s","DN PATIL Petroleum","2MJW+RQ3, Gangapur Road, Govardhan","20.0320227","73.6969144",""
"ChIJL6JCIGnt3TsRhuhKl6hJc30","Hindustan Petroleum Corporation Limited","PN 184, 185, Pimpalgaon Bahula, Gut No 193/A, 190 & 191 Shiwar, Satpur Colony, Nashik","20.002704","73.711038","true"
"ChIJ75U4sb_t3TsRGSjpkb5uIVo","Shri Siddhivinayak petroleum Jio BP","Shri siddhivinayak petroleum, opp. motiwala college, Gangapur - Satpur Link Road, Nashik","20.019249","73.7186418","true"
"ChIJP9uIQ1Ht3TsRfKuneTXAAaM","BP-SOMESHWAR (BHARAT PETROLEUM)","Gangapur Road, Nashik","20.0204315","73.72850129999999","true"
"ChIJxVEPx1nt3TsR3eCdS8cGPFs","Hindustan Petroleum Corporation Limited","opposite Anand Power Limited, Plot No 3, Swargiya Sitamai Sawliram Kale Marg, Kamgar Nagar, Satpur Colony, Nashik","20.00312599999999","73.74060399999999","true"
"ChIJ9_KJxXvs3TsRkaD4tMbbjvw","Jio-bp","Bus Stop, Plot No 1 & 2 Anandwalli, near Ganesh Nagar, Swargiya Sitamai Sawliram Kale Marg, Satpur Colony, Nashik","20.0045161","73.7410082","true"
"ChIJkeRW3-rt3TsR6plmm0vhr9U","Hindustan Petroleum Corporation Limited","Gat No 64/1/2, Plot, Cherry Hills, Gangapur Road, Gangapur, Nashik","20.0123339","73.7469862","true"
"ChIJXaDTBonr3TsRkPW5sbMGchw","IndianOil Petrol Pump (Savarkar Nagar)","Ground Floor, Gangapur Road, Nashik","20.012551","73.75085399999999","true"
"ChIJL8FxTrnr3TsRjp-fthDF0WA","Rahul Petrol Pump","Gangapur Road, Architects Colony, Ashtavinayak Colony, Veer Sawarkar Nagar, Nashik","20.0123642","73.7520466",""
"ChIJfcDoh8Tr3TsRP_4Sm8OoOnQ","Mulani's Petrol Pump","Master Colony, Trimbak Road, Nashik","20.0002162","73.75924619999999",""
"ChIJtc1u9-3r3TsRpltuGJiVR8Q","Bharat Petroleum, Petrol Pump -Vinod Automobiles","TRIMBAK RD NASIK, Nashik","19.9948403","73.76285020000002","true"
"ChIJEVtLVkjr3TsR_KdBEpWlWyk","Bharat Petroleum, Petrol Pump -Shradha Petrol Pump","C.B.S.NASIK, Nashik","20.0046163","73.76320460000001","true"
"ChIJvQOgeefr3TsR8xEdUVavfUg","Bharat Petroleum, Petrol Pump -Godavari Service Station","Ram Wadi, Nashik","20.0112068","73.7763731","true"
"ChIJOzhn1tfr3TsRdMn3YmuLxDw","Ashok Police Petrol Pump Bharat Petroleum","Sharanpur Road, Old Pandit Colony, Police Staff Colony, Nashik","20.0010725","73.7775327","true"
"ChIJwy8KKADr3TsR0bKNgq0kXEQ","Hindustan Petroleum Corporation Limited","No 36/2/2, near Shraddha Lawns, S, Ram Wadi Road, Kausalya Nagar, Ram Wadi, Nashik","20.012173","73.777221","true"
"ChIJZ-T5_Kzr3TsR6WCnbyRgeR0","Palija HP Petrol Pump","Malegaon Motor Stand, Panchavati, Nashik","20.0098801","73.792481","true"
"ChIJ8Tn_GF7q3TsRiQmqOIsr1Q4","Essar pragati Petrol Pump","2R58+CX2, Aurangabad Road, Swaminarayan nagar, Nashik","20.0085165","73.8173864","true"
"ChIJeW2aTi_q3TsRCkOn45lbhRc","Nayara Petrol Pump","Maharashtra State Highway 17, Vaiduwadi, Mhasrul Gaon, Manora","20.0427484","73.8056347","true"
"ChIJkTcwWKzr3TsRYraVe40DuR0","Shweta HP gas Agency","Peth Phata, Opp. State Bank, Panchavati, Nashik","20.01307989999999","73.79191019999999","true"
"ChIJUVTSm-zr3TsRvlaHfEIs7Bo","Om service station & CNG pump","Prasanna Arcade, National Highway 848, Trimbak Naka, Shalimar, Nashik","19.9978767","73.7815847","true"
"ChIJTWbB_8zr3TsRCXsDw6vavmg","Hindustan Petroleum Corporation Limited","Ground Floor Old Mumbai Agra Road, Trambakeshwar Road, Nashik","19.997536","73.78108399999999","true"
"ChIJP0MIFQDr3TsRS7MyY7PI21Y","Bharat petroleum CNG station","Karan House, 1373K, Kanhere Wadi, Trimbak Naka, Shalimar, Nashik","19.9975491","73.7810378",""
"ChIJKThtDQDr3TsRo7uE2vJ6_eM","Salimir","XQVJ+V6H, Matoshree Nagar, Nashik","19.9946913","73.78061",""
"ChIJkWjffabr3TsROJpK0mTXJsY","Sadbhavna Petrol Pump","2Q4J+74G, Police Staff Colony, Nashik","20.0056876","73.7803297","true"
"ChIJGcMXGADr3TsRgyG7jFOfjIw","Satpur","XQXR+P2C, Nashik","19.9993217","73.79001880000001",""
"ChIJ6VXzqAbr3TsRWGCHoCnyrQo","BAFANA TYRES - (CEAT, JK, MRF , APOLLO, BRIDGESTONE,CONTINENTAL,YOKOHAMA)","02, 03, Sarvodaya complex, bus stop, opposite to Ganjmal, 60 Feet Road, Ganjmal, Nashik","19.9954744","73.78832009999999","true"
"ChIJS-fyOgHr3TsRXaRuwfqNfw0","National Home Auto Service","XQXQ+2W3, Old Adgaon Naka Road, Panchavati, Opposite Katya Maruti Police Station, Nashik","19.9975115","73.7897864",""
"ChIJM5LFkgPr3TsRmemLb8TzZ_c","Mobil","XQVQ+HWG, Pune Road, Renuka Nagar, Nashik","19.99393989999999","73.7898261",""
"ChIJUwoYUKzr3TsRwZ-oPc6mDF4","Hindustan Petroleum Corporation Limited","Ground Floor, near Malegaon Stand, Panchavati, Nashik","20.0094488","73.7912466","true"
"ChIJJYhjBwjr3TsR2SH6_thZcFk","IndianOil Petrol Pump (Panchavati)","Lock No 12030, Motor Stand, Panchavati, Nashik","20.009705","73.792046","true"
"ChIJe8G9g3rr3TsRi9gGrZl_lcU","Bharat Petroleum, Petrol Pump -Khalsa Automobiles","PANCHAWATI NASIK, Ahilyabai Holkar Bridge, Panchavati, Nashik","20.010037","73.79271469999999","true"
"ChIJ07D_TVrq3TsRjF6hnXu2MPk","IndianOil Petrol Pump (Om Nagar)","near Haldi Lonws, Adgaon Naka, Om Nagar, Nashik","20.0109019","73.8057523","true"
"ChIJhQY7PWzr3TsRm0_iKLcXR-U","IndianOil Petrol Pump (Om Nagar)","Lock No 11019, Agra - Mumbai Highway, Adgaon Naka, Panchavati, Nashik","20.01028999999999","73.807671","true"
"ChIJ6Wr5Sznr3TsRxBte2-2T0MA","Sahadev Petroleum","Tapovan Road, Nashik","19.9927848","73.80942","true"
"ChIJY8GovoXr3TsRErWmrCy3bYo","Mauli Petroleum Service","Samarth Nagar, Makhmalabad, Nashik","20.0269597","73.7885812","true"
"ChIJsUZLJTPr3TsRThk9RbaT0ts","IndianOil Petrol Pump (Makhmalabad)","Gut No 76/2, near APMC Market, Plot No 6/1, Durga Nagar, Nashik","20.0312025","73.7952511","true"
"ChIJu8t_LADr3TsRwDix73C7vWk","Nyra Petrol Pump Aurangabad Road","2R58+GX3, Aurangabad Road, Madsangavi, Nashik","20.0087726","73.81740789999999","true"
"ChIJiy6kZwDr3TsRQw5I6rYOwMQ","Hindustan Petroleum Corporation Limited","Survey No 55/4, Plot No 4 & 5, Makhmalabad Road, Nashik","20.033308","73.7828669","true"
"ChIJsYhdAOrr3TsRZDVLdoF6mJU","Yugandhar Petroleum","Ghadge mala, Makhmalabad Road, Nashik","20.0333204","73.7828684",""
"ChIJAdASsRLr3TsR1g0qQXTeQAM","BPCL ME & Sons","14, Peth Road, Durga Nagar, Sneha Nagar, Nashik","20.0317259","73.79526729999999","true"
"ChIJKfiNEtjB3TsRAF-xv1PiuDk","Hindustan Petroleum Corporation Limited","Ground Floor, Jatra Link Road, Nandur, Dasak, Nashik","20.009871","73.843514","true"
"ChIJx3LAAazr3TsR0w6AGH_8dAw","Rajvin Petroleum","Siddhivinayak Chowk, near NilgIri bag Road, Chhatrapati Sambhaji Nagar Road, Nashik","20.001664","73.8313996",""
"ChIJk9Mrw2fr3TsR8ypEXvaOoVs","BPCL kimaya Petroleum","Aurangabad Road, Kailash Nagar, Nashik","20.0049272","73.8265831","true"
"ChIJCQzAJRXr3TsRaC79KHBrh7U","Shell","Aurangabad - Nashik Highway, Nashik","20.005965","73.823725","true"
"ChIJsZlNcd7B3TsRtjCGKbid-ZE","Hindustan Petroleum Corporation Limited","Ground Floor NH 3, Konark Ngr, Agra - Mumbai Highway, Adgaon, Nashik","20.028041","73.84740099999999","true"
"ChIJbVBZ853r3TsR1laxKLBAwt4","Nayara Suvarna Krishna Petroleum","2R9G+5WH, Audumbar Nagar, Near Bali Mandir, Munbai, Agra - Mumbai Highway, Nashik","20.0179255","73.8273557","true"
"ChIJ2xfV_5rr3TsRAG8pXw252Hk","MNGL CNG PUMP next to KK Wagh College","2R8F+6PX, Service Road, Pachwati, Sri Ram Nagar, Konark Nagar, Nashik","20.0156132","73.8243518","true"
"ChIJFZA2HjHq3TsRTAE1d_tm7co","Hindustan Petroleum Corporation Limited","Gut No 233/1/A, Plot No 22, Dindori Rd NH 3, Rasbihari, Meri Link Road, Mhaske Nagar, Nashik","20.0267701","73.82765599999999","true"
"ChIJy08_mTPB3TsR15KaL51sqSY","Hindustan Petroleum Corporation Limited","Gut No 1507, near Old Jakat Naka, NH 3, Agra - Mumbai Highway, Adgaon, Nashik","20.0356817","73.8638151","true"
