place_id,name,address,latitude,longitude,open_now
"ChIJ0bGmMQDB3TsRQ2yllLS5UjU","Bharat Petroleum - BP Adgaon","2VP7+PQH, Vasantdadanagar, Adgaon, Nashik","20.036609","73.863848","false"
"ChIJTb79zjnB3TsRTDiRNMO0axE","IndianOil","No 2, Gut No 1470, Adgaon, Nashik","20.0375169","73.86574329999999","true"
"ChIJ9diHqrnB3TsRRXqIH77PavY","IndianOil Petrol Pump (Odha)","Gut No, 329/2, Odha","19.9975186","73.9027803","true"
"ChIJSx5sGADB3TsRuISB2hrft-M","Near jatra hotel cng","2VVF+HRF, Nashik","20.0439415","73.8745591",""
"ChIJ0QjW1Y_B3TsR_istk5UR5Fg","IndianOil Petrol Pump (Jadhav Mala)","Truck Terminal, Agra - Mumbai Highway, Adgaon, Nashik","20.0439088","73.8746901","true"
"ChIJ5VtO7NjB3TsRuBxWKDcUOD4","Shell","opp. Truck Terminal, Nashik Road, नाशिक","20.045426","73.874382","true"
"ChIJGQkiszHq3TsRdBqmVz7O1Bc","Jio-bp","Plot No 6, Survey No 207, 7/A, Dindori Road, Mhasrul Shivar, Nashik","20.0357314","73.80323419999999","true"
"ChIJ2cQZWU_r3TsRknU30NEeDfM","Bharat Petroleum, Petrol Pump -Ichamani Construction & Co","NASHIK-DINDORI RD- ICHAMA, Nashik","20.03730599999999","73.8038935","true"
"ChIJy3Sg5SDv3TsRz3CyRE9tuYU","Hindustan Petroleum Corporation Limited","Gut No 338, beside DSB Bank, Girnare Road, Dugaon","20.0707555","73.6782755","false"
"ChIJM627bDDu3TsRn0pE43CYBHM","IndianOil Petrol Pump (Girnare)","26, Makhmalabad Rd, Ashwamegh Nagar, Makhmalabad, Nashik","20.071594","73.666923","true"
"ChIJGwRZawDp3TsRPF1JLu17sps","Hindustan Petroleum Corporation Limited","Ground Floor, Makhmalabad, Nashik","20.052259","73.762404","true"
"ChIJucefbg7v3TsRUgJ0WgtR6Ok","M/S ASHTAVINAYAK PETROLEUM","Dugaon Girnare Road, A/P Girnare Tal, Dist, Nashik","20.0745396","73.6593154","true"
"ChIJVSuRrEDp3TsRisNWmzwzBTc","IndianOil Petrol Pump (Omkar Nagar)","Shiv Petroleum, Peth Road, Nashik","20.0715032","73.7784746","true"
"ChIJrTshY_np3TsR94w-h1AkQMo","SB Vinayaka Petrol Pump & CNG Gas Pump (BPCL)","3QGH+6P, Gawalwadi","20.075508","73.779305","true"
"ChIJL6q2MsHp3TsRGNcgLGmLGlE","Nayara - Navkar Petroleum","Peth Road, Makhmalabad, Nashik","20.0656703","73.7806791","true"
"ChIJOdKozr_p3TsR00mJUom5l74","IndianOil Petrol Pump (Lakhamapur)","Survey No 261/2 Ramshej, Dindori","20.1142509","73.76291049999999","true"
"ChIJwQeSYfnr3TsRf6JyTGnxLKU","Petrol pump","2QXH+3HW, Makhmalabad, Nashik","20.0460927","73.7786765","true"
"ChIJq_tCg7bx3TsRFhagJV6VanU","Shree Parvatiraj Petroleum","3JCR+PCF, Nashik","20.0718153","73.6410503","true"
"ChIJYc74D7bx3TsRQGCcCyGxO6Y","Trimbakraj petroleum girnare harsul road","Gut No 460, 2/2, Vilwandi, Girnare","20.0727199","73.6405657","true"
"ChIJoQTOkP3q3TsRDB0fg3CBEV4","Hindustan Petroleum Corporation Limited","Ground floor, Dwarka Circle, near Godavari Hotel, Agra Road, Nashik","20.0405862","73.78044919999999","true"
"ChIJF1bnmBzp3TsR42lEpdVKNdo","Ramshej Aashewadi(Adblue pump)","4QC8+45F, Ramshej","20.1203086","73.7654367",""
"ChIJz4NKgK_p3TsRm6c8fmXFd98","IndianOil Petrol Pump (Akrale)","Plot No 196/1B Dhakambe, Dindori, Akrale","20.0835948","73.8037973","true"
"ChIJS6QoCpHr3TsR_UCSwt2di_Y","CNG BPCL Shree Gajanan Petroelum","Devbhumi Apartment, Maharashtra State Highway 26, Near Rau Hotel, Omkar Nagar, Nashik","20.047008","73.7927906","true"
"ChIJhZzmSpLp3TsRZZZtFJXeG6o","Bhawani Shankar Petroleum Co","Dindori Road, Nashik","20.0523519","73.804861",""
"ChIJBUgxpgjr3TsRPyRoI9JIVAk","Reliance Petroleum","C, Plot, Fitness Society, Survey No, 207/B, Dindori Road, Mhasrul Gaon, Shivar","20.0456957","73.80459610000001","true"
"ChIJ4UvIvi_q3TsRTqJl2FECoT4","Hindustan Petroleum Corporation Limited","S No 234 Plot, 3, Dindori Road, Mhasrul Gaon, Nashik","20.03900459999999","73.8048144","true"
"ChIJUUgo4FHo3TsRJtdQu-VdM4E","Bharat Petroleum, Petrol Pump -Navnath Petroleum","DHAKAMBE, Nashik","20.10239619999999","73.80662199999999","true"
"ChIJs1p1ygnp3TsRZhaOHjh058M","Hindustan Petroleum Corporation Limited","Gut No 329, A SH 17, Dindori Road, Nashik","20.111054","73.808052","true"
"ChIJzzf1VGno3TsRfZ5V6_K5h84","Hindustan Petroleum Corporation Limited","near Khatwad, Gut No 212/B, Nashik Dindori Road SH 17, Dindori, near Khatwad, Pimpalnare","20.1245286","73.812225","true"
"ChIJe4mZiMPD3TsRi6ic11IBRMM","Bharat Petroleum","National Highway 3, Vijay Nagar","20.073587","73.9068418","true"
"ChIJZY1lJcLD3TsRyuEBuZrzA3I","Hindustan Petroleum Corporation Limited","Gat No 23/2/1 NH 3, Niphad, Agra - Mumbai Highway, Ojhar","20.0754367","73.9103063","true"
"ChIJz2nJLuvD3TsRHuTYCUNIGzk","Jio-bp","opposite Panchwad Nagar, Gat No 2436/2 Mumbai Agra Road, NH 3, Ozhar, opposite Panchwad Nagar, Mig, Nashik","20.0822805","73.9155952","true"
"ChIJkWW8qMfD3TsRn6hkrK8qWg4","BPCL - Adgaon ( Smartfleet -OTP - Petrol - Diesel - EV Charging)","Survey No.1866, near Garware Point, Agra - Mumbai Highway, NH3, Adgaon, Nashik","20.0586716","73.8881899","true"
"ChIJ26RjjdTD3TsRwd5SQVCsT1k","Hindustan Petroleum Corporation Limited","Survey No 150, NH 13, Agra - Mumbai Highway, Jaulakedindori","20.061371","73.891171","true"
"ChIJlfPCotPD3TsRKj5hcp1m2-w","IndianOil Petrol Pump (Dindori)","Survey No 172, Hissa No 172, Agra - Mumbai Highway, Jaulke","20.0645022","73.8927313","true"
"ChIJF-40ZP_D3TsRpFOhMVRUw2w","Hindustan Petroleum Corporation Limited","near Nashik International Airport, Gat No 577 Airport Road, Dindori, near Nashik International Airport, Janori","20.091108","73.893492","true"
"ChIJB7fpeZPD3TsRI_O99kfOiyI","IndianOil Petrol Pump (Shivaji Nagar)","Ground Floor, Agra - Mumbai Highway, Korapgaon, Ojhar","20.085268","73.918961","true"
"ChIJaR7iLq_D3TsRUvYY4-KOfUY","Bharat Petroleum, Petrol Pump -R.B.Gaikhe & Sons Nh3","OZAR ( NH3 ), Nashik","20.088017","73.9223885","true"