place_id,name,address,latitude,longitude,open_now
"ChIJtetIInnRxTsRXxJqJTkKgos","HP Petrol Pump","MR87+VJR, Solapur","17.6672395","75.8140299",""
"ChIJzXxn_HjRxTsRzzAt85BeqLM","IndianOil","Gat No 145, near Jawaharlal Nehru Vastigrah, Belati","17.6680988","75.8151507","true"
"ChIJUbtdJABXxjsRlBDIFj0hBJQ","Shir sharanbasaveshwar petroleums HP","Ground floor, NH 13, Vijayapur - Solapur Road","17.6112377","75.8886911",""
"ChIJi-BkUADRxTsR9KPUts7X3N8","CNG AKKALWADE SOLAPUR KOLHAPUR ROAD","MR9V+C77, Degaon","17.668388","75.843909",""
"ChIJZ0JwUEjRxTsRiNk5S3JveAo","IndianOil","Gat No 140, Jawaharlal Nehru Basaveshwara Ngr, 1/A/1/A/2, Solapur","17.6686858","75.8438725","true"
"ChIJW4WokP7QxTsRiXFT5gVQrmg","Hindustan Petroleum Corporation Limited","SH 3, Gat No 146, 1/A, Sangola - Mangalwedha - Solapur Road, Solapur","17.6692252","75.8141322","true"
"ChIJXXTqeQDRxTsRrTVvv2XFOgM","TATA DEF","MRCM+PGP, Solapur","17.6718311","75.8338246","true"
"ChIJucq821zXxTsRGgV_jo5o3ig","Hindustan Petroleum Corporation Limited","Survey No 8/1, Solapur Vijapur Road, NH 52, North, Soregaon, Solapur","17.6096674","75.8929816","true"
"ChIJ7TAhI2TXxTsRC5xpgMjsatI","M/S. Sneha Bharatgas Agency","JV2R+5XM, National Highway 465","17.6004677","75.8924105",""
"ChIJteZgUKDXxTsR4nvmTNzx14U","Gas godown SRPF Camp Solapur","JV8W+3X6, Unnamed Road, Swami Vivekanand Nagar, Solapur","17.615154","75.897382",""
"ChIJ5-XRNADXxTsRIwsPObnZw4s","Inn gas Auto Lpg Pump","JVHW+WVJ, near Nirmiti Lawns, Solapur","17.6298393","75.89712569999999","true"
"ChIJ49iey2nRxTsRgT7qY85I4rg","IndianOil","NH 13, Vijapur Road, Nehru Nagar, Solapur","17.634432","75.89748399999999","true"
"ChIJP8U4Ru3RxTsRY6IW8iakGtw","IndianOil","Gat No 125/1/A Majrewadi, Jule, Solapur","17.6325964","75.8993527","true"
"ChIJUW76gQ7RxTsRRHCWK8fyA-A","KAILASH CNG FILLING STATION","near Hotel Mayurvan Family Restaurant, Plot 265 & 273, Vijapur Road, Mantri Chandak Park, Jule, Solapur","17.635139","75.898955","true"
"ChIJZ9R6PnTaxTsRvk_W1TqxOeI","Petrol Pump","Modi Khana, Navi Peth, Solapur","17.6586381","75.904091",""
"ChIJEe3PvgLaxTsR2MRJJqdfH78","BPCL Petrol Pump - Shri Joshi Petroleum","31/A, Bank Colony, Jule, Solapur","17.6325204","75.9103493","true"
"ChIJP2lmcQnZxTsRqyFeB4aVGDk","Bharat Petroleum Petrol And CNG Pump","Airport Area, Shankar Nagar, Solapur","17.6044474","75.9499125",""
"ChIJAy4EXnjaxTsRQFR04Yq-7QU","IndianOil","41, Railway Line, Dufferin Chowk, Solapur","17.668024","75.901268","true"
"ChIJ076o4JLXxTsR8iq1EQpl_G0","BPCL Petrol Pump","National Highway 52","17.5616172","75.885669",""
"ChIJW5a1EBDZxTsR8zo7AgQMUtA","IndianOil","Gat No, 524 & 525, Hotgi Road, Mdr 39, Antroli, Solapur","17.601184","75.958727","true"
"ChIJm82FHV7axTsRYwSuhZruTE4","Essar Petrol Pump","36, Solapur - Akkalkot Road, Gandhi Nagar, Rangraj Nagar, Solapur","17.6736127","75.923069","true"
"ChIJDT0G63_QxTsRc9KrkjgQ5sU","Hindustan Petroleum Corporation Limited","Survey No 8444D, Plot No 4B, Murarji Peth, Solapur","17.6785583","75.8986299","true"
"ChIJzXIvoIjaxTsRVqZb5KOks1M","BHARAT PETROLEUM","MWJ6+RQV, Mangalwar Peth, Solapur","17.6821107","75.9119292",""
"ChIJgYHKC_LZxTsRUhgwfeQ2BtE","Hindustan Petroleum Corporation Limited","Survey No 307, Kumte, Solapur","17.60785599999999","75.915763","true"
"ChIJO3ACmALaxTsRM-LsPGdosqA","go gas","India","17.632034","75.9100004",""
"ChIJswTI-Q_ZxTsR0FBWI58vcFw","Hindustan Petroleum Corporation Limited","Gat No 86/1, Pai Solapur, opposite Solapur Airport, Hotgi Road, Hatture Vasti, Solapur","17.621407","75.93422029999999","true"
"ChIJ3a9SPmzbxTsR2N2VEHpGuAI","Hindustan Petroleum Corporation Limited","Survey No 19, A/1/E, Plot No 12, North, Majarewadi, Solapur","17.6453661","75.9247991","true"
"ChIJTS033grbxTsRDIX50MiAiMQ","Bharat Petroleum Petrol and Diesel Filling Station","JWWF+RQJ, Shivaganga Nagar, Solapur","17.6470806","75.9244038","true"
"ChIJbzmLPnTaxTsR7hSYf1liCxg","IndianOil","No 1639, Rupa Bhavani Road, Civil Lines, Solapur","17.65675809999999","75.9069792","true"
"ChIJM1uZNwrZxTsRGEj8yoAgLJw","IndianOil","India","17.6064804","75.9486257",""
"ChIJUzpfBADbxTsRriwGS96ZEko","Indian oil pump","MW64+7MJ, Solapur","17.6607067","75.9066362","true"
"ChIJPf7oJ0fbxTsRwVUv8Bi-CGI","Prabhat Petrol Pump","Bharatratna Indra Nagar 70 Pur Road, MIDC Road, New Paccha peth, Sakhar Peth, Solapur","17.6587669","75.9241976","true"
"ChIJO9AFRArbxTsRM4Kt3SyHid0","Sri Gurukrupa Petroleum PUMP","218/9, Navnath Nagar, Old Nagari Bank Building Akshwani Road, Aadarsh Nagar, Nagendra Nagar, MIDC, Solapur","17.6551436","75.93058119999999","true"
"ChIJl7BybADRxTsRZEdiKTxPaDE","Snehal more","MV8X+2FV, Railway lines, Solapur","17.6651108","75.89866119999999",""
"ChIJjcGFXTnXxTsRU-62OHacRrE","Mauli Sales And Services","Mauli Sales And Sevices, Bharat Petrol Pump, VijayPura Highway, Solapur","17.5616044","75.88580209999999",""
"ChIJsyTJnILQxTsRjMJZVNmQVLQ","Naval And Son (Petrol Pump)","45-A Railway Lines, Station Road Besides St. Joseph High School, Solapur","17.6673706","75.8995446","true"
"ChIJt--kA9fbxTsRssSGjceKeNM","Prime Fuel Auto LPG Station","WIT Boys Hostel Road, New Paccha peth, Sakhar Peth, Solapur","17.6644694","75.9215207","true"
"ChIJnaRGmDnbxTsR4Gbn2Cur160","Solapur Gramin Police Petrol & CNG Pump","Datta Nagar, Sakhar Peth, Solapur","17.6671878","75.9149939","true"
"ChIJWSFqQ5_bxTsR9gdyAOTy44k","Hindustan Petroleum Corporation Limited","CTS No 10393, near Ashok Chowk, FP No 36, New Paccha peth, Solapur","17.6659534","75.9211222","true"
"ChIJQ9BOEQDbxTsR2wHsm8rA7wc","MSEDCL EV charging center","MW6M+384, MIDC, Solapur","17.6604444","75.9334894","true"
"ChIJxb1tUMvbxTsRh7_KpD05PlY","Sakahi puc centre","Bhavani petrol pump Ruppa bhavani mandir, old, tuljapur naka, Solapur","17.671706","75.9087247",""
"ChIJg-EZBeXbxTsR9UIdJyMLb2k","Akshaya Valuers & Consultants","Akshaya Valuers & Consultants, 1st Floor, Sun Plaza 145","17.6750776","75.90059959999999","true"
"ChIJMa3PZGbbxTsRZSg2TFUVqE8","Rajdhani Petroleum(Nayara Energy)","JXX3+G85, Old Kumbhari Road, New Paccha peth, Madhav Nagar, Solapur","17.6487554","75.95336","true"
"ChIJpRSfl3_QxTsRGsRKKUQIAik","Shivaji Petrol Pump - Hindustan Petroleum (HP)","3, Chhatrapati Shivaji Maharaj Chowk, OLd Police Line, Murarji Peth, Solapur","17.6785645","75.89863509999999",""
"ChIJTZKwqWLaxTsRx71WRTygN58","Chadchankar Petrol Pump","MWH6+3Q5, Ganesh Peth, Shaniwar Peth, Solapur","17.6776317","75.9119888","true"
"ChIJCWBllODbxTsRxpfrb-LV1l0","Shri Swami Samarth Service Center and all wheeler's puncture repair","opposite Pogul, No 158/A Akkalkot Road, opposite Pogul, Rangraj Nagar Road, Sakhar Peth, Solapur","17.671626","75.9339313",""
"ChIJATVxMH_bxTsRV0NKPEnzJWI","Shri Swami Samarth Auto Centre","Shop No 1, Sadul Pertrolpump, Akkalkot Road, Solapur","17.6716401","75.93391620000001",""
"ChIJkdbmbVraxTsR_-VmVgVwuvY","IndianOil","opposite Pogul, No 158/A Akkalkot Road, opposite Pogul, Rangraj Nagar Road, Solapur","17.671711","75.93390699999999","true"
"ChIJmRyJdBLRxTsRB1W70D6xUk8","Bharat Petroleum, Petrol Pump -Shah Hansraj Jeevan","Sadik Mechanics, Old Employment Chowk, Kumta Naka, Solapur","17.6800487","75.8979133","true"
"ChIJK9zGIX_QxTsRrUAQdRa1BaY","Hindustan Petroleum Corporation Limited","Ground Floor, near ST Stand, Chhatrapati Shivaji Maharaj Chowk, Solapur","17.6811656","75.8971948","true"
"ChIJR3avIX_QxTsRrwqOrMrr89w","Sagar Auto Gas-AEGIS","MVJW+JPC, National HIghway 211, Mahesh Nagar, Solapur","17.6815684","75.8967705","true"
"ChIJSTxJiYjaxTsRO1w0eTW3PoY","Hindustan Petroleum Corporation Limited","Survey No 8945, near Chatla Saree Center, Plot No 169/A, Jodbhavi Peth, Solapur","17.6810638","75.91268529999999","true"
"ChIJq3yRhHPXxTsR1TO5sa5-6IY","Hindustan Petroleum Corporation Limited","Gat No 532/2, Hattur","17.5460464","75.88298670000002","true"
"ChIJg-LkvvrRxTsRxBHGWBAmxCs","Zyada gas Auto Lpg Pump","Bhaishree Petroleum AUTO LPG GAS PUMP, near MURARJI PETH, Murarji Peth, Solapur","17.6825414","75.8951677","true"
"ChIJYRr_jALXxTsRXvrXSFg8nc0","Chavan Petroleum (HPCL Pump)","near Gulmohor Dhaba & Hotel, HATTUR Solapur Vijapur National, near Gulmohor Dhaba & Hotel, National Highway 52, Solapur","17.5437421","75.8840128","true"
"ChIJnUOXL_XaxTsRPxTg6MyujZ0","IndianOil","Ground Floor, Market Yard, Solapur","17.680857","75.923813","true"
"ChIJ02mqVJXbxTsRwV0jXD4TGOw","IndianOil","Gat No 646, Near Jawaharlal Nehru Vastigrah, 2/1, Kumbhari","17.6588056","75.9698216","true"
"ChIJEwt8sObbxTsRNBRrppfWzF0","TotalEnergies","India","17.6424549","75.9744662",""
"ChIJFQep2F7ZxTsRCnP9yhfaJy0","Hindustan Petroleum Corporation Limited","Infront of Hatture Mangal Karyalay, Gat No 278/P Solapur, Hotgi Road, South, Solapur","17.582487","75.979635","true"
"ChIJT864_drbxTsREF5tn5EMDmQ","Bharat Petroleum Petrol Pump , SAGAR FUELS","Solapur - Akkalkot Road, Kumbhari","17.651973","75.98693","true"
"ChIJ8WJynB_ZxTsRaxVY4gAujZk","Bharat Petroleum, Petrol Pump -Kareem & Sons","NR HOTGI RLWY STN, SOUTH S, Solapur","17.5695048","75.98783689999999","true"
"ChIJU4Xa7J7fxTsRCZgIfmVjxpM","Hindustan Petroleum Corporation Limited","near Hotel Kamat, Gut No 136, Solapur Akkalkot Road South Solapur, Tograli, near Hotel Kamat, Kumbhari","17.62851599999999","76.0211858","true"
"ChIJ4auhpLHbxTsRgB4jsDAvgD4","Go Gas LPG pump - solapur akkalkot road","MX82+CMX, Telngi pachha peth, Solapur","17.666107","75.9517204",""
"ChIJObesLYPfxTsR2z1Oplhq0BU","Shree Seva Petroleum","Solapur - Akkalkot Road, Togarali","17.6225151","76.0288431","true"
"ChIJY2t1Co7exTsRceoNCuPjyEI","Bharat Petroleum","India","17.6227882","76.02890049999999",""
"ChIJ5dAKGUd3xjsRjRBLExLzYZM","Bharat Petroleum Petrol Pump , A S BAVI PETROLEUM SERVICES","AT POST AHERWADITALUKA SOUTH, Solapur","17.54236299999999","75.97644","true"
"ChIJeXLIaRLOxTsRaHP-x7utfGM","BP Solapur, COCO","NH-9, Pune Solapur Highway, Solapur, Kegaon","17.73403769999999","75.8232791","true"
"ChIJXUFIaBLOxTsRi6tjVsTPCFE","Ganesh Highway Service Station","Pandharpur - Solapur Road, Kondi","17.7366799","75.8198865","true"
"ChIJoZ5C_ZLNxTsRBs8_XCMQhyg","Bharat Petroleum","PQJM+6MQ, Pakani","17.7305974","75.78424",""
"ChIJtSIlpiTOxTsRiT824pAMhnA","IndianOil - SWAGAT","Gat No 305/2, Kondi","17.7292921","75.836287","true"
"ChIJR3OJahLOxTsRTdleywd1yR8","भारत पेट्रोलियम","India","17.7364922","75.8193793",""
"ChIJf7Ed8kLRxTsRvB-4nNUa0E4","Hindustan Petroleum Corporation Limited","No 4, TP Scheme, CTS No 8927/B1, Budhavar Peth, Solapur","17.6868516","75.89918999999999","true"
"ChIJNaHCeUbNxTsRdSidnujk-JU","HPCL COMPANY PAKNI","PQHH+MWR, Pakani","17.7292308","75.77975459999999",""
"ChIJH9sN--nPxTsR-CXuadMdVRU","Hindustan Petroleum Corporation Limited","GUT No 143, 2 & 143/3, Barshi - Solapur Road, Gulwanchi","17.7382755","75.8774016","true"
"ChIJg3NfAwDbxTsRLJSmngNGN9A","Bhawani Petroleum","Maddi Vasti, near Juna Tuljapur Naka, 2/82, Bhavani Peth, Solapur","17.692501","75.912912",""
"ChIJaWzH5LfbxTsRoQOlgHza178","HP Patil Petroleum & CNG","10/43, Bhavani Peth, Solapur","17.6873533","75.917991","true"
"ChIJC50PJVvbxTsRD3fbQspDyZU","Hindustan Petroleum Corporation Limited","Gut No 52/3, Part B, NH 52, Beed - Solapur Road, Solapur","17.6969833","75.9142667","true"
"ChIJR1PwuUrbxTsREHYtul-_keA","Yallama Lpg Gas Pump","MWPR+MFC, Mulegaon Road, Saruwadi Nagar, Rangraj Nagar, Solapur","17.6866968","75.9411264","true"
"ChIJ5196A5PbxTsR0hSVgoE8mh4","Shree ganesh Highway service","PWCC+79F, Solapur - Tuljapur Road","17.7206969","75.92091289999999",""
"ChIJjfu9BADFxTsR5_l2ERudcXc","Hindustan Petroleum Corporation Limited","opposite IOC, Gat No 160/4P NH 52, opposite IOC, Beed - Solapur Road, Hatii, Solapur","17.729527","75.930173","true"
"ChIJAZji_DPFxTsR9oG4ciCv5lI","IndianOil","Ground Floor Hegloor, Ashok Chowk, Solapur","17.731039","75.929619","true"
"ChIJmWCLagDFxTsRP21jfrt8d1k","Hatti Highway Services","PWJH+CWF, Haglur","17.7310639","75.9297863","true"
"ChIJMYLhhiTbxTsRRCMtGb3cvPI","IndianOil","Gat No 111 NH 9, Mulegaon, Jawaharlal Nehru Vastigrah, Hyderabad Road, Solapur","17.6924701","75.96183599999999","true"
"ChIJZ3ZhjRLbxTsRqYjF-0k-f8M","HPCL Shri Gurukrupa Petroleum & CNG","India","17.6946596","75.9673577",""
"ChIJv0ETaCLbxTsRBn_u537Ex60","Hindustan Petroleum Corporation Limited","Gut No 131, Infront of Ford Showroom, 1/A Old NH 9, National Highway 65, Mulegaon","17.694393","75.9674424","true"
"ChIJHUVb8NvbxTsRK6D1kKgP_hI","IndianOil","Ground Floor, Solapur - Tuljapur Road, Haglur","17.7422151","75.9359595","true"
"ChIJ05q_bKDcxTsRU5nvAI2Muwc","IndianOil","Ground Floor, NH 9, South, Doddi","17.708251","75.99354699999999","true"
"ChIJm4jwoaHcxTsRujdc_85vEdQ","Hindustan Petroleum Corporation Limited","Gat No 182/1/1, Solapur Hyderabad Hwy, NH 52, South, Fata, Solapur","17.7096101","75.9970701","true"
"ChIJfziIFvvbxTsRdl1BB_P3XkI","Bharat Petroleum, Petrol Pump -Shreyash Petroleum","TAKALI, SOLAPUR, Solapur","17.6981668","75.974032","true"
"ChIJpYF1rm7bxTsRMoezQheu_ys","Kalyani Petrol Pump","Mulegaon Tanda","17.6993698","75.9759746",""
"ChIJz1ibdf7dxTsRM87r-3x6BOg","IndianOil","S No 69/2, South, Doddi","17.6888573","75.99969879999999","true"
"ChIJGWWLoDrMxTsRT7bdkQdd0aE","Hindustan Petroleum Corporation LPG Plant Solapur","QQCV+XR7, Chincholikati","17.7724198","75.79453920000002","true"
"ChIJkx_nE4fNxTsR4Cs4Pdd84FA","Chincholi MIDC CNG pump Solapur road","QR22+QP9, Chincholikati","17.7518526","75.802007","true"
"ChIJFZwXp2DNxTsR3qR8B5SMrAw","IMC LIMITED CNG Pump Filling station","QR22+QP9, Chincholikati","17.7519076","75.801852","true"
"ChIJV3hsL8XNxTsR9leiywAI18E","Bharat Petroleum, Petrol Pump -Bp-Chincholi","CHINCHOLI, Solapur","17.7475638","75.7944524","true"
"ChIJs6GU2MTNxTsRJr6LHNjtbbQ","Hindustan Petroleum Corporation Limited","Ground Floor, Hyderabad Naka, beside Sunil Hotel, Chincholikati","17.74674359999999","75.79376309999999","true"
"ChIJaXRUELfPxTsRtxWeawvaMJE","Nagraj Petroleum","Barshi - Solapur Road, Karamba","17.7627572","75.8692446","true"
"ChIJv9oZDzDMxTsRSBCGhnHuk9c","HPCL Bottling Plant, MIDC Solapur","Chincholikati","17.7723844","75.7945192","true"
"ChIJ7fgt_SzNxTsRjBu32kq3xj4","Hindustan Petroleum Corporation Limited","Ground Floor, opposite Nisarg Hotel, National Highway 65, Mohol, Chincholikati","17.7491494","75.7891557","true"
"ChIJffnTP0bNxTsRBjFAh72_O5g","Hindustan Petroleum Corporation Limited","near Hotel Mohit, Gut No 200/2/B/2/P NH 65, Solapur Pune Rd, Mohol, near Hotel Mohit, Sawaleshwar","17.753138","75.7819741","true"
"ChIJf5G8a6HRxTsRbV-ocak0R5c","SAHYADRI HIGHWAY SERVICES PETROL PUMP","GAT NO 200/2, B/2, Solapur - Pune Highway, Sawaleshwar","17.7543096","75.780016","true"
"ChIJqVTIypzNxTsR9F7ApOou7go","IndianOil","Gat No 218, NH 9, Solapur - Pune Highway, Mohol","17.755874","75.774377","true"
"ChIJ67F0rxjFxTsRFOEN0jjEmsE","Hindustan Petroleum Corporation Limited","Gat No 30/2/1 NH 52, Tuljapur, Haglur","17.749761","75.940051","true"
"ChIJzy0Pff7ExTsROoQWfFJTT_s","Bharat Petroleum","Haglur, Solapur, NH-204, Beed Solapur Road, Solapur, Solapur","17.7678","75.9491","true"
"ChIJX4KhoTnExTsRz2g308GHN8k","Satguru CNG Bharat Petroleum","India","17.8011922","75.96057739999999","true"
"ChIJnez7ksXFxTsRm9BYh7Hh1a8","Bharat Petroleum, Petrol Pump -Shri Rajaram Petroleum","211, HN Apte Path, Solapur Bazar, Narayan Peth, Pune","17.8117363","75.9639529","true"
"ChIJBT60JfnFxTsRJx5OKc0YbXY","Bharat Petroleum, Petrol Pump -Satguru Petroleum","S.NO. 404, KASEGAON, 405, Solapur","17.8120364","75.9642302","true"