place_id,name,address,latitude,longitude,open_now
"ChIJHWySIGHazTsRMSwmYsitgjs","Bharat Petrol","J3P6+85Q, Nizamabad","18.6358482","78.0604785","true"
"ChIJsyMY0MHXzTsR0RqhKtuj8Lw","Muthakunta (Alisager) Cross Road","JX6R+5JG, Muthakunta","18.6104385","77.9915779",""
"ChIJEw5oBADXzTsRvIAEUG3cDSA","Bharat Petrol Pump,(Sagar Filling Station)","JX6Q+23J, Varni - Nizamabad Road, Mosra","18.6103873","77.9884263","true"
"ChIJ4RWR5DzXzTsRceU7tZcUbQE","Hindustan Petroleum Corporation Limited","Survey No 863/1 Nizamabad Varni Road, Varni, Mosra","18.6101525","77.9878583","true"
"ChIJ89mIlHrZzTsRm-_2SWvrNpY","IndianOil","SY No 870/3, Mosra","18.6130509","77.98374059999999","true"
"ChIJozQVfPbbzTsRziJTy7Z8sU4","Hindustan Petroleum Corporation Limited","550, A550, Sy No 551, Varni - Nizamabad Road, Varni, Nizamabad","18.637084","78.0617395","true"
"ChIJ18CoVWvXzTsRV9uF4RtX3n0","Hindustan Petroleum Corporation Limited","Survey No 133, 1/A, Varni - Nizamabad Road, Chandur","18.58373599999999","77.951825","true"
"ChIJy9-XSN_azTsRFRhgAxlqjQU","IndianOil","M, No 10/14/1343/1234, Nagaram Road, Gajulpet, Shivaji Nagar, Nizamabad","18.6631251","78.0929012","true"
"ChIJzcHcrSTFzTsRxgFqL1dEKK0","IndianOil","Ground Floor, Borgaon (Kalan)","18.6550161","78.1271952","true"
"ChIJAW6zaw3PzTsRqPMcmYt1hms","IndianOil","Survey No 253, Mudakpally (Narsingpally)","18.574001","78.11430299999999","true"
"ChIJHbWbQvrPzTsRpbir8CJ35jY","Hindustan Petroleum Corporation Limited","Survey No 306/P1 Shivar, Mugpal","18.6215833","78.1222574","true"
"ChIJN3vfhhfFzTsRMX11z76ASMA","IndianOil","Ground Floor Mugpal, Gajulpet, Nizamabad","18.622024","78.122271","true"
"ChIJVUoTZuDbzTsRrqEwipduMrc","IndianOil","Survey No 1881 & 1882, Woddara Colony, Kanteshwar, Nizamabad","18.6495709","78.07739819999999","true"
"ChIJ9b0JOuTazTsRoiKsP1wK6u8","Hindustan Petroleum Corporation Limited","Survey No 1841, 1842 1849 & 1851, Nagaram Road, Nizamabad","18.65542","78.0813","true"
"ChIJyUkvWQDbzTsREO255xzazFY","Sri Raghavendra filling station","M34J+5GF, Indrapur Colony, Anand Nagar, Nizamabad","18.6554379","78.0813058",""
"ChIJISt7_xnbzTsRRHvC7-KsttY","Sree Venkateshwara Auto Fuels","M34M+JRJ, 0.5 Kms. from Varni Chowrasta on RHS towards Nagaram, 10-9-469, Sai Nagar Road Number 2, Indrapur Colony, Anand Nagar, Nizamabad","18.6583419","78.0823566","true"
"ChIJp0mfjEHPzTsRvj-bSm4pDnk","Hindustan Petroleum Corporation Limited","Survey No 38, Mugpal, Manchippa","18.5450636","78.1126274","true"
"ChIJp0zGTorFzTsRxq__E-90BjA","Nehal pathology Lab","India","18.6572796","78.1173826",""
"ChIJy_T0zpvFzTsRj46nd4GXeb4","Sri Laxmi Narasimha Filling Station","Flat No. 6, beside Nexa Show Room, 9/1, Hyderabad Road, Nizamabad","18.6550738","78.12680519999999","true"
"ChIJfxhdzi7FzTsRokEvubHYaik","Hindustan Petroleum Corporation Limited","Ground Floor, Hyderabad Road, Borgaon, Pangra","18.6596281","78.1185459","true"
"ChIJMbdZDwrFzTsRF-SrH59c-ac","BPCL M/s Sri Goamukhi Filling Station /cng pump","M44G+7P8, opposite to NexaShowroom, HYD Main Road, Nizamabad","18.655651","78.1268209","true"
"ChIJzyBnIT3FzTsR6r2gpySfKGU","Indian Auto Gas Filling Station","M43J+C97, Madhavanagar, Nizamabad","18.6535252","78.13092","true"
"ChIJIwMGOdXazTsRHF37dcU2-sw","Hindustan Petroleum Corporation Limited","Survey No 329/A, Vinayak Nagar Street, Nizamabad","18.6637543","78.10981210000001","true"
"ChIJjSC-XsXbzTsRlQ5G5qZTbK4","IndianOil","Survey No 9, 8/209 & 9/8/210, Quila Road, Gajulpet, Nizamabad","18.6669501","78.0861201","true"
"ChIJ4TOmcADbzTsRx6QQIEpJGwc","SREEDA FILLING STATION","1-12-18/A, Vinayak Nagar, Pragathi Nagar, Nizamabad","18.6653768","78.1066661","true"
"ChIJVRs2kufbzTsRPT7bve_URus","Bharath gas godown","M485+CV3, Sircilla - Nimmapalli - Sirikonda - Nizamabad Road, Vinayak Nagar, Nizamabad","18.6658349","78.1098633",""
"ChIJC1HkCSnbzTsRaNCdnpD211w","IndianOil","Ground Floor, Pulong Chowrasta,Gajulpet, Nizamabad","18.6678201","78.10327199999999","true"
"ChIJp1EHwsbFzTsRrTbXKkuKuvE","IndianOil","Survey No 270, beside Hotel Junction 65, Baswagarden Road, Vinayak Nagar Street, Nizamabad","18.666972","78.11336399999999","true"
"ChIJ9ZBIJvbFzTsRT-aRP7i-Nk0","IndianOil","Sy No 430, Chakarnpalli, A & 431/Aa, Nizamabad","18.623718","78.187086","true"
"ChIJGxqwEsTIzTsRS1_8u62RBHo","IndianOil - 7th BATTALION FILLING STATION","Dichpally","18.5948384","78.2186018","true"
"ChIJ5T4G56XFzTsRqZwMDQ5bBJc","IndianOil","Door No 4/105/6 Survey No 111, Dharmaram B, Bardipur","18.6557621","78.165322","true"
"ChIJmYqmdd3IzTsRYASTrcHhaDg","SARANG AUTOLINES BPCL BHARAT","BPCL PETROL PUMP, SURVEY NO. 449E DICHPALLI, Nizamabad","18.587881","78.22359999999999","true"
"ChIJP-a0e9nFzTsRifu-1txZKY0","RAGAVA Enterprises Bharat Petroleum & CNG","Nadipalli, Nadepalle","18.6246909","78.1870275","true"
"ChIJEe0DwL7FzTsRJaQTnLkRD9w","KABS AUTOLINES HPCL","Dichpally","18.63591659999999","78.1775729","true"
"ChIJNb8gHIPFzTsRV7LOxTFym3c","Hindustan Petroleum Corporation Limited","Survey No 741/2, 741/5, Dichpally - Nizamabad Road, Bardipur","18.6362076","78.17703","true"
"ChIJa6hf6bLIzTsRsX-YTcj1KbU","IndianOil","APSP Camp, Sy No 235 Nadipally, Dichpally, Nizamabad","18.6110833","78.2039444","true"
"ChIJ2XGf-wjFzTsRTQorfm4xmgM","Hindustan Petroleum Corporation Limited","Survey No 1367/2, Dichpally - Nizamabad Road, Bardipur","18.6536225","78.15248790000001","true"
"ChIJsfVfdJnFzTsREBhGPOa2KAQ","BRAHMA FILLING STATION","Nizamabad - Dichpally - opp:Eenadu, off, Hyderabad Road, Nizamabad","18.6536968","78.1494641","true"
"ChIJwZl42_XFzTsREbvsdbj9cvM","IndianOil","Sy No 1363, Bardipur","18.6536966","78.1490736","true"
"ChIJuVv45qXFzTsRkEukjw1QvO0","Indian Oil","India","18.6557055","78.1626706",""
"ChIJd5CtgQbGzTsR6jzoTvxtd_k","IndianOil","Survey No 652/A, Suddapalli","18.633186","78.207645","true"
"ChIJ5xZGWMPIzTsRWbACEmAuOrs","Hindustan Petroleum Corporation Limited","Survey No 452, NH 7, hoi, Dichpally","18.5912821","78.2202623","true"
"ChIJ8Ryxi-DIzTsRE6GshgJGcsk","IndianOil - Jagat Pran Service Station","Sy no:- 187, NH :- 44, Bibipur","18.5830677","78.2248238","true"
"ChIJqffXzozbzTsREb1Vdq3xhNg","Hindustan Petroleum Corporation Limited","Survey No, 158 to 160, Sarangapur, Nizamabad","18.7000293","78.0429025","true"
"ChIJExs5iZ_dzTsR9TdE_icUJcg","IndianOil","S No 17 & 156, Ananthagiri","18.707571","78.025854","true"
"ChIJlaZfnJDbzTsRspon0RiHaZY","Essar Petrol Pump","M3V3+5C2, Nizamabad","18.6928792","78.0535239",""
"ChIJj9phvXTZzTsR7frWUjVexO0","Modern Filling Station","MXVM+6R8, Bodhan - Nizamabad Road, M S C Form","18.69304499999999","77.984591","true"
"ChIJtzGbsvDZzTsRTXTmU43vOAY","IndianOil","Sy No 443, 1/B, Edapalli, Jamlam","18.6933913","77.9845046","true"
"ChIJ6TL_v5_bzTsRMjq8Rq1Ps3c","IndianOil","S No 202, Arsapalli, Ananthagiri","18.687108","78.063675","true"
"ChIJw4FAXrvbzTsRcMuuqbOD354","Go Gas station (Car LPG)","M3P8+M37, National Highway 63, District Jail, Sarangapur, Nizamabad","18.6866626","78.0651707","true"
"ChIJIUpjVHDbzTsRCqG9rnIqLXY","Hindustan Petroleum Corporation Limited","Survey No 915, Jannepally Road, Nizamabad","18.6982501","78.065544","true"
"ChIJJZTxRsvbzTsRp1eDpU1bTMc","Bharat Petroleum, Petrol Pump -Baba Fuel Pump","Bodhan Road, Auto Nagar, Arsapally, Nizamabad","18.6789015","78.0776017","true"
"ChIJwdcoIwDbzTsRE6-gFKiXZ2k","SIRI LAKSHMI FILLING STATION","P32C+V22, Jannepally Road, Nizamabad","18.7021329","78.0700134","true"
"ChIJgSCqnOHbzTsRUt1cRLpXrH4","BPCL Anikesh Laxmi Mohana Filling Station","Khanapur, Nizamabad","18.6882836","78.0778038","true"
"ChIJ98gMWqrbzTsRSqu1okDaQl0","Reliance Fuel Station","opp. Reliance Petrol Pump Fruits Markers, 2-2A, Mujahed Nagar, Nizamabad","18.6767909","78.0807346","true"
"ChIJlavLtzjbzTsRiv9mlQ48P8Q","IndianOil","Ground Floor, Bodhan Road, Nizamabad","18.6768439","78.0811561","true"
"ChIJz2OYWxfbzTsRTWCeJ3TUMNE","IndianOil","Ground Floor, Bodhan - Nizamabad Road, Malapally, Gajulpet, Nizamabad","18.6757069","78.0833313","true"
"ChIJoUw4ZLPZzTsRTdq4xM67wgk","Ms salik","MXR6+Q7, Brahammanpalle","18.6919857","77.96073679999999","false"
"ChIJy4DhSVTbzTsRjmdvruoQx1w","IndianOil","Ground Floor, Bodhan - Nizamabad Road, Gajulpet, Nizamabad","18.675762","78.084507","true"
"ChIJud7e9DLZzTsREfi0inn3Vmw","Hindustan Petroleum Corporation Limited","No 655A, A656, National Highway 63, Yedapally","18.676855","77.955575","true"
"ChIJGwIARh7bzTsRjthrjiXiS1A","Hindustan Petroleum Corporation Limited","Survey No 65, Karimnagar - Nizamabad Road, Shivar, Arsapally, Nizamabad","18.6880876","78.0821563","true"
"ChIJY9cXSADZzTsR9xI2cJKjBI0","IndianOil","SY No 565/4, Yedapally","18.7025701","77.9630801","true"
"ChIJjZ-NJwDZzTsRxQZKN_Jn0kE","Telangana police welfare society filling station,Yedapally","MXG4+P3J, Bodhan - Nizamabad Road, Nayaabad, Yedapally","18.6768886","77.9537113",""
"ChIJnwW4RP_bzTsR57NLNubzH5Y","IndianOil","Sy 107/2, Ptadwai, Nizamabad","18.6884649","78.0838067","true"
"ChIJQePwawDfzTsRp40ygbSXxI8","Indian oil","PXGP+CM4, Dupalle","18.7260074","77.9867127",""
"ChIJCeoyTjHbzTsRqzPwmxa_JGw","Sri Vijaya Narsimha Filling Station","H No 2, 68 Near Gunj, opp. Gunj Kamana Road, near Gunj, Nizamabad","18.6749824","78.095261",""
"ChIJAQAw0KTEzTsRYUIyiZfhnek","SHAM AUTOLINES BHARAT PETROL PUMP","National Highway 63, Mubaraknagar, Nizamabad","18.7019423","78.1260692","true"
"ChIJHS9jpyXbzTsRcWQqY8Y7RdI","B SAYA REDDY BPCL Bharat Petroleum Gas Station","M3FX+72R, beside Sayareddy Petrol Pump, RP Road, Khaleelwadi, Nizamabad","18.6732336","78.0975071","true"
"ChIJzW0j2I3bzTsR543UPpGErzA","P. LAXMIKANTHA RAO AND SONS","5-1-84, Weekly Bazar Road, Nizamabad","18.67285399999999","78.09780409999999",""
"ChIJa-Qf8WHbzTsRSxXpsTbbGFE","Hindustan Petroleum Corporation Limited","D No 5, 1/124, Weekly Bazar Road, Nizamabad","18.6728323","78.0978286","true"
"ChIJ9a4X4xHbzTsRXb1c2KWenOw","Hindustan Petroleum Corporation Limited","1B, 1C, D No 6/15/1495/1A, Gurbabadi Road, Nizamabad","18.6804536","78.09608089999999","true"
"ChIJHdT23PnbzTsRy7a4ch1Nyl0","Bharat Petroleum, Petrol Pump -K.Narasinga Rao","NIZAMABAD NR. BUS STN, Nizamabad","18.6769567","78.10123899999999","false"
"ChIJ2XqGLMrbzTsRlpXArADNvoU","Prakash Filling Station(INDIAN OIL PETROLPUMP)","Gurbabadi Road, DUBBA, Nizamabad","18.6859183","78.0977612","true"
"ChIJ62AAEgDbzTsRT8HUypJT9rY","Indian oil -Police welfare Society Filling station","M4H5+GCV, Kumar Gali, Nizamabad","18.678788","78.10846699999999","true"
"ChIJt_8kFBHbzTsRADTIfhwCTv0","K.R Sons PETROL filling station(Bharat Petroleum) Company Outlet-Nizamabad","beside railway Kaman, near Railway Under Bridge, opposite lawyer Rajender house, Plot no. 5-8-1 and 5-8-2, Karimnagar - Nizamabad Road, Nizamabad","18.6800649","78.1091817","true"
"ChIJz1AJKUHbzTsRRZHAaMIJeT4","IndianOil","Ground Floor, Dubbak - Kanteshwar Road, Khanapur, Nizamabad","18.690785","78.0932973","true"
"ChIJO3_3qUzbzTsRvothLz5nHik","S K Fuel Station","Darga, 6-6-132, Near Hamalwadi, Subhash Nagar, Nizamabad","18.6852564","78.106595",""
"ChIJWY3BLSTbzTsRZiutCZvDxNA","IndianOil","Survey No 234/2, Survey No 382, Gurubabadi,Gajulpet, near Dubbak - Kanteshwar Road, Old, Nizamabad","18.68606","78.10710399999999","true"
"ChIJfwPCmUbbzTsRaCql2bcwR5Y","Bharat Petroleum","India","18.6929005","78.09540840000001",""
"ChIJmdRRyCPbzTsRNnDp_OTISPE","Hindustan Petroleum Corporation Limited","Cross Road, Survey No 276, Nizamabad Bypass, Khanapur, Nizamabad","18.6939773","78.0954277","true"
"ChIJCaKw1OnFzTsR0-sDK8aT-Ns","Mm Traders","Mm Traders, Byapass Road, Nizamabad","18.69057159999999","78.11791699999999",""
"ChIJ5YFKHQDFzTsRNoHhFAaSbwU","Navodaya service station","M4Q9+MPQ, By-pass Road, Nizamabad","18.6892228","78.11935729999999",""
"ChIJl4x4_5LFzTsRnOkZ2oUPOIY","Ratna Filling Station","Dubbak - Kanteshwar Road, Gopanpally, Nizamabad","18.686265","78.12246069999999",""
"ChIJsxErs3fFzTsRsjAIUMbw0N4","Hindustan Petroleum Corporation Limited","Survey No 402A & 403A, Karimnagar - Nizamabad Road, Gopanpally, Nizamabad","18.682066","78.125541","true"
"ChIJkfiWOgDFzTsRNr2kvJ219DA","RAGAVA ENTERPRISES","M4JG+RFV, Bypass Road, Goopanpally, Kanteshwar, Hyderabad","18.6821202","78.12616480000001",""
"ChIJc6JvsQTFzTsRHPlVWXEW8Lo","SMART FUEL STATION","Kanteshwar, Bypass Road, Goopanpally, Hyderabad","18.6821202","78.12616480000001","true"
"ChIJP-6B5LnEzTsRvBTYBhaZLhI","LPG Gas Station","M4VF+Q23, National Highway 16, Maruti Nagar, Nizamabad","18.6943842","78.1225377","true"
"ChIJZVLs9rnEzTsRj6R4tFNUiBY","IndianOil","Lock No 12018, Gajulpet, Nizamabad","18.695199","78.12311299999999","true"
"ChIJLZVLHbrEzTsRIccPStg17tQ","Hindustan Petroleum Corporation Limited","Survey No 294, NH 63, Armoor Road, Nizamabad","18.6954292","78.1229321","true"
"ChIJY-hT_zzFzTsRdQIu9fVAfas","Bhumanna Kisan Seva Kendra","3-60/3, Mubaraknagar, Nizamabad","18.7057767","78.1257413","false"
"ChIJF_f-grrFzTsRNmgtZ4wYE9E","IndianOil","Survey No 954/E, Makloor","18.6980542","78.1557649","true"
"ChIJ2RG9Oi7DzTsRoiBTa2CyKcE","Hindustan Petroleum Corporation Limited","Survey No 533/2, NH 63, Borgaon (Kalan)","18.717857","78.135504","true"
"ChIJezop42TDzTsRntz1vb628KQ","IndianOil","Ground Floor, Das Nagar, Makloor","18.7227532","78.1429445","true"
"ChIJDx2eKWzGzTsRBl0A9Jq44Yc","Hindustan Petroleum Corporation Limited","Survey No 567/Ru, Hyderabad Nagpur Road NH 44, Dichpalle, Mentrajpalle","18.6539604","78.2168724","true"
"ChIJ7wvIQTHDzTsRinJFLx2Vke0","Sanvy Fuels","S.no.4, Das Nagar, 5/22, maaklur Road, Nizamabad","18.727507","78.14044179999999","true"
"ChIJb2zU1gjHzTsRrCtd6Ribpu0","Hindustan Petroleum Corporation Limited","Survey No 282/A, Hyderabad Nagpur Road, NH 44, Jakranpally Secundrapur, Nizamabad","18.6775783","78.2339646","true"
"ChIJT4Ke-HnezTsR8bvVMQhl3fQ","IndianOil","Ground Floor, Navipet, Abhangapatnam","18.7638127","78.0138147","true"
"ChIJxZh_VADdzTsRWONn--2zhD0","Srilaxmi Srinivasa Filling Station","Main Road, Abhangapatnam","18.7476772","78.0273465","true"
"ChIJSUHzfFvfzTsR26vQHZztQ1c","Bharat Petroleum Petrol Pump , VIJAYA LAXMI FUEL STATION","SY NO 36/EE ,DARIYAPUR,NAVIPETSY NO 36/EE ,DARIYAPUR, Navipet","18.765531","78.01317600000002","true"
"ChIJKYXT5lTfzTsRXoM-rNvJnhg","Hindustan Petroleum Corporation Limited","Sy No 686, near TSRTC Bus Depot, Navipet","18.7701631","78.01523569999999","true"
"ChIJITXnNg_fzTsRo8cHfCMVrpU","Hindustan Petroleum Corporation Limited","Survey No 18/A, Nandipet Road, Navipet","18.777045","78.016239","true"
"ChIJm4lM2hPfzTsRFkz-3b2fXjc","SAROJINAMMA FILLING STATION","H.no.381, Fakeerabad Navipet Mandal, Nizamabad","18.7772613","78.0162465",""
"ChIJtwHVrADfzTsRfcie9aCoClU","Hindustan Petroleum Corporation Limited","Survey No 837, AAP/1, Basara Road, Navipet","18.7821148","78.0123373","true"
"ChIJn8q2ahzfzTsRuikFWPPSf6k","Banjara's HP Petrol Pump","near Ayyapa Temple, Basara Road, Navipet","18.7858867","78.0097833","true"
"ChIJ3Z7aBSTfzTsR5fIJxD6U55E","Sai Krupa Filling Station","near Ayyapa Temple, Basara Road, Navipet","18.7864134","78.0095889","true"
"ChIJ1UpPEqvfzTsR-0JIV326t28","NAYARA ENERGY- MADHAVRAO VITHOBA PATIL PETROL PUMP","32/3, 34/A, Basara Road, Dharmabad","18.788223","78.00735689999999","true"
"ChIJxf7MmXrfzTsRxZER0GET2pE","IndianOil","H No 11, 1/1929, 1 Kanteshwar, Gangastan, Navipet","18.7886086","78.0072979","true"
"ChIJKchB6RzdzTsRdPRLJi5nGZU","IndianOil","Ground Floor, Kondoor, Nizamabad","18.7452069","78.083575","true"
"ChIJmaXOoBXDzTsRV0rH6ELmoik","S.K.A &SONS","Q427+2CP, Makloor","18.7500987","78.1135678",""
"ChIJw7JLHTDDzTsRIhpoYK5KMU4","Bharat Petroleum","P4XC+4J2, maaklur Road, Makloor","18.7477506","78.1215063",""
"ChIJl7K6ozrDzTsR0RHnrCghaQ8","Hindustan Petroleum Corporation Limited","Survey No 1120, Nandipet Road, Makloor","18.74641609999999","78.1227605","true"
"ChIJi8ANguvCzTsR9kC7dNu4mz4","IndianOil","Sy No 733/Aa, Kanteshwar, Nizamabad","18.7809901","78.13892799999999","true"
"ChIJU4WTWBXDzTsRf-Ifq3SlWTo","MYRA FUEL STATION","near Ambedhkar Statue, 3-48/3,kalladi, near Ambedhkar Statue, Alur","18.7919933","78.17781339999999",""