place_id,name,address,latitude,longitude,open_now
"ChIJNQhxTek-CTkRLo6ANIVBnQ0","IndianOil","Haridwar Road, Shyampur, Rishikesh","30.0594001","78.229872","true"
"ChIJifyym_g9CTkRk1H_9nynifw","IndianOil","near NDS School, Ground Floor NH 58, Haridwar, near NDS School, Road, Shyampur, Rishikesh","30.0632186","78.2394286","true"
"ChIJH6qSRs8_CTkRtuIWYMQdYOs","Hindustan Petroleum Corporation Limited","Khasra No 420KA, Rishikesh, Parwadoon, Khata No, 00187, Khandraiwala","30.0270723","78.2054596","true"
"ChIJZ_xDFAA_CTkRfSNnlwJYkFQ","PETROL PUMP HPCL","26C7+VV8, Raiwala","30.02217450000001","78.2146922",""
"ChIJn1nggvo5CTkRGth817vzni0","Bharat Petroleum, Petrol Pump -M.J.Fuels","HARIPUR KALAN,RISHIKESH RO, DEHRADUN","30.000278","78.189816","true"
"ChIJj7qN2C4_CTkRTiYXuQ5qVCQ","Bharat Petroleum Pump","Ambala-Dehradun-Haridwar Road, Raiwala","30.0350328","78.21056709999999",""
"ChIJsQsiDQBHCTkRcmCEqb1o1vo","Haridwar cng pump","Dudadhari Chowk, Peepalwali Gali, Motichur, Haridwar","29.980423","78.183376",""
"ChIJjd5stXNHCTkRzehD4AGnWwY","KN Filling Station BPCL PETROL DIESEL CNG","X5HJ+RMQ, Bhoopatwala, Motichur Range","29.9795576","78.18193389999999","true"
"ChIJd6D_pOY_CTkRfhq45qzAxGI","Hindustan Petroleum Corporation Limited","Ground Floor Dwar, opposite 213 KM Stones, Rishikesh Road, Shyampur, Rishikesh","30.0576837","78.22639989999999","true"
"ChIJIyqYCOk-CTkRLZkhNRIYWHs","Airwing Petrol Cng Pump","58, National Highway, Khairi Kalaa, Namberdar Farm, Rishikesh","30.0580381","78.2278245","true"
"ChIJ94_ZHAA_CTkRn1B9QpamgbU","UMA Gas Service LPG Godown","26VW+XP5, Chopda Farm, Khadri Khadakmaf, Kharakmaf","30.0448976","78.2468669",""
"ChIJ-3ahglY5CTkRIi7DCDng4RE","IndianOil","Ground Floor, NH 72, Rishikesh","30.073251","78.20167099999999","true"
"ChIJraS83lA5CTkR7WSbPXDzAI0","IndianOil","Ground Floor, NH 72, Rishikesh","30.078959","78.19321599999999","true"
"ChIJW2H--u8_CTkRJEPayzY1EWU","Hindustan Petroleum Corporation Limited","No 197/3, Khasra, Gumaniwala, Dehradun","30.07114099999999","78.2449887","true"
"ChIJLZtKXPU_CTkRFp9cLhDwbbM","Sanjeev Fuels HP Petrol Pump","36CW+C9Q Rishikesh Road Malviya Nagar, Virbhadra, Gumaniwala, Rishikesh","30.0710905","78.2459958",""
"ChIJuUDRod0VCTkR7t4PB9cwO1Q","Neelganga Fuels (Indian Oil)","Neelkanth Bend, Yamkeshwar Road, Pipalkoti","30.0709512","78.35567929999999",""
"ChIJzYjmQv06CTkRgoxiOO713Iw","IndianOil","Ground Floor, Mazri Grant","30.138001","78.155486","true"
"ChIJG6K4NMM7CTkR570YHLr2NV8","MAJRI GRANT","near Fun Valley, Laal Tappad","30.13409","78.1651098","true"
"ChIJOWlxOs4_CTkRS2zlW1p44Rg","Aakash Ganga Energy Station","124 EKTA VIHAR , KALE KE DHAL, HARIDWAR, ROAD, Rishikesh","30.09160459999999","78.2759507","true"
"ChIJJzpSVJJHCTkR7YPk4u4aZsc","IndianOil","No 124, Kale Ki Dhal, Kh No 279/3/2, Rishikesh Road, Rishikesh","30.0913207","78.27602759999999","true"
"ChIJAclnRxsWCTkRppfnkk0QS0w","IndianOil","Ground Floor, Laxman Jhoola, Dehradun","30.1077001","78.30030099999999","true"
"ChIJn36dAvM9CTkRClNIvX3Qy-Y","IndianOil","Ground Floor, Bypass Road, Rishikesh","30.11430009999999","78.284202","true"
"ChIJh1lNAB4WCTkRi6hD1-6T07g","IndianOil","Ground Floor, 105, Dehradun Road, Manvendera Nagar, Rishikesh","30.1121032","78.2935246","true"
"ChIJRcu1Sek9CTkRiTRWep9Ed4o","IndianOil","Ground Floor, 355, Haridwar Road, Palika Nagar, Rishikesh","30.1022001","78.292708","true"
"ChIJcWKQ2do9CTkRenplvwncivM","IndianOil","Ground Floor, Bsnl Colony, Rishikesh","30.1157","78.283557","true"
"ChIJ4xH6T1UXCTkR5vd6-G0ZS9s","Hindustan Petroleum Corporation Limited","Ground Floor, Dehradun-Rishikesh Road, Rishikesh","30.110418","78.2947372","true"
"ChIJAUmrg289CTkR6AY09ZZ660Y","Bharat Petroleum Petrol Pump , BIRENDRADUTT HARIRAM","Rishikesh - Chamba - Tehri Road","30.116165","78.285808","true"
"ChIJw1TNv-UXCTkRlm2r6ucSDk4","Bharat Petroleum, Petrol Pump -Birendradutt Hariram","near icici bank, 66, Laxman Jhoola, Rishikesh","30.1074601","78.2997176","true"
"ChIJOyOuJBsWCTkRxi--ospbw8A","British Petroleum","India","30.1078845","78.30102720000001",""
"ChIJMe4PzP0XCTkRdx1Vq-IFa3s","Reliance Petroleum","G NEW SITUATED, AT VILLAGE DHALWAL, M/S STAR PETROLIUM,GANGA VIHAR , UT KHASRA NO. 1/13 (OLD) 476, K) & 477, Haridwar Road, Rishikesh","30.1203253","78.28952629999999","true"
"ChIJSWK8XhoWCTkRlDqr6KPgC2g","Hindustan Petroleum Corporation Limited","Ground Floor, Laxman Jhoola, Rishikesh","30.111703","78.3029701","true"
"ChIJNSu8JBoWCTkR-SToJt86s74","IndianOil","Ground Floor, Laxman Jhoola, Adarsh Gram, Rishikesh","30.1121001","78.30279999999999","true"
"ChIJ4eynPRoWCTkRcYBGd-A1fpQ","HP Fuel Station","NH-58, Haridwar Road, Chandereshwar Nagar, Chandreshwar Nagar, Rishikesh","30.11185009999999","78.3031141",""
"ChIJlc1oIxoWCTkRnu1kuKSAkos","Hindustan Petroleum Corporation Limited","Ground Floor, Laxman Jhoola, Rishikesh","30.1124601","78.302601","true"
"ChIJlx3ySDsXCTkRN02yWgIPyq0","IndianOil","Ground Floor, Muni Ki Reti, Bachhelikhal","30.125948","78.316208","true"
"ChIJxylVQzMRCTkRBZ26GLFPhas","IndianOil","Ground Floor Bawani Shivpuri,NH 58, Narendra Nagar, Bachhelikhal","30.1323294","78.38518450000001","true"
"ChIJ4xc7zeA6CTkRGrUAwrP6j-U","IndianOil","near Fun Valley, Ground Floor Majri Grant, near Fun Valley, Dehradun","30.148233","78.150848","true"
"ChIJByf8WSQ9CTkReACyK7RPosw","IndianOil","Ground Floor, SH 24, Rishikesh Road, Ranipokhari","30.177272","78.216545","true"
"ChIJuT-E7FcjCTkRGNVWTCy5wG4","IndianOil","Ground Floor, Ranipokhari","30.18800809999999","78.2033019","true"
"ChIJSX_GcLgkCTkRwnQwJ8FRzH0","Hindustan Petroleum Corporation Limited","Ground Floor, near Jolly Grant, Rishikesh Road, Airport, Athhoorwala","30.1859084","78.1742794","true"
"ChIJ9QmQjPc9CTkRP3PpbFbFkiQ","Hotel Mantra - Best hill view hotel in Rishikesh, couple friendly hotel in Rishikesh, hotel near Jollygrant Airport","Rishikesh Dehradun road Barkot Mafi, Ranipokhari, Rishikesh","30.1764962","78.23350470000001",""
"ChIJ9Yn1t4I9CTkRx4LvJ5W4heM","NAYARA PETROL PUMP Barkot Mafi Dandi","Dehradun Road, Mauja, badkot mafi","30.1761628","78.23391","true"
"ChIJnWk8YKElCTkRO0KUXbyut8k","Reliance jio bp petrol pump","55M8+XWW, Rishikesh Road, Sangatiya Walakhur","30.1849118","78.16769479999999","true"
"ChIJmwAxKqslCTkRuXz2Rkg-fuI","Hindustan Petroleum Corporation Limited","Khata No 288, Khasra No 242, near Eletricity Board Office, Doiwala, Resham Majri Grant","30.148306","78.149444","true"
"ChIJV7A1qto6CTkRzWqIfgXQ5qw","IndianOil","Ground Floor, Haridwa, Jeevan Wala","30.160828","78.145282","true"
"ChIJ-wPBQEUlCTkRhz0Rcgvcsuk","IndianOil","Ground Floor, Rishikesh Road, Jolly Grant, Dehradun","30.203185","78.1993392","true"
"ChIJBz3Snss7CTkRszgEe14hNmE","IndianOil","Ground Floor, Rishikesh Road, Bhania Wala","30.1872345","78.15179429999999","true"
"ChIJixtNJoslCTkRY5TzYTU3dSI","Hindustan Petroleum Corporation Limited","Ground Floor, Chowk, Doiwala","30.18206170000001","78.14044919999999","true"
"ChIJ4xCWqDclCTkRAlrn5LZlalw","IndianOil","Ground Floor, Bhania Wala","30.1807168","78.1367454","true"
"ChIJbxtcUZ4lCTkRYXW3vFXaxfg","Hindustan Petroleum Corporation Limited","Ground Floor, Haridwar, Rishikesh Road, Doiwala","30.17589","78.127449","true"
"ChIJk4xdxYIlCTkR5Z3CbslJ6_U","Hindustan Petroleum Corporation Limited","Khasra No, 226 & 227/1, Markham Grant","30.171741","78.117661","true"
"ChIJYYz7pjolCTkRV_DTDbadI7Q","Hindustan Petroleum Corporation Limited","Khasra No, 693 & 694, Pargana Pachwa Doon, Ramnagar Danda","30.228745","78.199873","true"
"ChIJs8dihk4YCTkRFFfsbDlivqg","Hindustan Petroleum Corporation Limited","Ground Floor, near Km Stone 31, NH 94, Narendranagar, Agrakhal","30.208901","78.325301","true"