place_id,name,address,latitude,longitude,open_now
"ChIJ9Y7FdgRG5DkRuePrfh_V-qQ","IndianOil","Ground Floor, Siliguri","26.7005001","88.32930010000001","true"
"ChIJgbMwnolG5DkRko6Prmco6gU","IndianOil","Ground Floor, Medical More Kadamtala, Matigara","26.7097001","88.36510009999999","true"
"ChIJaQFUQalI5DkRQcrVK73T-p4","Hindustan Petroleum Corporation Limited","Ground Floor, Bagdogra","26.699373","88.320278","true"
"ChIJOYbHWjFE5DkRnhFLohlUQm0","IndianOil","Ground Floor Gosaipur, Rangapani, Ranidanga","26.6763153","88.36814269999999","true"
"ChIJV4W4yvdE5DkRyCH0XQpK_8o","Hindustan Petroleum Corporation Limited","Darjeeling, Ground Floor Lichupokhri, Phansidewa","26.644743","88.374811","true"
"ChIJu5zCDHJG5DkRKl8-RyTnO8o","Bharat Petroleum - Tirupati Service Station","P83W+MRP, Rupsing","26.7042112","88.3470796",""
"ChIJce9cRNFF5DkRau4JvfgVKUE","Bharat Petroleum, Petrol Pump -Kawakhali Fuel Centre","KAWAKHALI ROAD, SILIGURI, DARJEELING","26.692494","88.37776559999999","true"
"ChIJnd3UC2Fb5DkR89x5eVbJyqc","KSHIROD Filling Station","Fulbari Ghoshpukur Bypass Road, Dhamnagachh","26.59605159999999","88.3526014","true"
"ChIJy92ReBxF5DkR5B2HoNI5VT8","IndianOil","Ground Floor Dhamnagach, Nh 31d, Bandar Gachh","26.5954068","88.35229269999999","true"
"ChIJ95uydfhF5DkR2jsXMwduN0U","IndianOil","Ground Floor, Kawakhali, Sushruta Nagar, Matigara","26.6874081","88.39174799999999","true"
"ChIJ5yy4l-ND5DkRKMXm65NLwng","Hindustan Petroleum Corporation Limited","Ground Floor, Jalpaiguri Road, Siliguri","26.688994","88.414219","true"
"ChIJsYZ_qOFC5DkR6_6zGeRBDTA","IndianOil","Ground Floor SH 12A, Jatiakali, Fulbari, Jalpaiguri","26.6272001","88.4424001","true"
"ChIJEw3oBcJG5DkRnoWUu6oOkm4","Bharat Petroleum","P9FM+82G, Matigara","26.7233156","88.38258850000001","true"
"ChIJf_RVUh5C5DkRL_CcOSFM7OM","IndianOil","Ground Floor, Baribhasa,Desbandhupara, Siliguri","26.6916001","88.4624001","true"
"ChIJn9DaCTxB5DkR5-NbNo7mIZ0","Bharat Petroleum","PCF8+MF4, Hill Cart Road, Ward 1, Patiram Jote, Siliguri","26.7241469","88.4161878","true"
"ChIJq99vmTtB5DkRNlsN5SfVvMY","IndianOil","Ground Floor, Hill Cart Road, Siliguri","26.72550099999999","88.415199","true"
"ChIJVTQeulIV-TkRY2EtMUdtvEY","IndianOil","Ground Floor, Fulbari Toll Gate, Hat, Fulbari","26.6571983","88.4150981","true"
"ChIJTZtSUxVD5DkRnK2UbWLQD30","Indian Oil","beside PNB and SBI branch, NH-31D, beside PNB and SBI branch, haat, Fulbari","26.6502001","88.4178001","true"
"ChIJXaa7ZspD5DkRcC8gPAnDOGA","Bharat Petroleum, Petrol Pump -Siliguri Service Stn.","Tinbatti More, Siliguri","26.686733","88.41616069999999","true"
"ChIJAYznB9BD5DkRpN1o0sStx0U","Goenka Bharat Petroleum Petrol Pump","JCPJ+R78, Binnaguri","26.6370266","88.4306878","true"
"ChIJTTkxqWZB5DkRJ_oHHrco9_A","Auto Pump","155/5 Sree Maa Sarani, Dist, Babupara, Siliguri","26.6978762","88.4247467",""
"ChIJ397WHx5D5DkRhv8gY_27dD0","bp","India","26.6278173","88.4403732",""
"ChIJaV1dZEpD5DkRqEtRK4Hv2CU","Reliance JIOBP Petrol Pump Siliguri Fulbari","Hat, Fulbari","26.628011","88.4408598","true"
"ChIJv1lYWVtB5DkR-WVwa8LmvrU","Hindustan Petroleum Corporation Limited","Ground Floor, Burdwan Road, Siliguri","26.703997","88.415922","true"
"ChIJi6xTSRlH5DkRG_NWR7_bDJo","IndianOil","Ground Floor Darjeeling, Matigara","26.712204","88.40212299999999","true"
"ChIJNSdAorZG5DkRosedsz0gKcU","BHARAT PETROLEUM","India","26.712545","88.3963687",""
"ChIJxfkmNjNb5DkRo06bC33K1cQ","Essar Petrol Diesel Pump","H9XG+9CQ, Guabari","26.5984558","88.3761213","true"
"ChIJVe7PWSBb5DkRjlJltpek8LY","Dukan India (Mamtaj)","H9WF+FVX, Guabari","26.5969626","88.375556",""
"ChIJn0lnUg9D5DkRwW3DRUpo_EA","Bharat Petroleum Petrol Pump , BHARAT FUEL CENTRE","ASIGARHEASTERN BY PASS","26.677048","88.46292900000002","true"
"ChIJARV5aIlC5DkRsu0DnDn3dOY","Bharat Petroleum","JFV8+43Q, Balaram Road, Binnaguri","26.6428273","88.4652297",""
"ChIJIRobHEND5DkR-YAQCLb-6Uo","BALARAM SERVICE STATION","Balaram hat, Sahudangi to Gandar more, Bhutkir hat) Road, Mauza, Binnaguri","26.6421649","88.4653301","true"
"ChIJsdX5UwBB5DkRInIoU-ub6ow","Bharat Petroleum","14a, Burdwan Road, Ward 6, Pradip Nagar, Siliguri","26.7176349","88.4208132","true"
"ChIJJ19i_j9B5DkROuRoi-zNg-4","IndianOil","Ground Floor, Hill Cart Road, Siliguri","26.718042","88.42075299999999","true"
"ChIJX3zFSR1H5DkRkV9pGbwwkXE","IndianOil","Ground Floor, Paribahan Nagar, Matigara","26.7229299","88.38834469999999","true"
"ChIJTXPPOTlH5DkRz7_7i9UicHw","IndianOil","Ground Floor, Matigara","26.7224001","88.38170009999999","true"
"ChIJkYtZOABH5DkRLYoi3mbD9d0","Nikita","P9CJ+WCF, Matigara","26.7223104","88.38103629999999",""
"ChIJE7zDohRB5DkRNudFHjzkSQs","STARLEAK INFRASTRUCTURE PRIVATE LIMITED","Pramod Nagar Ward, 42, सेवोक रोड, Bhaktinagar, सिलीगुड़ी","26.7187297","88.42530490000001","true"
"ChIJUxYkmBRB5DkRG4RPTjBCuRs","Hindustan Petroleum Corporation Limited","35, Sevoke Road, Siliguri","26.71893099999999","88.425277","true"
"ChIJLw746PJD5DkRf5RQgAK31IU","IndianOil","Ground Floor Gandarmore, Bhakti Nagar, Nawapara","26.664155","88.471871","true"
"ChIJpS21UAxC5DkRHs1J0IL7-3k","HP Petrol Pump - M/s Agnik Fuel Centre","Bhutki Road And Ambari Road Junction, Sahudangi","26.6738264","88.4727066","true"
"ChIJG55T4PRB5DkReOMeEMmwHX8","Hindustan Petroleum Corporation Limited","Ground Floor, Sahudangi Thakurnagar, near Jaleswari Market, Eastern Bypass, Shanti Nagar, Darjeeling","26.6973022","88.4611202","true"
"ChIJByAMME1B5DkRHgOrIuImCYY","Indranil Saha","e b rd, Eastern Bypass, Shanti Nagar, Dabgram","26.6975743","88.4610112",""
"ChIJZ0-P00JD5DkRQuVLUQfVbxU","Hindustan Petroleum Corporation Limited","Ground Floor, Bhutkihat Junction, near Ambari, Bhutkihat Road, Sahudangirhat, Jalpaiguri","26.6737241","88.47326609999999","true"
"ChIJpz5NGUlo5DkRZf85d3Tl0pg","IndianOil","Jalpaiguri, Ground Floor, Ambari Falakata Bhaktinagar, Kamarvita, Bhutkidangapara","26.63899430000001","88.5009864","true"
"ChIJ_wQW_wJo5DkRAoXUQEG9kUU","Hindustan Petroleum Corporation Limited","Ground Floor, Bhutkir Hat, Bhaktinagar, Rajganj","26.6059008","88.4850026","true"
"ChIJ80VwLA5D5DkRSWKq7wCmtcs","Hindustan Petroleum Corporation Limited","Ground Floor, Jugibhita, National Highway 27, Gandermore, Rajganj, Bhutkir Hat, Jalpaiguri","26.62222599999999","88.46655009999999","true"
"ChIJX4T5QUlp5DkRx2qIgxW67ik","IndianOil","Jalpaiguri, Ground Floor, Ambari Falakata Bhaktinagar, Kamarvita, Bhutkidangapara","26.63899430000001","88.5009864","true"
"ChIJr6N7TWRB5DkRV9duH_qfIAY","MAHANTA SHOP","near Adarsh Pally Bazar, Farabari Road, Adarshpally Bazar, Siliguri","26.7015404","88.4755752",""
"ChIJAaZp-gJo5DkRKmLH4fa-ZJk","IndianOil","Ground Floor, Sitaguri, Njp, Mohan Vita, Bhutkidangapara","26.6088362","88.482096","true"
"ChIJJ1dR1B5p5DkRtww8VixV7L8","Niranjan lal service station","opposite annapurna dhaba, N.H 27, sitaguri, Siliguri","26.60852539999999","88.4814823",""
"ChIJWwn0mI9B5DkRLJ27TMiyPPI","IndianOil","Ground Floor, Niranjan Nagar, near Ashighar More, Ghogomali, Darjeeling","26.7140152","88.456916","true"
"ChIJey3BdA1p5DkRokE63WxMuV4","Common Services Center ( CSC ) Jaldumur Para Road","PF85+Q9P, Shikha Road, Ghogomali, Siliguri","26.7169613","88.4584514","true"
"ChIJyaDSegBn5DkRFsddoE9bV9Y","NIRANJAN LAL SERVICE STATION","HFXV+MM4, Ambari Falakata","26.599141","88.4942049",""
"ChIJY666MwBB5DkRc1I_r6CSrN4","Vobesh petrol pump to ashighor more","PFF6+359, Ghogomali, Siliguri","26.722364","88.460415",""
"ChIJwfikVEFp5DkRRGnnOjM40XM","Bharat Petroleum","MGGR+PP4, Gajol Doba Road, Shikarpur","26.676763","88.5418333",""
"ChIJu-2k6lJG5DkRWxLNjkZwdNQ","GANPATI SQUARE FUEL CENTRE","Khaprail Road, Siliguri","26.7384876","88.3540986","true"
"ChIJ5ekqQgpH5DkRavDfGckvWbU","IndianOil","Ground Floor Panchkulguri, Nimai, Darjeeling, Matigara, Siliguri","26.746892","88.348987","true"
"ChIJ-_3xdLxH5DkRz-54lClb2qU","IndianOil","Ground Floor, Khaprail More Patharghata, Matigara","26.7365234","88.3561241","true"
"ChIJj9vx-hpH5DkR292nTBtEO4M","Bharat Petroleum, Petrol Pump -Sharda Auto Care","MALLAGURI, DARJEELING","26.7363737","88.3572198","true"
"ChIJdVQQPyhH5DkRBxK5UODocsg","Bharat petrol pump","Panchakulguri","26.7513777","88.34778879999999",""
"ChIJlQcKYXxH5DkRy8Qo9rsxa9c","Bharat Petroleum, Petrol Pump -Hill View Fuels","SUKNA, DARJEELING","26.77017039999999","88.378371","true"
"ChIJo0nslpNH5DkREeL2MrHFJeI","HP Gas Agency & Courier service,CSC Center, Aadhar Update Centre","Q99H+WM5, Hill Cart Road, Panchanai","26.7697654","88.3792321",""
"ChIJIytgbx9H5DkRuyWS6z-voPk","IndianOil","Ground Floor, Pradhan Nagar Pancha Nadi, Darjeeling, Dagapur, Siliguri","26.7474001","88.39550009999999","true"
"ChIJuW0yTaZH5DkRd27pluata38","Safe Rides","SIT,Petrol Pump, Methibari, Siliguri","26.7836781","88.3685939",""
"ChIJLyig6iZB5DkR5AxHNVSCaC0","Bharat Petroleum","Ward 46","26.7365329","88.4148982","true"
"ChIJiRqEQiVB5DkR3vOo_Dc92eg","Hindustan Petroleum Corporation Limited","Ground Floor, Hill Cart Road, Pradhan Nagar, Siliguri","26.730411","88.412268","true"
"ChIJv5LQ7Z5B5DkRtxmPH7k6QM4","PETROL PUMP","PCM6+6VH, Temple Road Mallaguri, Pradhan Nagar, Siliguri","26.7330605","88.41223409999999",""
"ChIJ6fcqDABB5DkRWu6ZLq8aprM","East India Service Station, Mallaguri","PCM7+JHQ, Pradhan Nagar, Siliguri","26.7340788","88.4139847",""
"ChIJgSOvRQVB5DkRHLZZoPABS3w","DDTS Petrol Pump","PCJJ+3H7, Sevoke Road, Ward Number 13, Bankim Nagar, Siliguri","26.7301749","88.4314339","true"
"ChIJDzMuzFJB5DkRHyOBv3fopTI","IndianOil","Sevoke Road, Bankim Nagar, Siliguri","26.730711","88.43191100000001","true"
"ChIJ_c_4eMFA5DkRk6-oFP183OQ","IndianOil","Ground Floor, Debidanga, Champasari, Darjeeling","26.7591948","88.4185031","true"
"ChIJDdZbZeJB5DkRdE4yb0wQQBs","Bharat Petroleum, Petrol Pump -Sagar Service Stn.","Sevoke Road, Ektiasal, Siliguri","26.7420844","88.436103","true"
"ChIJBwf1TgBB5DkRmKdKmtRMTiw","Sawaria service station (petrol pump)","Himalayan Kanya Abasan, Ward 42, Don Bosco Colony, Siliguri","26.7523336","88.4435728","true"
"ChIJWfO2j1hA5DkRSj5JR5mQh7w","Bharat Petroleum, Petrol Pump -Sona Petrol Pump","Salugara, Siliguri","26.756509","88.44097959999999","true"
"ChIJYTIifgBB5DkRlabrTNKseVc","Indian Oil Petrol Pump","PFH2+VQ8, Ward 40, Haidar Para, Siliguri","26.7297663","88.45173330000001",""
"ChIJn5tzDABB5DkRIR5k_ur4CF8","KARMAKAR FUEL STATION","near ektiasal more, Iskcon Road, Siliguri","26.7297436","88.45173650000001",""
"ChIJW-YB37hB5DkR7EpckRKVI1A","IndianOil","Ground Floor, Eastern Bypass, Baikunthpur","26.7413069","88.4545739","true"
"ChIJKegGF_hA5DkR8dglrfI3HIU","IndianOil","3rd Mile, Sevoke Road, Salugara, Siliguri","26.76778719999999","88.44563099999999","true"
"ChIJBSV3goA45DkRu3qTY1uTm04","IndianOil","Ground Floor, Sukna","26.7907025","88.3630063","true"
"ChIJfzLJQgA55DkRQ0qaXk_Fam0","Indian Oil Petrol Pump","Q9R7+84R, near At, Main Road, Sukna","26.7908159","88.3627776",""
"ChIJrdHHUQBB5DkRI3pOFYmXIN0","Indian Oil","2nd Mile, Vega Circle Mall Ground Floor, beside Spencers, Sevoke Road, Nimbu Basti, Siliguri","26.7519447","88.43935689999999",""
"ChIJ0dHjtqM35DkR9xnesmQLVIs","IndianOil","Jamdar, Ground Floor Panighata Dudhia, Road, Vitta","26.811601","88.2469701","true"