place_id,name,address,latitude,longitude
"ChIJya61_P59mjkREkmhWAAHR40","Hindustan Petroleum Corporation Limited","Ground Floor, Civil Lines 1, Infront of District Industries Office, Sultanpur","26.26804139999999","82.07973199999999"
"ChIJTyLX5DB9mjkRiy4o6EaH7LQ","Ram Pyare Shukla","621, PWD Office Road Civil Line, 1 Ishi, Dayanand nagar, Sultanpur","26.2665294","82.08012579999999"
"ChIJnctRFwB7mjkR0NZzyYgRuvo","Power house Faridipur","8439+V42, Chandpur Saido Patti","26.3046444","82.1177605"
"ChIJR7KWCO58mjkRpW2Rg7L0xqQ","Hindustan Petroleum Corporation Limited","Ground Floor, Civil Lines, near Bus Depot, Sultanpur","26.2649266","82.0802635"
"ChIJfYNTja9-mjkR5shRq5nDe4M","Hindustan Petroleum Corporation Limited","Ground Floor Dandia Nagar to Gosaiganj Road, Itkauli","26.286482","82.137051"
"ChIJibHVEfJ8mjkRLQHMYRL20sc","Gomati Petrol Tanki","738F+GJP, Faizabad - Sultanpur Road, Badhaiyabeer, Civil Line, Sultanpur","26.2663445","82.0740885"
"ChIJ8UITwDN9mjkRoLdDPDIH2fM","IndianOil","Ground Floor, near Bus Stand, Civil Line, Bhadaiya","26.266202","82.07369249999999"
"ChIJVVSzu2h9mjkRncH4_G8tRLs","BABA FUELS","Pyare Patti Road, Sultanpur","26.2559753","82.0801898"
"ChIJU-HiJYV9mjkRL2aCw4OGUts","Petrol Pump (2024)","734J+92, Sultanpur","26.2559242","82.0800738"
"ChIJib1l9JR7mjkR-rctHYeaJTk","haji maqsood filling station","Ground Floor, SH 9, Tatya Tope Nagar, Sultanpur","26.31566","82.1038021"
"ChIJ7dk8On99mjkRUHW6oXLs5s4","IndianOil","Ground Floor, Sadar, Garhakalan, Bhadaiya","26.2519997","82.0780162"
"ChIJZUkLedqBmjkRO7n0SmR2BTs","IndianOil","Ground Floor, bikhar Lambhua, NH 56, Varanasi - Lucknow Road, Narharpur","26.1492906","82.2072862"
"ChIJBSqdp0qAmjkRIAIlUIhZGJk","IndianOil","NH-56, Madanpur, Rahayakpur","26.1613915","82.1930793"
"ChIJFxGQjh-BmjkRd0bihHU7em4","Reliance Jio BP Petrol Pump LAMBHUA Sultanpur","Khatauni no 2538 Village Bhadaiyan, Tahsil Lambhua, Sultanpur","26.1704942","82.18556000000001"
"ChIJ8aATFUV_kDkRzqxq3yJ6bTA","Virendra Filling Station(BPCL PUMP)","ON NH 731, LAMBHUA BYPASS, TO, Varanasi - Lucknow Road, Lucknow","26.14659619999999","82.2230107"
"ChIJCZfhvk1_kDkRXLZy4ipeWlE","Hindustan Petroleum Corporation Limited","Ground Floor, Garayen Road, Lambhua","26.1315116","82.2216066"
"ChIJ5a_gOwB_kDkRWffFLayI6aE","Hindustan Petroleum Corporation Limited","No 161 & 162, Varanasi - Lucknow Road, Sultanpur","26.131306","82.23789400000001"
"ChIJP3onfgB_kDkRKU_vI2Get0E","Parthivi filling station","46JP+RW, Shahpur Pooran","26.1311571","82.2379895"
"ChIJpYDbvN1_kDkRMfS1Bjc2IB4","IndianOil","Ground Floor, Mampur","26.1639982","82.2449604"
"ChIJxe98QgB_kDkRgb7uuET-VEA","PETROL PUMP MAMPUR SHOBHIPUR","567W+W43, Mampur","26.1647681","82.2452888"
"ChIJxSAvED57kDkRo1XIEhkIo_s","Bharat Petroleum, Petrol Pump -Saryu Filling Station","PARGANA-CHANDA, TEHSIL-LAMBHUA, Sonava","26.0209948","82.3633377"
"ChIJDS4gLwZ7kDkR1hOaw8-Qnpk","IndianOil","Ground Floor, Lucknow Varanasi Road NH 56, Gurahupur, Chanda, Bhua, Patkhauli","26.063997","82.320691"
"ChIJK-isl-5xkDkRpEhdenIiS2g","IndianOil","Ground Floor, NH 731, Babuganj, Dhakwa Bazzar","26.016767","82.366723"
"ChIJ5-hyZkB7kDkRHih9azW9d1o","Chaudhary filling station (Indian Oil)","3899+CM, Ghurahoopur","26.0685167","82.3192333"
"ChIJY3muh05xkDkRPPfbTPC9ExM","Rajesh Kumar Yadav","ward no.- 08, Nagar panchayat - Dhakwa, Sonpura","26.015407","82.3672742"
"ChIJzfFl_ndvkDkRLSeqoaTFp_8","IndianOil","Ground Floor, Badlapur, Singramau - Baharipur Link Road, Misrauli","25.948251","82.407102"
"ChIJZa7uYAdvkDkRMO0d48dG28w","Shree Heeralal and son's filling station singramau","Shree Heera Lal & son's filling station mishrauli, Singramau","25.9482377","82.4070995"
"ChIJ2TxR6NdxkDkRNnGz5i7NEwc","Hindustan Petroleum Corporation Limited","Ground Floor, near Karampur, NH 56, Badlapur, Chanda, Hariharpur","25.972491","82.387761"
"ChIJmRpZEm1vkDkRcmJgZEBew5s","IndianOil","Unnamed Road, Kaweli","25.9405109","82.4048943"
"ChIJD7TYCNJxkDkR2bTBmhq_TS4","Upadhyay Automobiles","Upadhyay Automobiles, Patti","25.9797038","82.38655539999999"
"ChIJrW2AB31xkDkRiBmODkb_t0A","IndianOil","Ground Floor, Nh 731, Patti, Diyawan","25.9812235","82.3840895"
"ChIJL6ToeXdvkDkR14-yOr5qBT4","IndianOil","Gata No, 422 to 425, Badlapur, Kushaha","25.9426775","82.4339407"
"ChIJlWLs0QBtkDkRbK75oS1GxAU","Hindustan Petroleum Corporation Limited","Ground Floor, Pargana, Badlapur, Pahitiyapur","25.924401","82.417501"
"ChIJ13SdP5NtkDkRc7FQLQgPkTg","Maa Vaishno Feeling Stations","WCF8+MWC, Pahitiyapur","25.9241798","82.4172597"
"ChIJH14kYJ1skDkRPIhVI5GTLuU","IndianOil","Ground Floor, Shahganj, Badlapur","25.8801366","82.475256"
"ChIJuZtud45rkDkRtTEuK848f2I","IndianOil","Ground Floor, Bami, Bataubeer Bazzar","25.911431","82.484011"
"ChIJQQca4sJtiDkRlTtNFdJIOkk","IndianOil","Ground Floor, NH 731, Badlapur Bypass, Sultan Rd, Sarokhanpur","25.8924429","82.46950799999999"
"ChIJyY442kVrkDkRoHP-wD1cDsU","Hindustan Petroleum Corporation Limited","Ground Floor, NH 56, Mirshadpur","25.861165","82.491441"
"ChIJjak2BPRtkDkRW2F9FwAdJBs","IndianOil","Ground Floor Badlapur, Sarokhanpur","25.8896459","82.46127729999999"
"ChIJjzHSXwBtkDkRW1eeKH0gvXs","Navisha Filling Station","VFQ6+XC8, Ramnathpuram, Badlapur","25.8899125","82.4610781"
"ChIJ6R96OPtskDkRdo6Yjy5DEyQ","IndianOil","Arazi No 822 Bangaon Patti, Badlapur","25.883491","82.44172499999999"
"ChIJXRWEZ8ltkDkRtnWCyxSHfco","Bharat Petroleum, Petrol Pump -Sarthak Filling Station","BADALPUR,GKP-ALLBD RD ,DST, JAUNPUR","25.88088340000001","82.4387521"
"ChIJE8IMU71rkDkRH4AaZKhOKFU","Pathak Fuels","On dhaniyamau, bypassing, Badari","25.8506702","82.5148586"
"ChIJoTo64RptkDkRSY30U2HZELo","IndianOil","Ground Floor, NH 56, Shahganj, Badlapur","25.901601","82.440501"
"ChIJm4z2MwAVkDkRbpAhVTCRFpI","Bharat petroleum, Sri Hari petroleum naupedwa","RG8W+QQ9, Udpur","25.8169086","82.54699839999999"
"ChIJT9oklm0VkDkR48oCjdFuIrU","Petrol Pump","RG8V+CGW, Mahmadpur","25.8161034","82.54381289999999"
"ChIJsaz5I-AVkDkRDPi5JookVwA","Bharat Petroleum, Petrol Pump -Mahendra Service Station","NEOPEDWA BAZAR,LKO RD,DST, JAUNPUR","25.8178059","82.54184409999999"
"ChIJnRKrY88VkDkRpOw97-_qxwY","IndianOil","Ground Floor, NH 71, Sadar, Baherwa, Lakhmipur","25.7995229","82.5592935"
"ChIJ5XskfgAVkDkRFbW19ZmfyeM","Niraj Filling station(Indian Oil)","RGGJ+R7Q, Kataka Chak English","25.8266003","82.5301746"
"ChIJ90YCuGg_kDkRUnurMwQatIU","IndianOil","National Highway 731, SAWANSHA, Baksha","25.7833485","82.57805030000002"
"ChIJHzcI_yoVkDkRqy9KB1iYaJI","IndianOil","Barpur, Pura Mohbbat","25.820602","82.504565"
"ChIJFyrpqZ47kDkRfGVAx_dxiOk","Hindustan Petroleum","PMC7+5R5, Jaunpur City Staion Road, Naiganj, Olandganj, Jaunpur","25.7204","82.6646"
"ChIJkXauIsA7kDkRERR6as7YcFo","Bharat Petroleum","NH-231, Badshahpur Jaunpur Road, Mahatma Gandhi Marg, Nayiganj, Jaunpur","25.7400737","82.6706805"
"ChIJ-8hQ27k7kDkRESg6Dmazazo","IndianOil","Ground Floor, Sunder Nagar, Jaunpur","25.735257","82.680072"
"ChIJmdW5L7c7kDkRG1SbvsvZy_I","Bharat Petroleum, Petrol Pump -Prime Allied Sevice Corp.","WAZIRPUR,JAUNPUR,DST JAUNP, Jaunpur","25.7342256","82.6828961"
"ChIJfUIJuUo6kDkRwEg4T0UvGQU","IndianOil","Ground Floor, Civil Lines Road, Jaunpur","25.73863709999999","82.6926684"
"ChIJfwig7fc6kDkR2v49qjCMb1Y","IndianOil","Ground Floor Jagdishpur,Sarai, Jaunpur","25.715649","82.702902"
"ChIJbxpjfKU8kDkRaQr1gXhCBuI","Nayara Petrol pump","MJHQ+FVQ, Unchani Kalan","25.6787113","82.6397479"
"ChIJMSrCNXY7kDkRK0i1LT1GpqQ","IndianOil","Ground Floor, Harbaspur","25.71345900000001","82.662183"
"ChIJ5_OcQMw7kDkR9Mvlgfn7phM","Hindustan Petroleum Corporation Limited","Ground Floor, Mirzapur Road, Jahangirabad, Jaunpur","25.708038","82.658866"
"ChIJb03wwFw7kDkRn-wvNexGmcs","Hindustan Petroleum Corporation Limited","Ground Floor, SH 5, Sadar, Raibhanipur","25.72830099999999","82.670501"
"ChIJ1V2SzmQ7kDkRwYWy-HJfY3k","Bharat Petroleum","India","25.702284","82.655554"
"ChIJ8Xxl4qs7kDkRAeaEqBPisPM","IndianOil","Ground Floor, Chandpur","25.730243","82.67191"
"ChIJEUPxzmQ7kDkRlJWZWaITE7c","Marat Petroleum","PM34+9J4, State Highway 5, Phoolpur","25.7022459","82.6555767"
"ChIJVz9gyYU7kDkRa9cVVjPqcn4","Baijnath Petro Mart Bharat Petroleum","Vill- Mustafabad, Van Vihar Road, Jaunpur","25.7233459","82.67887619999999"
"ChIJvfS5t7g7kDkRMeWrsnt0SLM","IndianOil","Ground Floor, Polytechnic Chauraha, Pukhta, Sarai","25.737409","82.675806"
"ChIJ-cjEkOY9kDkRRSnrs1U5j2k","Bharat Petroleum, Petrol Pump -Kumar Petro","NAIGANJ,JAUNPUR,DST JAUNPU, Jaunpur","25.7399845","82.64784970000001"
"ChIJCy3wErQ7kDkRSjJytWlfxgo","Naiganj kumar petrol pump","PMRC+6F4, Rajgarh Colony, Olandganj, Jaunpur","25.7405125","82.6712031"
"ChIJqREizgM7kDkRP1V4dkriRt0","Bharat petrol pump","PM5P+XM2, Jaunpur","25.7098999","82.68664299999999"
"ChIJSb_ziB07kDkRALlDCqymb3c","Bharat Petroleum Petrol Pump , GREENLAND FUELS","PMWC+HJ5, Sultanpur Road, Katghara, PARAGANA - HAVETEHSIL, SADAR, Jaunpur","25.7467524","82.6718408"
"ChIJE0kmFKM7kDkROT-TA8zfFNo","Bhagwan Das. & Sons , Ranjan Enterprises","PMGV+CWM, Vill - Jagadishpatti ,Matapur","25.72609079999999","82.6948063"
"ChIJSexLTVQlkDkRIDORXh1ebss","Bharat Petroleum","Sirkoni Jaunpur Varanasi road, NH56, Jaunpur","25.66748199999999","82.7322373"
"ChIJJaRpWwAlkDkRTjjFNtiWe28","Kgn car ac repair","MP9J+C6V, Sirkoni","25.6686153","82.7305524"
"ChIJuYzaJYQxkDkRadVKFYeef8U","Kisan Sewa Kendra Husepur Petrol Pump","Husepur, Kabulpur","25.6737626","82.76774859999999"
"ChIJ0QlghRkvkDkRjrsgYADavMI","IndianOil","Ground Floor, Durbeshpur, Jalalpur - Chawari Road, Bishunpur Majhwara","25.6077","82.7693"
"ChIJhwu2nRkvkDkRoXMI0YFamgA","Darbeshpur Petrol Pump","JQ49+WRX, National Highway 56, Jaunpur","25.6073627","82.7696244"
"ChIJDSqhgXIxkDkR0MWvAdJjFW4","IndianOil","Gata No 399 Amahit, Sadar, Husepur","25.679294","82.77688599999999"
"ChIJPYSJBHMpkDkRojFuACKdr_0","Bharat Petroleum","NH-56, INDUSTRIAL AREA, KARKHIYONKARKHIYON","25.541828","82.801476"
"ChIJLR0OIRMpkDkRUZ4PML3whqg","Hindustan Petroleum Corporation Limited","Ground Floor, NH 56, Kerakat, Rehati","25.586751","82.776265"
"ChIJkRJlVdkpkDkR6rNigFSzgmc","IndianOil","Ground Floor, Asbaranpur","25.5524299","82.7836214"
"ChIJdzMKegApkDkRSNmgUdXFpBU","Hindustan Petroleum Corporation Limited","Ground Floor, Upsidc Industrial Area, NH 56, Pindra, Kolsala, Karkhiyaon","25.548301","82.79780099999999"
"ChIJKa77NCUpkDkR00VuqekSl7A","IndianOil","Ground Floor Trilochan, Mahadev, Bishunpur Majhwara","25.566401","82.78850100000001"
"ChIJC0iyQfMpkDkRMsEaz7L7KeQ","Gail india pvt. Ltd. Cng pump","GRV2+253, Agro Park, Karkhiyaon","25.5425126","82.8004112"
"ChIJhzTqObspkDkRghG0d1kH1Pg","SP SIDDHARTH FEELING CENTRE","Trilochan Mahadev, Rehati, Chhatari","25.5726455","82.7803955"
"ChIJe141PQApkDkRzIxzelw4KWk","Bharat petroleum","HQFH+V6, Chhatari","25.5747148","82.7781177"
"ChIJc9DDbqEvkDkRRCjb2o1I8-Q","JIO-BP PETROL PUMP","Rehati","25.594652","82.7742265"
"ChIJjxpbeY4pkDkRXGZp5H7zgck","IndianOil","Ground Floor NH 56, Phulpur","25.516537","82.812409"
"ChIJrdZNg1HUjzkROQK5PJqA8Qg","Hindustan Petroleum Corporation Limited","Ground Floor, Varanasi - Lucknow Road, Babatpur, Sagunha","25.435101","82.85550099999999"
"ChIJ8RnftcHVjzkR3aSJ21KCGzI","IndianOil","Ground Floor Ajgara, NH 56, Pura Raghunathpur, Babatpur","25.462825","82.839315"
"ChIJoyaUW_rVjzkRepj1odmXiIQ","IndianOil","near Industrial Estate, Ground Floor basni rd,babarpur, near Industrial Estate, Pura Raghunathpur","25.4480297","82.84161379999999"
"ChIJc8bH5hTVjzkRnw7VNHOpOiI","IndianOil","Ground Floor, Babatpur Kapsethi Road, Pindra, Kavirampur","25.44108739999999","82.8278957"
"ChIJ-0dNl_PVjzkRQt91YlHbjDA","IndianOil","Ground Floor, 39 Gtd, Khuthana, Bhagwanpur","25.436818","82.82747599999999"
"ChIJs-LbtH7VjzkRXSvI_X735uM","GAIL CNG Sanchetana Filing Station","CVM4+RMC, near PNB BANK, Sagunha","25.4345684","82.8566302"
"ChIJeTjpXGvVjzkRBWNtW2ruc3g","JNG Feeling Station","NH-31 (Old NH -56, Airport Road, Babatpur","25.4312547","82.8595043"
"ChIJ_YK5VgDVjzkRhPP36gHLQZ4","GAIL CNG ,JNG FILLING STATION BABATPUR VARANASI.","CVJ5+CP5, Shishwa","25.4310044","82.8593447"
"ChIJjzX6Xk7VjzkRzTIJGzSKslc","Hindustan Petroleum Corporation Limited","Ground Floor, Airport Road, Babatpur","25.430831","82.859161"
"ChIJ9dRkXcrVjzkRyS0Ux2cxgGg","Hindustan Petroleum Corporation Limited","Survey No, 178, Kolasla, Pindra, Gangapur","25.464101","82.879701"
"ChIJcUO_8xTVjzkR-abHgLpVh-0","IndianOil","Gata No 173, Pargana Kolasala, Assi, Gangapur","25.4642668","82.88177309999999"
"ChIJ3xixUGvWjzkRb9Fj5uMXovg","IndianOil","Gata No 902, Babatpur, marg, Jamalpur, Pindra","25.4621756","82.80445379999999"
"ChIJ1a9iXPHUjzkRuYLs4h2fiHk","IndianOil","Ground Floor, NH 56, Airport Rd, Bamokhar","25.4253891","82.87050119999999"
"ChIJSXfVMvLUjzkRaUTcEEPLSgs","BBC petrol pump","CVFC+HR7, Jamaalpur","25.4239133","82.8720542"
"ChIJ4W9mYRnWjzkRz162hs6R7Jg","IndianOil","Ground Floor, Pindra, Kolasala,Belwan, Pindra","25.4788507","82.804578"
"ChIJ2ZOPlMnVjzkRCR0cB_SMEP4","IOCL BOTTLING PLANT VARANASI","CVCF+4J4, Bamokhar","25.4202592","82.8740637"
"ChIJEcotXcEsjjkRpKVAV_eTyVg","IndianOil","Tarna NH 56, Shivpur, Varanasi","25.369314","82.92450699999999"
"ChIJU4xE-1EsjjkRlQKgFWpYWKo","IndianOil","NH 31, Airport Road, Suddhipur, Varanasi","25.359163","82.960518"
"ChIJR4jYIlEtjjkRmCH2HCY7mZc","BP Petrol Pump","9WF9+7V8, National Highway 31, Wazidpur","25.3731657","82.91969809999999"
"ChIJD-50STktjjkRSOCrOvALsu0","Hindustan Petroleum Corporation Limited","Ground Floor, Phase 2, Ring Road, Koirajpur","25.373073","82.909649"
"ChIJD_XF1sYsjjkRXUorsuV7US8","PRIMAX HOSPITAL","India","25.371077","82.9228175"
"ChIJgyb6shctjjkRrIklF-c03A8","GAIL CNG Kesari Filling Station","Varanasi - Lucknow Road, Ganeshpur","25.369278","82.9245285"
"ChIJM5ujIcIsjjkRv-GF5epuDaU","BP Oil","9W9G+9V7, National Highway 56, Bharilayi, Varanasi","25.3684047","82.92715969999999"
"ChIJ4x_78DgsjjkRgx5yQ8VLitE","IndianOil","NH 56, Tarna, Shivpur, Varanasi","25.368377","82.9279846"
"ChIJ6TbgbWvTjzkRGM_Q-mylPlE","potrol fual","Varanasi Division, Mobile 786 Varanasi.Kotwan","25.3910139","82.901742"
"ChIJj-ctPmgtjjkRYQsIF69vPY4","GAIL CNG CGS Mother Filling Station","9WQM+XP7, Varanasi Ring Road","25.3899182","82.9342984"
"ChIJaXykqlnTjzkR3DkJOBNmyuA","IndianOil","Ground Floor NH 56, Birapatti, Harahua, Luchchepur","25.393397","82.893625"
"ChIJD6KZCqXTjzkR0r79RTEMTI0","Bharat Petroleum Petrol Pump , GAUTAM FILLING CENTRE","VILLAGE DUNIYAPURHARHUA, Rameshwar Road, Varanasi","25.39049","82.888361"
"ChIJw0jzZdQtjjkR39Gg-wAQFRE","IndianOil","near Lohta Police Station, Plot No 535 & 563, Kotwa Road, Sadar, Birapatti, Varanasi","25.3484213","82.91528830000001"
"ChIJ9VL-NuYtjjkRuWuzalU5iWY","Mahadev Indane Gas Agency","Chhataripur, Varanasi","25.3638759","82.9529428"
"ChIJLykO3NwtjjkRg5F4rO9Ar2M","Tausif Petrol","Road, Kotwa, Tariya","25.3453599","82.9310284"
"ChIJJ6wnMsAtjjkRyCwK0sWPW2o","Nadeer Husain Fuel Shop","Tadiya Rod, Tadiya, Kotwa, Varanasi","25.3448732","82.9317402"
"ChIJgzE7sPEtjjkR-fKdaE45W-s","JAINUL ABDIN","Madarsa Islamiyan, Kotwa, Gadhai","25.3425558","82.92803409999999"
"ChIJ0RlZVgDVjzkRzo2qaaNVn60","AJAY FILING STATION CNG","CV6P+M83, Sehmalpur","25.4116453","82.88578989999999"
"ChIJ0d8iiL3UjzkRu0UCHzgo1HY","Ajay Automobile","Sarayswami","25.4116934","82.88563300000001"
"ChIJd9l6ipctjjkROH59FNoGL9c","IndianOil","Ground Floor, Sadar, Dandoopur","25.3867692","82.96424189999999"
"ChIJn4X59_sujjkR3bTlrFyyGn4","IndianOil","NH 29, Ashapur Chauraha, Varanasi","25.3625549","83.0307862"
"ChIJb83zTQAvjjkRvzCMHSDo2YA","Sathwan pahariya bela roud","पेट्रोल पम्प, सतावन","25.3976943","83.0106234"
"ChIJj1kYLQAvjjkRXuPSVK-iU9A","M/से SHREE फिलिंग KSK","92H5+X37, Bela Road, PAHARIYA, Sathawan","25.3799146","83.00768529999999"
"ChIJ724GewAvjjkRabHsOACG6D0","Petrol pump","C226+P6C, Sathawan","25.4018238","83.010514"
"ChIJHygWrzwpjjkRaGXc_MaPbl0","IndianOil","Ground Floor, Ajgara, Damodarpur","25.4052998","83.02704659999999"
"ChIJr6KSBp4ujjkRTa5iYSJiNqQ","Hindustan Petroleum Corporation Limited","No 171/7 Azamgarh Road, Lalpur, Soyepur","25.372121","82.99362099999999"
"ChIJiVE58XkvjjkRahDiUikcA-Q","IndianOil","Sadar, Ashapur Road, Varanasi","25.3625724","83.0307569"
"ChIJoU9ZOYstjjkRXvvDWWOs_5Q","IndianOil","Ground Floor, Near, Ashapur Road, Tilmapur","25.3674045","83.0399094"
"ChIJgQXlB7AvjjkRxmYIg6dVjoU","Bharat Petroleum, Petrol Pump -Dhanwantri Filling Station (Adhoc)","TILMAPUR ON NH,SARNATH ,DS, Varanasi","25.36446459999999","83.035466"
"ChIJMyhi5eQvjjkRjsYzpqF27I4","Baba Vishwanath Auto Fuels","SA-6/125, M/5, Gautam Buddha Rajpath Road, Asapur, Varanasi","25.3597653","83.02070739999999"
"ChIJ0_r7a1wvjjkR698ZFTzSMBY","GAIL CNG Shankar Station Filling Station","LALPUR,VRNSI-AZMGD RD,DST, Varanasi","25.3694461","82.99372269999999"
"ChIJw0ACZAAvjjkRWN0UmeGeasY","Alok filling station","SA-15/232, Hiramanpur, Varanasi","25.3658333","83.0389766"
"ChIJW5PxW50ujjkRv_MGzwpPK8o","IndianOil","Azamgarh Road, State Highway 73, Lalpur Pandeypur, Varanasi","25.367018","82.993679"
"ChIJoQLva2EpjjkR0pkE2oJYRNA","DEO KSK","Jairampur","25.4190625","83.0343125"
"ChIJo33DkEcpjjkRZxuOkbYd7qU","IndianOil","Ground Floor, Sarnath - Munari Road, Jairampur","25.419391","83.0342034"
"ChIJZ6MTh4kujjkRLC4gm0DvvfI","IndianOil","NH 29, Ashapur Road, Pandeypur, Paharia, Varanasi","25.357128","83.00915499999999"
"ChIJOWOOgoIujjkRRO6_WE_KljU","Bpcl Petrol Pump","75, National Highway 28, Mawai","25.3635664","82.9932208"
"ChIJXWK_wWsvjjkRK8ObKdWY-Hs","Rajghat Gas Service","925Q+MJH, Lerhupur","25.3591941","83.03909569999999"
"ChIJedsxu74vjjkR4g6LuSOV_-0","Vinayaka Filling Station","Sa, opposite Union Bank of India, 20/170-B, Paigamberpur, Asapur, Varanasi","25.3536291","83.0250465"
"ChIJ684xwnArjjkRMk_Op6qQT4E","Badami Gas Agency","CX7Q+Q28, Unnamed Road, Chandapur","25.4144071","82.987563"
"ChIJ_xceAtk7jjkRhDK8R3EUO-g","JAIGURUDEV PETROL PUMP","244, Hanumanpur Road, Hanumanpur, Mughalsarai","25.28862489999999","83.1250199"
"ChIJ9TYWfDM7jjkRNk9SD9wxOT0","Bharat Petroleum, Petrol Pump -Shaheed Agyat Filling Station","CHANDASI,MUGHALSARAI,DST C, Chandauli","25.2901456","83.10480199999999"
"ChIJBa5aW-g6jjkRyOpLrAJ286U","Hindustan Petroleum Corporation Limited","Ground Floor, GT Road, Mughalsarai","25.28677099999999","83.109711"
"ChIJA-9ItLs6jjkRqD99ZfHtLSs","IndianOil","Ground Floor Chandauli,Alampur, Mughalsarai","25.296442","83.093322"
"ChIJBxDTfPs7jjkRdH4o49BQuHA","IndianOil","Ground Floor, Old, GT Road, Chandhasi","25.2976206","83.0906268"
"ChIJ0e-hqms7jjkRoWm_61fESSg","Gupta Service Station","96, Ganjkhwaja, Mughalsarai","25.2837754","83.1155672"
"ChIJmdiZ0Io7jjkRnIvvWpJqiLg","Kisan sewa kendra","843W+3RG, Jalalpur","25.3026809","83.1470643"
"ChIJ1S9DbgA7jjkRn_PxLzv_LbA","SK Petrol Palace BPCL Petrol Pump","73XQ+FR6, Chandhasi","25.2986704","83.0895144"
"ChIJiZkn4Ug7jjkRD_0ytrgtNb4","IndianOil","Plot No 66 MI & 8788/2, Patpara Crossing Jalalpur Chotu Sarai, Alampur","25.302769","83.147821"
"ChIJodHZcaU6jjkRKFtt4swjD1I","Hindustan Petroleum Corporation Limited","Ground Floor, Chandasi, Varanasi","25.298801","83.087801"
"ChIJn33z99I7jjkRuIdJ9oQUOmU","Sharib Husain","Satpokhari","25.3052122","83.084954"
"ChIJBy2xpMg7jjkRjSnU63dUHms","Bharat petroleum premium petro filling station","Alinagar Road, Mughalsarai","25.2776099","83.12809299999999"
"ChIJjbRDf547jjkReuHBZa1irys","Bharat Petroleum, Petrol Pump -Shree Neelkanth Filling Station","74PV+CC9, MUGHALSARAI, DST CH, Saresar","25.2843727","83.1444867"
"ChIJZQ07umw7jjkRWt6ZYWY2f7Y","Bpcl Mughal Sarai Installation","74MV+CM9, skaldiha highway, Mughalsarai","25.2835428","83.1442379"
"ChIJFc5UwWs7jjkRuf-twRf3PVw","Hindustan Petroleum Corporation Limited","Ground Floor, Alampur, Sakaldiha - Mughalsarai Highway, Saresar","25.286601","83.147801"
"ChIJ5a6gPxI7jjkRbozMhuK7buM","IOCL BKPL Pump Station","74JQ+3P4, indian oil tank, Mughalsarai","25.2801256","83.1393331"
"ChIJnTLoZQU7jjkRv36KBgsaTDg","Hindustan Petroleum Corporation Limited","Ground Floor, Alinagar Road, Mughalsarai","25.276581","83.13143099999999"
"ChIJE2UUOic7jjkRTxHh3ycPYfs","Indian oil Depo mugalsarai","74GQ+RW2, Alinagar","25.27750769999999","83.1396036"
"ChIJPbTWb4A7jjkRA57As6jvm6Y","IndianOil","Ground Floor, Mughalchak, Bilardih, Alampur","25.2738747","83.1391865"
"ChIJ0_tUGws7jjkRwIY-G1jC6GY","IndianOil","Ground Floor, Old, Grand Trunk Road, Alinagar","25.2739683","83.14003060000002"
"ChIJA4VGq5o9jjkRqWv17mJQFhI","Hindustan Petroleum Corporation Limited","Ground Floor, NH 2, Bichiya, Hinota, Chandauli","25.259811","83.239841"
"ChIJ_aNNi1k8jjkRyyq4zslmndU","Hindustan Petroleum Corporation Limited","Ground Floor, Ganj Khwaja, NH 2, Grand Trunk Road, Lauda","25.2637201","83.1957501"
"ChIJHe1brigWjjkRUl3e7gYNDHM","Chaurasia Service Station (Bharat Petroleum Corp. Ltd.)","7764+83H, NH_2, (G.T.Road), Ward No. 3, Nehru Nagar, Chandauli, Delhi - Kolkata Highway, Bichhiya Kala, Chandauli","25.2608958","83.2555988"
"ChIJp2n6CmI8jjkRtkpg2xwE0Do","IndianOil","Ground Floor, NH 2, Adsand, Rema","25.268626","83.179746"
"ChIJmfk3gi8WjjkRIAG8qnLIt3A","IndianOil","Ground Floor, near DM Office, NH 2, Barthara Kalan, Chandauli","25.2609286","83.25895299999999"
"ChIJbZolqIA8jjkRUYPuluB2CNM","IndianOil","Ground Floor, NH 2, Rewsa","25.268199","83.1697603"
"ChIJTbMDgq49jjkRW4AVmp1CuRY","KRISH AUTOMOBILES","India","25.2616183","83.2131483"
"ChIJ9wHvKgA9jjkR6nT4qIr4sOk","IndianOil","near Surya Rama Centre, Ground Floor Jhansi, near Surya Rama Centre, Mughalsarai","25.2615099","83.2126033"
"ChIJ-cgW8SQ9jjkRbTisEZDMYyE","Bharat Petroleum, Petrol Pump -Nk Pandey & Co.","JHANSI,ON NH, DST CHANDAUL, Chandauli","25.2618326","83.2121714"
"ChIJN7pkIQA9jjkRZxqpTEl4OpQ","Maa kamakhya uriya pump m.k.t hotal jhasi Chandauli","7665+WXR, Jhhansi","25.2623625","83.2098906"
"ChIJDbfCDQA9jjkRQ5ZGz8vUZ5A","Maa kamakhya uriya pump","7665+WXR, Jhhansi","25.262143","83.209642"
"ChIJ4xQGRFM8jjkRba5n0LeIL4A","Hindustan Petroleum Corporation Limited","Ground Floor, Lauda","25.262681","83.20664099999999"
"ChIJW-02PgA9jjkRa117lo86Vhw","MAMA BHANJA SYNERGY P.V.T. L.T.D.","7674+47H, Mohammadpur, Asian Highway 1, Rampur Urf Akabarpur","25.2627344","83.2055374"
"ChIJJTYj0V09jjkRh8hajJ5kCfQ","Hindustan Petroleum Corporation Limited","Ground Floor, NH 2, Grand Trunk Road, Lauda","25.26191099999999","83.20384299999999"
"ChIJn14H-1M8jjkRGONTDqdWmi8","HP PETROL PUMP - KISSAN SERVICE STATION","HP Dealers PO Launda Jhansi Chandauli, Varanasi","25.2622169","83.2037203"
"ChIJe67zVAA9jjkRbuL4Hr1kfes","Jai Mata Di Filling Station - Indian Oil","7673+54X, Mohammadpur","25.263439","83.202803"
"ChIJnWl6SlE8jjkRraCbtLjsaCI","Bharat Petroleum","7672+8FR, Service Rd","25.2633587","83.201128"
"ChIJrzw5j1k8jjkRV3U6lk43Nrw","Hindustan Petroleum Corporation Limited","Ground Floor, Mohammadpur","25.264543","83.192365"
"ChIJsQy15V48jjkRMamIMXiEwqM","Raja Service Station (IOCL)","Grand Trunk Road, Mohammadpur","25.2655048","83.1899303"
"ChIJsxNgB3Q9jjkRKyGDajg8-kI","IndianOil","NH 2, Ganj Khwaja","25.2663792","83.1897795"
"ChIJIftXeJkRjjkRwlgMKXkd7UQ","Hindustan Petroleum Corporation Limited","Arazi No 153 NH19, Delhi - Kolkata Highway, Varanasi","25.2490931","83.36771449999999"
"ChIJ-91dIwARjjkRvkawpBWH4-w","Abhishek Tour And Travels","69X9+M92, Saiyadraja","25.248065","83.3680133"
"ChIJfxPaWcgRjjkRJIB75-Mq9vA","Hindustan Petroleum Corporation Limited","Gat No 1340, NH 19, near Varanasi, Delhi - Kolkata Highway, Bagahi Kumhapur","25.248072","83.368371"
"ChIJsXIeJQARjjkRQppzMG8YFkU","Hindustan Petroleum Corporation Limited","Ground Floor, NH 2, Narwan, Bagahi Kumhapur","25.2495261","83.36672899999999"
"ChIJxd4NJXIRjjkRAzYtl8Qn5E8","IndianOil","Ground Floor, NH 2, Adsand, Bagahi Kumhapur","25.2481596","83.3701888"
"ChIJhc4AJwARjjkRDxfaw7Rhuz0","Amarrnath Fuels","AH1, Bagahi Kumhapur","25.2492019","83.3704078"
"ChIJG5-rMAARjjkRKPeH4CgHMrM","MAHADEV Energy Bharat Petroleum","AH1, Bagahi Kumhapur","25.2490494","83.37131769999999"
"ChIJXTz_AQARjjkRG3SW_W5BzyA","Bagahi service station BHARAT PETROLEUM","69X7+RP, Bagahi Kumhapur","25.2494448","83.3644379"
"ChIJoRUhQAARjjkRTYPadfjOZmA","भारत यूरिया पंप","Bharat Uria pump 19, near Bharat Petroleum, National Highway, Bagahi Kumhapur","25.2488497","83.3721052"
"ChIJzaRVSQARjjkRztcEF7WQ4H4","Bagahi kumbhapur","69XF+765, Bagahi Kumhapur","25.2481318","83.3731114"
"ChIJZb77fwARjjkRpwhD4D4jaDc","R.J Chandauli","69XF+2M5, National Highway 19, Bagahi Kumhapur","25.2474753","83.3745649"
"ChIJRQkdawARjjkRDvWjSi1lZxc","RPM FUELS Indian Oil Petrol Pump","69WG+XCG, Bagahi Kumhapur","25.2473952","83.3753296"
"ChIJS2d8r1sRjjkRq56OQan3Fhw","Baghai Kumhapur","69WG+XCG, Bagahi Kumhapur","25.247445","83.3760643"
"ChIJmVRUP7kRjjkR_sMzZKN78B4","Pahadi Mata Fuel Centre","Bagahi Kumhapur","25.2487145","83.3591684"
"ChIJ_zmtZVgRjjkRCbj1XEt56Ic","KAILASH FUELS JIOBP PETROL PUMP","Kailash Fuels, Delhi - Kolkata Highway, Barati Kamraura","25.2471468","83.37861939999999"
"ChIJk2WesEYRjjkR61BTO5HVbWM","Reliance Petrol Pump","Grand Trunk Road, Raghu Patti","25.24718399999999","83.37876279999999"
"ChIJR1TR7fkRjjkR_wjt0tRmIFw","Siyaram Energy station - BPCL","Plot no 833, Opp BP-Chandauli Saiyadraja bypass, GT Road, Saiyadraja","25.2480766","83.35647519999999"
"ChIJMebee0ERjjkRUoXEZ3Z8vzw","BP Petrol Pump","Grand Trunk Road, Bagahi Kumhapur","25.2474568","83.3548801"
"ChIJUWGPelYRjjkRnlhD_g2piXg","Hindustan Petroleum Corporation Limited","Arazi No 358, Syyedraja Zamaniya Road, Marui","25.26361199999999","83.366149"
"ChIJpRueUTwRjjkRWooJ-qmYzKc","IndianOil","Ground Floor, NH 2, Naubatpur","25.246382","83.3887963"
"ChIJH9h5XxAMjjkRNFI7L_SWp6s","बाबा बिल्डिंग","India","25.2220313","83.49373179999999"
"ChIJMXYfFAANjjkR4lJqJEQPgMQ","CNG Pump","6FFQ+5FH, Dhanichha","25.2229451","83.48872910000001"
"ChIJB2nHfBcMjjkRSi0jqj1VgMc","IndianOil","Ground Floor, NH 2, Akorhi, Khamidaura","25.2230273","83.488659"
"ChIJQfcrhLwLjjkRuOZoWMJ201g","ESSAR Petroleum","6G4J+JF6, Sarangpur","25.2065453","83.5311365"
