place_id,name,address,latitude,longitude
"ChIJocEdZCDB9jkRKLcxVCKi2tg","IndianOil","Ground Floor,GTR Road Barbendia, Govindpur, Kharikabad","23.8002079","86.6217087"
"ChIJCSDs_CHB9jkR-48HdF3-UDE","IndianOil","Ground Floor NH 2, Govindpur, Kharikabad, Bagsuma","23.801038","86.61934699999999"
"ChIJp97SG9_A9jkRDPx3e1c2TBM","Bharat Petroleum - Mahamaya Filling Station","NH-2, Govindpur, Dhanbad District, Khariabad","23.8019049","86.6186044"
"ChIJt0pxn2rB9jkRjhaUp1_O2nA","IndianOil","Plot No 1187 P, 1188/1201, Khata No 18 Tetulia, Cmpf, Nirsa","23.7983561","86.6427509"
"ChIJsae4jMDD9jkR9ocu6nJwhGc","IndianOil","Ground Floor, Grand Trunk Road, Nirsa","23.7991274","86.6440875"
"ChIJz2WixyLB9jkRrC4ocUDlNqk","Hindustan Petroleum Corporation Limited","Ground Floor, Nirsa","23.7982667","86.6464426"
"ChIJXan4VwDB9jkRVuzjIVeYEtw","BABA LOKNATH SERVICE STATION","QMX3+94G, Tetulia","23.7984282","86.65283819999999"
"ChIJ2wPJziLH9jkRQ5ZV1eRDcI0","Anwar Ansari","RJGM 7PM, near Panchayat, Kaladabar, Dhanbad","23.8255841","86.63424479999999"
"ChIJeXK22RXH9jkRnKH9m2_B9sQ","Hasina","RJGP 3X3, Gh, Kaladabar","23.8251001","86.6369354"
"ChIJn4z-vN7D9jkRumMYwJqFQVs","Jio-bp","Ground Floor, Nh 2, Ramkanali","23.7943985","86.66509529999999"
"ChIJKTCJhq_A9jkRtffM-wwWUKA","Hindustan Petroleum Corporation Limited","Ground Floor, NH 2, Govindpur, Gahira","23.8093301","86.5884701"
"ChIJe9trphvB9jkRLzoOoQQWDRY","BPC MAA YASHODA MAHARANI FUELS","RH5M+PGH, Deuli","23.8093146","86.5838611"
"ChIJV2QtJRPD9jkR-SJJk6Q9xr8","IndianOil","Ground Floor Nirsa, Pandra","23.7990915","86.71443339999999"
"ChIJL49U3yvD9jkRp6kdImCupxY","Bharat Petroleum Petrol Pump , INDUSTRIAL CORPORATION","NIRSAG T ROAD, NH2, Dhanbad","23.7793","86.717427"
"ChIJL2vhnR7D9jkRZnXu78-LiVc","Hindustan Petroleum Corporation Limited","Ground Floor, Grand Trunk Road, Nirsa","23.780201","86.71655009999999"
"ChIJCR2jUdLC9jkRhK4i1KNZaqg","Hindustan Petroleum Corporation Limited","Ground Floor, opposite Chopra Colony, NH 2, Mugma","23.767162","86.738952"
"ChIJQcscSrzd9jkRPYXqmeLL7I4","Bharat Petroleum, Petrol Pump -Unique Service Station","KANCHANDIH,NH2,DISTRICT DH, Dhanbad","23.7670486","86.7418233"
"ChIJv3raCgDD9jkRW_tnsSsko4s","Jio Petrol Pump","QPG2+VJR, Nirsa","23.7772486","86.7015194"
"ChIJkdkHmT7d9jkRCwKsUvZEPG8","Hindustan Petroleum Corporation Limited","Ground Floor Nirsa, Grand Trunk Road, Mugma","23.75852099999999","86.758399"
"ChIJRX4ucgDd9jkRUuEBgRItWVQ","ECL KAPASARA INDIAN OIL CONSUMER PUMP","Mugma More, Kapasara","23.757785","86.7599067"
"ChIJNSHccg_D9jkRZ8f2xp4uJI4","SHIVAM FUELS","SHIVAM FUELS, MPL Jamtara road, Sambandhpur, Nirsha, Dhanbad","23.81398819999999","86.722804"
"ChIJ95m0WGbD9jkRnfL3ckIIffw","(BPCL)Maa Uma Shakti Filling Point(BPCL","QMQM+WCR, NH2, Gopalganj","23.7898679","86.6835297"
"ChIJfw43Gxrd9jkRcz43FS_PlJs","Hindustan Petroleum Corporation Limited","Ground Floor, NH 2, Mugma","23.766091","86.767181"
"ChIJl7Bm3hrd9jkRXvjOahx1K5I","Indian Oil Jagdamba Petroleum","Rajpura","23.7676481","86.7679844"
"ChIJab8UTy_D9jkRoktcwUiLhoY","IndianOil","NH2, Gopalganj","23.7905538","86.6805957"
"ChIJ_2zRkYvd9jkRfljws36chW4","KUNAL MAJI","Shop No 003, Kesar Kular, Kesar Kular Maithon Dhanbad, Maithon","23.7764243","86.76885209999999"
"ChIJoYEKrDTd9jkRh50ckyXn7fU","Siyar Kanali","QQ26+72G, Pani Tanki Road, Egarkunr","23.7506937","86.7600712"
"ChIJOeAZBGPd9jkRgqHLMd3R7yY","Shrabani Maji","Shop No 006, Kesar Kular, Kesar Kular Maitho Dhanbad, Maithon","23.7762725","86.7689678"
"ChIJSUQAHybC9jkR3JwHd-fpckg","Hindustan Petroleum Corporation Limited","Ground Floor, Ledaheria, Nirsa","23.74544260000001","86.6911227"
"ChIJbYU_eADd9jkRl4xBqTa8CWs","Maithan fuels⛽","QQ9C+67G, Rajpura","23.7680509","86.77069279999999"
"ChIJTwX6fQHe9jkRUPio5ilQLwI","IndianOil","Ground Floor, Grand Trunk Road, Barakar","23.734554","86.826653"
"ChIJ9a0cD_nd9jkRbNALkLfdQW8","Bharat Petroleum Petrol Pump","PRM8+P39, GT Road, Barakar","23.7336337","86.818829"
"ChIJTdQdqPTd9jkR9L75lmYLsXA","Hindustan Petroleum Corporation Limited","Ground Floor, Old, Grand Trunk Road, Chirkunda","23.73610099999999","86.80254099999999"
"ChIJo5DEVajf9jkRT-IIqS8uAkI","IndianOil","Ground Floor, Dendua Sitarampur, Rupnarayanpur Road, Salanpur","23.77651","86.870064"
"ChIJZczFotnd9jkR2eEDE0YQ1fg","Hindustan Petroleum Corporation Limited","Ground Floor, NH 2, Barh Jorh, Maithon","23.7640801","86.8183701"
"ChIJYzxUrHre9jkRXGBCpYJPPWk","Sitaram Auto Service","NH2, Byepass Road, Delhi - Kolkata Highway, Kalyaneswari","23.7671153","86.8319118"
"ChIJD6wcOS3f9jkRJP1Qm3pbE8U","IndianOil","Lock No 13016 NH 2, Bypass, Debipur","23.770297","86.84189099999999"
"ChIJYVpIaWff9jkRj1AV_shia1c","IndianOil","Khatian No 12791264, City Centre, Plot No 4066, JL 26, Nakrajuria, Salanpur","23.7771992","86.8425635"
"ChIJD92G5T_d9jkRdFYXgV2bvdE","Bharat Petroleum, Petrol Pump -Deepak Highway Service Station","KUMARDHUBI, NH2, DIST, DHAN, DHANBAD","23.7631049","86.7948404"
"ChIJQdVuWDDd9jkR5hPT8P7o-30","IndianOil","Ground Floor, Uphara, Rafiganj, Kumardhubi, Kalimati","23.75577","86.79379999999999"
"ChIJ02BqhFHe9jkR9uzgHe3bK-k","Amal Bikash Service Station.","Amal Bikash Service Station, NH2 Bye Pass Road, Jamaldhi","23.76955749999999","86.8568909"
"ChIJq-LDhVHe9jkRzfH81tJbomA","IndianOil","Ground Floor, Jamaldih NH 2, Kulti, Kalyaneshwari","23.769032","86.8576001"
"ChIJURwlD_nd9jkRvCsUSZVhvPs","Sreeji automobiles","PRM7+QWX, Asansol - Barakar Road, Barakar","23.7344946","86.8148647"
"ChIJoRutWtbd9jkRFxaWire9ZRg","Table","PRP6 5X8 67, Barakar","23.7350842","86.81258520000002"
"ChIJt5Pziqbd9jkRmF_SYi0-lCg","IndianOil","Ground Floor, Sanjay Chowk, near Maithon Dam, Merah, Chirkunda","23.762524","86.785629"
"ChIJMbiof5Dd9jkRx6tBPAlJmX0","IndianOil","Ground Floor, Kumardhubi, Chirkunda","23.74475279999999","86.7920177"
"ChIJAeEy_m_d9jkRfWvOrDjRb2o","Hindustan Petroleum Corporation Limited","Ground Floor, Kumar Dhubi, Grand Trunk Road, Dhanbad","23.745211","86.791011"
"ChIJ_ftbDAXd9jkRR-cvtz03zlk","JEEN MATA AUTOMOBILES","BCCL Quarter, New, Dishergarh Road, Begunia, Barakar","23.7296462","86.8156059"
"ChIJs0BK0dTn9jkRX4Zv7NEFgkw","Begunia Petrol Pump","PRG8+Q9H, New Colony Begunia","23.7269304","86.81597149999999"
"ChIJj_Y17ebn9jkRKVNoaQY7YGM","Hindustan Petroleum Corporation Limited","Purulia - Barakar Road, Barakar","23.7255567","86.81496820000001"
"ChIJm80IL24f9zkRa-jYCCK05Wk","Hindustan Petroleum Corporation Limited","33 & 34, Plot No 31, Asansol - Gourandi Road, Bardhaman","23.7179272","86.95284629999999"
"ChIJa0rYwdgh9zkRU7mCDyYLQMs","IndianOil","Ground Floor Nuni, Kanyapur, Barabani","23.73507","86.956268"
"ChIJD8XUsvUh9zkRXtSU0TDdEgU","Hindustan Petroleum Corporation Limited","Ground Floor, NH 2, Talberia","23.73313929999999","86.9183053"
"ChIJG6vl24gh9zkRddwVxrhShsw","IndianOil - SWAGAT","Ground Floor, Salanpur, Lalganj, Talberia","23.7342361","86.9146904"
"ChIJ44FZp5sh9zkRLIywEooJqT0","Jyoti Highway Plaza","Public School, opposite Delhi, NH2, Talberia","23.7354088","86.9139522"
"ChIJe6eirGgf9zkR5A5kx9SRy1k","M Auto petrol Station","PW47+JF6, Grand Trunk Road, Munshi Bazar, Asansol","23.7065273","86.9136556"
"ChIJc69QIfUf9zkR1bN7xRtI8zI","R N FILLING STATION","01, Dhemomain Dhemomain Road, Santinagar, Asansol","23.706349","86.91314349999999"
"ChIJ-4qsQssf9zkRlyJBq-Rz2Tg","Indian oil petrol pump-Tarakeswar Filling Station","PALASHDIHA Road Road, Panchgachia","23.7195088","86.9541988"
"ChIJhd7vBG4f9zkRa1O_Gt4j-cI","IndianOil","NH 2 Bypass, Kanyapur","23.716195","86.953141"
"ChIJCUNqXxUf9zkR1jDYCrjYVDE","Bharat Petroleum, Petrol Pump -Bharat Automobiles","NH2, ASANSOL BYE-PASS, Palasdiha","23.7164509","86.9557154"
"ChIJ39qPTjEh9zkRkC7GBlUgIY0","IndianOil","Ground Floor Asansol, Paschim Bardhaman, NH 2, Kanyapur, Raniganj","23.7437076","86.9525343"
"ChIJjQSNm8wf9zkRxHEOv8MN7F0","IndianOil","Ground Floor, NH 2, Bypass, Kanyapur, Asansol","23.7065923","86.94989179999999"
"ChIJbajG46Uf9zkRuXY7GZa8cts","Hindustan Petroleum Corporation Limited","Ground Floor, Grand Trunk Road, Gopalpur, Asansol","23.69843629999999","86.9370761"
"ChIJwTwvB_vf9jkRmKa1D3lHqUQ","Hindustan Petroleum Corporation Limited","Ground Floor, near Debjyoti Pulp And Paper Factory, NH 2, Miliakhola","23.7409501","86.8948715"
"ChIJD5P3rAUf9zkRnpcaXDCctg8","IndianOil","No 139Mp, Lock, 21002, Grand Trunk Road, Court More, Asansol","23.694914","86.94949299999999"
"ChIJ5RO2Gwcf9zkRuGKHTOhqZCQ","IndianOil","Grand Trunk Road, Burnpur, Asansol","23.694352","86.950628"
"ChIJeRyJ8RPg9jkRR9YNQBzFwZs","Hindustan Petroleum Corporation Limited","Ground Floor, Old GT Road, Neamatpur","23.7147974","86.88636199999999"
"ChIJGy6eTxDh9jkRsNEq9VK1TFE","Bharat Petroleum, Petrol Pump -Bengal Auto Stores","NEAMATPUR. BURDWAN DIST, BARDHAMAN","23.7157443","86.8856488"
"ChIJ88uG2gQf9zkR6xeYG04iSYg","Hindustan Petroleum Corporation Limited","Ground Floor, Shaheed Bhagat Singh Chowk, Asansol","23.6940883","86.9516072"
"ChIJyaUacwAf9zkRihecOWqOTno","Hindustan Petroleum Corporation Limited","Ground Floor, near Chitra Cinema, Burnpur, Asansol","23.6872056","86.94302979999999"
"ChIJf9cnfykX9zkRAVVnRY62aW4","Hindustan Petroleum Corporation Limited","Ground Floor, NH 2, Searsole, Rajbari","23.6473201","87.0996701"
"ChIJr7bWMhcR9zkR5JPbkJR_Odw","Hindustan Petroleum Corporation Limited","Ground Floor, Netaji Subhas Road, Raniganj","23.61141409999999","87.1136474"
"ChIJPYWPjTMR9zkRuzCdAEzoPXg","Jayswal Automobiles","2, National Highway 14, Searsole Rajbari, Raniganj","23.6387194","87.1133662"
"ChIJs28ijzIR9zkRE--gAZBAerY","IndianOil","Burdwan Division, Ground Floor, NH 2 Grand Trunk Road, Raniganj, Amrasota","23.6387359","87.11336039999999"
"ChIJl0fYIw0R9zkRQZj2XOmpz84","Bharat Petroleum, Petrol Pump -Prabhat Quick Auto Fillers & Eng.","near Punjabi More, NH2, Raniganj","23.6386251","87.1149124"
"ChIJRew3Ri0R9zkRGwiBf8uqYjw","Manoj Shaw Servicing Center","J4R6+5GM, Raniganj","23.6404697","87.1113005"
"ChIJs5UCoDYR9zkRA4NMFegYL58","Hindustan Petroleum Corporation Limited","Ground Floor, Punjab More, Old, Grand Trunk Road, Raniganj","23.6354501","87.11859009999999"
"ChIJlWjlR_ER9zkR9P_tNbEJLiQ","Hindustan Petroleum Corporation Limited","Ground Floor, Punjab More, Raniganj","23.6401158","87.1211039"
"ChIJQ4EdWgAR9zkRZ_9tCeQSxZo","HP Petroleum, CNG & EV Station","J4J6+4P4, Searsole Rajbari, Raniganj","23.6302744","87.1118134"
"ChIJ0xofbNYR9zkRE8_1VO7F3Us","IndianOil","Ground Floor, NSB Road, Raniganj","23.626634","87.114397"
"ChIJXXJLyToR9zkRqI_twtSq_uo","JAYSWAL AUTO SERVICE","near ANJANA CINEMA, 37, NSB Road, WEST, Raniganj","23.6177525","87.1137907"
"ChIJu4X-zLsW9zkRYFY9wcuuZUg","Toposi Hp Pump","near by colliery, Toposi gram, Kunustoria","23.6566415","87.12811620000001"
"ChIJmctXbvUR9zkRkv4Hdu4L9_Q","Hindustan Petroleum Corporation Limited","Ground Floor, Netaji Subhash Road, Raniganj","23.6158201","87.11322009999999"
"ChIJ-V1CDQAR9zkRpMyRPNu-eTU","Fatima Fuels","Dr, M.N.Ghose Road, Raniganj","23.6115164","87.118478"
"ChIJfcEMxV4R9zkRmCxTx1PPQoM","Bharat Petroleum","India","23.6231333","87.13904199999999"
"ChIJIVfHxV4R9zkRw_6muHOZkto","Aryan Fuels","Bardhaman","23.6231276","87.1390638"
"ChIJFfffdXQX9zkR5Nd-YU7uVJc","IndianOil","Floor 130/5 Mile, Ground, GT Road, NH 2, Satgram, Behala, Bardhaman","23.653492","87.08746599999999"
"ChIJ_zYiDQAR9zkRN4YOTR3Myf4","Fatima Fuels","J47H+GX2, Doctor MN Ghosh Road, Raniganj","23.6137569","87.1298989"
"ChIJtUtsbbkR9zkRFLBC1HjKsrQ","SHREE DURGA SERVICE CENTRE","J49Q+5X6, Raniganj","23.6179241","87.1398801"
"ChIJ3RK6c-AT9zkR-os7vQJoqvo","Hindustan Petroleum Corporation Limited","Ground Floor, Grand Trunk Road, Mangalpur, Raniganj","23.618691","87.14378099999999"
"ChIJJVAfeUBt9zkRNK5rcwnS40E","IndianOil","Ground Floor Gopalmath Durgapur, Oyaria","23.571998","87.239786"
"ChIJI_NBiWpt9zkR71GW6OrN1hM","HP Petrol Pump","H69V+V43, Delhi - Kolkata Highway, Main Gate, Durgapur","23.569633","87.242803"
"ChIJN26DIuIS9zkRcE-CaduzSyE","IndianOil","Ground Floor, Bhadur Gram, NH 2, Andal","23.593966","87.196739"
"ChIJg9lRkERz9zkRbDgiS3lV3Hw","Bharat Petroleum, Petrol Pump -Paul Auto Services","DSP GATE,NH2,DURGAPUR,BURD, BARDHAMAN","23.560404","87.2552788"
"ChIJsXNP2m9t9zkROWfjQyvj1Xs","IndianOil","No 3056, Lr Khatian, Plot No 5126 5127 & 5128, Andal","23.58317","87.22317"
"ChIJHR2JdUJt9zkR-tJUFjPpmVc","Bharat Petroleum, Petrol Pump -Saikat Automobile","ANDAL ON NH-2 LHS TOWARDS, BARDHAMAN","23.5826482","87.22352629999999"
"ChIJ14lAFcAT9zkRy7LR6KR8PwE","Fast Food Corner","ANDAL MORE, Hospital Rd, Grand Trunk Road, Durgapur","23.5873238","87.2112369"
"ChIJ81LYHNwS9zkRanavB3MNVhU","National Highway service station","Andal","23.5893194","87.2064106"
"ChIJl7OJgExt9zkRcTevxPH-ry0","IndianOil","45, 64, Plot No 44, 65, Tamla Road, Andal","23.5982884","87.2293955"
"ChIJS4dAHdwS9zkR9r0RsStNuHM","Bharat Petroleum","India","23.5894246","87.2063893"
"ChIJvT3W0d0S9zkRw8gkn7w8bN4","LPG Supplier (BP)","H6Q3+FMR, Dighnala, Andal","23.58873629999999","87.2041471"
"ChIJXyHxaT9t9zkRHWxuw8V7sGM","Hindustan Petroleum Corporation Limited","Ground Floor, Gopalmath, Andal Gram","23.57311099999999","87.23811099999999"
"ChIJ6c4Mcf4T9zkR0JLYyb1sOcA","Reliance Petroleum","National Highway 19, Andal","23.5943082","87.19535069999999"
"ChIJf7TnK40T9zkRO7fbeK0Ol68","Manish Automobiles","Indianoil petrol pump, DakshinKhand","23.6110394","87.2178797"
"ChIJq7ACzzMT9zkRkztJ2bJwVXU","IndianOil","Ground Floor Dakshin Khanda, Andal","23.611049","87.21746499999999"
"ChIJb8ZdsuFt9zkRiC-ET9cH2xk","Bharat Petroleum, Petrol Pump -Raja S/Station","Main Gate, Durgapur","23.5651823","87.2488468"
"ChIJ69D0NBwT9zkRGThbLunbIfs","Nityananad Fuel Center","Shop No, 1, Royalty More Road, Andal","23.5716588","87.1895646"
"ChIJKxmmOPMS9zkRhDqQZHAfy88","Sree Ganesh Fuel Centre","H5CQ+X97, অণ্ডান সাউথ বাজার, রয়েলটি মোড়, ওয়ার্ক শপ রোড, Ramprasadpur","23.5724199","87.1884146"
"ChIJZQxbI1ET9zkR1zboW48LtGQ","Dakshin khanda Mini Petrol pump","Dakshin khanda, kalibari more Paschim","23.6179736","87.21750349999999"
"ChIJfdDsr9Nt9zkRVXth39WBFKs","Vai Vai Petrol service","AMRAI JABUNA ROAD, 3, Durgapur","23.5874497","87.260224"
"ChIJYSVp001w9zkRQGMEwSauZIY","IndianOil","C 415, Ssb Sarani, Bidhannagar, Durgapur","23.5173718","87.3458909"
"ChIJkxnCqq1x9zkRuBr9VFaBlG8","IndianOil","No 112, Lock No 12006, HP GT Road, Barddhaman, Khayrasole, Durgapur","23.511513","87.338753"
"ChIJURz6O3Jx9zkRiZvUuDrEiFo","IndianOil","Lock, 11006, Durgapur Station Road, Durgapur","23.492565","87.317651"
"ChIJeaqZBoNx9zkRKJ9vmD__J0I","Bharat Petroleum Petrol Pump","BC ROY AVE,DURGAPUR,BURDWA, BARDHAMAN","23.5053038","87.30914430000001"
"ChIJuddLiVhw9zkRa755PA1gBQw","Hindustan Petroleum Corporation Limited","Ground Floor, Muchipara, Grand Trunk Road, Durgapur","23.503911","87.354061"
"ChIJfQf8EPZx9zkRVP6KFpcKxYc","IndianOil","Lock No 11009 Bamunara, Bidhannagar, Banskopa","23.492351","87.37308349999999"
"ChIJzVWYx4Rw9zkRc2j_fiaWwSE","HP Petrol Pump - Gorai Fuel Centre","Ground Floor, Bamunara Industrial, More, Estate, Banskopa","23.4922194","87.3748016"
"ChIJH0qjoI5x9zkRVpC1SQy5I_4","Surya Lakshmi Service Station","NH-02, Banskopa","23.4919176","87.3748863"
"ChIJX86CmAhx9zkRLZ9fSDs2vlg","Hindustan Petroleum Corporation Limited","Ground Floor, Zonal Centre, Jadabendra Panja Avenue, Sagarbhanga, Durgapur","23.497931","87.33078100000002"
"ChIJA5RuELBx9zkRnyuXv9VSmSA","HP Petrol Pump - Auto Care Centre","Indo American More, Ground Floor NH 2, Durgapur","23.51517309999999","87.33213839999999"
"ChIJE5QTMQlx9zkR6B0XwDu3MKo","IndianOil","GF, JP Avenue, Sagarbhanga, NH 60 Zonal Centre,Durgapur, Sagarbhanga, Col","23.496804","87.328171"
"ChIJkTdVDcd79zkRY6VKaFUsKOM","BHARAT PETROLEUM - MAA KAMAKSHA SERVICE STATION","Chatty, Rajbandh","23.4873816","87.38266999999999"
"ChIJH8xLhJpx9zkR1kBDbDZ0xwM","Indane Bottling Plant","G877+CFC, Lenin Sarani, Industrial Area, Durgapur","23.5135615","87.313651"
"ChIJnRklJwBx9zkRU655bsVms3o","D P L","L Housing Complex, D.P, Industrial Area, Durgapur","23.5115595","87.3114258"
"ChIJdd48XoNx9zkRGKg4o0g9_ZM","Hindustan Petroleum Corporation Limited","Ground Floor, Coke Oven, near Doctor Bidhan Chandra Roy Avenue, PCBL More, Durgapur","23.5077431","87.3103237"
"ChIJSYLlbYNx9zkR6hOSPxVKdUs","IndianOil","Lock No 11013, Dr BC Roy Avenue Paschim Bardhaman, Industrial Area","23.512094","87.3110125"
"ChIJz9ciq4Nx9zkR18BI3nJ3Vxs","Shark Petroleum","G845+3H6, Doctor Bidhan Chandra Roy Avenue, Industrial Area, Durgapur","23.505158","87.30887609999999"
"ChIJoxONyVlx9zkR-jqycvONnRk","Sujayjee","Labour Hut, Dr, Doctor Bidhan Chandra Roy Avenue, Durgapur","23.5052574","87.3086024"
"ChIJjQWKMQBx9zkRJfB_jX_I8vg","durgapur city center","G8C6+5QF, Durgapur","23.5204443","87.3119227"
"ChIJU1RlUT569zkRtlOlaxVrZlo","IndianOil","","23.476452","87.4029558"
"ChIJ6UjsLYJ79zkRBGFssC5KDPo","IndianOil","GF, Trilokchandrapur, Kanksha Near Barddhaman, NH 60 4 Mile More, Gram Exp Hwy, Bidhannagar, Durgapur","23.503185","87.454765"
"ChIJ50RMqFp59zkRIdD5wM-ss5A","Akash Lohani","Panagarh Bazar, Panagarh","23.4535712","87.4475143"
"ChIJ1RJ9TY179zkRaoebI2JragY","IndianOil","Ground Floor, Kanksa","23.4600341","87.4555817"
"ChIJRRnnRQ579zkRT-pWKi3k4ZQ","IndianOil","Lock No 13014, RTKM 8 GT Road, Burdwan, Birudiha","23.4619358","87.4308599"
"ChIJGS4qMAB99zkRnPNslfRRSTE","COCO KANKSA","FF58+724, Kanksa","23.4581396","87.46508349999999"
"ChIJp8MK_Ot99zkRteEzklTLDJQ","IndianOil","Ground Floor, NH 2, Bypass, Panagarh","23.4589409","87.465797"
"ChIJzZHqqFJ59zkRShL_HAwdBVg","Panagarh Petrol Pump","Panagarh Bazar, Kanksa","23.4454119","87.45986219999999"
"ChIJecP-jjF69zkRlvv5h5lL8EA","Hindustan Petroleum Corporation Limited","Ground Floor, near KM Stone 511, NH 2, Birudiha","23.4703912","87.4153097"
"ChIJ_XwHXNZ79zkRPLKtZrIrdk0","Maa Sarada Service Station","FC97+VWM, National Highway 19","23.4697174","87.4147887"
"ChIJa5n7ALp-9zkRxqMXebROSuk","IndianOil","Lock No 11019, Grand Trunk Road, Panagarh Bazar, Bidhannagar, Durgapur","23.43997599999999","87.469915"
"ChIJi5jx4Lt-9zkR9t5xSwLPyws","IndianOil","Ground Floor, Matix Road, Panagarh Bazar, Natunpara, Panagarh","23.439749","87.474159"
"ChIJJ2Xv0ap59zkRX-kUDtf_Jh0","Bharat Petroleum Petrol Pump , MAA ANNAPURNA FILLING STATION","SHILAMPUR, KANKSA, Paschim Gangarampur","23.426611","87.44024"
"ChIJgQ9vjxN79zkRcd-khPR9SRk","Bharat Petroleum, Petrol Pump -Rajlaxmi Auto Filling Stn.","opp. DITM, Grand Trunk Road, RAJBANDH","23.4741908","87.40853349999999"
"ChIJd71V9zJ_9zkRJ7IdrLnr-mU","Hindustan Petroleum Corporation Limited","Ground Floor Sonai, Pondali","23.4420216","87.4775602"
"ChIJAfz6-3HV-TkRlAf-1fz8yQQ","Hindustan Petroleum Corporation Limited","Ground Floor, Budbud","23.399561","87.554221"
"ChIJNSIFsebV-TkRsYOd8kqccA8","IndianOil - SWAGAT","Bagabanpur","23.3941875","87.5698906"
"ChIJLXUM71jV-TkR6Juri4oDPcY","Ghosh Auto Fuel","CHV2+MVR, Unnamed Road, Ramnagar","23.444245","87.55213499999999"
"ChIJqSTpErnV-TkRSl_DPXFoWeM","MAA MANASA FUEL STATION,AMARAR GARH","MAA MANASA FUEL STATION, Guskara Rode, Mankar","23.4288099","87.5754084"
"ChIJ5U0PePd_9zkRM6XGsP7OKsE","Hindustan Petroleum Corporation Limited","Ground Floor Kota Gram, Kota Chandipur","23.4338013","87.5080296"
"ChIJcUFXPbnU-TkRt3DSWKSOCAg","IndianOil","Ground Floor, NH 2, Grand Trunk Road, Gulsi, Paraj","23.380188","87.60197099999999"
"ChIJn06bIMss-DkROpxYgY1ShBo","IndianOil - SWAGAT","NH 2, Golgram, Galsi","23.3632568","87.6410205"
"ChIJr8ov3kgt-DkR3x_0TQBNgSE","Bharat Petroleum, Petrol Pump -Mandal Fuel Service Station","NH2,North-East of Bhasapul more,Galsi,Purba","23.3603381","87.6497435"
"ChIJbw6NfyYt-DkRWadgkhu1SdY","Jio BP - Tirupati Filling Station","Plot No 6837, 6838, JL No 54, Vill: Galigram, Golgram","23.3541648","87.660692"
"ChIJzzjoCCnV-TkRoAGRSJtav4I","JIO - BP Petrol Pump SHREE NIDHI SALES","9JH6+797, Paraj","23.3781593","87.61092959999999"
"ChIJ9ye1cwAz-DkRyZ1pjrBIF5g","Sahid DEF Point⛽⛽","7QVC+F6W, Belgram","23.2937257","87.7705814"
"ChIJQ3LdahA0-DkRgCyFxbdOWKU","Hindustan Petroleum Corporation Limited","Ground Floor, NH 2, Shyamsundarpur, Nala","23.2846853","87.7875212"
"ChIJrfp9agAz-DkRz1omGhPljlc","Nurtazz Xpress","8Q25+44P, National Highway 19, Sanko","23.3003371","87.75815639999999"
"ChIJI2tJ83U3-DkRzwuQttrRAuU","Hindustan Petroleum Corporation Limited","Ground Floor, Block Burdwan 1, Belkash","23.2587515","87.78552529999999"
"ChIJD74Xg1I1-DkRYYOpoHKdTKc","Bharat Petroleum, Petrol Pump -Friends Service Station","KESHABGANJ, Bardhaman","23.2735949","87.81132099999999"
"ChIJz1qj9_tI-DkRV_8RWz4_hoc","IndianOil","Lock No 13005, Bamchandipur, Joteram","23.219426","87.899829"
"ChIJH5d9g-hJ-DkRCyu9KF3Z6eI","Hindustan Petroleum Corporation Limited","Ground Floor, Mehdi Bagan, Grand Trunk Road, Bardhaman","23.252331","87.864961"
"ChIJKXbKGZ1J-DkRqVwa_kB9RLo","Alisha fuel station","BUS STAND, near ALISHA, Gopalnagar Avenue, Bardhaman","23.2169829","87.8878194"
"ChIJyzF-GVFI-DkROr7iOnGHck0","Hindustan Petroleum Corporation Limited","Ground Floor, Gopalnagar Avenue, Bardhaman","23.2173662","87.8878489"
"ChIJwQjv8MpJ-DkRiK-yj2O_098","Hindustan Petroleum Corporation Limited","Ground Floor, Grand Trunk Road, Police LIne Bazar, Bardhaman","23.227571","87.872991"
"ChIJRy7kUy5I-DkRxXmhvW05qsY","Bishalakshmi Petrol Pump","Rammudipally, Becharhat P","23.2164984","87.86271359999999"
"ChIJmQeDxIhI-DkR3iFmPZJZL88","শ্রীকৃষ্ণ বসালয়","5VRX+P7Q, Dhamas - Burdwan Road, Bamunia","23.191835","87.8982429"
"ChIJ2VJYYsVJ-DkRy8t8k1wovdc","Dholdighi Petrol Pump","Grand Trunk Road, Khosbagan, Bardhaman","23.2370779","87.8664744"
"ChIJySUDYcVJ-DkROJpQiCiNRuA","Hindustan Petroleum Corporation Limited","97, Grand Trunk Road, Bardhaman","23.237171","87.86621099999999"
"ChIJ5-eefrxJ-DkR9FWoq0YsoNo","Hindustan Petroleum Corporation Limited","JL No 71, Plot No 181, Kalna Road, Bardhaman","23.2396129","87.9036117"
"ChIJFYtNZwBJ-DkRXlRe1qmyUEI","Hindustan Petroleum Petrol Pump","6WR3+5R, Dangachha","23.2396693","87.90446349999999"
"ChIJLbkDrRBJ-DkRrENlpU14Toc","IndianOil","Lock No 13008, 48/1, Grand Trunk Road, Bardhaman","23.2439042","87.8685095"
"ChIJsUqH3M9J-DkR_6FNtzCIf7U","NARAYAN AUTO STORES - (BPCL)","BUS STAND, 66, GT, ROAD, OLD TINKONIA, opposite of SIDDHARTHA HOTEL, Bardhaman","23.2455567","87.86880470000001"
"ChIJlcBAT6RJ-DkR-IYOdt61fK0","Reliance Petroleum","NH-2, VILLAGE GANGPUR, POST OFFICE JOTHRAM, DISTRICT: BURDWAN Burdwan -1 (Rev 01","23.2165079","87.9293393"
"ChIJJx2wlcI3-DkRaa20zgcP4A4","Hindustan Petroleum Corporation Limited","Ground Floor, Machhkhara","23.201921","87.844031"
"ChIJ5-gd7TM2-DkRW2HCDKEM3H8","IndianOil","Ground Floor, NH 2, Nutanganj, Tejganj, Bardhaman","23.22906619999999","87.84115279999999"
"ChIJ4buJ4qJa-DkREOfU02aqzbg","IndianOil","Ground Floor Kanai Danga, Chanchai, Memari, Rasulpur","23.169632","88.029243"
"ChIJEWK4dx1Q-DkRaCH9flISoAU","IndianOil","Ground Floor, Palla - Rasulpur Road, Sheikhpura, Rasulpur","23.194067","88.012633"
"ChIJUQ_EWYlR-DkRmQRUow0otyg","Palsit Pure And Sure Filling Station","NH-19, Old NH-2, Sekhpur","23.1929902","88.01342009999999"
"ChIJ48nIPQ1Q-DkRnCi9LHjgtyw","Hindustan Petroleum Corporation Limited","Ground Floor, Grand Trunk Road, Rasulpur","23.189461","88.030451"
"ChIJ-REO1ZBP-DkRhEOuPCz6h-8","Hindustan Petroleum Corporation Limited","near 581 KM Stone, Ground Floor, Kalanabagram NH 2, Saktigarh, near 581 KM Stone, Bypass Road, Konarpara","23.1968955","87.9857978"
"ChIJzZuMMABb-DkRu1fEw81qX7M","TATA DEF STATION ⛽ টাটা ডেফ ষ্টেশন","52CH+5WC, Kanai Danga","23.1704431","88.0297636"
"ChIJ1SgOgg9P-DkRiM5CT9FB_A0","Mondal Auto Mobiles","Mondal Auto mobiles, Paschim Memari","23.186543","87.9830167"
"ChIJm7f3JKBP-DkR4bZHyBaraPI","Hindustan Petroleum Corporation Limited","Ground Floor, G T Road, Bardhaman","23.203381","87.974031"
"ChIJX7-MkLZR-DkRFY76ke4pEcY","Kalipada Service Center","Bishnupur bus stand, Rasulpur","23.1862985","88.05361309999999"
"ChIJidp8IDVb-DkRBBqImCZ-5_0","Rajat Bairagi GB","Nilkuthi Primary school, Ajhapur","23.150938","88.0176853"
"ChIJmY6r18Bf-DkRjBII-x0JqrI","IndianOil","Plot No 557/565566 Dumro, NH 2","23.0113333","88.1442067"
"ChIJD3bnL91f-DkRy_Hxek7ikNA","Bharat Petroleum, Petrol Pump -Bp- Gopalpur","Gopalpur","23.0018197","88.1465901"
"ChIJbb8ay8lf-DkRsHpG972lTE8","Bharat Petroliaam","23, Magra-Gurup Road, Bhastara","23.03043449999999","88.1389339"
"ChIJGX2N7G1f-DkRdn7cpG8eHcI","Bharat Petroleum","Kansaripur","23.0246274","88.1372809"
"ChIJt39y0YJf-DkRgxCUnG4yQ_w","HP petrol Pump","Mazinaan, Durgapur Expressway, Gurap","23.0369751","88.1291773"
"ChIJucVrcpdf-DkRSZBPrMAaR9M","Petrol Pump","24QG+QRM, National Highway 19, Gurap","23.0393589","88.1275773"
"ChIJw1QIWSRf-DkRYXsDRiY2Jf0","IndianOil","PL No 903/23 ,P, Khasra No 629643, Bombay Service Station, Dhaniakhali","23.02152","88.1392285"
"ChIJE2ejC_9e-DkRxcrUdPphR3w","Hindustan Petroleum Corporation Limited","Ground Floor, NH 2, Durgapur Expressway, Dhaniakhali, Gurap","23.03978009999999","88.1266801"
"ChIJ76UkAn1f-DkRagn8lp1Lnqk","Adhoc SREE KRISHNA SERVICE CENTRE GURAP (COCO)","GURAP bhastara, Nh2, Durgapur Expressway, Dulfa","23.0203836","88.1399138"
"ChIJ0aTRSKxf-DkRwu8euJHWg_U","IndianOil","Khatian No 1729/173, Dag No 630 JL No 126, Durgapur Expressway, Gurap","23.0412407","88.1252748"
"ChIJVdbK6tJf-DkRepbQpAHDd7c","Bharasa KSK Pump (IOC)","Magra-Gurup Road, Bhastara","23.0306604","88.1527758"
"ChIJ1wiXIydf-DkRmCTGExrhdJg","Bharat Petroleum, Petrol Pump -Shukla Service Station","GHOSLA, Gurap","23.0492818","88.1204288"
"ChIJTZtZG3Je-DkRXmWStSe4i5U","IndianOil","Hooghly, Ground Floor Dasghara, Birpur Balidaha, Jolekul","23.0239487","88.1043699"
"ChIJp3w1XwBf-DkRJF4XXBJ5S2M","M/S MAATARA K.S.K","239X+QH5, Gurap","23.019386","88.098985"
"ChIJHSHJ8t1f-DkRHboiNfYVKJg","Hindustan Petroleum Corporation Limited","Ground Floor, NH 2, Durgapur Expressway, Dhaniakhali","22.997901","88.148201"
