place_id,name,address,latitude,longitude,open_now
"ChIJN9m0rwqHUDcRdW9PWM6uc4c","Hindustan Petroleum Corporation Limited","Ground Floor Mawrie, NH 40, Mylliem","25.5102322","91.811872","true"
"ChIJWxgIy-2HUDcRyxqtsOgXpiI","IndianOil","Ground Floor, 11th Mile, Mylliem","25.48117899999999","91.819423","true"
"ChIJ6W7MhROGUDcRgKGivswm0OE","IndianOil","Ground Floor, Mawngap","25.482971","91.768079","true"
"ChIJvSuWfnN-UDcRRIPQvWxhW_Y","LAIMER FILLING STATION -Bharat Petroleum","HV73+393, Asian Highway 1, Sawmer","25.56263959999999","91.8534105","true"
"ChIJKV9SQ9iHUDcR_3cgi15AcZA","ESM Service station","FRX9+M97, Mylliem","25.4991559","91.8184256","true"
"ChIJt8lnVxuHUDcR2pCumajZBfg","IndianOil","Ground Floor, Laitjem, Laban, Kynton-U-Mon","25.522222","91.79806699999999","true"
"ChIJr3rFL2mHUDcRoUyaKMaby5o","Bharat Petroleum ESM Service Station","India","25.5278723","91.8190802","false"
"ChIJaWZMKwCHUDcRW0L5Jc667UY","ALZA REFILL CENTER","GQ6P+PW2, Mawkriah","25.5113072","91.78660529999999","true"
"ChIJQUsf1pqHUDcRupQfzBJ7Pgs","Hindustan Petroleum Corporation Limited","Ground Floor Mylliem, Syiemship, Lumsohriew","25.508641","91.78577399999999","true"
"ChIJ5SAcvWmHUDcReXaoSanU5Z0","PHUH KYRHAI FILLING station","GROUND FLOOR, BPCL PETROL PUMP, LAITPYNTER, SYNRANG KABAN, PO, PS, Mawngap","25.4906077","91.7766333","true"
"ChIJeRAYVVuHUDcRKGdLBz3RV54","IndianOil","Ground Floor Mawngap, Laitpynter, Lyngïong","25.486593","91.774037","true"
"ChIJy_gQYEKHUDcRdww0x9B9OU4","Alza Refill Centre","Alza Refill Centre, Mawkriah","25.4849626","91.7650085",""
"ChIJp6zUNuJ9UDcRUONrqYodHhQ","Hindustan Petroleum Corporation Limited","Ground Floor Upper, Shillong","25.5541101","91.8455501","true"
"ChIJwUt6UAB9UDcRqP0fBgM5vA8","Bharat petroleum","GVHP+CC7, National Highway 6, Pomlakrai","25.5285637","91.88552519999999",""
"ChIJO5StOo19UDcRGspbYUf6NLw","CHIRUP TSG FILLING STATION","Laitkor Lumheh","25.5283562","91.8857321",""
"ChIJ55wSNnJ-UDcRBcExtYUamDg","IndianOil","Ground Floor, Jail Road, Laimer, Shillong","25.565737","91.855171","true"
"ChIJKYk0RWJ8UDcRI-hYHVTJr5g","IndianOil","Smit Road","25.5106327","91.8970942","true"
"ChIJV5jU8xB8UDcRcEENRlqeYXw","IndianOil","Ground Floor, Laitkor, Kynton-U-Mon","25.542061","91.897336","true"
"ChIJkXp14aR-UDcRdrZOZM_6fow","IndianOil","Ground Floor, Laitumkhrah, Shillong","25.565721","91.897291","true"
"ChIJ7RxQY6V-UDcR163iSZaTang","Hindustan Petroleum Corporation Limited","Ground Floor, Nongthymmai, Shillong","25.5654574","91.89989179999999","true"
"ChIJKzSdAY1-UDcR5438896EY38","Thangkhiew Filling Centre","Barabazar Shillong Meghalaya, Gauhati","25.57716","91.87832999999999","true"
"ChIJeTE1I6t9UDcRAcE1hFuqj98","BPCL W.D. Service Station","FWX4+J7J, Smit Road, Smit","25.4990606","91.9049773",""
"ChIJ2T9_nfZ9UDcR5kX0Z6EAH3g","Hindustan Petroleum Corporation Limited","Ground Floor, NH 44, Madanryting, Laitkor Mawri","25.531627","91.88662699999999","true"
"ChIJf-KYbC59UDcR6KptFFmLxlo","BPCL Kharkongar Service Station .","GWW3+PGX, National Highway 6, Shillong","25.5468743","91.9038544",""
"ChIJK4JILp59UDcRXWelneF3-so","IndianOil","Ground Floor, Nongthymmai, Mawblei, Kynton-U-Mon","25.5531621","91.9058148","true"
"ChIJOUd71FR5UDcRgdMhsFZtWj8","IndianOil","Demthring, Shillong","25.5579425","91.9093132","true"
"ChIJCzxCl5l-UDcRbmk3iTtWHAo","IndianOil","Ground Floor, Point, Malki, Shillong","25.5659098","91.886602","true"
"ChIJ5yATlaJ-UDcRYmxfwMgFyBk","IndianOil","Ground Floor, Dhankheti, Laitumkhrah, Shillong","25.566195","91.89141099999999","true"
"ChIJ4QeR4aR-UDcRWDkjpSnqi8I","XTRACARE","India","25.5659206","91.8976105",""
"ChIJXTXM4aR-UDcRrmuDVL6qo90","Assam oil","India","25.5661264","91.8973501",""
"ChIJ36O5ERR_UDcRFUAd5pgVmSQ","IndianOil","Ground Floor, NH-40, Cantonment Area, Shillong","25.571794","91.876919","true"
"ChIJO-XO8Lt_UDcRoxziEMnKAkU","Samim Store","93667735, Chibinang, Shillong","25.5737847","91.8824628","true"
"ChIJX2nDDLN-UDcRBXYmV7iKaTw","Nongrim Hills Petrol Pump","Rynjah, Shillong","25.5719445","91.9078955","true"
"ChIJC68fGJN-UDcR7ZN04xiSR8M","IndianOil","1, Jail Road, Police Bazar, Shillong","25.578088","91.883951","true"
"ChIJI54qNfR7UDcRsBeRGkFMyPg","IndianOil","Ground Floor, Near Sohryngkham, Mawlyndep","25.5371395","91.9787984","true"
"ChIJr7okdPZ-UDcROANgpSUaagY","IndianOil","Ground Floor, Ïewduh, Bara Bazar, Shillong","25.585978","91.872185","true"
"ChIJWbDKEFZ-UDcRtP0Kt-j11ec","Hindustan Petroleum Corporation Limited","Ground Floor, NH 40, GS Road, Mawlai Nongkwar, Shillong","25.5965497","91.8701728","true"
"ChIJT1dvv1V-UDcReMJveUkFBBA","IndianOil","Ground Floor NH 40, Shillong, Mawlai Mawdatbaki, Mawroh","25.599277","91.869484","true"
"ChIJhQCtv5p_UDcRM1FIDvAcASw","IndianOil","R O Box No 64, Lawsohtun, Mawlai Mawdatbaki, Shillong","25.600171","91.86916599999999","true"
"ChIJYdWEx7d_UDcRjByIp627naM","IndianOil","Ground Floor, Mawlai Mawdatbaki, Shillong","25.603133","91.86830100000002","true"
"ChIJ7XuO2PN_UDcREaj2fHVusk8","Hindustan Petroleum Corporation Limited","Ground Floor, Mawlai Mawdatbaki, Shillong","25.5919471","91.8733627","true"
"ChIJjzVB1Pl-UDcR6c94jXUhl0A","Mawlai, Pump Site For Honda 2 Wheelers","HVRF+QCJ, GS Road, Mawlai Mawdatbaki, Shillong","25.5919506","91.87351629999999","true"
"ChIJwfh_rxR_UDcRd8wVs4E8S7M","IndianOil","Ground Floor NH 40, Mawiong, Mawroh","25.626316","91.88602399999999","true"
"ChIJuyROZd9_UDcRa8jNk2JQ-jw","IndianOil","Ground Floor, Polo Bazar, Shillong","25.58022459999999","91.899939","true"
"ChIJIRA3Hn9_UDcRDacUKfgqXM4","BPCL KRE JNGIM LINA SERVICE STATION","HWH4+964, Demseiñ-Ïong, Shillong","25.578379","91.9055741",""
"ChIJr2PYPA55UDcRCNy_QzzoF48","IndianOil","near Assam Rifles, Ground Floor, near Assam Rifles, Nongmynsong, Shillong","25.590232","91.915792","true"
"ChIJPU_4pSZ_UDcRBMcleS6Lsug","NEHU Petrol Station","JV5W+G84, North Eastern Hill University, Shillong","25.6087505","91.895839","true"
"ChIJAQ-MOCV5UDcRDBe0qGBv2I4","Hindustan Petroleum Corporation Limited","Ground Floor Wahheh, Neigrihms Hospital Road, Mawpat","25.5921369","91.92102489999999","true"
"ChIJF5j3J4R_UDcRzJEA0lK8e34","IndianOil","Ground Floor, Bypass, Mawlai-Mawïong","25.6227961","91.9101223","true"
"ChIJ-cU4pZZ_UDcRSyu3-0Sh6MM","IndianOil","Ground Floor Mawiongrim, E Khasi Hills, GS Road, Mawlai Mawdatbaki, Shillong","25.635308","91.892466","true"
"ChIJwUeFGEN_UDcRzzwsXcX_zGI","Hindustan Petroleum Corporation Limited","Ground Floor, GS Road Shillong, NH 40, Mawlai-Mawïong","25.6372652","91.8932524","true"
"ChIJZ2bBj5F5UDcRifOAv2OdZxo","T W POHSHNA BPCL PETROL PUMP","Major District Road 32, Mawdiangdiang","25.5963188","91.94675699999999","true"
"ChIJ6z8FLAd5UDcRH9UkFb5PN-I","Bharat Petroleum","HWWW+GQM, Major District Road 32, Mawdiangdiang","25.5963301","91.94691569999999",""
"ChIJvfjHL11_UDcR_iEZXa24ArI","Rymbai Filling Station BPCL","JVQR+QWG, Mawlai-Mawïong","25.6394465","91.8923233","true"
"ChIJMUT0dzWCWjcRhDKnaE_Eb7M","ByePass Filling Station BHARAT Petrol Pump","MWWH+2Q2","25.6950013","91.9294055","true"
"ChIJ47R_weKDWjcRNBaGB0iPmAY","IndianOil","Ground Floor Barapani, Umbang, Shillong","25.6846341","91.9013165","true"
"ChIJMeIBSz2DWjcRXE9dU_bq2Ao","Hindustan Petroleum Corporation Limited","Ground Floor, Umiam","25.6853895","91.9160508","true"
"ChIJP7nfHTSCWjcRhhKKvpOIOZE","HP","India","25.6917155","91.9254912",""
"ChIJiZYGFmaBWjcRXdYV3NVFYxY","Hindustan Petroleum Corporation Limited","Ground Floor, Bypass, Umsning","25.7155737","91.88870969999999","true"