place_id,name,address,latitude,longitude,open_now
"ChIJqfDbwXE_9DkRXshlxHKjZlI","Petrol Pump","Bahadurpur","23.6521616","85.9442028",""
"ChIJe4w-TaZr9DkRVP0jANoTGzk","IndianOil","Khata No 37, Plot No 591, Khetko","23.7518895","85.9063504","true"
"ChIJ6y5F14Nr9DkR0sERiQopwyc","IndianOil","Khata No 24, Plot No 959, Petarwar, Tenughat, Champi","23.7400975","85.8762665","true"
"ChIJcXALiq5B9DkRuOC7RTZJ08k","Indian Oil, Nageshwar Fuel Centre","Bokaro, Sonpura, Dantu, Kasmar","23.6672151","85.9074651","true"
"ChIJMwtFAKJB9DkRi2F7_RMoPSM","General Store","Chando","23.6573211","85.9255036",""
"ChIJEVfpSOBr9DkR3PJf73og2G4","IndianOil","Ground Floor Jaridih, Argamo, Bermo, Ghandinagar","23.770859","85.92761999999999","true"
"ChIJ5xhwKp5p9DkR88p_JhON_KM","IndianOil","PR7V+CX, Ulgara","23.7137965","85.8448823","true"
"ChIJ6a3Bkc8U9DkR363M7-oL-AY","Hindustan Petroleum Corporation Limited","Ground Floor, Bermo","23.7715864","85.9399674","true"
"ChIJlSRMsFI_9DkRmstHa5AnUK8","Hindustan Petroleum Corporation Limited","Ground Floor, Kasmar Bahadurpur Road, Ponda","23.651779","85.939061","true"
"ChIJnwvRxXo_9DkRzzpKf99ymL8","Bhavna Fuel Station","MW2Q+MJM, near Sadar Patel Public School, Ramghar - Bokaro Highway, Kamlapur","23.6517051","85.9390488","true"
"ChIJH2Y_fs5r9DkRlH_qmm0wdwY","IndianOil","Ground Floor, Kathara","23.7754","85.88668299999999","true"
"ChIJUU8P56Br9DkR3fWU2UvMPO8","Hindustan Petroleum Corporation Limited","Ground Floor Bermo, Kathara","23.7758037","85.88745589999999","true"
"ChIJIVEv2fY_9DkRaAfTdVMOaWI","Gola bokaro Jharkhand","MX56+2J, Bakaspura","23.6576123","85.9616097",""
"ChIJUVRHBgY_9DkRrXPVKLwhhp4","IndianOil","Ground Floor, Jaina More, Jaridih, Bahadurpur","23.6577412","85.9618974","true"
"ChIJP0ORfIAW9DkREuFdqaFXQmA","Hindustan Petroleum Corporation Limited","Ground Floor, Phusro","23.7602327","86.0141783","true"
"ChIJs-qo5kMW9DkRtDVjHMhEsrk","HP PETROL PUMP - KAILASH MISHRA FUELS","HP Retail Outlet AT & PO Tantri PS- Jaridih, ON Tantri Tupkadih Road, Ranchi","23.742843","86.036692","true"
"ChIJP9AH4LQ99DkRI2MgpRrKmzE","Essar Petrol Pump","National Highway 23, Jena, Tanrmohanpur","23.6666603","86.0351506",""
"ChIJ5bntb4899DkRpCfcygHetWc","Hindustan Petroleum Corporation Limited","Ground Floor, Phusro Road, Jaridih, Jena, Jaina","23.6797387","86.0221177","true"
"ChIJ923gLlM99DkRJZuYrPcK-us","IndianOil","Plot No 1306, Khata No 26 Khutri, Jenamore Road, Lakrakhanda, Phusro","23.7026281","86.0361672","true"
"ChIJUT3hSZM_9DkRBgIZ4FWO3rw","Bharat Petroleum, Petrol Pump -Tripathi Petrol Supply & Ser. Stati","Dumri - Bermo - Jain Road, Jena, Bokaro Steel City","23.6632557","85.9829304","true"
"ChIJcQ6jOwA99DkR3lD3ONyuW7Y","HR FUEL KHUTRI","P23P+37X, Khutri","23.7028862","86.0367656",""
"ChIJF3IyejI99DkRGKgTsPZ1H7w","IndianOil","Khata No 76, Amlo, Khutri, Jaridih, Plot No 1050, Khutri","23.7041526","86.0394077","true"
"ChIJzep_ly0U9DkRq0hjvQQc-nc","IndianOil","Bokaro, Ground Floor Potso,Phusro Bazar","23.762724","86.002948","true"
"ChIJ9ezlsi0U9DkR4MszzYvdUrU","Hindustan Petroleum Corporation Limited","Ground Floor, Bermo","23.7632034","86.0042103","true"
"ChIJ46L7hWI99DkRoeYVCE1FLW4","IndianOil","Ground Floor, Tupkadih, Jaridih, Lakrakhanda, Khutri","23.705413","86.0423474","true"
"ChIJ8farblk99DkRwa0rr5BJ6Eg","ASHOKA AUTO SERVICE","Jena, Bokaro Steel City","23.6677448","86.0198103","true"
"ChIJK2Vz0NI99DkRtTyTasKutTw","Tripathi Petrol PUMP","23, National Highway, Santi Nagar, Jena, Jaina","23.6655056","86.0203609",""
"ChIJOwXb87Q99DkR2omg4I7fsZw","IndianOil","Ground Floor Jaina, Jena, Bokaro Steel City","23.6638754","86.0182811","true"
"ChIJ12X37ikU9DkRWXI2jwPOz4Y","IndianOil","Railway Station, Ground Floor Bermo, Phusro,Potso, near Phusro, Bokaro","23.7665733","86.01135289999999","true"
"ChIJCzgDs0kW9DkRR9vDFC2NxaM","IndianOil","Khata No 04, Plot No 88, Jarisih, Lakrakhanda, Tantri","23.7386108","86.0456322","true"
"ChIJc5GQAAA_9DkRfdhHngBLq-4","Shankar Kumar","MX35+PC7, Bahadurpur","23.6542846","85.9585544",""
"ChIJ_2B6A0oW9DkRxeZhL0xNeyg","Hindustan Petroleum Corporation Limited","Ground Floor, Tupkadih Road, Jaridih, Tantri","23.7374866","86.0480566","true"
"ChIJRWg4bOYX9DkRj7iyWjchzaA","IndianOil","AT & PO, Tantri","23.736136","86.049872","true"
"ChIJK2TVTQM_9DkRheFD9nFekJE","JAINA AUTOMOBILES ( NAYARA PETROL PUMP)","Tand Mohanpur, Jena, Bokaro Steel City","23.6669041","86.03529139999999","true"
"ChIJXW0p62A99DkRbgBeMcwCrFA","SHAMBHAVI FUELS (B.I.A.D.A)","M3Q3+XRH, near Dalmia cement factory, Biada Street, Balidih, Bokaro Steel City","23.689932","86.0545966","true"
"ChIJxY0OmeI89DkRbS_-1sWcO9o","IndianOil","Ground Floor, Balidih, Bokaro Steel City","23.6653764","86.0646484","true"
"ChIJ9ep8MOI89DkREkvQAL04X9Y","IndianOil","Railway Colony, Bokaro Steel City","23.6637767","86.0675342","true"
"ChIJ1RTzdgA99DkRUj6x54XYXtQ","UREA PUMP","M3M5+C6F, Balidih, Bokaro Steel City","23.6835707","86.0580585","true"
"ChIJMR6olmoX9DkRIizDgYZ0F1g","SHREE GANESH FUELS","Main Road ,Turio , Bhandaridah Chandrapura - Pushro, Road, Bokaro Steel City","23.7551862","86.0533821","true"
"ChIJnTrOLtoX9DkRd1MB1h9D_eI","IndianOil","Ground Floor Bhandhridah, Chandrapura, Turio","23.7554847","86.05341","true"
"ChIJUWXrMwA99DkRykP-SyfvKEk","Baba enterprises hp fules","A-43/134, Housing Colony, Balidih, Bokaro Steel City","23.6726837","86.06756",""
"ChIJIZiLYAA99DkRw7hoSRU2auc","UREA DEF REFILLING CENTRE","M29W+H9W, Tanr Balidih","23.6689937","86.04596260000001",""
"ChIJkfre620Z9DkRVjLieqBe54U","Arti Kumari","Paschimpalli, Paschim Pally, Ghatiari","23.7467137","86.10688329999999",""
"ChIJJUIpcegV9DkR7aeSpoeYhy4","Supratim Automobiles Petrol Pump","main road Kurpania, Bermo","23.78785989999999","85.9334057","true"
"ChIJk4MthLMU9DkRXcXNXXM1dvY","IndianOil","Ground Floor, Sunday Bazar, Kurpania","23.788232","85.9333511","true"
"ChIJN8oQEgBr9DkRjGadzc0r5s8","IndianOil","Khata No 117, No 112, Gomia, Hazari","23.7821651","85.86422809999999","true"
"ChIJJ1-TA-Zr9DkR090KnbMFQu4","Hindustan Petroleum Corporation Limited","Ground Floor, Hazari More, Gumia","23.7846768","85.85898","true"
"ChIJU3olZABr9DkRNP3vuslBVgc","Nayra petrol pump","QVM5+W8F, Gumia","23.7848168","85.85829179999999","true"
"ChIJ5bX4MuRr9DkRaBN1Xga6CcQ","Bharat Petroleum","India","23.7861303","85.85614559999999",""
"ChIJU3CQduRr9DkRP0rP5hcvOfw","Hazarimore Pump","QVP4+CCF, Gumia","23.7860721","85.8560485","true"
"ChIJN7oKOott9DkRs_WWaqlKdAw","Bharat Petroleum Petrol Pump","RVGG+RM, Kanjkiro","23.82711","85.87667859999999","true"
"ChIJ19lHuVlt9DkRNv8fdLUcJAU","Rahish Ansari","Md Rahish Ansari, Kachho","23.8450421","85.87916539999999",""
"ChIJe6cB9qAW9DkR-UkzbbdE6lY","IndianOil","Ground Floor, Dhori, Makoli, Potso","23.7863349","86.0136704","true"
"ChIJQ9G5p6AW9DkRPCO8EjsVzp0","NAYARA PETROL pUMP/ Ms Ishwar Petrol Pump","Q2Q6+9WJ, Chapri","23.7884744","86.0122754","true"
"ChIJ6zeWwqEW9DkR6XCp0XD1XBY","Ganga Jagdish Filling Station","Q2M8+P9F, Makoli Road, Central Colony","23.7843182","86.0159319",""
"ChIJIT4oBVcX9DkR9yTJRJth9L0","Vishveshwar Fuels","Dumri - Bermo - Jaina Road, Chapri","23.796955","86.014372","true"
"ChIJFSPjGR8R9DkR0CxwAqIWhJo","Jawed AUTO Electrical","R2CM+H92, Birni","23.8213902","86.0333787",""
"ChIJgW_tLEcR9DkRAcz_PJ8I08o","IndianOil","Khata No 10, near Potso, Plot No 146, Nawadih, Bhalmara","23.8252866","86.0303261","true"
"ChIJf9Fm5TcR9DkRotFF3c_gNV4","IndianOil","Mouza No 78, Khata No 18, Plot No 151, Amlo, Birni","23.82092","86.041657","true"
"ChIJDbYVap8Z9DkRgyY8l3FJlso","Anand Kumar","Beliyatand, Narra","23.7852491","86.1075796",""
"ChIJibDgkpYZ9DkRcpQIMu6uvj0","Sunil Kumar","Nara Beliyatand, Near Chandrapura","23.78532389999999","86.11044419999999",""
"ChIJ2_HkZ9QR9DkR_-_f5VNoSmY","IndianOil","Plot No 1855 Chirudih, Block, Nawadih, Potso","23.843746","86.051166","true"
"ChIJUXbHlsIR9DkRIIQfcK_A9vA","Kuddush","Nawadih Main Road, Nawadih","23.8472761","86.0355911",""
"ChIJlXdFVz0a9DkRCNwWfh6jJRA","हिन्दु झटका मिट दुकान","R4C7+WQ6, Nawadhi Road, Telo","23.8222998","86.1143803",""
"ChIJKaQVIykR9DkRZfAWDt8sI2k","M.S Laxmi Fules.","Nawadih, Chirudih","23.8525308","86.04531209999999",""
"ChIJkSfsg7_Z9jkR-DdXoolU_do","IndianOil","Jb No 6, Nawadih, Plot No 470, Kanjkiro","23.8401756","85.862481","true"
"ChIJ3UN3VABt9DkRiSBoa4atNLE","Budgadda petrol pump","RVR6+8W9, BTPS Main Road, Burgara","23.8402291","85.8618479",""
"ChIJ8Xw29RcR9DkRymBo658A6DU","Krish Kumar","At, Nawadih, Po, Kharpito","23.875187","86.0241918","false"
"ChIJbVXT69wR9DkRl2zA6mwLNdo","Johar Petroleum","Ps Nawadih, Joharpetroleum Po Surhi Dist, Bokaro","23.8925868","86.0358724",""
"ChIJpTOVkNwR9DkRkvRqHcvpRNM","Bharat Petroleum","V2VP+4QW, Dumri - Bermo - Jaina Road, Surhi","23.8928735","86.0369466",""
"ChIJcbM7rXIR9DkRyuTxUH5LLlU","Hindustan Petroleum Corporation Limited","Ground Floor Nawadih, Phusro, Dumri Road, Surhi","23.89584099999999","86.039361","true"
"ChIJaQBqsJxV8TkR_2GCpulvjao","IndianOil","Ground Floor, Asurbandh","23.9150536","86.03749979999999","true"