place_id,name,address,latitude,longitude,open_now
"ChIJaWPzxSv79TkRX6Hj3RqAENM","IndianOil","Ground Floor, Ichagarh, Jaikan, Rola, Rola","22.72182699999999","86.115158","true"
"ChIJrzqiqI_l9TkRWwUTsZXqfNY","IndianOil","Ground Floor, Adityapur, Jamshedpur","22.7907933","86.14773819999999","true"
"ChIJPRUa9urk9TkRWN8Qbl_P0ic","Hindustan Petroleum Corporation Limited","Ground Floor, Adityapur, Jamshedpur","22.7900307","86.1523758","true"
"ChIJtRmLuj399TkRSkRAkUd8_ts","Hindustan Petroleum Corporation Limited","P, 1276/P, Khasra No 525, PN 1275, 1371/P, Shiv Nagar, Harharguttu","22.7620734","86.1810732","true"
"ChIJzc2wEIL99TkR037j81Bmwr0","Petrol Pump - Shiv Shiva","48-b, Harharguttu, Jugsalai, Jamshedpur","22.7621727","86.18113620000001","true"
"ChIJbd5ZKVHl9TkRromLaJkcA18","IndianOil","Ground Floor, Adityapur - Kandra Highway, Gamharia, Jamshedpur","22.799118","86.13029499999999","true"
"ChIJIzCTuDXj9TkRVS-fefytHxo","IndianOil","Ground Floor, Jugsalai, Jamshedpur","22.7698413","86.1972262","true"
"ChIJ_Z5bPu389TkR2yy4hJYFhos","IndianOil","Ground Floor, Rola, Sunder Nagar, Purihasa","22.73149","86.1967232","true"
"ChIJyQevry_j9TkRX9C2jhevjXQ","Bharat Petroleum","near Masjid, Burma Mines Road, Jamshedpur","22.775222","86.20772","true"
"ChIJ0wpzE2Xj9TkRBnOAo2R3Lv8","Hindustan Petroleum Corporation Limited","Ground Floor, Bistupur, Jamshedpur","22.7989519","86.1839411","true"
"ChIJTfwopNH99TkRdMWbAM4fAno","Shaw Small Emergency Fule","Uparkulitola, Haludbani, Parsudih, Jamshedpur","22.7412898","86.20727529999999",""
"ChIJT4tlgsb89TkRjCpdtWKouek","Sunder Fuels (B.P) Petrol Pump","Tata - Hata Main Road, Golpahari, Parsudih, Jamshedpur","22.75016149999999","86.20051989999999","true"
"ChIJHep1u1v89TkRU3vKd5tRb6c","Bharat Petroleum","India","22.7099785","86.2022528",""
"ChIJi3jxulv89TkRk89l0xzzlqQ","Deep & deep bpclPetrol Pupm","P652+XXJ, Tata - Hata Main Road, Kudada","22.7099532","86.20240609999999",""
"ChIJQ-xgEwD99TkR7h63pDd1adE","Hindustan Petroleum Corporation Limited","Ground Floor, Sunder Nagar, Tata - Hata Main Road, Kudada","22.70672649999999","86.2026197","true"
"ChIJ2Vuy7c789TkRRLpmd1A36D4","Hindustan Petroleum Corporation Limited","Ground Floor, Tata, Jamshedpur - Chaibasa Road, Karandih","22.757961","86.202294","true"
"ChIJY-PnWNf89TkRaiSnVdGwkpw","RAJENDRA & SONS Bharat Petroleum- Petrol Pump","Q636+PMQ, Cinema Road Parasuidh, Tata Nagar, Jamshedpur","22.7543386","86.2117229","true"
"ChIJgTscRlz99TkRwsFzn1qG4lE","Bharat Petroleum, Petrol Pump -Rajendra & Sons","Parsudih, Jamshedpur","22.7481174","86.2209316","true"
"ChIJUXLbeOLj9TkRWmfLrbyRvzQ","HP PETROL PUMP - SUPER ENERGY","Ground Floor, near Tatanagar, Railway Station, Burma Mines","22.7720566","86.2016579","true"
"ChIJ86EEV0Xj9TkRxaCJS8EQAcE","IndianOil","Ground Floor, near Rly Crossing, Jugsalai, Jamshedpur","22.7776429","86.1858963","true"
"ChIJK0hCyMT99TkR5wDRG2t8wQE","IndianOil","Khata No 41, P No 153, Agrico, Khukhradih","22.719006","86.23505399999999","true"
"ChIJEZ2hTSXj9TkRMkRN2I2g8yc","Hindustan Petroleum Corporation Limited","Ground Floor, near NML Gate, Burma Mines, Jamshedpur","22.7787044","86.2056381","true"
"ChIJm3WcQ13j9TkR45sNzp1X_kA","Hindustan Petroleum Corporation Limited","Ground Floor, J.J. Apartments, near Ram Mandir, Jamshedpur","22.7879881","86.1843557","true"
"ChIJi4t5KwDl9TkRF0ZBx2V76yY","Pan dukan chauk","Q5P9+J52, LIC Staff Colony, Aditypur Colony Site No 1, Adityapur, Jamshedpur","22.7865218","86.16787599999999",""
"ChIJBTLN1-zl9TkRlTr8ioeOYE4","Petrol","Railway Colony, Adityapur Basti, Adityapur, Jamshedpur","22.7864684","86.16724789999999",""
"ChIJyUFsWmDl9TkRuqdehWavzgQ","Bharat Petroleum, Petrol Pump -Kedia & Co","KARSAWAN, Adityapur, SERAIKALA","22.7856481","86.163186","true"
"ChIJ9VgqXqLk9TkRxnjNHv0qxUI","IndianOil","Ground Floor, BDR Furniture, Adityapur, Jamshedpur","22.7870124","86.1678055","true"
"ChIJjd7WzRfl9TkRAPK-dtlmXgA","IndianOil","Ground Floor, Adityapur, Jamshedpur","22.7866185","86.16596899999999","true"
"ChIJF9KX-2Hj9TkRsYsgi_amTVQ","IndianOil","Outer Circle Road, New Rani Kudar, Bistupur, Jamshedpur","22.7942671","86.175613","true"
"ChIJG5QjVgDj9TkR5BQrksLy7YA","Indian Oil","Q5VQ+W83, Tata Steel Plant Area, Jamshedpur","22.7947585","86.1882957",""
"ChIJ177XvoXj9TkRZMf_v9vhouQ","Bharat Petroleum, Petrol Pump -Ak Filling Station","PAMPARA, SERAIKALA KARSAWAN","22.7956258","86.1840943","true"
"ChIJG8S9T6z-9TkRTfTUG1s3f5o","IndianOil","Ground Floor Potka, Tata - Hata Main Road, Gitilata","22.6642104","86.1812782","true"
"ChIJiUERjcnj9TkR7sTEBFznBDA","Bharat Petroleum, Petrol Pump -Soni Sons","RO, near Hotel Natraj, Bistupur, Jamshedpur","22.7960387","86.1839334","true"
"ChIJr82w4uL99TkRH9gzqbi33-0","Bharat Petroleum Petrol Pump , SAI FUELS","Gadhra, Govindpur","22.7451967","86.2534231","true"
"ChIJm9kQ7Oz99TkRTNWQvgDL_FU","Abhishek","Ana Chowk, Chhota Gobindpur","22.7608848","86.24776229999999",""
"ChIJjbbzeAD99TkRD5LBNpydflE","Chota Gobindpur bharat petroleum","P7V4+X43, Khankripara, Jamshedpur","22.744642","86.25495",""
"ChIJwxF_UrLi9TkRG3JS1KGZbRg","Bharat Petroleum, Petrol Pump -Red Carpet Service Station","P.O, Telco Colony, Jamshedpur","22.7704084","86.244103","true"
"ChIJdfsOyFT49TkRsxDg7KZk_8U","IndianOil","Ground Floor, Hata Chaibasa Road Rajnagar, Hensal, Kutum","22.7525538","86.25414529999999","true"
"ChIJOVvvEfUH9jkRaqYLIEVXwxc","IndianOil","Janta Market, Gobindpur, Housing Colony, Chhota Gobindpur","22.7452759","86.2581043","true"
"ChIJ0yxhiebi9TkR3MAY8x-0y5o","IndianOil","Ground Floor, Tuiladungri, Jamshedpur","22.7958677","86.2120715","true"
"ChIJD6QFR2jj9TkR5PBviefpkzY","Bharat Petroleum, Petrol Pump -Green Park Service Station","P.O. GOLMURI JAMSHEDPUR, SINGHBHUM EAST","22.7897978","86.2253075","true"
"ChIJmd34RObi9TkRZBH3UG_VvKg","Hindustan Petroleum Corporation Limited","Ground Floor, Golmuri, Jamshedpur","22.7939341","86.22441429999999","true"
"ChIJl6bipWoH9jkRmSRxLtWvwD4","MAA SHERAWALI FUELS Bharat petroleum","Unnamed Road, Khankripara, Jamshedpur","22.7348461","86.2629285","true"
"ChIJ-5PhwasH9jkRhw5_4WMhuuo","BPCL M/s Manglik Hariom Fuels","P735+JWW, AEC Complex, Hartopa","22.7042979","86.2591221",""
"ChIJCZh8L3AJ9jkRNL_3rnhdv7Y","M Z ENTERPRISES","Q7C6+5PR, TELCO BARINAGAR, near Sri sri jyotiling Shiv Mandir, Jamshedpur","22.7704912","86.26176269999999",""
"ChIJ3dJGIKzi9TkRkMEf3Pppjig","IndianOil","Ground Floor, Ring Road, Telco Colony, Jamshedpur","22.7725744","86.2500309","true"
"ChIJlXeP65EJ9jkRqCN_IzSPv3s","Bharat Petroleum Petrol Pump , SHAKUNTALA & SONS","Ghorabandha, LOHABASA","22.770485","86.271106","true"
"ChIJC1_LkAsI9jkRJoIF2q8pGXA","IndianOil","Ground Floor, Luabasa, Ghorabandha, Jamshedpur","22.7719799","86.273614","true"
"ChIJB4Yf3WwH9jkRRmNWrwPnrA4","Bajal KSK","M7VM+676, Rajdah","22.6926985","86.2834584","true"
"ChIJOx7iGAEJ9jkRFpSeft6pbyE","Bharat Petroleum Petrol Pump , AASTHA AUTOMOBILE","HURLUNG, Jamshedpur","22.783755","86.270366","true"
"ChIJDQKpls0J9jkR9bCFZdJzhB4","Bharat Petroleum","Q7Q9+CG3, Unnamed Road, TRF Colony, Baridih, Jamshedpur","22.7885017","86.2687814","true"
"ChIJTfhCABcI9jkRnRF1lMaInyU","Birsanagar Petrol Pump","Astha twin city road, Lal tand, near B.ED College, TRF Colony, Baridih, Jamshedpur","22.788528","86.268845",""
"ChIJ1XYMyJXi9TkRh_VT91ptz7o","IndianOil","Ground Floor, Baridih, Jamshedpur","22.7925061","86.2399001","true"
"ChIJF0OoZFYJ9jkRnSRIm7O4VPc","M/S K. Mohan Babu Fuel Station","Q7QV+4C8, Hurlung","22.7877324","86.2931536",""
"ChIJA9PbF2EI9jkRccXUyuw_6OE","भारत पेट्रोलियम","India","22.7876572","86.2933158",""
"ChIJzfPfFYbj9TkRZ3HcZSC2Z2o","IndianOil","Car Care Centre, Golmuri, Jamshedpur","22.794717","86.22348099999999","true"
"ChIJP_vWCwXl9TkRePA7a-vL1bs","Hindustan Petroleum Corporation Limited","Ground Floor, SH 40, Industrial Area, Adityapur, Assangi","22.8020254","86.1255985","true"
"ChIJUWxu8Ybl9TkRbzFDcXOSGeg","Bharat Petroleum Petrol Pump","Tata Kandra Main Road, Chota Gamharia","22.8190569","86.097177","true"
"ChIJyX5xAd7u9TkRkm1k2zpMJAk","IndianOil","Ground Floor, Bikanipur","22.8336967","86.0483658","true"
"ChIJCX3cTgDl9TkR05u-ghspVgc","Hindustan Petroleum Corporation Limited","Khata No 085, NH 116, Shridungri, Jamshedpur","22.8037367","86.12428969999999","true"
"ChIJS2k4DwXl9TkRXtjvYXFEkEU","Bharat Petroleum- Petrol Pump","R42G+QCX, Adityapur Area, Gamharia, Jamshedpur","22.801993","86.126114",""
"ChIJp2uXQgDl9TkRHXQ6fAdO9wk","Bharat petroleum","R474+46Q, Gamharia, Jamshedpur","22.8128335","86.10561589999999",""
"ChIJW__XqOnk9TkRuq0oY5vttRI","IndianOil","Ground Floor, near Adityapur, SH 40, Tata Kandra Road, Industrial Area, Gamharia, Jamshedpur","22.8137864","86.1041171","true"
"ChIJ-5Tw8Mfv9TkRwoiahqB35KQ","IndianOil","Ground Floor, Gamharia, Kalikapur","22.8257935","86.0908142","true"
"ChIJ0f26OwDj9TkRwNtWGMLkKsM","Gail cng pump","R554+5QX, Jamshedpur","22.8079996","86.1569842",""
"ChIJTavVRozk9TkRPILfQRIc2ws","Hindustan Petroleum Corporation Limited","Ground Floor, Bhatia Basti, Kadma, Jamshedpur","22.8042209","86.158351","true"
"ChIJ6YmGMDXv9TkRVu9mS99wXlg","Bharat Petroleum, Petrol Pump -Nav Bharat Petroleum Company","RAMCHANDRAPUR, Gamharia, Jamshedpur","22.8321663","86.0794664","true"
"ChIJDf_RuYXk9TkRfIRhreEBaPs","Bharat Petroleum Petrol Pump","Kadma, Jamshedpur","22.8048073","86.16703679999999",""
"ChIJpeHm43rk9TkRM2VhwJv0lE0","Hindustan Petroleum Corporation Limited","Ground Floor, Kagal Nagar, Sonari, Jamshedpur","22.8215669","86.1665688","true"
"ChIJyT7HLu7j9TkRtR_fL_qvQiU","IndianOil","Ground Floor, Dhatkidih, Jamshedpur","22.8037647","86.1794202","true"
"ChIJE85adpTj9TkR21IzCvc71mM","DCU,Sonari","R5FH+HX2, New Kapali Basti, Ballichela, Sonari, Jamshedpur","22.8238856","86.1799039",""
"ChIJu1z8aYPj9TkRUsToYsPeInA","IndianOil","Circuit House Area, Bistupur, Jamshedpur","22.8177439","86.18383949999999","true"
"ChIJ8UIhqhzk9TkRgaRTl92kG_4","Bharat Petroleum","V537+JV4, Kanderbera Road, Dobo","22.854022","86.16470129999999",""
"ChIJXTYHR6fl9TkRw20Zv0-YK8M","HLM Automobile","V537+JVG, Kanderbera Road, Dobo","22.8540715","86.1647134",""
"ChIJB28d7avj9TkRdh5IWDdl6gM","IndianOil","Ground Floor, Chowk, Mango, Jamshedpur","22.8189689","86.2120443","true"
"ChIJH-61Sk7i9TkRhqK7IIWsvyo","IndianOil","Gour, Tarabati, Mango, Jamshedpur","22.8272079","86.2232494","true"
"ChIJe-Mmnsbj9TkR-c434oemftU","IndianOil","Purulia Road, Chepapul, Kapali, Jamshedpur","22.84287299999999","86.201996","true"
"ChIJHeg3mcjj9TkRLiEnlwQ1stE","Petrol Pump","2, Purulia Road, Mango, Jamshedpur","22.8412607","86.20618069999999","true"
"ChIJFSaOccrj9TkRV9Nv8-yQSyU","IndianOil","Road Number 14, Jawahar Nagar, Mango, Jamshedpur","22.837811","86.212448","true"
"ChIJW80fydvj9TkRGHIuSY_ZB18","IndianOil","Ground Floor, NH 33, Pardih Chowk, Mango, Jamshedpur","22.8535609","86.2028711","true"
"ChIJA2lJjMrj9TkRm7mJn6M1JsM","Mishra & Co.","2, Sakchi, Jamshedpur","22.8087006","86.2010968",""
"ChIJTTpbjG_j9TkRVnTp_b83nkY","Bharat Petroleum, Petrol Pump -Sri Sai Filling Station","SNP Area, Sakchi, Jamshedpur","22.8051439","86.2028953","true"
"ChIJUW10SAnj9TkRs7o4zmehzlk","IndianOil","Ground Floor, Sakchi, Jamshedpur","22.8077933","86.2018475","true"
"ChIJM9Nr_g7j9TkRCQowKOz7nbg","Hindustan Petroleum Corporation Limited","Ground Floor, Sakchi, Jamshedpur","22.8046854","86.20323300000001","true"
"ChIJB22hlXbj9TkRZPsLwnThwJ8","Suraj automobiles","Dhalbhum Club Ground, SNP Area, Ambagan, Sakchi, Jamshedpur","22.8097668","86.2038039",""
"ChIJ35sxyRrj9TkRAQ0Xg7gIDRw","Hindustan Petroleum Corporation Limited","Ground Floor, New Kalimati Road, Sakchi, Jamshedpur","22.800729","86.207364","true"
"ChIJ5TH3PXHj9TkRIV33wqqmCTc","GAIL CNG R.K Jain Filling Station","Q6W6+XJW, New Kalimati Road, Hirasingh Bagan, Sakchi, Jamshedpur","22.7974928","86.2115913",""
"ChIJJc2Zqvbj9TkR4WGDyKXBrDw","Hindustan Petroleum Corporation Limited","Plot No 3645 3642 & 3621, Old Purulia Road, Mango, Jamshedpur","22.8208194","86.20450559999999","true"
"ChIJATZPZ_bj9TkRr7iPwQ3Ejvs","Gourav","Ashoka Tower, 306, Kumar Basti, Mango","22.8210348","86.2096893",""
"ChIJmzjkDqzj9TkRZivGWCW1fiY","Bharat Petroleum","Near, The Second Subarnarekha Bridge, Jamshedpur","22.81983","86.2115879","true"
"ChIJreuosxXj9TkRclzQtSJwn2s","SAPNA PRINTER","Bhuiyadih, Jamshedpur","22.8065754","86.2214944",""
"ChIJxz0gLQDj9TkRP8od6s803hE","Indian Petrol Pump","R6J2+GQV, Road Number 12, Zakir Nagar, Mango, Jamshedpur","22.8314519","86.201983",""
"ChIJ8Ro3JgDj9TkRjyAI1IFAXxI","Majhi petrol pump","R6J2+JRM, Old Purulia Road, Zakir Nagar, Mango, Jamshedpur","22.8315999","86.2020343",""
"ChIJ7-iSFgDj9TkR8f_YR_7F1H8","RELIANCE TRANSCONNECT","R6F9+394, Dimna Road, Subhash Colony, Mango, Jamshedpur","22.8226449","86.2184618","true"
"ChIJ2dNjSe7i9TkRnHI-Ap43wSA","Sidhgora Bharat Petroleum (B.P) Petrol Pump","Sidhgora, Jamshedpur","22.8002487","86.22893069999999","true"
"ChIJPba2k7Xj9TkR3AsIjMjl80c","Hindustan Petroleum Corporation Limited","Ground Floor, Mango, Jamshedpur","22.83607049999999","86.2121849","true"
"ChIJH4EwcIzj9TkRv2iTRmUKzXE","Raza Petroleum","Hashmi Mohalla, Road No 1, Silpahari","22.8447259","86.1908579",""
"ChIJzR3mOKzj9TkR0zGxvVbsTj4","Hindustan Petroleum Corporation Limited","Ground Floor, Dimna Road, Shankoshai, Mango, Jamshedpur","22.8272944","86.2232523","true"
"ChIJZwECzzDj9TkREUd4Ib2Ljjg","FIROZ TRADERS","FIroz Traders, 1, Road Number 16, Jamshedpur","22.8403111","86.20906",""
"ChIJndv8Wibj9TkRC7m8gkDRiVE","Bharat petrol","R6HF+6G8, Adarsh Nagar, Mango, Jamshedpur","22.8281665","86.2239647",""
"ChIJ8fGb2bkI9jkReJqBSx-_dpg","IndianOil","NH 33, Silpahari","22.788429","86.327332","true"
"ChIJLTtlQwDj9TkRQHE-WoHAs1A","Hp gas godown","R7H3+HX6, Deoghar","22.8289093","86.25488849999999",""
"ChIJY3oeaGTj9TkRPTd6ivc0J-Y","Bharat Petroleum Petrol Pump , BP-BALIGUMA","NH-33 BALIGUMAP.O. M.G.M. COLLEGE, 146, Ashiana Suncity, Mango, Jamshedpur","22.83396","86.24291199999999","true"
"ChIJMcmMQknj9TkRNDW8jzq9wdM","IndianOil","Bypass Road, Chowk, Argora, Ranchi","22.828751","86.22435399999999","true"
"ChIJL4-iPEDi9TkRHb182QOx410","Hindustan Petroleum Corporation Limited","Ground Floor, Dimna Chowk, Mango, Jamshedpur","22.8358065","86.23524560000001","true"
"ChIJVyHsf6wJ9jkR7bk48Zo02mU","IndianOil","NH-33, Bhillaipahari, Jagannathpur","22.81813900000001","86.29198699999999","true"
"ChIJcYpipcjj9TkRLJ1bY1-NNyY","Yash Petroleum","Shree Complex, Mango, Jamshedpur","22.8335778","86.2274442",""
"ChIJIeXmJPjj9TkR6DST9BPsGF4","IndianOil","Transport Nagar, Mango, Jamshedpur","22.8343497","86.2284526","true"
"ChIJ3w3y3Yfj9TkRLG9xQpmyvrU","IndianOil","Transport Nagar, Mango, Jamshedpur","22.835953","86.228111","true"
"ChIJueC5R2Dj9TkRkwwf5yWg9rs","भारत पेट्रोलियम, पेट्रोल पम्प - रमेश कुमार जैन","Pardih Chowk, Kumrum, Mango, Jamshedpur","22.839613","86.2254019","true"
"ChIJ2Qe4q9Xu9TkRFujXrZM4mfc","Petrol Pump","V332+G7R, Kandra","22.8538728","86.0506497",""
"ChIJEd1CLFTo9TkROacY5pK_jZE","JOHAR PETROLEUM, MANIKUI JHARKHAND INDIA","W355+725, Chandil - Kandra Road, Manikui","22.9081271","86.0575992",""
"ChIJSVRfBPPm9TkRp2Zby0iOqTM","Hindustan Petroleum Corporation Limited","Ground Floor, NH 33, Chandil, Kanderbera, Tilla","22.885771","86.14175589999999","true"
"ChIJT6v14S3m9TkR9NZg4QUiFyI","Hindustan Petroleum Corporation Limited","Ground Floor, NH 33, Chandil, Chilgo","22.9002588","86.1030676","true"
"ChIJCWPPS1vn9TkRJbSMhypClaw","Bharat Petroleum, Petrol Pump -Subarnarekha Automobiles & Service","KANDERBERA, JAMSHEDPUR, SERAIKALA KARSAWAN","22.884775","86.1484554","true"
"ChIJUedqTyvm9TkRAAAAMNeeKwg","HLM FUEL STATION","W34X+47Q, NH-33, Chilgo","22.9053319","86.0982195",""
"ChIJPwjKPlLn9TkRrb1CR2-LRBo","Bachmann fuel Bharat petroleum","W34X+47V, Karnidih","22.90537059999999","86.0981678","true"
"ChIJL41FLQDn9TkRnpiPC93g5X0","Dalma service station","V5M2+QRW, Kandarberya","22.8844867","86.1520761",""
"ChIJYZ_pU4Dn9TkRH-5Uz5yho0U","IndianOil","Ground Floor NH 33, Chandil, Kanderbera, Adardih","22.8845926","86.152192","true"
"ChIJU1lQg1Pp9TkRmhONi6X2b4U","Kandra Filling Station, Seraikela, Jamshedpur","opposite Nilanchal Power & Iron Ltd, Kandra Chowka Rd, Kandra, Ratanpur Mauza, Jamshedpur","22.8729758","86.06156779999999","true"
"ChIJy57C8snl9TkR_NXk8DNp2C0","Hindustan Petroleum Corporation Limited","Khata No 218, Plot No 103, Kanderbera Road, Chandil, Dobo","22.8535923","86.16585839999999","true"
"ChIJyWsK2Hno9TkRmuQj3YEwHR4","Indian Oil","W39R+259, National Highway 18, Bhadudih","22.9175351","86.0904815",""
"ChIJ-9KwEtTo9TkRp3ilXavtD2M","Hindustan Petroleum Corporation Limited","Ground Floor, near Telephone Exchange, Chandil Road, Kandra","22.86185679999999","86.0572543","true"
"ChIJiUjY09fu9TkR9UwDZkuqu3E","IndianOil","Ground Floor, Bazar, Main Road, Hudu","22.84778399999999","86.052475","true"
"ChIJT7PBbNbh9TkR9vrkz-rLJjo","Reliance Petroleum","NH-33, BESIDE MOTEL HIGHWAY, VILLAGE ANBONI, POST OFFICE, DISTRICT: SARAIK, Kandarberya","22.8788403","86.1790867","true"
"ChIJqXQbT0nh9TkR8QzzHUMVC68","Kartik Oran Service station IOC Pump","Asan Bani","22.8786844","86.181105","true"
"ChIJUZoP4Qrh9TkRzruD0gk4Afw","Jio-bp","Ground Floor Kanderbera, Beside Motel Highway, Nh 33, Anboni, Tilla","22.878417","86.183028","true"
"ChIJtVvM2Wzo9TkR9O5AukJZPzk","Hindustan Petroleum Corporation Limited","Ground Floor, NH 33, Humid","22.9282066","86.0805029","true"
"ChIJv66hx1jp9TkRwSblP3uwSKU","IndianOil","Ground Floor Chota Lakha, Adardih","22.9137619","86.0541052","true"
"ChIJLSjQtUPh9TkRGf_EL73zW_8","IndianOil","Ground Floor, Asan Bani","22.876592","86.192163","true"
"ChIJN6WWBl3h9TkRbdoRbw2P7z8","Asan Bani Highway Services (TCI Petrol Pump)","NH 33 Asanbani PO Kanderbera Chandil, Jamshedpur","22.8750387","86.1958666","true"
"ChIJk8A_LGjh9TkRnoTPYJNSOGo","Bharat Petroleum","V5GW+39F, National Highway 18, Asan Bani","22.8751915","86.1959187",""
"ChIJH_bZhwHh9TkRBjOFfLMVI3A","IndianOil","Ground Floor NH 33, Saraikela Kharsewa, Fazlugora","22.86469","86.2019834","true"
"ChIJZxBkpnTj9TkRDD4cJtx_QeY","GAIL india CNG Station","V633+J59, National Highway 18, Kumrum, Mango, Jamshedpur","22.8540492","86.2029961",""
"ChIJ0SM-ds7j9TkRIRaKJzilP6M","M/S Pride Fuels","NH-33, Pardih Chowk, Kumrum, Mango, Jamshedpur","22.8470011","86.2107565","true"
"ChIJKyxTBTQK9jkR_aGV2xHkwZc","IndianOil","Ground Floor, Bhuiyasinan, Bara Bangurda","22.8813721","86.2925824","true"