place_id,name,address,latitude,longitude,open_now
"ChIJ3eniYzF6GTkRxFA3-e6xxv4","Nayara Petrol Pump","GRX9+8V5, Amritsar","31.5482567","74.8197199","true"
"ChIJf8492ul5GTkR0YZWb1By-GM","IndianOil","Jhabal Mannan","31.5076798","74.79597799999999","true"
"ChIJa6rjTkhlGTkRBOWjKQ8gfqk","Hindustan Petroleum Corporation Limited","Ground Floor, Grand Trunk Road, Chheharta, Amritsar","31.628301","74.80200099999999","true"
"ChIJk0m1UGZ7GTkRebHEIKjeoY0","IndianOil","Ground Floor, Grain Market, Bhagtanwala, Mule Chak","31.6015333","74.8650799","true"
"ChIJ95LQFjdlGTkRqt035tHhRaA","Bharat Petroleum Petrol Pump","JRH5+Q5H, G.T. Rd, Near Khandwala, Modren Colony, Chheharta, Amritsar","31.62942799999999","74.8079829","true"
"ChIJERjLBlR7GTkR31HWS9jUxjs","Bharat Petroleum Petrol Pump , RANDHHWA FILLING STATION","BOHRUBOHRU, Amritsar","31.55756899999999","74.826149","true"
"ChIJIbmi7617GTkRa_IAApV_8HM","Hindustan Petroleum Corporation Limited","Ground Floor, Ibban Kalan","31.568144","74.8321174","true"
"ChIJFyVIHHdwGTkR7uxxkvbpAQY","IndianOil","Ground Floor, Chehratta Baba Budha Road, Chheherta, Basarke, Amritsar","31.58548699999999","74.776787","true"
"ChIJLS8vRwB7GTkRXXsoGsd8ksw","Dr Parminder Singh Dhillon","HQWW+VPQ, Khapar Kheri","31.596971","74.796796",""
"ChIJ06wk7mlxGTkRYcbXJklPLsI","IndianOil","GF, Chheharta Baba Budha Ji Sahib Road, Chheherta, Dhand","31.549366","74.758934","true"
"ChIJIy-7YeBxGTkRO5x2NwuNhX4","Raju Kisan Sewa Kandar","Asr, Dhand","31.546888","74.7589548",""
"ChIJP4Cb96V6GTkRDtSlPGB0Qzc","IndianOil","Ground Floor Basarke Chirata, Chabal Road, Chheharta, Amritsar","31.606417","74.787453","true"
"ChIJsUReYxR7GTkRt-xniK13d9k","IndianOil","Ground Floor, Bus Stand, Chabbal Rd, Bharariwal, Amritsar","31.597883","74.847602","true"
"ChIJVbQV9hR7GTkRrHjigR9PwKk","Hindustan Petroleum Corporation Limited","Ground Floor, SH 21, Amritsar - Khem Karan Road, Mule Chak","31.59904279999999","74.8477801","true"
"ChIJ9V0PfrN6GTkR6BNlG2r8QEQ","Hindustan Petroleum Corporation Limited","near Gurudwara, Ground Floor Chheharta, near Gurudwara, Guru Ki Wadali, Amritsar","31.6165027","74.7980231","true"
"ChIJM6-HY616GTkRp7MT_US8MdI","HP Computer","India","31.616338","74.7918637",""
"ChIJzQ5koE53GTkR7nNFNzso8W8","IndianOil","GQC7+2PJ, Chettaha Road, Mianpur","31.520087","74.7642704",""
"ChIJt4pLPT97GTkRbOf3CKORh7w","Hindustan Petroleum Corporation Limited","Ground Floor, Dam Gunj, Bharariwal, Amritsar","31.6070312","74.84871179999999","true"
"ChIJAT2Uvkt7GTkR8D8v1Xl9jlY","JAMMU FUELS ,New Essar Petrol Pump","Road, Hakima Gate, Bharariwal, Amritsar","31.6061309","74.8572192","true"
"ChIJH2dolpp7GTkRBEM0DuA8Jw0","Hindustan Petroleum Corporation Limited","Khasra No 631Min, Chabal Road, Khazana Wala Gate, Amritsar","31.6124467","74.851317","true"
"ChIJ6UwuJgB7GTkRFcO4I9u0qbg","S.R Filling Station","JV72+4GC, Chabbal Road, Indra Colony, Amritsar","31.6128112","74.8512774",""
"ChIJV3luV957GTkRNmMjKYZaOEg","Hindustan Petroleum Corporation Limited","Ground Floor, Dhapai Road, Dhapai, Amritsar","31.6144799","74.8493202","true"
"ChIJf1rqpfhvGTkR5CCtFuzB7ZA","Nayara Energy - VJ Filling Station","near Krishna Mandir, Grand Trunk Road, Naraingarh, Chheharta, Amritsar","31.6270239","74.78538759999999","true"
"ChIJd3lAxFdlGTkRjx2UJOYEhAA","IndianOil","143105, Shri Guru Amar Dass Nagar, Chheharta, Amritsar","31.6262652","74.7815166","true"
"ChIJnTKbFjdlGTkR8keErESOlLM","Shri Guru Hargobind FILLING STATION","India","31.6295543","74.8080789",""
"ChIJP_9lHRFlGTkRdMnJLbPe9Ko","Hindustan Petroleum Corporation Limited","Ground Floor, Kot Khalsa Road, Amritsar","31.625796","74.8294204","true"
"ChIJWX5Xnl55GTkR9AUPB2Gd8VA","IndianOil","Aim, Ground Floor Amritsar, Road, A Kalan, Chabal Kalan","31.498634","74.790858","true"
"ChIJI8VdDG9lGTkRb4he4d3Vu1g","IndianOil","Ground Floor, opposite OCM Mills, Khandwala, Amritsar","31.62989249999999","74.81170039999999","true"
"ChIJ19QqegBlGTkRKOfPknM_-w8","Petrol Pump","shri guru hargobind filling station, gt road, chowk, Khandwala, Amritsar","31.63005369999999","74.816075",""
"ChIJayKS2i9lGTkRrJaYYAD0gvw","Hindustan Petroleum Corporation Limited","Ground Floor, Rayon & Silk Mill, near Maya Cinema, Grand Trunk Road, Amritsar","31.630291","74.816221","true"
"ChIJvSPzfCplGTkR_k5as6LWt8U","IndianOil","Sher Shah Suri Road, Ghanupur, Khara","31.6322362","74.8032234","true"
"ChIJn-pC72BlGTkRm8a8AeTwMJE","Petrol Pump","Model Town, Amritsar","31.6304553","74.824163",""
"ChIJrehtEk97GTkR7OOxW2t1e0w","IndianOil","Ground Floor, Chabal Road, Amritsar","31.616663","74.85876499999999","true"
"ChIJZxF_Ek97GTkRNeSY94tIeOA","Bedi service station","Bedi Service Station, Chabal Road, Khazana Gate, Dharamkanda, Amritsar","31.6167574","74.858747",""
"ChIJ-eDh5pp8GTkR5a9KvraBFCU","IndianOil","opp. ent hospital, Ground Floor Tarn Taran Road, opp. ent hospital, Majitha road, Amritsar","31.5974968","74.88331649999999","true"
"ChIJHQPaMC98GTkRvqgGVwb3NsE","IndianOil","Ground Floor, near Khalsa College, Varpal","31.54976","74.911093","true"
"ChIJMRdR4ph8GTkRbYQOE1QFo7Y","IndianOil","Ground Floor, Amritsar-Tarn Taran Road, Amritsar","31.604599","74.881546","true"
"ChIJy_u9QOp8GTkRkEFfZaMz8y8","Bharat Petroleum Corporation Limited-Sharda Power Point","Near Canal, Main Sultanwind Rd, Kapoor Nagar, Amritsar","31.607571","74.901811","true"
"ChIJFcrQpL58GTkRXTIr8PRCgng","IndianOil","Ground Floor, Sultanwind Road, Amritsar","31.612801","74.892303","true"
"ChIJLQDBSbh8GTkRJnmSd6K4WCw","IndianOil","Ground Floor, 100 Feet Road, Amritsar","31.618019","74.895021","true"
"ChIJM_8-1lN7GTkRK2yoUd9os94","Petrol bebra","JVC8+M87, Khai Mohalla, Amritsar","31.6216738","74.8658019","true"
"ChIJCUAPW7B8GTkR4fCl19-flZ0","Bharat Petroleum - Sharma Filling Station","JVCQ+67J, Chamrang Road, Guru Ravi Dass Marg, East Mohan Nagar, Ajit Nagar, Katra Ahluwalia, Amritsar","31.62059","74.8881459","true"
"ChIJzWfFkPZkGTkRjLgJ1iJRfXc","IndianOil","Ground Floor, Airport Road, Amritsar","31.6229337","74.8788227","true"
"ChIJuUe9A658GTkRdEEO25SUpTE","Bharat Petroleum","Ghee Mandi, Guru Ram Das Market, Baghramanand, Amritsar","31.6235072","74.8855872",""
"ChIJ9fp67cV8GTkRWZ7JMwlRFtc","A H Padam Petroleum","Grand Trunk Road, Rajinder Nagar, Maqbool Pura, Amritsar","31.619154","74.906611","true"
"ChIJ54iNmMh8GTkRqXdk8Jj8tTk","Bharat Petroleum Energy Station Mela Ram and Sons GT Road","Grand Trunk Road, Sant Avenue, Pratap Nagar, Amritsar","31.620851","74.901861","true"
"ChIJdXIlMdt8GTkR1DNBiBgGK7M","IndianOil","near Olivia International School, Grand Trunk Road, Sultanwind, Amritsar","31.618294","74.90946199999999","true"
"ChIJeW_G8d98GTkRNIFH4buS8fE","IndianOil","Ground Floor, Grand Trunk Road, INA Colony, Amritsar","31.612438","74.920478","true"
"ChIJzbxWIKpkGTkRzEKx20xR8nU","Petrol Pump","Hathi Gate, Katra Ahluwalia, Amritsar","31.6333967","74.87247789999999",""
"ChIJJz-AHKlkGTkRzSWf9C26raA","Bharat Petroleum Petrol Pump","Court Road, INA Colony, Amritsar","31.6338998","74.8718688","true"
"ChIJJ135LbZkGTkR4mjn1S9YAEE","IndianOil","near Railway Workshop, Cherrata Road, Putligarh, Amritsar","31.63318099999999","74.851227","true"
"ChIJ5YytHbFkGTkRkNK4P5MhEZg","Hindustan Petroleum Corporation Limited","Ground Floor, opposite Sadar Police Station, Rani Ka Bagh, Amritsar","31.6346147","74.8585721","true"
"ChIJWwBvKRN8GTkRpa-SqIDaQ1w","Hindustan Petroleum Corporation Limited","Ground Floor, Amritsar-Tarn Taran Road, Chabba","31.5625777","74.8891995","true"
"ChIJYRRaF7V9GTkRNv03WMm6CB8","ESSAR NAMDHARI PETROLPUMP","HVFP+GPP, Barnala - Amritsar Bypass Road, Gurwali","31.5738436","74.88684219999999","true"
"ChIJk5ew9G98GTkRxHA6zhuEEEg","NAYARA","India","31.5737435","74.8872181",""
"ChIJ3xi2vw99GTkR3fSQDHtUsgg","IndianOil","Ground Floor, Amritsar-Tarn Taran Road, Gurwali, Bagrian","31.576977","74.887344","true"
"ChIJQzNNPJB_GTkRHc0X76sJRc0","Bharat Petroleum, CNG ,Petrol Pump -Shri Guru Arjan Dev Filling Station","BALACHAK, Tarn Taran Sahib","31.5474364","74.8906703","true"
"ChIJtco4hzF9GTkRvXToviD-Gis","Hindustan Petroleum Corporation Limited","Ground Floor, Amritsar-Tarn Taran Road, Kot Mit Singh, Amritsar","31.589327","74.8845338","true"
"ChIJ5Q22tqZ8GTkRBeOeiloNyZc","Hindustan Petroleum Corporation Limited","Ground Floor, Inner Circular Road, Cantt, Amritsar","31.6122592","74.8787447","true"
"ChIJbQTv1w99GTkRF91qFaIO5xM","IndianOil","Ground Floor, Wind Bypass, Sultanwind, Amritsar","31.607633","74.90251959999999","true"
"ChIJfZIRKal9GTkRmHPc2G-SLsY","SAHOTA 2.0","JW45+G28, pind patti balol di dist, Sultanwind, Amritsar","31.6062859","74.907572",""
"ChIJVVVVVcB-GTkRDQVHN0d4nsQ","IndianOil","Ground Floor, Bus Stand, near Amritsar, Nh 54, Old NH 15, Gohalwar","31.514736","74.89446099999999","true"
"ChIJKRX5qzF7GTkRCchs5U8igW0","Pollution check center","M8/4266, Gurbax Nagar, Khazana Wala Gate, Amritsar","31.617937","74.8590109",""
"ChIJ_X5mSsJ-GTkRKyu2ev46AXs","Hindustan Petroleum Corporation Limited","Ground Floor, Thathi","31.5121584","74.89478720000001","true"
"ChIJrf8BF057GTkRSxUglHbHnF4","IndianOil","Ground Floor, Bakkar Mandi, near Lahori Gate, Amritsar","31.619869","74.8614889","true"
"ChIJJ8EJNgZ7GTkRfiX0lFKZCnw","Bharat Petroleum & CNG","Beri Gate Market, Amritsar","31.6217056","74.8657116",""
"ChIJYylQ2LF8GTkRrBqx0uoHUAw","Goldy Service Station","Shop No. 246 A, Ghee Mandi, New Kaulsar Market, Katra Ahluwalia, Amritsar","31.62207199999999","74.8859459",""
"ChIJyRgXc0x7GTkRmeGAS2zbeXA","IndianOil","Jwala Flour Mill, Daimganj, Nawan Kot, Amritsar","31.621872","74.857033","true"
"ChIJU7tSc9x8GTkRGHUlxzJ8a6I","IndianOil","Ground Floor, near Tarn Taran, Grand Trunk Road, Wala, Amritsar","31.61587099999999","74.91366599999999","true"
"ChIJtWsRF6B9GTkR5UcSAnzWZRg","IndianOil","near SSSS School, Vallah Road, near SSSS School, Chowk, Maqbool Pura, Amritsar","31.6215899","74.9032094","true"
"ChIJXT3qlZN9GTkR6nbS1cVwrvg","Bharat Petroleum","Grand Trunk Road, Transport Nagar, Golden Avenue, Amritsar","31.6248766","74.8942972",""
"ChIJx7gMIq18GTkR0P6zsy3xf_o","IndianOil","Ground Floor, Outside, Mahan Singh Gate Road, City Centre, Amritsar","31.6280606","74.8830971","true"
"ChIJv4_KobN8GTkR3pc_AABl0fY","Hindustan Petroleum Corporation Limited","Ground Floor, Grand Trunk Road, Ram Talai, Amritsar","31.6271268","74.8901214","true"
"ChIJSyDX7L59GTkRMAASWWQDvFI","Mitul Mehra","A-84-A, New, New Amritsar Colony, Amritsar Cantt.","31.6134458","74.92273300000001",""
"ChIJgSSTBmJ9GTkRwpCi5yCGd-M","Nayara Petrol Pump-Narayan Filling Station","opp. Ram Mandir, Grand Trunk Road, Ram Talai, Amritsar","31.6277776","74.89031969999999","true"
"ChIJJ_93bbN8GTkRRqJ3x9OK1sw","mata lal devi fillibg station","15/15, Ram Talai, Sharifpura, Amritsar","31.6280887","74.8903656","true"
"ChIJqdGTf7F9GTkRJIqVJ-2i3uc","Yugraj Singh 1999","Yugraj Singh 1999, Batala","31.6289891","74.8917872",""
"ChIJoU8_b6xkGTkRrrB5kjqu9Ls","HP PETROL PUMP - RAJKUMAR AND COMPANY","Ground Floor, Fort Road, Goal Bagh, Amritsar","31.63094189999999","74.8671978","true"
"ChIJL3LQM6VjGTkRVdwPtZXOYRk","Bharat Petroleum, Petrol Pump -Mela Ram & Sons, A/C G T Road","GT ROAD ASR CITY,AMRITSAR, Amritsar","31.631935","74.8814627","true"
"ChIJf1Zkj3RjGTkRkPlP39k3fVE","IndianOil","Ground Floor, Kot Atma Singh, Amritsar","31.6323512","74.8803501","true"
"ChIJmUVkHhJ9GTkR_vPSYCthXZ0","IndianOil","Ground Floor, Grand Trunk Road, Amritsar","31.603496","74.93843","true"
"ChIJFzE9cEl9GTkR29m5mzk9iCA","Hindustan Petroleum Corporation Limited","Ground Floor, Amritsar Mehta Road, Vallah, Amritsar","31.6311073","74.9501662","true"
"ChIJj5zYWCB9GTkRzhcDZlEJjSs","IndianOil","Ground Floor Daburjee, NH 1, Grand Trunk Road, Meharbanpur","31.59682800000001","74.95204199999999","true"
"ChIJeZMujHN9GTkRzR1gNRAJR8E","IndianOil","Ground Floor GT Road, Daburji Road, Meharbanpur","31.598588","74.948444","true"
"ChIJhVWKu2TVGzkROUaqWRjfQh4","IndianOil","Ground Floor, National Highway 54, Valtoha, Bandala","31.5489997","74.98036789999999","true"
"ChIJbQScUkXVGzkRPxs-8ChHLI0","gurdial chohla sahib filling station bundala NH54","GXXJ+C2, Sukhewala","31.5485029","74.98009449999999",""
"ChIJfSyudYTXGzkRH1pPKBGRF0k","IndianOil","Ground Floor, Manawala, Grand Trunk Road, Meharbanpur","31.58630010000001","74.9754001","true"
"ChIJGxP7mbrVGzkRbMyxlyGbvFE","Hindustan Petroleum Corporation Limited","Ground Floor, NH 54, Bathinda - Amritsar Highway, Bandala","31.545101","74.979362","true"
"ChIJS9rWWl3VGzkRK_p8wj8kviw","Hindustan Petroleum Corporation Limited","Ground Floor NH 54, Manawala Tarn Taran, Road, Bandala","31.5389718","74.9753795","true"
"ChIJXczYHxJ9GTkRgnrZqus9s4M","Gurdas Filling Station","JW3Q+G93, g t road near police line, Daburji","31.6037682","74.9384211","true"
"ChIJAyXXqu_XGzkR1on-yJGwHZc","IndianOil","Asian Highway 1, Meharbanpur","31.5814105","74.98883820000002","true"
"ChIJ-Qx0NwDVGzkRREtdHLzj_tE","Jio bp","GXF9+R8W, Amritsar 1","31.5246178","74.96833310000001",""
"ChIJkatqUOvVGzkRO16iOF14b-U","Hindustan Petroleum Corporation Limited","Ground Floor, Jandiala - Tarn Taran Road, Bandala","31.530721","74.985861","true"
"ChIJjVKMENDVGzkRrJnRUxozqlk","IndianOil","Ground Floor Bundala, Amritsar","31.544151","75.00357","true"
"ChIJAais57fXGzkREXzIEY45qGg","IndianOil","opposite COCA-COLA FACTORY, near TOLL-PLAZA, Jandiala Guru","31.57286329999999","75.0100245","true"
"ChIJLVXBtdR_GTkRVd-sq6ocsO8","IndianOil","Ground Floor, Bus Stand, near Amritsar, Jandiala - Tarn Taran Road, Khabedogra, Amritsar","31.504906","74.963043","true"
"ChIJcZ37rYnWGzkRAClCk_ZGadc","ESSAR","India","31.5703621","75.0165829",""
"ChIJweiE1XDVGzkRKsRJ_XGhZIU","HUNDAL FILLING STATION. Bharat Petroleum Petrol Pump ,","JANDIAL GURU, Amritsar-Tarn Taran Road, Amritsar","31.5532163","75.01596599999999","true"
"ChIJnzCor7N9GTkRAN98JccvWvA","IndianOil","Ground Floor, near Sriguru Ramdass Medical Instt, Amritsar Hargobindpur Road, Vallah, Nawan Pind","31.633773","74.962595","true"
"ChIJtTMsabtkGTkRtFUQozPriPU","IndianOil","1A, Court Road, Kennedy Avenue, Amritsar","31.642405","74.860359","true"
"ChIJ-2DZAkxkGTkRsg7OuMoNmso","KPS petro centre","MRMM+G58, Raja Sansi Road, Heir, Bal Schander, Amritsar","31.68378799999999","74.832962","true"
"ChIJweGgRp1kGTkR0jeortjbOJU","IndianOil","Ground Floor, near Rattan Singh Chowk, Fatehgarh Churian Road, Amritsar","31.6605026","74.8726523","true"
"ChIJSfiNDGJjGTkRI3cRfSDNCJg","Hindustan Petroleum Corporation Limited","Ground Floor, Circular Road, Amritsar","31.65725819999999","74.87454249999999","true"
"ChIJ2z52kiVlGTkRTOWSK1Bw6tU","Bharat petroleum","3, National Highway, Pind Kale, Amritsar","31.6400068","74.7921715",""
"ChIJe0OZD_plGTkRtcZz56hi3K4","Hindustan Petroleum Corporation Limited","Ground Floor, Ghanupur Kale Road, Amritsar","31.6454198","74.8072292","true"
"ChIJh6UUknBlGTkRgSEW7lNjXp0","Hindustan Petroleum Corporation Limited","Ground Floor, Ram Tirath Road, Mahal Sub Urban","31.649043","74.8156151","true"
"ChIJ2-y2IdFkGTkRZB-Kyr5FUNs","IndianOil","Ground Floor, opposite Khalsa College Road, Attari Road, Amritsar","31.63166199999999","74.834473","true"
"ChIJAeKysKNpGTkRCfoEvzOplKk","Reliance Petroleum","&, Post office, NH1, at MS445.5 , Village, Manawala Road, Amritsar","31.63313179999999","74.8380124","true"
"ChIJK6y1d39lGTkRz7thX6Lr9fQ","IndianOil","Ground Floor, Ram Tirath Road, Wadala, Bhittewad","31.6612683","74.7833508","true"
"ChIJbx5weMZkGTkRJ6tRrJdyikI","Hindustan Petroleum Corporation Limited","348, Ram Tirath Road, Putligarh, Amritsar","31.638001","74.844911","true"
"ChIJNfWTistkGTkRDhJ5gBrg2T0","Hindustan Petroleum Corporation Limited","Ground Floor, near JK Dharam Anda, Krishna Nagar, Islamabad","31.628741","74.844901","true"
"ChIJ0d85znllGTkRB3wNR5igs8k","Hindustan Petroleum Corporation Limited","Ground Floor, Gumtala Link Road, Defense Enclave, Amritsar","31.65970799999999","74.84159009999999","true"
"ChIJUbZxz2tlGTkRzsNjLoBtuC8","Hindustan Petroleum Corporation Limited","Ground Floor, near Ramdas, Fatehgarh Churian Road, Defense Enclave, Amritsar","31.659708","74.841591","true"
"ChIJzcI3AXpvGTkRBcCsFFpEgV0","IndianOil","Ground Floor, Baoli Sahib, Chawinda, Chowgawan Road, Amritsar","31.6657932","74.769107","true"
"ChIJTZaw4cNlGTkR66d4pVM12jc","IndianOil","Ground Floor, Grand Trunk Road, Sadar, Amritsar","31.634136","74.855644","true"
"ChIJbbByuINlGTkRHfoGfdjdon0","Dala Prime Fuels - Indian Oil","Rani Ka Bagh, Canal Colony, Amritsar","31.63828689999999","74.8557768","true"
"ChIJJcHYkTt9GTkRR690A7LCzeU","IndianOil","Ground Floor, Golbagh, Amritsar","31.6429467","74.8564323","true"
"ChIJU6iKkPZkGTkRdz0r0yXHsdk","Gupta Petrol Pump","State Highway 25, Guru Amardas Avenue, Amritsar","31.66541309999999","74.84398750000001",""
"ChIJ--dJ4NxlGTkRQr9-KR38HHM","Bharat Petroleum, Petrol Pump -Armaan Filling Station","Raja Sansi Road, Defence Colony,D-Block, Ranjit Avenue, Amritsar","31.6649574","74.8446792","true"
"ChIJS8kh4qJlGTkRnTREAQMvik0","Hindustan Petroleum Corporation Limited","Ground Floor, Suburban, near Airport Road, Sahibzada Jujhar Singh Avenue, Gumtala, Amritsar","31.6696206","74.84193280000001","true"
"ChIJx3FMfVhkGTkREVRsxJby0m0","HP","India","31.6698278","74.8417003",""
"ChIJe-mHBbtkGTkRZH5fY7A9a-o","Hindustan Petroleum Corporation Limited","Ground Floor, Circle, Shivaji Park Road, Amritsar","31.641134","74.859985","true"
"ChIJQxRBzrFkGTkRME7uW8dBQo4","Hindustan Petroleum Corporation Limited","Ground Floor, Grand Trunk Road, Model Town, Amritsar","31.6345701","74.86164339999999","true"
"ChIJNVV8-1lkGTkRQP9FLjraO1k","IndianOil","Airport Road, Urban Estate, Amritsar","31.6736072","74.8392652","true"
"ChIJbcScefVlGTkRpEZdY8sgxdI","Marwaha Petro","41, Kennedy Avenue, Amritsar","31.6419167","74.8617766","true"
"ChIJw6AE8ztjGTkRkyc1EC0hVuw","IndianOil","Ground Floor, Batala Road, Amritsar","31.648191","74.904549","true"
"ChIJt1UYNgtjGTkRbDfifMATRyM","HP - Khazan Filling Station","Majitha-Verka By Pass, Nashera Village, Amritsar","31.671462","74.8979389","true"
"ChIJAwh8JiBjGTkRgV2HFt91wuU","IndianOil","Ground Floor, Batala Road, Near Verka Chowk, Amritsar","31.65543119999999","74.9188052","true"
"ChIJBzjk0hpjGTkR76q0zW97S1o","IndianOil","near Escort Hospital, NH 1, Batala - Amritsar Road, Amritsar","31.666071","74.911431","true"
"ChIJ25ts859jGTkR1h33lH_HcQM","Hardas Fuel Point Bharat Petroleum","MVGW+PR7, Majitha Road, Dashmesh Avenue, Guru Teg Bahadur Nagar, Amritsar","31.676779","74.897043","true"
"ChIJH1Tk83LYGzkRJF2RW1i649Q","IndianOil","Ground Floor, Batala Road, Amritsar","31.669783","74.939499","true"
"ChIJVXOeVqpkGTkRmtRfzFJ-sTQ","Hindustan Petroleum Corporation Limited","Ground Floor, Court Road, Amritsar","31.6348411","74.87129519999999","true"
"ChIJs8khYn9lGTkRxEimyBUifDI","Raju Automobile","JVMC+P5W, Grand Trunk Rd, near Delhi Motors, Taylor Road, INA Colony, Amritsar","31.6343503","74.8704404","true"
"ChIJ495fAANlGTkRjbkqUfPNb9k","Mela Ram & sons","JVM9+VQF, Grand Trunk Road, INA Colony, Amritsar","31.6346767","74.8694261",""
"ChIJNUQWp1FlGTkRrtWB0ShLSDg","IndianOil","67, Taylor Road, Amritsar","31.63713849999999","74.87063719999999","true"
"ChIJpWseSlZjGTkRhzO4syIDbDw","IndianOil","Ground Floor, M.M Malviya Road, Company Bagh, Amritsar","31.63670899999999","74.875343","true"
"ChIJCxjXFABlGTkRz74tzrJFyaI","Harsha Automobiles CNG , PETROL & Diesel Pump","M.M Malviya Road, Crystal Chowk, INA Colony, Amritsar","31.6368213","74.87550639999999","true"
"ChIJO_j8WFBjGTkRxN9mkJBGFyI","HP PETROL PUMP - SITE BARKATRAM AMRITLAL","JVQM+C63, Hpcl Retail Outlet Near Dental College Hukum Singh Road","31.63851","74.883044","true"
"ChIJCToPG99jGTkR9MNB-AMfyzY","Charanpreet 2000","Charanpreet 2000, Lawrence Road, Amritsar","31.6484039","74.8796022",""
"ChIJUz1-zqZjGTkRJe_LKac3tgg","IndianOil","Ground Floor, Majitha Road, Bhawani Nagar, Amritsar","31.646032","74.884804","true"
"ChIJy4kJLyVlGTkRr6QGypuQVps","JAGDAMBE FUEL POINT","Shop No 5, Sur Singh District Tarntarn, Main Bazaar","31.649813","74.86434899999999",""
"ChIJA9RVAoHXGzkRgQGnNC4vUfQ","IndianOil","Ground Floor, Amritsar Mehta Rd, mehta road, Nawan Pind","31.641543","75.010403","true"
"ChIJt17x48NjGTkRbfDvRyxcBUA","Jai Hind","JWV4+6WM, New Rajesh Nagar, Amritsar","31.6430827","74.9073027","false"
"ChIJSTa0GYzXGzkR0VcRF_o_D24","Hindustan Petroleum Corporation Limited","Ground Floor, Amritsar Mehta Road, Chhapa Ram Singh","31.6368159","74.9791262","true"
"ChIJY_gzR3BjGTkRr_8sxTVu1lU","Hindustan Petroleum Corporation Limited","Ground Floor, Verka, Amritsar","31.6693485","74.9399435","true"
"ChIJL56XdDljGTkRxVPFDepCjjY","Hindustan Petroleum Corporation Limited","Ground Floor, Batala Road, Khanna Nagar, Amritsar","31.64576100000001","74.90198099999999","true"
"ChIJhUdNh0djGTkRRLGgXc4rdNc","IndianOil","Tungpai, Batala Road, Amritsar","31.643771","74.897202","true"
"ChIJ-Ze4mPZjGTkRBZjK4wmck_4","Bharat Petroleum","MXH3+25J, Batala - Amritsar Road, Mudhal","31.6775819","74.9529003",""
"ChIJA2hbg4hiGTkRR_WGQ7BcuDc","IndianOil","Ground Floor, Batala - Amritsar Road, Vallah, Mudhal","31.6793852","74.95513179999999","true"
"ChIJXUqdvnDYGzkRXEp5VFGvjr8","IndianOil","Fatehgarh Shukarchak","31.6726507","74.9747124","true"
"ChIJldYYGGdjGTkRx2fM8Ld7C4E","IndianOil","Ground Floor, Khalsa College, Pandori Waraich, Amritsar","31.680234","74.916721","true"
"ChIJA2ARQf5jGTkRruwG0XmBbPo","Raja Kisan sewa kendar","MWH8+W68, Unnamed Road","31.679784","74.915583","true"
"ChIJ5TC-khdjGTkRnTzZMjKoBvE","Hindustan Petroleum Corporation Limited","Ground Floor, Amritsar Bypass Road, Rakshikargarh, Diamond Avenue, Amritsar","31.671701","74.898001","true"
"ChIJXeg00HNjGTkRlskHMQgRRk0","Hindustan Petroleum Corporation Limited","Ground Floor, Raksi Karhah, near Green Field, Majitha Road, Amritsar","31.6671001","74.8923001","true"
"ChIJGR1-1oBoGTkRvT70VXQuiJA","Essar Filling Station","PQWG+V27, Harse Chhina","31.7471595","74.7750537",""
"ChIJ78nXnjllGTkRE_dh5scsU7I","Indian Oil Corporation Limited","PR55+H4W, Unnamed Road, Raja Sansi","31.7089778","74.8078169",""
"ChIJX98SUcZnGTkR67yT5QCPRfY","Reliance Aviation","PR55+V7R, Raja Sansi","31.7097319","74.80812569999999",""
"ChIJx6hCt3ZmGTkR1llwLYYLOUg","IndianOil","Ground Floor, Ajnala Road, Raja Sansi","31.71466","74.811041","true"
"ChIJDczJXn1nGTkRjme3itdID68","IndianOil","Ground Floor, Raja Sansi Road, Raja Sansi","31.7010894","74.8212682","true"
"ChIJfwaBixRmGTkR-Rudyu71WNc","IndianOil","Bus Stand, Ground Floor Rajasansi, near Amritsar, Road, Ajnala","31.726294","74.80155200000002","true"
"ChIJHbjrzxVlGTkRw-ODJv4Yjo0","IndianOil","Ground Floor Kamboj, Ajnala Road, Kot Atma Ram, Amritsar","31.683923","74.83353","true"
"ChIJu9VD6t9nGTkRYa5Lcm8FwA4","IndianOil","Jawala Flour Mills, Ground Floor, Ajnala, Amritsar Road, Kukran Wala, Amritsar","31.74993499999999","74.787437","true"
"ChIJN_SKAYBoGTkRmw26vF6THYc","IndianOil","Ground Floor Harsha Chinna, Ajnala, Bagga Kalan","31.7499875","74.7804299","true"
"ChIJpx4QCQBpGTkRg3rJyyP4oCM","Filling Station","QQ2J+354, Chogawan Road, Kukran Wala, Harse Chhina","31.7501326","74.78045100000001","true"
"ChIJK60UsxxlGTkRpZpJFfiNRDs","IndianOil","Ground Floor Loharka, Bagga Kalan","31.713507","74.86241900000002","true"
"ChIJx2PiZNZnGTkRzMKddaSkwbE","Hindustan Petroleum Corporation Limited","Ground Floor, Ajnala Road, Harse Chhina","31.7569692","74.7830523","true"
"ChIJrXNAvblmGTkRZa0Fp6iVfv0","Hindustan Petroleum Corporation Limited","Sandhu Filling Station, Loharka Road, Amritsar","31.733793","74.860246","true"
"ChIJpTbPDntkGTkRUca-pFFbp6k","Bharat Petroleum","MVH7+JX4, Loharka Road, Ranjit Vihar, Amritsar","31.6790061","74.8649482","true"
"ChIJNQ9ihr1nGTkRMAnqyepRtMY","IndianOil","Indian Petrol Pump, Sensra","31.76527089999999","74.8105069","true"
"ChIJMU20xkllGTkRJlc5tZnD4wM","Gujarat Gas CNG Station","MV86+223, Gumtala Sub Urban, Gumtala","31.6650141","74.86005519999999",""
"ChIJdXxUUI9kGTkRCPfKvTrjMzk","MS/HSD DHILLON HP AUTO FUELS","Ground Floor, opposite Ranjeet Avenue, NH 1, Bypass Road, Gumtala, Amritsar","31.66523269999999","74.8618618","true"
"ChIJEcp2cipjGTkRJLG8IrxIOSI","Pal Energy Solutions, BPCL Petrol Pump","Murad Pura, Naushehra","31.6875898","74.8832541","true"
"ChIJqevk3oFjGTkRMo0IpzkIyrA","Hindustan Petroleum Corporation Limited","Ground Floor, near Springdale School, Fatehgarh Churian Road, Amritsar","31.6734326","74.8782554","true"
"ChIJjYbmtRFhGTkRTPZn_vuHmng","Essar Petrol Pump","QW35+97V, Amritsar - Sangatpura - Fathegarh Churian Road, Shanewali","31.7534879","74.9081565",""
"ChIJQS9tgO5jGTkR2REtONlCNiw","IndianOil","Ground Floor, Bus Stand, near Amritsar, Chfurian Road, Murad Pura, Amritsar","31.700413","74.889275","true"
"ChIJr4WjPWFhGTkRI5ykXyKGy_U","IndianOil","Jawala Flour Mills, Ground Floor, Churian Amritsar Road Bal Kalan, Amritsar","31.724874","74.90158199999999","true"
"ChIJuUkkOGpjGTkRza8oqXs8xjg","Uppal Filling Station","MWQ5+WC5, Majitha Road, Pandori Waraich, Amritsar","31.68975249999999","74.90860660000001","true"
"ChIJVwdqWVtjGTkRF20D_wipWJ4","IndianOil","Ground Floor, Majitha Road, Amritsar","31.668268","74.892395","true"
"ChIJx8JMagBhGTkRrmi5PaIVebU","Randhawa petroleum","PWR4+RPC, Sohian Kalan","31.74207329999999","74.906764",""
"ChIJUx46TgtlGTkRKeiOBqZPBVM","Hindustan Petroleum Corporation Limited","near Coca Cola Godown, Ground Floor Old Jail Road, near Coca Cola Godown, Circular Road, Amritsar","31.6551826","74.8694873","true"
"ChIJq_-GGG1hGTkRZK_KSFV89NQ","IndianOil","Ground Floor, near B R Dhab, Sohian Kalan","31.74328","74.906723","true"
"ChIJo2916oBhGTkRp1ahaDT6ZUU","CHANDI FILLING STATION","Amritsar - Sangatpura, Fatehgarh Churian Road, Sahnewal","31.7494398","74.9074918","true"
"ChIJFdWlGQBjGTkRfD_1I6XzJrk","Gourav&house","Bhagat Kabir Mar, Amritsar","31.719802","74.934871",""
"ChIJK5ijKz1jGTkRpoB51Jemfco","Bharat Petroleum, Petrol Pump -Jagmeet Filling Station","NAGKALAN, AMRITSAR, Amritsar","31.7205522","74.93625469999999","true"
"ChIJASf3VABhGTkRLmP5_xbw0U8","Randhawa petroleum","QW28+227, Sohian Kalan","31.75003969999999","74.9150313",""
"ChIJ595wecRhGTkR2DXseJTLR0w","IndianOil","Ground Floor, Majitha Road, Wadala Viram","31.75436200000001","74.952289","true"
