place_id,name,address,latitude,longitude,open_now
"ChIJByUZ6-fYGzkRhAWjLx48fVg","IndianOil","near Km Stone 93, Ground Floor Asr Batala Rd, Gopalpura, Waryam Nangal, near Km Stone 93, Amritsar","31.70935699999999","75.00368999999999","true"
"ChIJR7iUvSbZGzkRkb17xu4_3Ek","Tung Power Point","MXRF+7H7, Batala - Amritsar Road, Sohian Khurd","31.6906526","74.9739266",""
"ChIJ2yXtF__ZGzkRkl91EgPdM3A","IndianOil","Ground Floor NH 54, Sohian Khurd, Waryam Nangal","31.6907136","74.97554819999999","true"
"ChIJcYayEY9hGTkR4pUcM_5gHAo","IndianOil","Ground Floor, Amritsar Bypass, Majitha Road, Nangal Panua, Wadala Viram, Amritsar","31.73835800000001","74.943466","true"
"ChIJKz5PrY1hGTkRKBY6_paah7A","IndianOil","Ground Floor, Panuwa, Nangal, Majitha","31.7416005","74.9449905","true"
"ChIJKXdxdWNhGTkRe2mr3L74TBI","IndianOil","Ground Floor, Majitha Road, Wadala Viram","31.7495066","74.94907189999999","true"
"ChIJ5aYPBH1hGTkRZDIOfxe4FEc","Guru kirpa energy solutions","opposite Dana mandi, Majitha","31.75107809999999","74.9499326","true"
"ChIJJ2fefgDfGzkRs37uOTzJqJc","Bharat petroleum","PXQQ+QG8, kathunagal, road, Majitha","31.73936","74.9887514",""
"ChIJ_yeNcypgGTkRXIzhzBy1rNE","Hindustan Petroleum Corporation Limited","Ground Floor, Majitha Road, Amritsar","31.7598724","74.9565568","true"
"ChIJgZoT_sRhGTkRZ8UAo28tZJI","HP PETROL PUMP - RAVI FILLING STATION","Majitha Town, Majitha, Jalandhar","31.7599043","74.9565662","true"
"ChIJBcLmFd_YGzkRSKV04JbilKg","Hindustan Petroleum Corporation Limited","Ground Floor NH 15, near Amritsar Pathankot Road, Kotla Saidan, Kathu Nangal","31.7160158","75.0126529","true"
"ChIJ4ejMo2HZGzkRYHuxJMvGyl8","SACHAR KSK ( Indian Oil)","Majitha road Village Ajaibwali, Kathu Nangal","31.7243275","75.01270079999999","true"
"ChIJOzxCwwJhGTkRjpsowHytKIs","IndianOil","Ground Floor Majitha Hamza Road, Majitha, Wadala Viram","31.7690271","74.9644005","true"
"ChIJ050jry_ZGzkRxtO1UHcpTVA","IndianOil","Bus Stand, Ground Floor NH 54, near Amritsar, Kathu Nangal","31.72596369999999","75.02167519999999","true"