place_id,name,address,latitude,longitude
"ChIJ3zGhNn6QZzkRj89zcQYhYxI","Bharat Petroleum, Petrol Pump, Cng Gas -Sugam Filling Station","PRASAD, UDAIPUR AHMEDABAD, UDAIPUR","24.2064334","73.69971190000001"
"ChIJ5fi165GRZzkRTkMO25yxmuk","Petrol Pump","6M5X+2M9, Baroti","24.2075336","73.69924449999999"
"ChIJG3iAFIibZzkRa_I4rxNkH2A","SHIV RENEWABLE ENERGY","near Parai, Pandit hotel, near Parai, Parsad","24.1801814","73.6869174"
"ChIJ189dFQCRZzkRiE0N1kp6XEs","BALAJI ADANI CNG PUMP","6M8W+XG3, Baroti","24.216694","73.696274"
"ChIJHenqpmqSZzkR_1gvagema0c","Hindustan Petroleum Corporation Limited","Ground Floor, NH 8, Tidi, Udaipur","24.317201","73.677481"
"ChIJw6iDj2ONZzkRQaBW6N8_0k8","IndianOil","Ground Floor, Bori Kuan, NH 8, Girwa, Tidi, Barapal","24.351171","73.64814009999999"
"ChIJ1X39Q7HyZzkRk9ZQ4wo2pYk","Kisan Seva Centre","9JQP+4R9, Bhinder - Udaipur Rd, Udaipur","24.3878","73.63709999999999"
"ChIJK4O7kpbzZzkRi44W6Ffepbc","IndianOil","NH 8, Udaipur - Ahmedabad Highway, Barapal","24.3972379","73.63465819999999"
"ChIJMebZd3PzZzkRmC0yCwy0ucc","IndianOil","Ground Floor, NH 8, Barapal, Udaipur","24.3996128","73.6327912"
"ChIJt5LdJ7LzZzkRBhN7PooWRL4","GATEWAY FUELS","NH, vill, Barapal","24.4014394","73.6321542"
"ChIJa-4D5oaSZzkRv36QSdzQWuA","Hindustan Petroleum Corporation Limited","Ground Floor, NH 8, Tidi Dam Road, Udaipur","24.341201","73.66160099999999"
"ChIJk_9nqIrtZzkRSu9wvFt9cUs","IndianOil","Ground Floor Kaya, Road, Dhundi, Ahmedabad","24.4516001","73.6537001"
"ChIJD7o-YADxZzkRPEDXaZe52zI","V max petroleum","FMV3+C8W, Lai","24.4936053","73.6533194"
"ChIJ6-ey5eHxZzkRWFdNVhamUoU","Dalal Fueling Station","FMV3+C8V, Lai","24.4936221","73.6533058"
"ChIJRceCMSHuZzkRI4sd0mh2pto","HP PETROL PUMP - CHOUDHARY PETROLEUM HOUSE","Ahemdabad Road, Udaipur","24.496775","73.6551574"
"ChIJJZR2ghHvZzkR_ON04NCUUUw","IndianOil","Gokul Village Road, Sector 9, Udaipur","24.5448526","73.7153842"
"ChIJewCFak_vZzkR_rQE8e2iJZk","IndianOil","Ground Floor, Jaisamand Road, Dakan Kotra","24.5057911","73.737126"
"ChIJ11T2KNroZzkRHtZ1WZ18hls","IndianOil","Ground Floor Kaladwas, Girwa, Udaipur","24.5391","73.7620001"
"ChIJWZEmCavpZzkRKfVvH1WTcas","Nayara Petrol Pump - Shrinath Filling Station","Umarda road, Udaipur","24.5356389","73.7670387"
"ChIJ2W30PwDvZzkRgBKXRQ-ltMk","Girja Vyas Petrol Pump - RK Puram,Udaipur","GPV8+X47, Gokul Village Road, Gokul Village, Sector 9, Udaipur","24.5449036","73.7153039"
"ChIJ18nVVA7vZzkRrHIy8vLFu_E","Hindustan Petroleum Corporation Limited","Ground Floor, Jaisamand Road, Savina, Udaipur","24.5419101","73.7095701"
"ChIJMagXdMzoZzkRE9V3AxSjqbY","Hindustan Petroleum Corporation Limited","Ground Floor Kaladwas, Road, Eklingpura","24.549411","73.75195099999999"
"ChIJk5PJ2avvZzkR_h_3-64ioa8","IndianOil","Ground Floor Nela, Udaipur Byepass, H Magri, Udaipur","24.53153","73.697401"
"ChIJIQHUbinvZzkRYyscO6LksnY","KSV Filling Station","GMJW+JQC, Nela bypass road, Gordhan Vilas Rural","24.5315679","73.6968885"
"ChIJ46xLrxbvZzkR2NZJNK3WZ_4","Bharat Petroleum Petrol Pump , SHREE KISHAN FILLING STATION","Main Jhamarkotra Road, Udaipur","24.555521","73.73792999999999"
"ChIJX4nOShbmZzkRsaPgJwBMNuU","Hindustan Petroleum Corporation Limited","Ground Floor, NH 76, Bedwas, Udaipur","24.5939334","73.764814"
"ChIJp8FAJRHmZzkRxB4Rbi_pMYs","Nayara Petrol Pump Transport Nagar","1-C, Airport Rd, Janakpuri, N.B. Nagar, Bedwas Airport Road Janakpuri, N Bhairway Nagar, Bedwas, Transport Nagar, Jharnon Ki Sarai","24.59396049999999","73.7628625"
"ChIJ-wBsDMjnZzkR1FcZlr2bS3M","DEBARI GATE FILLING STATION","JQM3+2XW, VILLLEGE VADA, DHINKLI","24.6326046","73.7549628"
"ChIJiWs6tRfmZzkR7JtPqnkk2RE","Bharat Petroleum, Petrol Pump -Siddhartha Energy Station","SIDDHARTHA ENERGY STAT, Udaipur","24.5947015","73.76970220000001"
"ChIJ3ZP8HADlZzkRuVYxw0RJ6NI","Jagdish filling station","New, Old RTO Road, Pratap Nagar, Udaipur","24.5987314","73.7446966"
"ChIJSTN-38rnZzkR6kCce30BoLc","VC Filling Station","Airport Road, Nakoda Nagar, Udaipur","24.5915759","73.7552132"
"ChIJsbbkIVTnZzkRn_abbhZY0a8","CNG PUMP (UDAIPUR ECO ENERGY)","Bheru Singh Ji Ki Bari, Rajasthan Vidhya Peeth, At, Pratap Nagar, Udaipur","24.5916205","73.7542382"
"ChIJo2SnA-LlZzkRKQpbIHGfwQo","Hindustan Petroleum Corporation Limited","Khasra No 1157/231/A & 1154 Plot No 3/A/1, A/2 & B/1, Pratap Nagar, Udaipur","24.5950012","73.7465637"
"ChIJaSHZ-wjmZzkRQprDvHhucK0","MS Vishal Filling Station - Bharat petroleum","HQR2+VCX, Near Ambe Mata Mandir, Airport Road, Pratap Nagar, Udaipur","24.5922493","73.7511184"
"ChIJLwRH48HnZzkRnPqe3ZXXO6A","Bharat Petroleum, Petrol Pump -Eklingji Service Centre","Bhuwana, Udaipur","24.591305","73.75026559999999"
"ChIJHQuN5cTlZzkRj7yvricCsPQ","Hindustan Petroleum Corporation Limited","Khasra No 489, Airport Road, Sunderwas, Udaipur","24.586828","73.739229"
"ChIJs7PKIgDjZzkR0dTdTrkyO3k","SHREEJlCNG","NH 8, NATHDWARA ROAD, Mohanpura","24.710505","73.73172269999999"
"ChIJqwGNZaTjZzkR0bYUIL_iBJ4","IndianOil","Ground Floor, Mohanpura","24.71049290000001","73.7314253"
"ChIJdYld21bjZzkRigUAFYy3gXw","Royal Biodiesel Feeling Station","Opp. Prem Sagar Dhaba, NH-8 Eklingji Bypass,Nathdwara, Road, Udaipur","24.7238518","73.73163810000001"
"ChIJbz_bRgkLaDkRubEiYWIYp0g","Maharana Pratap CNG and fuel filling station BPCL","RQ66+966, National Highway 58, Rathujana","24.8109154","73.76051620000001"
"ChIJbeeffuwLaDkRHwrhWWKSr-A","Hindustan Petroleum Corporation Limited","Ground Floor, NH 8, Negdiya","24.838301","73.767501"
"ChIJF6-s0TwKaDkRAAAAsNq1lwU","Smart Fuel India","Shop 1, Udaipur","24.79028319999999","73.7601024"
"ChIJqQHdy14LaDkRc92sSyhkvlg","IndianOil","Ground Floor, Nathdwara, Delwara","24.78776199999999","73.75253"
"ChIJLYGVP5ILaDkR3thxB3kuyRQ","MAANSINGH FILLING STATION (BPCL)SISHVHI","Khasra no-1696/1390, Godaghati to Mavli Rd, Shishvi","24.834295","73.7984118"
"ChIJOdE-MfEJaDkROXrjNOhWFu4","IndianOil","Ground Floor Pipalwas, Kesuli, Bagol","24.835306","73.724289"
"ChIJxScY3vQLaDkRMroPHHch68I","Shree Mohan Filling Station","Bijli Vibhag Office, Old N. H. -8, near Police Station, near State Electricity Office, near Panchayat Samiti Office, Road, Delwara","24.7820414","73.7487278"
"ChIJqXJiWAALaDkR44cFNQg6gRc","AVVNL RSEB office","QQJ2+H28, Majera","24.7814116","73.7500761"
"ChIJ47FJVQANaDkR00faTYOqpqs","HMEL GHODAGHATI","VQ6C+7H, Dabiyon Ka Gurha","24.860628","73.771459"
"ChIJ615p6jgNaDkRy7qLHhBgPYE","Bharat Petroleum","bus stand, near Axis Bank, Nathdwara","24.9305653","73.8257592"
"ChIJ-egs4QINaDkRuNcz1wxTfCs","IndianOil","upli oden, Nathdwara","24.9096703","73.8049309"
"ChIJDWmAAwANaDkRjp_-S-PGvn8","Vishal Rajshree Filling Station","4, Rabcha Road, Udaipur","24.8838354","73.7904111"
"ChIJPTPQx8gNaDkRMQPLjkLGEck","IndianOil","Ground Floor, NH 8, Nathdwara","24.931401","73.826601"
"ChIJB8no3EYNaDkRSWNsYFmDsRc","Prabhu Lallohar","WRPG+95X, Rajsamand - Ajmer Road, Shiv Nagar, Nathdwara","24.9359805","73.8254963"
"ChIJ28ch1cBsaDkRITxOnQrbWg0","IndianOil","Ground Floor, Piparda","25.025801","73.85940099999999"
"ChIJXfyQNyptaDkRpkAzU2xwfBI","Bharat Petroleum & CNG, Tejpuriya","","25.0017928","73.8463104"
"ChIJUQLXBABtaDkR8cBvA1yL-CA","KANHAIYA FILLING STATION","opp. B.P. Petrol Pump, N.H. 8, Piparda","25.0211338","73.8569986"
"ChIJKUXENcRsaDkRuwNO1zQvV9I","Sbn electric works","opp. Kanhaiya bharat petrol pump, Piparda","25.0207498","73.8563745"
"ChIJhUHaSwBtaDkReiPpcLfhujU","(INDIAN OIL) MURLIDHAR FILLING STATION","NH 58, Rajsamand","25.0208535","73.8557376"
"ChIJD3YrK8dsaDkRtv066yqlUVw","Shiv Shambhu Filling Station","Piparda","25.01661379999999","73.85249259999999"
"ChIJXcEkWgBtaDkRhrMYyLO_gFw","Shri Shivanshika Filling Station - Indian Oil","229/30, NH 758","25.0263112","73.87638670000001"
"ChIJ-9HsWadsaDkR4hs71kZ7DCc","Jio-bp","KHASRA NO 1289, NH8, MILE STONE 207, VILLAGE RAJNAGAR, (LHS AJMER TO UDAIPUR TEHSIL &, Rajnagar","25.0512641","73.8586905"
"ChIJB5tABNhtaDkRTuovcC25ZRE","Hindustan Petroleum Corporation Limited","near Bus Stand, Ground Floor Nathdwara, near Bus Stand, Road, Kankroli, Dhoinda","25.045179","73.877451"
"ChIJQw6CgYFsaDkRUiwtOoYNf7E","Bharat Petroleum, Petrol and CNG Pump -Shrinath Filling Station","DHOINDA KANKRAULI, RAJ, RAJ SAMAND","25.0515454","73.88342"
"ChIJqwyO6HxraDkRpV5ne1AeNJI","Nayara Petrol Pump","Rajsamand, Mahaveer Nagar, kishor Nagar, Rajsamand","25.0573943","73.8788841"
"ChIJC0aM8HZraDkRRv_ESFjkysk","Bharat Petroleum Girdhar Petroleum","Shop No 2, near 100 Feet Tiraha, 100 Feet Road, Kankroli, Rajsamand","25.0557609","73.8840675"
"ChIJqyjBNfVraDkR7qu-gaTx7r8","IndianOil","Ground Floor, Jal Chakki, Kankroli, Rajsamand","25.0585686","73.88572789999999"
"ChIJm_pkZQBraDkREsUQi-5IIEQ","राजा राजसिंह चौराहा","SH 12, Mahadev Colony, Koyad, Rajsamand","25.0584452","73.8860282"
"ChIJAdIjD39raDkRfONWYdGvnNo","IndianOil","Ground Floor, Dealerjal Chakki, Kankroli, Sakroda","25.0579001","73.887101"
"ChIJLUhSUwBraDkRQmBwsl05ry0","Kelwada","3V8G+G7Q, Kelwara, Rajsamand","25.0663459","73.87572"
"ChIJi_ZEPV9paDkRHUri-xJpC6s","Bharat Petroleum Petrol Pump","Bhawa","25.0789106","73.93812539999999"
"ChIJyQZ7CwJpaDkRsiGbERrAl6k","K K Petrol Pump","4X46+FXM, Mahasatiyon Ki Madri","25.1062148","73.96243270000001"
"ChIJbxdRZHtpaDkRlCnlnmsdsws","IndianOil","Ground Floor, Bhada Bhanuja, Mahasatiyon Ki Madri","25.1172962","73.96304599999999"
"ChIJpRNmoA1paDkRIevCf3_HkNM","IndianOil","Ground Floor, Bhawa","25.0905186","73.9501751"
"ChIJGz26xuppaDkRfIbH7nSTCYY","Mahadev aashirwad filling station, bhawa, rajsamand, rajsthan","Nh 758,Villege bhawa, Rajsamand","25.0878086","73.948949"
"ChIJwQjV2NJmaDkRKRjfyqRQZrU","Petrol Pump","449F+556, Lapasiya Khera","25.1179074","74.12290519999999"
"ChIJE9YeuJ5naDkRgLgmQMEeoKc","Essar Petrol Pump","4397+CJG, Phiyabari","25.118552","74.0640871"
"ChIJ5ZUgJ59maDkRc9vDGol92P0","3 STAR","33MX+23Q, National Highway 162A, Kuraj","25.0825885","74.09774689999999"
"ChIJ2VhhG3BhaDkRGLnCDNvKKZ4","ANMOL PETROLEUM","NH-758 SANGAS, TEHSIL, Sahara","25.1282413","74.1738069"
"ChIJxczazXphaDkRayFa0tLEw_U","Sanwaliya Filling Station Essar Pump","45HF+G54, Udaipur Road, Potlan","25.1287672","74.17293769999999"
"ChIJvdLf-K2LaDkRxIzQPkhaLkE","रामदेव जी मंदिर। रामदेव नीवास","565G+V3M, Potlan","25.1597079","74.2251607"
"ChIJeeuTMAiLaDkRNf7pf0wDYMQ","Dilkhush Filling Station","568J+RPR, Gurha Khera","25.167103","74.2317542"
"ChIJLTpagDD1aDkRXFPK612xbKE","Surana Fuel Station Nayara Petrol Pump","Udaipur Road, Galodiya","25.19830239999999","74.2852274"
"ChIJpzIe_n_1aDkR5r0ZKhe3de4","Hindustan Petroleum Corporation Limited","Khasra No 37, 4/38/3, Sahada, Gayatri Nagar","25.198389","74.28590400000002"
"ChIJeZyBXxn1aDkRNL3DPmsSyqA","Sobhalal Laxmilal Hiran Petrol Pump","6785+H39, Mandal to Sargaon (DB) via Bhadu Bagore Amli Gangapur, Gangapur","25.2164171","74.257721"
"ChIJ7-29r1n1aDkR0Un-243MlbY","Gangapur Petroleum (BPCL Petrol Pump)","6742+W69, Sahara Chouraha Road, Gangapur","25.2072901","74.2506145"
"ChIJ31z8YTTzaDkRIJAAvqUxf8s","New Evergreen Nayara petrol pump","685F+3XH, Gatheela","25.2076904","74.32497099999999"
"ChIJU9XR-Cf1aDkR6nLhJwH6qao","Bharat Petroleum Petrol Pump , MEHTA PETROLEUM","MELONI KHERARAIPUR ROAD, Ward No. 3, Gangapur","25.21605929999999","74.2421677"
"ChIJ9ykIQF3taDkRxWeSapzCo00","IndianOil","Ground Floor, Gangapur Road, Karoi","25.2263848","74.4159366"
"ChIJb3Sw6gnzaDkR9LGa_Ai6zTg","Hindustan Petroleum Corporation Limited","Ground Floor, NH 758, Karoi","25.223101","74.40430099999999"
"ChIJDbgYHgDzaDkRuAM8XWWHSh8","Adani CNG Pump","6998+7P, Bhunas","25.2171136","74.36609969999999"
"ChIJuUjolWzzaDkRwsAbmQoiogs","Hindustan Petroleum Corporation Limited","Ground Floor, NH 758, Bhunas","25.217331","74.366001"
"ChIJ5-fsbZntaDkRHbbN14ZlmUQ","Hindustan Petroleum Corporation Limited","Ground Floor, NH 758, Gurla","25.267701","74.486301"
"ChIJfYro25DtaDkR6AiIt7ynWr4","Shakti Indian Oil","7F8M+VM3, State Highway 12, Mujras","25.2677754","74.4851379"
"ChIJrReuC2XsaDkRHeFwnQKsC48","IndianOil","Ground Floor, Amalda CO, Udaipur Road, Gurla","25.2679196","74.48486059999999"
"ChIJXy_2rGXsaDkR-rw0vffMhsg","ESSAR","India","25.26704","74.4843109"
"ChIJsUqHuPrpaDkRipoHluAOOrs","IndianOil","Ground Floor, G 19, Pur Road, Azad Nagar, Bhilwara","25.3257232","74.58289959999999"
"ChIJLVpJCwnCaDkRpZrDlSKmagc","BPCL Petrol Pump","Sector A, Bapu Nagar, Bhilwara","25.3322866","74.5965487"
"ChIJ6fyH-YvpaDkRVqfepz7cJRE","IndianOil","India","25.3182845","74.5646015"
"ChIJo4lhZZTpaDkRrJ6T_IRUCrQ","Bharat Petroleum, Petrol Pump -Navkar Filling Station","NH-76, VILL PUR, BHILWARA, Bhilwara","25.3312752","74.566124"
"ChIJ18s6I-7paDkR9pt6ztEHU3Y","IndianOil","Ground Floor, Samori","25.337215","74.55369340000001"
"ChIJw8eDUaLpaDkRTMmlQ7IIrT8","Hindustan Petroleum Corporation Limited","Ground Floor Sambodhi, near Ratnakar Steel Plant, Jindal Road, Bhilwara","25.3369027","74.55313819999999"
"ChIJueC-cobpaDkRm8xunY9PZC8","IndianOil","Ground Floor, NH 79, Bhilwara Road, Pur","25.3213769","74.586953"
"ChIJF434cxrqaDkRhF9D8xpQmsg","IndianOil","Ground Floor, Bhadokhara Attoon, Pur","25.3032369","74.5777327"
"ChIJ-63SaGvpaDkRP3_q9kD08_Q","DEVILAL","8HJR+5HP, Sector 4, Patel Nagar, Bhilwara","25.3304669","74.59145389999999"
"ChIJE_2EG9rpaDkRTA_EHHwrxbQ","IndianOil","near Kalaji Palace, Ground Floor Pansal, near Kalaji Palace, Gaon Road, Azad Nagar","25.34930009999999","74.587001"
"ChIJP1_v87HpaDkRNetpGUfVWHE","HP PETROL PUMP - NAHAR FILLING STATION","Hpcl Petrol Pump Vill Sambodhi Near Meja DAM, Udaipur","25.3585783","74.54593779999999"
"ChIJBQLBygPpaDkR0f30I54wGyc","Hindustan Petroleum Corporation Limited","Ground Floor, near Meja Dam, Samori","25.358592","74.545928"
"ChIJ240y4mzCaDkRCbAc8Sf37gg","Hindustan Petroleum Corp. Ltd.","8JV5+26C, Pansal, opp. Bhopal Mining Works, Road, Bhilwara","25.3425627","74.6080084"
"ChIJExhYj0vdaDkRIe9kAkdLGZk","Petrol Pump Essar","Jeepiya","25.4139933","74.6112562"
"ChIJvYRTdk7daDkRw1QRy-tMc3k","Hindustan Petroleum Corporation Limited","Ground Floor, Bhadali Khera","25.414957","74.610901"
"ChIJidbSbgDDaDkRmuyXmjiIM6g","My Eco Energy Indizel","CH3W+73F, Jeepiya","25.4031981","74.5951705"
"ChIJaZ46YmTDaDkRy6afKahUoRw","Bharat Petroleum Petrol Pump , SHYAMAL ENTERPRISES","E25 & E26 MADHAVNAGARAMER ROAD","25.403471","74.61424099999999"
"ChIJ03b3bUXdaDkRkqDRyuqs42Y","IndianOil","Ground Floor, NH 79, Badali Khera, Azad Nagar","25.42252329999999","74.6071089"
"ChIJqYIMS2bdaDkR1_0P01rt06U","IndianOil","NH 79 National Highway, Chouraha, Mandal","25.4356124","74.6030674"
"ChIJa3LwzXnpaDkR4zbbkf17_Zw","IndianOil","Ground Floor, Azad Nagar, Malola","25.3847731","74.5821823"
"ChIJ8YYwtyvpaDkR3TlYPjLXvCE","IndianOil","Ground Floor, Azad Nagar, Malola","25.3847731","74.5821823"
"ChIJO6NadonpaDkR5WDa5AFFVes","Nayara Petrol Pump - Seth Filling Station","Village After Jindal mines, On NH79 Bhilwara BY Pass Near by Dhulkheda, Bhilwara","25.3832079","74.5801327"
"ChIJ_-h-IADpaDkRmwesxosWO-M","SETH FS","9HMJ+63V, Dhool Khera","25.3831178","74.5801826"
"ChIJG32kUADDaDkRL012t11vePU","Shankar petrolium indian oil","near kankeriya bavji, 200ft, road, Bhilwara","25.3747713","74.61059809999999"
"ChIJW9hWaA3DaDkR6otQ1uQff2Q","IndianOil","Ajmer Road, Bhilwara","25.3777054","74.6224381"
"ChIJx1G7XZDnaDkRDJCScFe7i4s","Hindustan Petroleum Corporation Limited","Ground Floor, Mandal","25.4399901","74.5790501"
"ChIJLcv13_DpaDkRgG7pM7ZC9yQ","Hindustan Petroleum Corporation Limited","Ground Floor, NH 79, Narayanpura, Bhilwara","25.379701","74.578001"
"ChIJ_xus6wznaDkRUSx4KBtlCGs","Shree Bala ji Auto","Shree Bala Ji Furniture, Road, Bagor","25.4226402","74.56365540000002"
"ChIJ14NbZazCaDkR-G8BKGz0M-M","Monit Fuel Station","near D.n. TaTa motors, National Highway 48, Bhilwara","25.3762808","74.5788732"
"ChIJixytbC5JbzkRzvQqgUuZIiE","IndianOil","Ground Floor, Bairan, Banera, Babrana","25.5343199","74.5886963"
"ChIJK1TZBnbgaDkRnKnbeAvAweQ","IndianOil","Jaswantpura","25.564022","74.5927588"
"ChIJqYSZfJ_gaDkRV6bmCNLOqGo","Jio bp","India","25.5238178","74.589643"
"ChIJOWWs30ThaDkRmfwODoezlS8","CNG & EV Petrol Pump, Bharat Petroleum, Satya Sai Filling Station","near NEW BHILWARA MIDWAY, NH-48, near NEW BHILWARA MIDWAY, Nanakpura","25.5193586","74.592016"
"ChIJNbCmRQDhaDkRAKohxN6JPoQ","C- 5 UMESH","GH9M+4VJ, kanchan marg, D - Block, Vaishali Nagar, Jaipur","25.5178414","74.5846551"
"ChIJgwxrqgThaDkROq2Eh_ZZewU","Reliance Petroleum","Khasra No 616, 753/424, Nanakpura","25.5241108","74.5808188"
"ChIJMfmnYgDfaDkR0EuLy6bZCdk","Monika Sharma","GHJX+4J3, Balesariya","25.5302717","74.5990492"
"ChIJKbZ_iALeaDkROrYX4AT43lo","IndianOil","Ground Floor, Bhand Ki Bawdi, Mandal, Azad Nagar, Bhilwara","25.5098368","74.5935308"
"ChIJId5O7vfdaDkR2M-queB6rRE","ESSAR Pump- Dalmia's petrol pump","National Highway 48, Ramsinghpura","25.4961421","74.5997814"
"ChIJx6MNTVzdaDkRHTsVT-irpwM","INDIAN OIL","NH 48, Bhilwara","25.4929818","74.602409"
"ChIJEWDrfhzdaDkRuue4abHSnr4","M/S KHURD MATAJI ENTERPRISES","National Highway 48, Danta Nilawari","25.4898385","74.6033336"
"ChIJL4o-K_DdaDkRTgq34X2ypEI","HP PETROL PUMP - DAKSH PETROLEUM","Ground Floor, NH 79, Ramsinghpura","25.487661","74.604651"
"ChIJt4da7y3naDkRPGgoxvPrLAM","Sukhwal Petroleum","Mali Khera","25.4916348","74.5565539"
"ChIJZ-QAhjDnaDkRxkQQl_q7NPA","IndianOil","Ground Floor, Mandal, Beawar, Azad Nagar, Dhunwala","25.4863534","74.5611358"
"ChIJAxYw3dXhaDkRbjgRV2m-34M","Ravi Filling Station","Golden Quadrilateral, Jaswanpura","25.5672162","74.592581"
"ChIJ2Zhew8whaTkR2-fRfsLj-rQ","RAJ PETROLEUM","near Simla in hotel, NH-79 Ajmer road Raila National highway, near Simla in hotel, opposite to mateshwari guest house, and, Raila","25.6441257","74.5975836"
"ChIJAelP3TAhaTkRUBHLnr-zjBU","IndianOil","Ground Floor, NH 79, Balesaria, Raila","25.6442031","74.597905"
"ChIJPTOSkv_faDkRWIc837TW30I","Hindustan Petroleum Corporation Limited","Ground Floor, NH 79, Ajmer Road, Bhilwara","25.592501","74.594501"
"ChIJIY-Hm-ghaTkRIhO6AqRxWPw","BP Raila Pump","Dhuwaliya","25.66440649999999","74.6040125"
"ChIJafX43SEhaTkRkNwPgj050O0","Bharat Petroleum, Petrol Pump -Bp Raila","MJ73+QJF, Raila","25.6644471","74.6040331"
"ChIJqwP_FAkhaTkR4Cu36WCaUis","IndianOil","Ground Floor, Raila","25.665104","74.604401"
"ChIJoYGYbRkiaTkRoNBxXrUCDdo","IndianOil","Ground Floor NH 79, Sareri, Balesaria, Bhilwara","25.6954001","74.612201"
"ChIJIW9r_GAjaTkRpt6O0bIAC54","IndianOil","Ground Floor Hurda, Barantia, Sanodiya","25.70870009999999","74.616601"
"ChIJgVWGL5Y9aTkRH-nyx4jeUfs","IndianOil","near Mahindra workshop, Taswariya","25.847683","74.6167438"
"ChIJxwltGWM9aTkRc-X256H4wNo","Hindustan Petroleum Corporation Limited","Khasra No 1806, 1090 & 1808/1091, Hurda, Taswariya","25.850677","74.618054"
"ChIJg_sbW409aTkRVsfltp9nHTs","IndianOil","Ground Floor, Badla, Rupaheli, Hurda, Roopaheli","25.825077","74.615143"
"ChIJt5Iy-349aTkRiUQat1I-kHQ","Guru Panna Filling Center","Ajmer, On NH-79 Rupaheli Chouraha","25.824977","74.615471"
"ChIJw8Olhgs9aTkR3jPj_eVbEO8","IndianOil","Ground Floor, NH 79, Khari Ka Lamba, Hurda","25.8609214","74.6183464"
"ChIJUeNux2o9aTkRgKYzWGhUDwE","Hindustan Petroleum Corporation Limited","Ground Floor, Roopaheli","25.8045601","74.6158201"
"ChIJlXXjFgQ_aTkRu27_njYrd7U","Petrol Pump","Rajasthan State Highway 39, Bijainagar","25.9288461","74.6468318"
"ChIJe4aeZpk_aTkRTbMTL78bCo0","IndianOil","Ground Floor Bari Baral, Road, Bandanwara","25.948701","74.63220100000001"
"ChIJb__DN9A_aTkRnWEmplkq7IA","Hindustan Petroleum Corporation Limited","Survey No 328, Plot No 12 & 13, Bijainagar","25.92812799999999","74.63623799999999"
"ChIJDWziVSnhaDkRI33DPa6-FmA","IndianOil","Ground Floor, NH 79, 2, Baral road, Bijainagar","25.9276032","74.6304105"
"ChIJm00lYQBBaTkR8tCWkmZWlW4","Bharat Petroleum - Sathana Filling Station","XJCM+RF, Sathana","25.9730584","74.6338833"
"ChIJ1WoHupBBaTkRPjp_C4mRIfs","Bharat Petroleum Petrol Pump , CHOUHAN PETROL PUMP","KHASRA NO. 1479/1SATHANA, Bijainagar","25.9791346","74.635181"
"ChIJtz5vl-I-aTkRjs1l4l-dmWk","Reliance Petroleum","KHASRA NO. - 542 / 543 & 544 , LHS TOWARDS :- VIJAYNAGAR-GULABPURA , SH - 39 VILLAGE :- VIJAYNAGAR, TEHSIL :- MASODA , DISTRICT:- AJMER VIJAY NAGAR","25.921758","74.6532764"
"ChIJT_wt--U-aTkRMfFxzccN964","Hindustan Petroleum Corporation Limited","Ground Floor, near Bus Stand, Gulabpura","25.9120301","74.6574701"
"ChIJ1cQAF_s_aTkRFDXQtPdcS00","Hindustan Petroleum Corporation Limited","Plot No 1166/368, kekri Road, Bijainagar","25.925477","74.674191"
"ChIJbzUcE_NDaTkRTJcEXTHoFFE","CNG PUMP BPCL MAHAKALIKA FILLING STATION","Kheri","26.0847376","74.6795195"
"ChIJZzD0PABDaTkRmTiThmRZb4I","Jai Jwala filing station","3MJH+V2C, Bandanwara","26.0821904","74.6775122"
"ChIJaac8pl5FaTkRUGDYV2QIdyY","Hindustan Petroleum Corporation Limited","Plot No 2717, Ajmer Bhilwara Road, Bhinay, Bandanwara","26.117863","74.69377899999999"
"ChIJW0LEQI5FaTkRdg2_PgZxo5Q","HPCL - Kishanram Mohanlal","bhilwara road, Bandanwara","26.117896","74.6938522"
"ChIJA1pVVHtDaTkRgdjpgDiiLLU","IndianOil","Ajmer, Ground Floor Chhachhundra, Bandanwara, Bhinai","26.1213603","74.6810424"
"ChIJ5bZYKWNFaTkRdhzDriaELaM","IndianOil","Ground Floor Chhachhundra, Bandanwara","26.101686","74.716157"
"ChIJuzzPzmpBaTkRmaZF4e2fOg8","IndianOil","National Highway 48, Gowaliya","26.0579063","74.6699027"
"ChIJp3b5splEaTkRsoCYzJLcT3A","IndianOil","Ground Floor, NH 79, Bandanwara","26.1317165","74.6965422"
"ChIJUQjataRbaTkRDhN8UQCABEs","R. J. मोटर्स टाटा युरीया पम्प","6P69+WPV, Bandanwara","26.2115535","74.7185576"
"ChIJa9rc6vVbaTkR1C-hVh8Z0Q8","Hindustan Petroleum Corporation Limited","Plot No 2123 & 2124, Ajmer Bhilwara Road, Bandanwara","26.189885","74.7141516"
"ChIJWcU7-AdbaTkRMAFNbOyF9h8","Igl CNG pump","5PQ7+WMJ, Ajmer Road, Bandanwara","26.1898494","74.71413919999999"
"ChIJQ47aGABbaTkRPUfTNb8xtLg","PATNI ROADLINES LLP","5PM6+6G4, Nasirabad","26.1830148","74.7113174"
"ChIJP261ndlbaTkRmaX-A9wzYFI","Hindustan Petroleum Corporation Limited","Plot No 478, Ajmer Bhilwara Road, Nasirabad","26.247601","74.7192501"
"ChIJG9P9ykRYaTkR-wmG1FxRhiw","IndianOil - SWAGAT","Ground Floor NH 48, Near Dilwari Nasserabad Crossing","26.3118111","74.749111"
"ChIJ2--sxkRYaTkR0wE0P_n_3Xg","Suhani Filling Station-Hindustan Petroleum","Dilwada, Ajmer, NH-79A, Nasirabad Road, Nasirabad, Nasirabad","26.3169","74.7465"
"ChIJ0xERs0RYaTkRIKeyG49yBJs","IndianOil","Ajmer, Road, bhilwara","26.3176048","74.7455339"
"ChIJNbidIQBZaTkRgm1c_4G7jDc","Vijay vargiya ofice nasirabad","8P2M+PHR, Nasirabad","26.3018519","74.7338875"
"ChIJryjWODRZaTkRM_HLOZJmhnA","Bharat Petroleum, Petrol Pump -Jaswant Filling Stn (Resited Hsd)","DERATU, AJMER BHILWARA R, AJMER","26.2842811","74.75185259999999"
"ChIJ7zW7wWZZaTkRqEtJXmD51JE","IndianOil","Khasra No 1278 Dilwari, Nasirabad, Bijainagar","26.329716","74.75048799999999"
"ChIJa9Cst3VYaTkRj-flpgDllIQ","IndianOil","NH 79A, Dilbari, Nasirabad","26.3302869","74.7507595"
"ChIJF9K8cipZaTkRSyOMq5AKLyU","Hindustan Petroleum Corporation Limited","118/1478, Plot No 371, Ajmer Bilwara Rd, Dilwari, Nasirabad","26.3279607","74.7359068"
"ChIJQda6ZgBZaTkR6n4rgTjhBJg","RTC PETROL PUMP 6872 ⛽","7PFV+P4F, Nasirabad","26.2745411","74.7426265"
"ChIJ1_NozCtZaTkRdaid4ZVlO-8","Nayara Petrol Pump - Choudhary Laamor Filling Station","Khasra No. 5659 & 5660, Tehsil. Nasirabad, Derathu","26.2674095","74.7578209"
"ChIJI5QysXVYaTkR1GtFREQOM9c","dianOil","India","26.3457842","74.7530984"
"ChIJo-mtsHVYaTkReTx6jsPY7PY","IndianOil","Ground Floor, Nasirabad, Bijainagar","26.346","74.7528"
"ChIJle3Mx1NZaTkRkGhDkdT2-6g","Hindustan Petroleum Corporation Limited","Plot No 5428 SH 26, Nasirabad","26.266862","74.761665"
"ChIJt0P4QwBZaTkRxh2usoca5j0","HPCL LNG FILLING STATION","7PCH+9F2, Nasirabad","26.2708796","74.7286505"
"ChIJW6CUaWRZaTkR1IXDWVxc03w","Hindustan Petroleum Corporation Limited","Plot No 817/1, Ajmer Bhilwara Road, Nasirabad","26.270701","74.7288401"
"ChIJLUWkQWNZaTkR57rK5MYHZ6E","Jio-bp","Reliance Petrol Pump, Khasra No. - 817 / 1 , LHS Towards :- Bhilwara - Ajmer , N, Nasirabad","26.270862","74.727938"
"ChIJ9wFSBM37azkRdT4IOldEo9k","Verma And Company Srinagar Ajmer","CQVM+PW8, Shreenagar","26.4442987","74.7848156"
"ChIJRZ4s-UzjazkRXVzjEnu2tbA","IndianOil","Ground Floor NH 79, Shreenagar","26.4459721","74.786451"
"ChIJa9FJ6sf7azkRf11gGzEEKmg","IndianOil","Ground Floor Nasirabad, Shreenagar, Ajmer","26.4472607","74.788434"
"ChIJo1kTgFj7azkRiw8nYAqxIOY","krishna Petroleum","Ajmer","26.4449306","74.7952129"
"ChIJG7-X_UzjazkRz7qziOkdYQA","HP PETROL PUMP - NEHA PETROLEUM","NH-76 Vill Kanakhedi","26.4292697","74.7786194"
"ChIJN9fd_Rz7azkRjOs6IqtcVcQ","CNG Station Arihant Shree Nagar Ajmer","National Highway 48","26.4618159","74.80306569999999"
"ChIJ9WwXEkL7azkRvV5Rk9uZedg","Bharat Petroleum","India","26.4618385","74.80311309999999"
"ChIJdxGGkQfjazkRrJzWAKon6OY","Bharat Petroleum, Petrol Pump -Aarihant Filling Station","KANAKHEDI, Ajmer","26.4119346","74.7733985"
"ChIJZx2mfwDjazkRGK9koi_end0","D E F Uriea ⛽ pump","CQ4C+554, Nasirabad, Shreenagar","26.40539519999999","74.7704648"
"ChIJJ_CYPi_jazkR1STBpd_2smE","IndianOil","Ground Floor Kanakheri, Sri Nagar, Nasirabad","26.403023","74.770718"
"ChIJWevUxBH6azkRF6bNhmVB20c","IndianOil","Ground Floor, NH 79, Dhan Mandi, Kishangarh","26.5316052","74.8585107"
"ChIJz00wDYb7azkRJscXb644xww","HP INDIAN pump SILORA","GVM8+RPV, SILORA Rico ke pass, Kishangarh","26.5346083","74.866795"
"ChIJkVSdpbP7azkRqKyw3TsDlCA","IndianOil","Ajmer, Kh 732/201 975/200 981/211 Kishangarh, Udaipu","26.4897007","74.8267047"
"ChIJYyCYpAb6azkRCRIL8PxpZ0Y","RAPRASTHA GAS LIMITED","India","26.5395923","74.86720590000002"
"ChIJuUecNwDxazkRpJHIQ9ZEibc","Igl CNG pump,","GVX6+27M, Silora Road","26.547579","74.8606867"
"ChIJ4esECgDxazkRJgL_xN_FGI0","GUNSAGAR ENERGY STATION","09, Ajmer","26.5420897","74.8150003"
"ChIJEV2ZcCb7azkRFLQ71dxv4ak","Hindustan Petroleum Corporation Limited","Plot No 2/598, Kishangarh Nasirabad Road, Udaipur Kalan","26.481852","74.822182"
