place_id,name,address,latitude,longitude,open_now
"ChIJuaaqiBwPmjkRuG9t7u75KE0","Shivala Petro Mart(Indian Oil)","SUCHITAGANJ, TO, MASAUDA ROAD, Sariyawan","26.72600199999999","82.07552","true"
"ChIJG8MChhwPmjkRhvRiDXbiA6k","IndianOil","Ground Floor Sohawal, Near Mau Shiwala, Acharya Nagar, Mau Yaduvansh Pur","26.723083","82.09758699999999","true"
"ChIJLyT4730PmjkRvvXiVJxkugc","Petrol Pump (BPCL) 24x7 Fuel Point","Petrol Pump, BPCL, Near Faizabad Public School, NH-27 (NH-28) , Near UPSIDC Industrial Area Lucknow - Faizabad Road, Left Hand side when going towards Lucknow, NH -27 (Old NH-28, Singhpur / Hajipur (near:, Mumtaj Nagar, Darabgunj","26.7636665","82.090479","true"
"ChIJAfJ_IwAPmjkRLlE1pzskZlk","NATIONAL FILLING STATION","NH330A, Madkada Ka Purva, Mokal Pur","26.7029427","82.0637009",""
"ChIJka58rlUOmjkRoT40DlTMdXU","IndianOil","Faizabad","26.7135985","82.0819487","true"
"ChIJ9zgLTW4PmjkR6ETWg1H8GvA","Hindustan Petroleum Corporation Limited","Ground Floor, Sohawal, Ayodhya, Shahganj Road, Sakupara, Faizabad","26.710271","82.087105","true"
"ChIJdWMDYWgOmjkRQ4J-gosnU7I","IndianOil","Kadipur","26.690426","82.0722273","true"
"ChIJzQaIRg8PmjkRjgoxOzHPSKM","Deva Filling Station","Road Bhabha Chauraha, Sahaganj, Sodhiyawan","26.7118237","82.0879569","true"
"ChIJ_wKiaBwPmjkRkPIWVXXqg1c","BPCL. pump, Gauhaniya","Unnamed Road, Moiya Kapoor Pur","26.716689","82.05606100000001","false"
"ChIJYSgHJ3EPmjkRf4jNzVhNtdc","SA Brothers Filling Station (BPCL)","Nauwa Kuwan, Ayodhya","26.6921045","82.0490495","true"
"ChIJF_yvOgAPmjkRcvP5tabYllM","शुभम यूरिया पम्प","P4J4+2M6, Mau Shivala Road, Hausila Nagar Colony, Nayar Colony, Faizabad","26.7300399","82.10665279999999","true"
"ChIJ217c6D8RmjkRNAcLFva02DI","Petrol pump","P22H+H67, Sohawal Barun Bazar Road, Mohiuddin Pur","26.7014214","82.0280416",""
"ChIJFW_lf6ARmjkR4uRDztXOoTA","G B S FILLING STATION","Barun Bazar","26.7127928","82.02007139999999",""
"ChIJwUJOki8JmjkR_PdafVSydY8","Hindustan Petroleum Corporation Limited","Haveli Oudh, Sohawal, Plot No 683, Faizabad - Sultanpur Road, Khanpur Masodha","26.710201","82.137901","true"
"ChIJwRjePQAJmjkRgMkaNfTC8A4","Uriya pump[यूरिया पंप]","P46Q+M6W, Faizabad - Sultanpur Road, Dhabha Semar, Faizabad","26.711747","82.1380732",""
"ChIJ63B2DwAPmjkRMu9el3VySAI","PITAMBARA DEVI FILLING STATION (INDIAN OIL)","Q35C+X7Q, Kotsarai","26.7599597","82.07073799999999","true"
"ChIJ6fC2Ei8PmjkRFlV7NCOOoqo","Jio-bp pulse","Faizabad, Ground Floor Magalsi, Kotsarai, Sohawal","26.75986799999999","82.069171","true"
"ChIJpw5G6IQJmjkRz10rxzFHPbk","IndianOil","Ground Floor, Khanpur Masodha","26.7167494","82.1378638","true"
"ChIJc8mpmBQRmjkRO06iacz4_tI","IndianOil","Ground Floor, Opposite Tirimurti Hotel, Ghatam Pur","26.76039","82.0677808","true"
"ChIJ6ZOzWlgPmjkRBF--NGNSkoc","Bharat Petroleum, Petrol Pump -Warsi Service Station","KOTSARAY,FAIZABAD, Faizabad","26.7593837","82.0586177","true"
"ChIJPVI3NfwLmjkRbKYQfW7hb5U","IndianOil","Ground Floor, Nai Bazar, Faizabad - Sultanpur Road, Naipura","26.6695884","82.1343472","true"
"ChIJ0SofBeoNmjkRSnd2CbUFjLw","Diesel Ki Dukaan(Oil Station)","J2VX+H48, Halle Dwarikapur","26.643907","82.04782",""
"ChIJ7_WQnacamjkRVgVkf427Ln4","Hindustan Petroleum Corporation Limited","Ground Floor, Sohawal, NH 27, Salarpur","26.7602778","82.0386111","true"
"ChIJtYUA3hlxmjkRYDV8iNG1Sj0","Kaushal fuel point","Chandipur nagahra, shahganj","26.638003","82.0622891","true"
"ChIJaTevJKULmjkRxdalDglGqu0","MAA Vaishno gas service godown","M46M+8F9, State Highway 9, Dostpur","26.6607975","82.133729",""
"ChIJK-DhSD4FmjkRW8NaQ1xmO1Q","Bharat Petroleum Petrol Pump , RAJENDRA PRASAD SERVICE ST(AD HOC)","Civil Line, Faizabad","26.76702","82.100326",""
"ChIJU2v_AwARmjkR9rCG0z5a-Is","Urea pump","Q26P+8G3, Firozpur","26.7607683","82.0362914",""
"ChIJcSd_E80NmjkR31cUIgopf-s","भारत पेट्रोल पंप","चांदीपुर नगारा कुचेरा जलालपुर, Civil Line Road, Bikapur","26.6365625","82.0621875",""
"ChIJWb7RRVIRmjkRof4rtRHNJDE","Raj Filling Station","Q26P+7GP, Katrauli","26.7611314","82.0357942","true"
"ChIJd488RtkFmjkR74naBUbFOBk","IndianOil","Ground Floor, Basti - Lucknow Road, Acharya Nagar, Sahadatganj, Faizabad","26.7669508","82.1030078","true"
"ChIJRYkjELYPmjkRCHtlgTUHJzQ","IndianOil","Ground Floor, Gaddopur Maushivala Road Acharya Nagar, Gaddopur Path, Faizabad","26.758168","82.12132299999999","true"
"ChIJFabL0vQFmjkRatUC-0cEbx8","Hindustan Petroleum Corporation Limited","Ground Floor, Sahadatganj, Faizabad","26.768201","82.102901","true"
"ChIJTWsrI6EPmjkR2CfCVsOZOOg","Bharat Petroleum, Petrol Pump -Dr. S.D Yadav Filling Station","Transport Nagar, Faizabad","26.7582728","82.1268504","true"
"ChIJQVu7gHkJmjkRvejd8nWt5Pk","IndianOil","Ground Floor, Palia Risali, Sohawal","26.683962","82.16591199999999","true"
"ChIJWRedI64ImjkROUCbE6QkNn0","Bharat Petrol Pump","State Highway 15, Manas Nagar, Faizabad","26.75571219999999","82.13495669999999","true"
"ChIJX8U837oImjkR3Pa1mvaOt0c","IndianOil","Ground Floor, Acharya Nagar, Faizabad","26.7540013","82.141098","true"
"ChIJF_h-xpsImjkRHzAsKMrcUAc","IndianOil","Ground Floor, NH 28, Janaura Road, Kuber Nagar, Acharya Nagar, Faizabad","26.761073","82.15596599999999","true"
"ChIJj3DEnwIKmjkR6g65GC18ewU","IndianOil","Karma","26.6770982","82.2054845","true"
"ChIJ_zlQPRCokDkRmM4w52Wn8Gc","IndianOil","Ground Floor, near Shivoy Kisan Sewa Kendra, Sadar,Alwalpur, Baisingh","26.715529","82.221246","true"
"ChIJK4zrmSoGmjkReX6GW2ajLEE","IndianOil","Ground Floor Deokali, Naka, Acharya Nagar, Faizabad","26.769596","82.169693","true"
"ChIJD4Cis3oJmjkRIxspW5dTDqE","Paliya Risali","Darshan Nagar - Bharat Kund Marg, Malik Pur","26.6853306","82.1606869",""
"ChIJoRsDE2wJmjkR7palpD6ls9k","Jks Ray Sahab Fuels Station","M5MJ+66M, Mohtashimpur","26.6830826","82.180549","true"
"ChIJW9rf9_0JmjkRyZL_h-kPQ_U","Hindustan Petroleum Corporation Limited","Ground Floor, Darshan Nagar - Bharat Kund Marg, Sarethi","26.734461","82.19475299999999","true"
"ChIJZ--qckILmjkRFGew2NBfJb8","IndianOil","Ground Floor, Sadar, Kachhauli","26.6630044","82.18908239999999","true"
"ChIJg9QkJoQJmjkRARPNkuk7m-k","Bharat Petroleum, Petrol Pump -Singh Automobiles","Naka, Faizabad","26.7598764","82.141707","true"
"ChIJmXgQxM0LmjkRSgyTr3kxrAs","Bharat Petroleum, Petrol Pump -Maa Vaishno Filling Station","NANDIGRAM, DIST, Faizabad","26.6455396","82.1340764","true"
"ChIJ1aJk_hIJmjkRQfxI3QZTbZk","Bharat Petroleum, Petrol Pump, KDI Fuels","Q48Q+6CG, Ram Nagar, Faizabad","26.76557","82.1385909","true"
"ChIJ8ZRp170JmjkRq3fWwdR-AHE","IndianOil","Ground Floor, Sadar, Kushmaha","26.74419499999999","82.2004889","true"
"ChIJn4B2o_sHmjkRsaCS9Xg7G4w","Dishant Fuels(Bharat Petroleum)","Dishant Tractors Deokali, Fatehganj - Chowk Road, Wazeerganj, Faizabad","26.771416","82.1563364","true"
"ChIJ7d-pWwAHmjkRIy2kwqyDmPY","Gandhi churaha","Near, Gandhi chowk churaha, फैजाबाद","26.7729751","82.1457934",""
"ChIJ00qc9X8ImjkRjrq6PVDS6vM","IndianOil","Ground Floor Deokali, Road, Acharya Nagar, Faizabad","26.768771","82.172592","true"
"ChIJ4wRV9PkJmjkR5mKfiMtnmcs","N B AUTO FUELS","Q57Q+2JF, Darshan Nagar, Faizabad","26.7625581","82.189037",""
"ChIJZyZa_iUGmjkRXclSIcM74SY","Hindustan Petroleum Corporation Limited","No 7/3/10, Fatehganj Devkali Road, Gayatri Puram, Faizabad","26.7735144","82.1609249","true"
"ChIJ54b_IfWnkDkR_c5DTNuS2xI","Petrol pump N B AUTO FUELS","bypass road, Darshan Nagar, Ayodhya","26.7494637","82.2172386","true"
"ChIJe3lxes6mkDkRRGRwvtEKrso","Petrol pump","Nara","26.6870279","82.2712603",""
"ChIJUcax7g0ImjkR9BjgVWwtgaA","IndianOil","Ground Floor Kusfar, Faizabad, Darshan Nagar, Barabanki","26.759834","82.197617","true"
"ChIJR9I-KgCnkDkReRlz1IanV88","INDIAN OIL","NH 135A, सिरिसंदा","26.71117139999999","82.25504800000002",""
"ChIJ_dy3n9OhkDkRKtJNtN2OyCk","MJ Energy","Rasulabad-Darshan Nagar Road, chauraha, Gangauli","26.67125699999999","82.238385","true"
"ChIJUYMuY8ynkDkRUFsYsWizbOQ","Bharat Petroleum Petrol Pump , MAYANK KUKAN SINGH FILLING STATION","VILLAGE, Pura Bazar, Rajepur Uparhar","26.710513","82.258372","true"
"ChIJ_22wD-KmkDkRLOZgQhrfGTY","Hindustan Petroleum Corporation Limited","Ground Floor, Faizabad Ambedkar Nagar Rd, Pura Bazar, Rajepur Uparhar","26.7091916","82.2608233","true"
"ChIJz8jiy8KmkDkRSbXy6TXXGVY","IndianOil","Ground Floor, State Highway 30, Pura Bazar, Deogarh","26.698959","82.273392","true"
"ChIJoxRkMgAJmjkRAOPW8rRNDwM","Bairagal","Q644+2JH, Darshan Nagar","26.754839","82.206729",""
"ChIJcUZnDQynkDkRGeqOzHQ5Q0E","Petrol pump","M7VH+QV, Jalaluddin Nagar Uparh","26.6944675","82.27963790000001",""
"ChIJs-eYFr-hkDkRwS8WJoKFfzI","Bajrang Filling Station","224172, Rasulabad","26.64980989999999","82.2422577","true"
"ChIJNeevZAChkDkRXIa2_Ud3YSY","Bharat Petrol pump","J6XR+RWQ, Rasulabad-Darshan Nagar Road, Rasulabad","26.6497991","82.2422589",""
"ChIJEcwDpKGhkDkR_0ts20C0KyA","IndianOil","Ground Floor Rasoolabad, Sadar, Anjana","26.649887","82.242548","true"
"ChIJce_K4rOmkDkRyDePyWiJhls","Akhilesh Yadav Takku","SH 30- ashapur, takpura chauraha, Darshan Nagar, Faizabad","26.6872567","82.2861707","true"
"ChIJzywclQoImjkRSq-JU1s_yxQ","IndianOil","Ground Floor, NH 28, Acharya Nagar, Faizabad","26.768885","82.194756","true"
"ChIJIeAGRJAHmjkRcLIIKLYm1mA","Jio-bp pulse","Ground Floor, Ayodhya - Darshan Nagar Road, Shahnewaz Pur Uparhar","26.773588","82.214461","true"
"ChIJlZ6h8fQFmjkRu8x5HCHkxlk","IndianOil","near Collectorate Office, Ground Floor Ayodhya, near Collectorate Office, Faizabad Road, Acharya Nagar, Faizabad","26.769205","82.108318","true"
"ChIJbYug2wUGmjkRBY9yT1tvHIk","Bharat Petroleum, Petrol Pump -Majestic Automobiles","CIVIL LINE , FAIZABAD,FAIZ, Faizabad","26.7767396","82.1338882","true"
"ChIJrxPCeAAHmjkRUbn0cMm6t2Y","Running Rode","R42J+VFQ, Firozabad","26.8022143","82.1312329",""
"ChIJzzqjm0YbmjkRPpSZ6u0JcOs","Mahi Tayar Service","Q2J5 GPG, Barayi Khurd","26.7823595","82.00954709999999",""
"ChIJ06kTrxYGmjkRGVkfz0Qnan0","Tarang Petrol Pump","Niyawan Chowk Road, Hasnu Katra, Faizabad","26.7844978","82.1447486","true"
"ChIJ9aV9OwAHmjkRLigzHhUifaY","RAJE FILLING STATION","Q4MV+VX4, Naharbagh, Shakti Vihar Colony, Faizabad","26.7846409","82.1449409",""
"ChIJVbCUBG4HmjkR9lkl3KeP-xY","Amit Petrol Pumps","Shakti Vihar Colony, Faizabad","26.7819273","82.1481173",""
"ChIJSyJjk1gHmjkRYozIkG47pT4","ARCHANA PETROL PUMP","CHOWK ROAD, CHOWK, Faizabad","26.7789054","82.1538188",""
"ChIJZ9n8iY0HmjkRZns66A5QEmk","Bharat Petroleum","Tulsi Nagar, Faizabad, SH-9, Fizabad Gonda Road, Ayodhya","26.7980964","82.20403139999999","true"
"ChIJDxvm5SOokDkRg4GYx7NJeok","Bharat Petroleum Diesel only","Q6XC+W9X, Karsewakpuram, Ayodhya","26.7997872","82.22054469999999",""
"ChIJ4c6VaR0HmjkRCoXtQuh5tHQ","Shri petrol pump Bharat petroleum","41, Deokali, Faizabad","26.7743713","82.177317","true"
"ChIJS0_ecQMHmjkRndPYbrSJW0M","Hindustan Petroleum Corporation Limited","Ground Floor, Jalpa, Beniganj, Faizabad","26.782267","82.17780100000002","true"
"ChIJp5QTjGMHmjkRgBjRnFg9hhM","IndianOil","Ground Floor, Sardar Road, Ayodhya","26.785826","82.189537","true"
"ChIJ0waXHAAHmjkR3YY8c_O42A0","CNG Ayodhya Mandir","Q5PQ+8R3, Police Line, Ayodhya","26.78571119999999","82.1897183",""
"ChIJBWGOVgAHmjkRG_wYovVxgE0","Indian Oil. (Shri Ram Filling station)","Q6G2+4F7, Jiyan Pur, Ayodhya","26.7752787","82.2011608","true"
"ChIJj6O6AwAHmjkRjJAS9pngdCw","श्रीराम फिलिंग स्टेशन","Q5RX+VW7, दशरथकुंड, Ayodhya","26.7921605","82.1997954",""
"ChIJj3iPAo8HmjkRDpYYFk3Ijq8","Indian Gas Agency","R644+RW7, Theri Bazar, Ayodhya","26.8070328","82.2072866","true"
"ChIJWTTRlK0HmjkRN6lJu4BKeTc","Bharat Petroleum, Petrol Pump -Saket Auto Station","Ayodhya - Faizabad Road, Faizabad","26.807985","82.20930659999999","true"
"ChIJ8-bjKhGokDkRxaCMEl_feic","Hindustan Petroleum Corporation Limited","Ground Floor, Barhata Manjha","26.789391","82.228569","true"
"ChIJZctskgepkDkRuaTtmnpdME4","Bharat petroleum","R6F9+283, Kaptanganj - Faizabad Road, Wazirabad","26.8223997","82.217647",""
"ChIJ1Xf3rk4BmjkR2AdE_KW3sM8","J.D&Co.(Petrol pump) Bharat Petroleum","SH-30, Katra - Gonda Road, Chaudhry Purwa, Nawabganj","26.8674","82.1437","true"
"ChIJ05wWrooDmjkR87ujIX6RmPo","IndianOil","Ground Floor Raghunathpur, Ashokpur","26.85960099999999","82.105801","true"
"ChIJRfLDbQADmjkRBxjw8UhcKUw","IndianOil","Gonda, Ground Floor Ballipur, Wazeerganj, Tarabganj","26.8774373","82.1059956","true"
"ChIJmXn1smYBmjkRIAP3100zUlM","Torrent Gas CNG","V4GM+WC6, Louwabirpur","26.8772891","82.1335122",""
"ChIJv7J-OAABmjkRV5CB0Ny5HFI","Uriya pump Nawabganj","V4HM+28V, Louwabirpur","26.87804","82.13321669999999","true"
"ChIJMVyNeIUDmjkRqZulHd9hbiU","IndianOil","Ground Floor, Nawabganj Road Belsar, Durjanpur, Pipari","26.9018684","82.05326629999999","true"
"ChIJ7wSXphEBmjkRXGwSWCX9fEU","IndianOil","No 99/101, SH 30, Ayodhya Rd, I Estate, hobhapur, Sandila","26.8787038","82.1334123","true"
"ChIJlWbCEwAbmjkRqUgPs6NaFw8","INDIAN OIL PETROL PUMP ( AKVK FILLING STATION )","R2C6+268, Dhemwaghat marg, Duttnagar","26.8200452","82.0105895",""
"ChIJ6-drYwAdmjkRiy9UP_K31z0","Sanit kumar","V2PF+V5F, Kindhura","26.8871806","82.02292000000001",""
"ChIJM9l4PkoBmjkRiBvrUKqzdKc","IndianOil","Ground Floor, SH 30, Faizabad Road, Nawabganj","26.866029","82.148122","true"
"ChIJlWrjewABmjkRXZ4nd0qamuQ","KS electrician Nawabganj","V48X+7R7, Nawabganj","26.8656602","82.1495494",""
"ChIJgwcwQcAHmjkRQ0DpyFK4pic","IndianOil","Ground Floor, SH 30, Faizabad Road, Khadawan, Katra Shivadayalganj","26.84922299999999","82.19264299999999","true"
"ChIJ53IZEEQHmjkR5mbBfg5QBWQ","Hindustan Petroleum Corporation Limited","Ground Floor, Shiv Dayal Ganj, Gonda","26.847301","82.19930099999999","true"
"ChIJo7pfQOoHmjkR2ZYuR1QutWg","IndianOil","Ground Floor, Shiv Dayalganj, NH 28, Khadauwan, Katra Shivadayalganj","26.845982","82.206389","true"
"ChIJc2PsqQIHmjkR0u7zWcquja4","R.k.maruti garage","R6W4+HM5, State Highway 30, Katra Shivadayalganj","26.8463883","82.2067268",""
"ChIJ_VpkbAABmjkRVC-X1bs5pKw","Vidhyadhar Filling Station","Parsapur","26.8990625","82.1286875","true"
"ChIJJ90WLasBmjkR8qtZGVvoDDw","IndianOil","SH 9, Km Stone No 54, Ground Floor, Tikait Nagar - Mankapur Road, Nawabganj","26.9045434","82.1680421","true"
"ChIJ_a6CAHOpkDkRcwWXDKdgfp4","IndianOil","Ground Floor, Ismailpur, Mustahkam, Nawabganj, Tarabganj,Khadauwan","26.8491786","82.2249241","true"
"ChIJuYtf00epkDkR3JZ7Up58wFA","H P Petrol Pump","Macha","26.8373703","82.2534625",""
"ChIJFyaZue6pkDkR8oPWVOPt_9A","IOCL","R7P3+RFX, Macha","26.83711659999999","82.2537387",""
"ChIJwdyQRyaqkDkRwYaWvCJ8Xsw","IndianOil","Village & Post Sikandarpur Bazaar, Sikandarpur Khas","26.8704872","82.2459847","true"
"ChIJMUyTJC-qkDkRp9d21vaL474","P P and Motors","P P AND MOTORS, Basti","26.8764143","82.24949219999999",""
"ChIJFWnmdQCpkDkR09G10W4EgRw","Jio Bp","R7JF+CQP, Ram Nagar","26.8310996","82.2744438",""
"ChIJO8TxJzKrkDkRYHak5F4LBKY","IndianOil","Nand Nagar","26.9005569","82.25909089999999","true"