place_id,name,address,latitude,longitude,open_now
"ChIJaa_Ue61QpjsRVdUCv9mR7Yc","Hindustan Petroleum Corporation Limited","Ground Floor, Beypore","11.171491","75.809421","true"
"ChIJ25zUWnxZpjsRTyBiAsI-KxM","IndianOil","Mankavu, Mini Bypass Road, Kozhikode","11.233631","75.803131","true"
"ChIJv_clPhdZpjsRNX73Irmavio","IndianOil","Ground Floor, South Beach Road, Kuttichira, Kozhikode","11.242536","75.773743","true"
"ChIJozev9J1QpjsRK4vD1KNQH1o","Hindustan Petroleum Corporation Limited","Ground Floor, Feroke","11.181221","75.83618100000001","true"
"ChIJD1AzPmtZpjsRrkQhw2-R2wE","KP kUNIRAMAN AND SONS ( KALLAI ROAD )Bharat Petroleum Petrol Pump","Palayam, Kozhikode","11.2433948","75.7851496","true"
"ChIJIeRZv2pZpjsR-YnkYM9z-5Q","Hindustan Petroleum Corporation Limited","Ground Floor, Kallai Road, Kozhikode","11.245861","75.784921","true"
"ChIJbVMgATdZpjsRPqvxnZ2yY7E","Hindustan Petroleum","6QWM+8XV, Bank Road, Kozhikode","11.2458649","75.78492279999999",""
"ChIJs5v2f0BZpjsRd2BBMZ3vIh4","IndianOil","Govt Hospital Road, Palayam, Kozhikode","11.2497418","75.78371489999999","true"
"ChIJo9rqEjxZpjsRzJUf0ILsZw0","Shah Agencies Bharat Petroleum","7Q2G+MJ3, near petrol pump, Cherooty Road, Kozhikode","11.2516483","75.7765359","true"
"ChIJ______SJpjsRSoSD1o_Iy-c","IndianOil","Ground Floor, near Bus Stand, Koyilandi, Kozhikode","11.2583129","75.78695859999999","true"
"ChIJ24ciBQBZpjsR_dOo8DVUNT8","Nayara petroleum","6Q4X+8V5, Meenchanda - Beypore Road, Arakkinar, Kozhikode","11.2057567","75.7997383",""
"ChIJoeSYSTJZpjsRbRgwgSg9dH8","GOLDEN FUELS","GoldenFuels Vazhayur, Kozhikode","11.2121844","75.79755569999999",""
"ChIJTRK2UatQpjsRHx4krvtoLFM","Hindustan Petroleum Corporation Limited","Ground Floor, Beypore Road, Beypore","11.177051","75.807861","true"
"ChIJ5TyXl-pRpjsRdlO6u8Egqno","IndianOil","Harbour Road, Beypore","11.1716017","75.80732340000002","true"
"ChIJhVgVImVbpjsR8X3C91xQ83M","Jio-bp","Ground Floor, Police Station, opposite Nallalam, Meenchanda, Kozhikode","11.2096243","75.8081498","true"
"ChIJQ_vKSzFZpjsRt5urqNJMPE0","IndianOil","Ground Floor, Panniyankara, Kozhikode","11.222896","75.792519","true"
"ChIJ-wQ6rBlapjsRFbNQXBkdW4U","Hindustan Petroleum Corporation Limited","Ground Floor, NH 17, near Saradha Mandiram, Cheruvannur","11.201551","75.81629099999999","true"
"ChIJBRFPXL5bpjsRzEsjEiZWUuY","Malabar Total Energies (LPG Gaz ) station","DOOR NO 7/129, National Highway 66, Cheruvannur","11.19864","75.81781699999999","true"
"ChIJv8MEhZ1ZpjsRXCHeGzQrIdU","Amigos Petroleum Hindustan Petroleum","6QFR+XQW, Panniyankara Main Road, Panniyankara, Kozhikode","11.2249952","75.79196530000002","true"
"ChIJo5wKEVFZpjsRPeo1TZPNUzo","Hindustan Petroleum Corporation Limited","Ground Floor, Panniyankara, Kozhikode","11.225215","75.791992","true"
"ChIJz4mRMvpRpjsRIOt8PGUGjJI","Hindustan Petroleum Corporation Limited","Ground Floor, Beevi Memorial Hall, near TK Fathima, Chaliyam","11.159214","75.80957459999999","true"
"ChIJhSv_xtNZpjsRl7JCfG0AtHM","Bharat Petroleum, Petrol Pump -Siddharth Petroleum","6RF2+XM6, MINI BY PASS ROAD CLT, Thiruvannur, Kozhikode","11.2248476","75.8014208","true"
"ChIJUcVmXSVapjsRlN3dE_n4TIM","SHARICO OIL EXTRACTORES","India","11.2150536","75.8171043",""
"ChIJ28mWqHRapjsR3EXjB1nDiwg","IndianOil","Feroke, Cheruvannur, Kozhikode","11.188495","75.830856","true"
"ChIJ_bMdRpBQpjsRcKEd25ibHyo","IndianOil","Ground Floor Nallure Feroke,Feroke, Petta - Nallur Road, Kozhikode","11.170346","75.83991999999999","true"
"ChIJGWPhVQBbpjsRjEKt-a-6FjU","Mangavu","6RPF+H33, Guruvayurappan College Road, Mankave, Kozhikode","11.2363805","75.8226866",""
"ChIJc1Z1MitbpjsR7jY22WydVd8","AK Fuels","Indian Oil Petrol Pump Mankavu, Mankave Pantheerankave Road, Mathara, Kozhikode","11.2280778","75.83256089999999","true"
"ChIJ8UODdbhbpjsRB8lKSzBO34w","Hindustan Petroleum Corporation Limited","Ground Floor, near Olavanna Road, Junction, Olavanna","11.2259446","75.8360186","true"
"ChIJsbpyYuFZpjsRmAcoqr3i4ZI","Bharat Petroleum Petrol Pump , KERALA STATE CIVIL SUPPLIES CORP.","Pavamani Road, Kozhikode","11.254639","75.783537","true"
"ChIJB77BekdZpjsRuawhlisEQJA","IndianOil","Ground Floor, Pavamani Road, Tazhekkod, Kozhikode","11.254771","75.784264","true"
"ChIJWb0GBrtbpjsRW6HMLhjM8sM","Nayara Petrol Pump","Olavanna","11.226187","75.83648529999999","true"
"ChIJ1R50ljdZpjsR-LXmLuyQ-7M","IndianOil","KSRTC, Bus Depot, Mavoor Road, Kozhikode","11.2589825","75.7819111","true"
"ChIJN1Gi0GpRpjsR-c2dQHgFFWE","Hindustan Petroleum Corporation Limited","Survey No 55, 8 Poocherikunnu, Mannur, Kadalundi","11.151941","75.842151","true"
"ChIJPWbxmDlZpjsRwPL18KR509Q","IndianOil","Ground Floor, Mavoor Road, Kozhikode","11.259201","75.783801","true"
"ChIJp7rHDJxapjsRej1Use9a5e4","IndianOil","5VR9+4P4, Parammal, Kozhikode","11.190184","75.869271","true"
"ChIJQ3gLkXtQpjsRtYTb4l0VXoU","IndianOil","Ground Floor, Palakkad - Kozhikode Highway, Ramanattukara","11.1772198","75.8604369","true"
"ChIJMdCYC3RQpjsRHebK_qaNlP4","Hindustan Petroleum Corporation Limited","near Sevamandir School Road, Ground Floor NH 17, near Sevamandir School Road, Bypass Road, Ramanattukara","11.179881","75.87207099999999","true"
"ChIJ4Ur7HbBbpjsRJWEsFgwfQps","Hindustan Petroleum Corporation Limited","Ground Floor, Kozhikode Bypass, Pantheeramkavu","11.222211","75.85564099999999","true"
"ChIJe1D_fgRQpjsROaa1xYQtedk","IndianOil","Ground Floor Andiyoorkunnu, Kaithakunda, Ayikkarapadi","11.178269","75.894277","true"
"ChIJu004CuJQpjsRCNpfTyDki8g","IndianOil","Ground Floor Kottakadavu, Kadalundi","11.139212","75.837119","true"
"ChIJ3xrFzChQpjsRDpS3bJOcLHI","IndianOil","Ground Floor, near Kinfra Park, Andiyoorkunnu, Chelambra","11.1489571","75.8919526","true"
"ChIJrefJBg9bpjsR5w7ff564EgQ","Bharat Petroleum, Petrol Pump -Ameya Petroleum","Mathara - Palazhi Road","11.2503598","75.841325","true"
"ChIJUZPTbCtQpjsRVrGo1KX1SNQ","Hindustan Petroleum Corporation Limited","Ground Floor, Kolakkattuchali, Idimuzhikkal, Malappuram","11.143939","75.8955452","true"
"ChIJoYjtFJVbpjsR2nMT5YMptz8","Hindustan Petroleum","Palazhi, Pantheeramkavu","11.2511218","75.8318729","true"
"ChIJPVbAudFPpjsRFR-_Kb7i5HE","IndianOil","Ground Floor, Chelembra, Pallikal","11.1501387","75.9097669","true"
"ChIJUxh8qoFRpjsR-EoxNGsKJrY","PD Enterprises Bharat Petroleum, Petrol Pump","Kozhikode Bypass, Feroke","11.1794782","75.8535198","true"
"ChIJ35rBdABbpjsR3Hn7FfT27iU","GRNGASSOLUTION","5VQ9+RW7, Ramanattukara","11.1895489","75.8698069",""
"ChIJwVp59e1bpjsRp1HNBSXn2Cs","IndianOil","Ground Floor, near Farook College, Karad Paramba, Vazhayur","11.204522","75.879306","true"
"ChIJ7XJo9e1bpjsRVWYFksL4tXM","HP Masters service station","6VC4+W52, Pantheeramkavu","11.2222717","75.8554046",""
"ChIJUwSsMW9RpjsRSYCS7yKRW-k","NAYARA FUEL STATION","Saridha Body Builders, Palakkad - Kozhikode Highway, Ramanattukara","11.180761","75.885785","true"
"ChIJ5RwAKvtRpjsRdff0K0-d5jg","MRPL NASEER PETROLEUM","5VHQ+QRG, National Highway 966, Ramanattukara","11.1794999","75.8893614","true"
"ChIJHx1FpK5bpjsRJFXmSaLw79Y","IndianOil","Ground Floor, NH Bypass, Pantheeramkavu","11.234379","75.846687","true"
"ChIJA9dHcghRpjsRRHLOFanxQsM","MAGMA FUELS","AYIKARAPPADI, 11th Mile, Kozhikode","11.1746231","75.8976893",""
"ChIJV2yQkN1RpjsRVYB6EJIhyao","Hindustan Petroleum Corporation Limited","Ground Floor, Chelembra, Kakkanchery, Malappuram","11.1561509","75.8910521","true"
"ChIJ0WmExHBbpjsR4y4gEpbD_os","BHARAT PETROLEUM -CITY MAX ENERGY","near TVS showroom, PERUMANNA, near TVS showroom, Kozhikode","11.2386729","75.872946","true"
"ChIJzRLsahhbpjsROPf83-j459c","IndianOil","Ground Floor, Perumanna Road, Perumanna","11.239092","75.875272","true"
"ChIJ-R8fGOVFpjsRhdgPLJzNfRU","Golden Fuels","hills, East, Vazhayur","11.2120697","75.9037428","true"
"ChIJ81gYPjtFpjsRLR4H4Y9rccI","CALICUT HP GAS GODOWN","6W74+6HH, Unnamed Road, Vazhayur","11.213053","75.90649429999999",""
"ChIJ96YMNwBRpjsRbmm2fzIBAyo","Indian Oil Petrol Pump","4VVW+746, Thenhipalam","11.1431703","75.8952753",""
"ChIJnckXiNRPpjsRdE_V_E4fh4w","Hindustan Petroleum Corporation Limited","Ground Floor, Ernad, Cherukavu","11.1707731","75.91301299999999","true"
"ChIJ7QtuoPpPpjsRnjRvC6dz5hk","BPCL Petrol Pump (Royal Fuels)","Kakkanchery-Kottappuram Road, Pallikal","11.1484766","75.9024445","true"
"ChIJuYXKIRlRpjsRvjqMmHHYCls","Bharat Petroleum","Athanikkal","11.1218779","75.8465191","true"
"ChIJE97G-llZpjsR_rcv3bPnce8","Hindustan Petroleum Corporation Limited","Ground floor, Kottooli, Kozhikode","11.2628494","75.7738366","true"
"ChIJbwIPhNtepjsRJhQjXvCvuj8","Bharat Petroleum Pump City Petrols","michael's church, kannur Rd, near st, West Hill, Kozhikode","11.284804","75.7686817","true"
"ChIJabFlIM5epjsRdVbNSizpzxc","IndianOil","Ground Floor, Chakkorathukulam, Kozhikode","11.2756739","75.7722368","true"
"ChIJ6zl8cjNZpjsR1BO7kbmnryo","Hindustan Petroleum Corporation Limited","Ground Floor, Kannur Road, Nadakkave, Kozhikode","11.266921","75.77666099999999","true"
"ChIJG9ii6sxepjsRVTveQzWOpDI","Hindustan Petroleum Corporation Limited","Ground Floor, Kannur Road, Nadakkave, Kozhikode","11.270233","75.77617599999999","true"
"ChIJWQ69TjFZpjsRz3L5FCC09fY","Bharat Petroleum","6/343-B, Kannur Road, P.T. Usha Road Junction, Vellayil, Kozhikode","11.2619133","75.7773349","true"
"ChIJW0D0JgdfpjsR8bytmhC9g-s","Smoke test center","7QJC+936, Kannur Road, Bilathikkulam, Kozhikode","11.2809097","75.77015349999999",""
"ChIJK0NLJcJfpjsRf7Hp7iqKtx4","IndianOil","Ground Floor, Puthiyara, Kozhikode","11.309006","75.751785","true"
"ChIJxS2nRTFZpjsR6p_NneDYbxg","Hindustan Petroleum Corporation Limited","No 7/456 Oyitty Road, Kannur Road, Kozhikode","11.2625622","75.7770599","true"
"ChIJJSDhUuNfpjsRJW4dmh9InIc","Bharat Petroleum and CNG","East Nadakkavu East Hill Road, East Hill, Kozhikode","11.2707334","75.777597","true"
"ChIJi2b2YjRZpjsR6qQE6xZg_MU","Hindustan Petroleum Corporation Limited","Ground Floor, near Malayala Manorama, Wayanad Road, Kozhikode","11.2661751","75.7787453","true"
"ChIJ-bfloaZZpjsRauANckn4API","Bharat Petroleum, Petrol Pump -Narayanan & Company.","BANK ROAD CLT, Kozhikode","11.2611055","75.7800831","true"
"ChIJ7XjyJ5hZpjsRTuJAabnCcFA","Hindustan Petroleum Corporation Limited","Ground Floor, Bank Road, Kozhikode","11.260581","75.78056099999999","true"
"ChIJf2zOSvZfpjsR3kncbhj5qak","IndianOil","The Secretary, Puthiyangadi, Kozhikode","11.3192091","75.7472904","true"
"ChIJb1PY-chepjsRxWV1Z93eeBQ","IndianOil","Wayanad Road, Eranhipaalam, Kozhikode","11.278147","75.7805272","true"
"ChIJo89kyk9ZpjsRV25642Y-kU0","IndianOil","Ground Floor, Mini Bypass Road, Kozhikode","11.2613192","75.79392299999999","true"
"ChIJW2wwq7RepjsRHlpnI1qWxXs","Hindustan Petroleum Corporation Limited","Ground Floor, near Eranhipalam, Mini Bypass Road, Kozhikode","11.2696","75.78923809999999","true"
"ChIJSfd-zIdbpjsRG8JrPvtAvu4","Hindustan Petroleum Corporation Limited","Ground Floor, East Devagiri, near Medical College Road, Kozhikode","11.269579","75.84285009999999","true"
"ChIJt76ZRABZpjsRIxQSDxcMGH8","Noble petroleum","7R52+CPH, Mavoor Road, Arayidathupalam, Kozhikode","11.2585547","75.80185999999999",""
"ChIJ8fvcb1hbpjsRiqQumsf3fDs","Bharat Petroleum","7R88+923, Nellicode Housing Board Colony, Kavu Nagar, Kozhikode","11.2659117","75.81412809999999","true"
"ChIJR5GQ2ZZepjsR_YKy0Pf4rCQ","Hindustan Petroleum Corporation Limited","Ground Floor, Vengeri, Thadampattuthazham, Kozhikode","11.296491","75.792011","true"
"ChIJOQ0sHwBfpjsR5foYPa3O0s0","Indian Oil Petrol Pump - Vrindavan Petroleums","8Q3Q+XQM, Vengeri, Kozhikode","11.3049611","75.7894278","true"
"ChIJ_9CpjBhcpjsR63CGBgQy4ng","IndianOil","Merikunnu, Paroppadi, Kozhikode","11.291703","75.815086","true"
"ChIJW70yZABdpjsRe2eSWPjXaIs","KANNADIKKAL PETROLEUM (Indian Oil Fuel Station)","8R25+PG5, Kannadikkal, Kozhikode","11.3017145","75.80868459999999","true"
"ChIJq9QjkeZbpjsRvaZf5WnfizE","Bharat Petroleum, Petrol Pump -M.Kutty Hassan Kutty","Kovoor MLA Road, Ummalathoor, Kozhikode","11.271157","75.8317722","true"
"ChIJNSC-Qv9fpjsR490Qmg1MwOo","Nayara Fuel Station KK Petroleum","8Q5M+X5R, Kunduparampa, Kozhikode","11.3111571","75.7825877","true"
"ChIJg7f5HkdfpjsR3EWpAqVwY30","Meenakshi Fuels-Bharat Petroleum","near Kakkodi bridge, Kozhikode Balussery Road, Thanneerpanthal, Vengeri, Kozhikode","11.311908","75.7996095","true"
"ChIJLRakhUBfpjsRawk-Kw_uN4g","Hindustan Petroleum Corporation Limited","Survey No 67/1, Cherukulam","11.328031","75.770411","true"
"ChIJO9EtRHxbpjsRD_xqcXqXH6A","IndianOil","Ground Floor, near Calicut Medical College, Mavoor Road, Velliparamba, Kozhikode","11.269292","75.86109400000001","true"
"ChIJtX9EGu9cpjsRL6t9MiLDc1w","IndianOil","Ground Floor, Karanthur Calicut, Kunnamangalam, Chelavoor, Kozhikode","11.304555","75.868735","true"
"ChIJNyg14uhcpjsRun-xVAYU9X0","Hindustan Petroleum Corporation Limited","Ground Floor, Karanthur, Kunnamangalam","11.304351","75.872451","true"
"ChIJ7-jGv9xcpjsRlLNcGw0_g2M","Hindustan Petroleum Corporation Limited","Ground Floor, Kunnamangalam","11.308501","75.88111099999999","true"
"ChIJJbbHJ7VdpjsR55ftjBdfM_s","IndianOil","Ground Floor Parambil Bazar, Konott, Chelavoor, Kozhikode","11.316536","75.83269899999999","true"
"ChIJC_ngs9NdpjsRyxxXH6_KmOc","IndianOil","Palakkot Vayal, Junction, CWRDM Road, Mayanad, Kozhikode","11.2854362","75.8499501","true"
"ChIJhRrKleRdpjsRpOkkb4DyaGI","Bharath Pertroleum & CNG Kolaithazham","7VR7+F38, Karanthoor Medical College Road, Mayanad","11.2911521","75.8627022","true"
"ChIJOeX9nWdbpjsRejTt25LYI30","Bharat Petroleum, Petrol Pump -Henna Petroleum","Poovattuparamba - Perumanna Road","11.2641062","75.8892583","true"
"ChIJW-cb7GtdpjsRxhNvmsdFz64","Bharat Petroleum Petrol Pump , NISSI FUELS","Chelavoor, Kozhikode","11.2970428","75.8455718","true"
"ChIJZ6y3NwBdpjsRzHhliySAf0A","Jithoos Fuels - Indian Oil","7VQG+2MQ, Mundikkal Thazham - Peringolam Road, Peruvayal","11.2875831","75.87672409999999","true"
"ChIJM3Grvg1dpjsRl4kp-AqnIB0","Nayara Energy (essar) Hilife","8V26+C5W, 8V25+5XX, Re Survey No.95/2 Kunnamangalam, Village, Karanthur","11.3004994","75.8599989","true"
"ChIJQ1lslexdpjsRusq6vNGmheI","Nayara Petrol pump","445, Calicut Mukkam Road","11.3061326","75.8937424","true"
"ChIJx1Ip3wRdpjsROQbOAkTgnyY","Jio-bp","Survey No 291/1, No 291/2, National Highway 766, Muriyanal, Kunnamangalam","11.3186724","75.8840101","true"
"ChIJO5NkqpZdpjsR1gwQW_cv2xE","Pottammel Energy Hub","Kummangottu thazham, Kozhikode","11.3286058","75.84657279999999","true"
"ChIJnaN3gN5fpjsRvSLAyu8M1xw","Hindustan Petroleum Corporation Limited","8PXR+76G, Near Railway Station, Kannur Road, Elathur","11.3481873","75.7405934","true"
"ChIJ-esFgN5fpjsRXkdWYXSQRTg","Hindustan Petroleum Corporation Limited","Ground Floor, Elathur","11.350261","75.740051","true"
"ChIJTfzNcABfpjsRlCvhimLZWcs","Hindustan Petroleum Corporation Limited","Ground Floor, SH 38, Pooladikunnu, Purakkattiri","11.339791","75.761321","true"
"ChIJ6QJqLgBhpjsRNDanvCrWoJY","Ocean Petroleum (MRPL)","9Q95+WV2, Koliyottuthazham","11.3697579","75.7596551","true"
"ChIJoTKg1fthpjsRZeNBwGqf4_M","Hindustan Petroleum Corporation Limited","RS No 34/10A, 35/1A & 35/1B, Koyilandi, Chemancheri","11.392171","75.727941","true"
"ChIJh7bZjuBdpjsRol5wpYQpzd0","IndianOil","Ground Floor, Kozhikode Balussery Road, Chelannur","11.3377972","75.8101214","true"
"ChIJ-XKGUdhdpjsR3bJsk2P6H0M","IndianOil","Ground Floor, Mukku, Kakkodi","11.3281208","75.8094326","true"
"ChIJff7bZFVnpjsRwO02xKBx6KI","Hindustan Petroleum Corporation Limited","Ground Floor, Chelannur","11.359281","75.808871","true"
"ChIJ0yX1BgBhpjsRTrtMSLph6Z0","MOTO DEF ADBLUE FILLING STATION","9QQ6+J56, V k road, Atholi","11.3890343","75.7603781",""
"ChIJodWmavhgpjsRIaiYZYcIXCs","IndianOil","Ground Floor Atholi, Cheekkilode","11.3913101","75.761861","true"
"ChIJPZ5tFyVdpjsRkb4Eko6INas","Bharat Petroleum- PK Petroleum & CNG","PATHIMANGALAM, NH 212, ELEVENTH MILE, Kozhikode","11.3280872","75.88625820000001","true"
"ChIJK11qvwJopjsRM-ny8Kb6q40","IndianOil","Ground Floor Koduvally, Avilora","11.365225","75.910445","true"
"ChIJUSkXwqZCpjsRAXKZCsLksAI","IndianOil","Manipuram, Ground Floor Koduvally, Road, Avilora","11.360364","75.915801","true"
"ChIJxxByV7ddpjsR_3yXaDlpld0","IndianOil","Ground Floor Kozhikode Road, Narikkuni, Eravannur - Palath Road, Kozhikode","11.358129","75.859116","true"
"ChIJbwozfANdpjsRM1RZ9nr-AoQ","IndianOil","Ground Floor, Chakkalakkal, Padanilam","11.3434754","75.88676869999999","true"
"ChIJ9WQfgIRnpjsRqpOZ8CCbE5g","Hindustan Petroleum Corporation Limited","Ground Floor, Nanminda Road, Narikkuni","11.368451","75.85931099999999","true"
"ChIJ3-FNCDFdpjsRin9FdH_zdTM","Hindustan Petroleum Corporation Limited","Ground Floor, near Valappil Petrol Pump, Kunnamangalam","11.332741","75.89204099999999","true"
"ChIJYaW8CgBnpjsRahfkBjqdi-M","Baradh petrol","9VC8+C33, Narikkuni","11.3710815","75.86521549999999",""
"ChIJaa7If45dpjsRBw_h0YUQihA","IndianOil","Ground Floor Koduvally, Vennakkad, Kozhikode","11.341345","75.898892","true"
"ChIJNzBgUgBdpjsRRkEnv8klyfc","CNG (24hrs)","8VRX+JJJ, Vennakkad","11.3415799","75.89900039999999",""
"ChIJ434O77lDpjsRhgsNdaUcqUQ","Nayara Energy- Simla Fuels","SH68, East Kizhakkoth - Parakkunnu Road, Kozhikode","11.3598774","75.9043013","true"
"ChIJtT3y_S9DpjsR1ni0ug-6S38","IndianOil","Ground Floor, Chathamangalam","11.3084757","75.9106963","true"