place_id,name,address,latitude,longitude
"ChIJiaza7t8q3DsReULgjpe9AYk","Hindustan Petroleum Corporation Limited","Gut No 363/1, Manmad - Chandwad Road, Chandwad","20.321789","74.240202"
"ChIJ4dITVgYr3DsR3UNkBGQlOus","IndianOil Petrol Pump (Chandwad)","Survey No 20, Adgaon","20.3138987","74.261555"
"ChIJqXijwU3U3TsR-aEwDALtlTI","Hindustan Petroleum Corporation Limited","Survey No 113/P/A NH 3, Mumbai Agra Hwy, Chandwad, Shirsane","20.3086689","74.1576393"
"ChIJswEWki_U3TsRKE6O4TO9yGY","Bharat Petroleum, Petrol Pump -Samruddha Tara Petroleum","Malsane","20.2998713","74.1337913"
"ChIJh4j0Zy_U3TsRVDDHW7ycM-Q","IndianOil Petrol Pump (Adgaon)","Chandwad, Ground Floor Malsane, Agra - Mumbai Highway, Adgaon","20.300048","74.131399"
"ChIJzYZXVojV3TsRVC7H9s62558","Bharat Petroleum, Petrol Pump -Mharana Petroleum","Nashik Road, Vadalibhoi","20.3116902","74.1648144"
"ChIJgYFSQJrV3TsRmoGt7HjWTh4","Hindustan Petroleum Corporation Limited","Ground Floor Chandwad, Sogras Phata, Shelu","20.3322937","74.14232009999999"
"ChIJk1BXvCTV3TsRcIv52ryVhB8","Hindustan Petroleum Corporation Limited","Ground Floor, Chandwad, Adgaon","20.314395","74.1748401"
"ChIJCYX7FP7U3TsRgqK16uQYrkY","IndianOil Petrol Pump (Chandwa)","Gat No 328, 2, NH 3, Adgaon","20.3135504","74.1755757"
"ChIJpVfSR4_Q3TsRlgzGAtKKB2I","Hindustan Petroleum Corporation Limited","Gut No 718, opposite TATA Work Shop, NH 3, Agra - Mumbai Highway, Shirwade Wani","20.216401","74.043061"
"ChIJLVeYoIDQ3TsR-CvEQ_UE5LA","Bharat Petroleum, Petrol Pump -Jangam Transport","PACHORE VANI","20.209241","74.03426739999999"
"ChIJU-YskufQ3TsRv00xzAg1-eE","Petrol Pump","360, National Highway, Nashik","20.2343299","74.0670652"
"ChIJG80ACyLR3TsRUB-MPc4u6GQ","Hindustan Petroleum Corporation Limited","Gut No 543/2, Chandwad, Khadakjamb","20.2340128","74.06647679999999"
"ChIJ3UjeMKbQ3TsRot7PJiZVsUg","IndianOil Petrol Pump (Chandwad)","Ground Floor, Chandwad, Vadner Bhairao","20.242751","74.033461"
"ChIJAVykAtbE3TsRtJot6ayY7RQ","Deshmane Petroleum now CNG PUMP 24 hours available AND PETROL DIESEL","OPP OLD MARKET YARD, NH3, Agra - Mumbai Highway, Pimpalgaon Baswant","20.1516618","73.9829656"
"ChIJ7xUyZSrF3TsRi45Zijmi4wY","Bharat Petroleum, Petrol Pump And CNG -Maharashtra Petroleum & cng pump","Agra - Mumbai Highway, Pimpalgaon Baswant","20.1545736","73.9836864"
"ChIJUReKjtTa3TsRO3Alu18bazc","Bharat Petroleum","5X6Q+849, Pimpalgaon Baswant, MUMBAI-AGRARD","20.1607956","73.9878497"
"ChIJ6QweUwDF3TsRISmn41E4oMA","NASIK KE AAGE CNG PUMP","5X2M+H4Q, Nasik","20.1514588","73.9828556"
"ChIJh-6GQNjF3TsRTGllfDvsi3A","Hindustan Petroleum Corporation Limited","S No 449/6, opposite Market Yard, NH 3, Agra - Mumbai Highway, Niphad, Pimpalgaon Baswant","20.1515401","73.9829701"
"ChIJpQyx_CrF3TsRPS16iL_H2L4","Thakker Reliance Petroleum","Nashik, NH-3, Mumbai Agra Highway, Nashik, Nashik","20.15607379999999","73.9856449"
"ChIJTRauCcLE3TsRIwmwFqBtd2I","IndianOil Petrol Pump (Ojhar)","Gut No 552P Niphad, Kokangaon","20.1334214","73.9664106"
"ChIJjYqLHwDb3TsRgS4zltYUrWw","Gaikhe Brothers","5X6Q+849, MUMBAI-AGRARD, Pimpalgaon Baswant","20.1608287","73.9877671"
"ChIJZaSWtXzb3TsRUnwxZSbShDU","IndianOil Petrol Pump (Baswant)","Ground Floor, Pimpalgaon Baswant","20.1630068","73.98742539999999"
"ChIJRyBu9ZbF3TsRm0geLHQdhn8","BPCL - Tanishq Petroleum","431, At village, Agra - Mumbai Highway, Kokangaon","20.1264837","73.96261129999999"
"ChIJ0TgX29na3TsRUAXjewloWHE","Shivkrupa Petrol Pump","5XCP+6P2, National Highway 3, Pimpalgaon Baswant","20.170509","73.9867579"
"ChIJQenLu9ja3TsRYqKYOT1_ZI0","Hindustan Petroleum Corporation Limited","Ground Floor, near New APMC Road, Pimpalgaon Road, Jopul, Niphad, Pimpalgaon Baswant","20.174451","73.98384399999999"
"ChIJWTKuYMna3TsR6U8_0zjTTK4","IndianOil Petrol Pump (Jopul)","Ground Floor, Niphad, Pimpalgaon Baswant","20.1658768","74.002206"
"ChIJPbTnJwDb3TsRHtOCF2TzBXA","Shree Datt Petrolium","5XMW+625, NH360, Pimpalgaon Baswant","20.1830733","73.994255"
"ChIJd1KAIL3b3TsREmMqkzTxB6M","Sangram petroleum","Niphad, Pimpalgaon Road, Pimpalgaon Baswant","20.1655999","74.0187741"
"ChIJ13xtGADb3TsRyyn_QLhAw64","Hindustan Petroleum Corporation Limited","Ground Floor, Niphad Road, Ahergaon","20.16524979999999","74.0207116"
"ChIJd3yy0GPb3TsR5a6QK5c4POo","Vitthalpant Petroleum","Gut no.672 (P Wani Road, Pimpalgaon Baswant","20.1893782","73.98386649999999"
"ChIJe4mZiMPD3TsRi6ic11IBRMM","Bharat Petroleum","National Highway 3, Vijay Nagar","20.073587","73.9068418"
"ChIJZY1lJcLD3TsRyuEBuZrzA3I","Hindustan Petroleum Corporation Limited","Gat No 23/2/1 NH 3, Niphad, Agra - Mumbai Highway, Ojhar","20.0754367","73.9103063"
"ChIJz2nJLuvD3TsRHuTYCUNIGzk","Jio-bp","opposite Panchwad Nagar, Gat No 2436/2 Mumbai Agra Road, NH 3, Ozhar, opposite Panchwad Nagar, Mig, Nashik","20.0822805","73.9155952"
"ChIJ26RjjdTD3TsRwd5SQVCsT1k","Hindustan Petroleum Corporation Limited","Survey No 150, NH 13, Agra - Mumbai Highway, Jaulakedindori","20.061371","73.891171"
"ChIJkWW8qMfD3TsRn6hkrK8qWg4","BPCL - Adgaon ( Smartfleet -OTP - Petrol - Diesel - EV Charging)","Survey No.1866, near Garware Point, Agra - Mumbai Highway, NH3, Adgaon, Nashik","20.0586716","73.8881899"
"ChIJlfPCotPD3TsRKj5hcp1m2-w","IndianOil Petrol Pump (Dindori)","Survey No 172, Hissa No 172, Agra - Mumbai Highway, Jaulke","20.0645022","73.8927313"
"ChIJ5VtO7NjB3TsRuBxWKDcUOD4","Shell","opp. Truck Terminal, Nashik Road, नाशिक","20.045426","73.874382"
"ChIJ0QjW1Y_B3TsR_istk5UR5Fg","IndianOil Petrol Pump (Jadhav Mala)","Truck Terminal, Agra - Mumbai Highway, Adgaon, Nashik","20.0439088","73.8746901"
"ChIJSx5sGADB3TsRuISB2hrft-M","Near jatra hotel cng","2VVF+HRF, Nashik","20.0439415","73.8745591"
"ChIJF-40ZP_D3TsRpFOhMVRUw2w","Hindustan Petroleum Corporation Limited","near Nashik International Airport, Gat No 577 Airport Road, Dindori, near Nashik International Airport, Janori","20.091108","73.893492"
"ChIJTb79zjnB3TsRTDiRNMO0axE","IndianOil","No 2, Gut No 1470, Adgaon, Nashik","20.0375169","73.86574329999999"
"ChIJ0bGmMQDB3TsRQ2yllLS5UjU","Bharat Petroleum - BP Adgaon","2VP7+PQH, Vasantdadanagar, Adgaon, Nashik","20.036609","73.863848"
"ChIJy08_mTPB3TsR15KaL51sqSY","Hindustan Petroleum Corporation Limited","Gut No 1507, near Old Jakat Naka, NH 3, Agra - Mumbai Highway, Adgaon, Nashik","20.0356817","73.8638151"
"ChIJB7fpeZPD3TsRI_O99kfOiyI","IndianOil Petrol Pump (Shivaji Nagar)","Ground Floor, Agra - Mumbai Highway, Korapgaon, Ojhar","20.085268","73.918961"
"ChIJaR7iLq_D3TsRUvYY4-KOfUY","Bharat Petroleum, Petrol Pump -R.B.Gaikhe & Sons Nh3","OZAR ( NH3 ), Nashik","20.088017","73.9223885"
"ChIJ8Tn_GF7q3TsRiQmqOIsr1Q4","Essar pragati Petrol Pump","2R58+CX2, Aurangabad Road, Swaminarayan nagar, Nashik","20.0085165","73.8173864"
"ChIJZ-T5_Kzr3TsR6WCnbyRgeR0","Palija HP Petrol Pump","Malegaon Motor Stand, Panchavati, Nashik","20.0098801","73.792481"
"ChIJt-Hf3QLr3TsRlZtJGlPBpGE","Hindustan Petroleum Corporation Limited","Ground Floor, near Holy Cross Chapel, Old, Agra - Mumbai Highway, Trimbak Naka, Nashik","19.996577","73.78192489999999"
"ChIJIwUZWAjr3TsRq01UkbTkYVU","Hindustan Petroleum Corporation Limited","Ground Floor, Trambakeshwar Road, Trimbak Naka, Police Staff Colony, Nashik","19.9975467","73.7809146"
"ChIJa3Ip9MLq3TsRxCNU5olqpQs","Bharat Petroleum Customer Relation Centre","XRH5+6PX, Samta Nagar, Nashik","19.9781233","73.8093458"
"ChIJeW2aTi_q3TsRCkOn45lbhRc","Nayara Petrol Pump","Maharashtra State Highway 17, Vaiduwadi, Mhasrul Gaon, Manora","20.0427484","73.8056347"
"ChIJlRt6WB7r3TsRfyJBS-mFG00","KALIKA PETROLEUM SERVICES BPCL","Wadala, Pathardi Road, Vinay Nagar, Indira Nagar, Nashik","19.9820488","73.79194919999999"
"ChIJkTcwWKzr3TsRYraVe40DuR0","Shweta HP gas Agency","Peth Phata, Opp. State Bank, Panchavati, Nashik","20.01307989999999","73.79191019999999"
"ChIJhQY7PWzr3TsRm0_iKLcXR-U","IndianOil Petrol Pump (Om Nagar)","Lock No 11019, Agra - Mumbai Highway, Adgaon Naka, Panchavati, Nashik","20.01028999999999","73.807671"
"ChIJ07D_TVrq3TsRjF6hnXu2MPk","IndianOil Petrol Pump (Om Nagar)","near Haldi Lonws, Adgaon Naka, Om Nagar, Nashik","20.0109019","73.8057523"
"ChIJu8t_LADr3TsRwDix73C7vWk","Nyra Petrol Pump Aurangabad Road","2R58+GX3, Aurangabad Road, Madsangavi, Nashik","20.0087726","73.81740789999999"
"ChIJCQzAJRXr3TsRaC79KHBrh7U","Shell","Aurangabad - Nashik Highway, Nashik","20.005965","73.823725"
"ChIJ2xfV_5rr3TsRAG8pXw252Hk","MNGL CNG PUMP next to KK Wagh College","2R8F+6PX, Service Road, Pachwati, Sri Ram Nagar, Konark Nagar, Nashik","20.0156132","73.8243518"
"ChIJe8G9g3rr3TsRi9gGrZl_lcU","Bharat Petroleum, Petrol Pump -Khalsa Automobiles","PANCHAWATI NASIK, Ahilyabai Holkar Bridge, Panchavati, Nashik","20.010037","73.79271469999999"
"ChIJJYhjBwjr3TsR2SH6_thZcFk","IndianOil Petrol Pump (Panchavati)","Lock No 12030, Motor Stand, Panchavati, Nashik","20.009705","73.792046"
"ChIJUwoYUKzr3TsRwZ-oPc6mDF4","Hindustan Petroleum Corporation Limited","Ground Floor, near Malegaon Stand, Panchavati, Nashik","20.0094488","73.7912466"
"ChIJk9Mrw2fr3TsR8ypEXvaOoVs","BPCL kimaya Petroleum","Aurangabad Road, Kailash Nagar, Nashik","20.0049272","73.8265831"
"ChIJ6Wr5Sznr3TsRxBte2-2T0MA","Sahadev Petroleum","Tapovan Road, Nashik","19.9927848","73.80942"
"ChIJbVBZ853r3TsR1laxKLBAwt4","Nayara Suvarna Krishna Petroleum","2R9G+5WH, Audumbar Nagar, Near Bali Mandir, Munbai, Agra - Mumbai Highway, Nashik","20.0179255","73.8273557"
"ChIJGcMXGADr3TsRgyG7jFOfjIw","Satpur","XQXR+P2C, Nashik","19.9993217","73.79001880000001"
"ChIJU2D_vBCT3TsR6WpXo_MXuJw","HP Petrol Pump","S NO, 89/1, Agra - Mumbai Highway, MIDC Ambad, Vilholi","19.9178277","73.7132522"
"ChIJWY3owlyT3TsRVn540DT1Kcw","Hindustan Petroleum Corporation Limited","Gut No 42, NH 3, Agra - Mumbai Highway, Rajur Bahula","19.9099045","73.7046369"
"ChIJz46YbjyT3TsRc8HOAPtjQkg","Bharat Petroleum, Petrol Pump -N.L.Gandhi & Co.","RAJUR ( NH3 ), Nashik","19.9061572","73.7008602"
"ChIJW6IqlwKT3TsRjab5LDUJELE","IndianOil Petrol Pump (Akrale)","Gut, No 64/1/ P, Akrale, Rajur Bahula","19.9029937","73.70032479999999"
"ChIJN97QJJWT3TsRI47h_wWvOak","Hindustan Petroleum Corporation Limited","No 17/2, opposite Sanjivani Resort, NH 3, Agra - Mumbai Highway, Vilholi","19.9338981","73.7285469"
"ChIJrbhqEw6T3TsRrOiHTULEVUM","Shivneri Petroleum Services BPCL","SURVEY NO. 19/2A National Highway NH3 MUMBAI - AGRA VILHOLI, SHIVAR, Nashik","19.934059","73.73097729999999"
"ChIJ5eY_5iuT3TsRH2AN2yhskVc","Nashik CNG opp D mart","WPPJ+7V7, Mumbai - Nashik Expressway","19.9356683","73.7321783"
"ChIJf7noXRKT3TsRJk-tbsa8E3s","MNGL CNG Station","Mumbai - Nashik Expressway, Nashik","19.9357034","73.7322428"
"ChIJ2Sn-mDST3TsR6qwYLg8XYXU","Prathamesh Petroleum Authorised HPCL Dealership","opp. Eaton Ltd, MIDC Ambad, Nashik","19.9464855","73.7409603"
"ChIJjXN6_KaT3TsRkXyv3zsgkks","Hindustan Petroleum Corporation Limited","opposite Blue Cross Ltd, Plot No P/33, Ambad Satpur Link Road, MIDC Ambad, Nashik","19.946821","73.740944"
"ChIJ0xJXAIjt3TsRhcd34xEwYd4","IndianOil","Plot No X1, MIDC Ambad, Nashik","19.9502578","73.7378502"
"ChIJE5K5BmXt3TsRC_EtpDCX3Fw","IndianOil Petrol Pump (MIDC Ambad)","Plot No 10/1, MIDC Ambad, Nashik","19.9502601","73.7378501"
"ChIJDQFJKwDt3TsRepXbBi9im7Y","Shivshakti engineering","XP2P+MFV, MIDC Ambad, Nashik","19.9517471","73.7361734"
"ChIJ11VJIcCR3TsRFBbokO3JF6M","Hindustan Petroleum Corporation Limited","Ground Floor, NH 3, Igatpuri, Gondedumala","19.8285839","73.6752661"
"ChIJfyMu8OqR3TsRnGcW89B9JbI","IndianOil Petrol Pump (Igatpuri)","Gat No 553, Gondedumala","19.8306817","73.6749799"
"ChIJH6Ps4bCR3TsRk5RU8igIvN8","IndianOil Petrol Pump (Padaali Deshmukh)","Gat No 366, Padli Deshmukh","19.8041354","73.67155439999999"
"ChIJf6xXLZOR3TsRVkqYjLMyU1k","Bharat Petroleum Petrol Pump , VIRAJ PETROLEUM","GAT NO - 164, GONDE DUMALANH, 3, Mumbai - Nashik Expressway","19.8368938","73.6772422"
"ChIJm8wPkh6F3TsRieG-0gvqgeQ","Vicky Parmar","Shop No 1 Near Ghoti Tole Plaza Mumbai, Highway, Kasara","19.7083282","73.6145548"
"ChIJy7JMjVaE3TsRulDQFFb_pbc","M R Rathi & Co. BPCL, CNG Station","Take-Ghoti NH -3 , Mumbai Nashik Highway, Dist, Igatpuri","19.6993474","73.6028386"
"ChIJ0W5tYGuF3TsRHIAvU_4iXMg","Shahane Petroleum","near NH03, NH03 Highway near Ghoti goan, near NH03, Mumbai - Nashik Expressway, Nashik","19.7228433","73.6283328"
"ChIJNVrrcj6F3TsRZSBvKkBlkYE","Hindustan Petroleum Corporation Limited","Ground Floor, Ghoti - Sinnar Road, Khambale","19.7271246","73.6316587"
"ChIJd2jvMdqF3TsR3VYfJ0hojwg","IndianOil Petrol Pump (Bortembhe)","Lock No 12019, NH 3, Agra - Mumbai Highway, Igatpuri","19.6956413","73.5955293"
"ChIJUyQh1S-b3TsRo6lpuxHW9fE","IndianOil Petrol Pump (Fata)","Lock No 12020 Khambale, Ghoti, Igatpuri","19.7290957","73.6325462"
"ChIJOWQIEjuR3TsR0Cme_P97txw","IndianOil Petrol Pump (Aswali RS)","Gut No 621, Khambale, Igatpuri, Aswali RS, Khambale","19.7446828","73.6408866"
"ChIJ992_uEWF3TsRsucODYihoXY","Shree Hari Petroleum","gat no 621, NH3, Khambale","19.74503199999999","73.6408273"
"ChIJ1ekaslqb3TsRjyuuYAY3liw","IndianOil Petrol Pump (Korapgaon)","Gut No 240, No 2, Ghoti - Sinnar Road, Ubhade","19.725706","73.659238"
"ChIJBZ2pJxd-5zsRTv-3_yzB6do","IndianOil Petrol Pump (Mokhawane)","Survey No 170/2, Shahapur, Mokhawane, Shirol","19.6277524","73.4505551"
"ChIJn5IUFK145zsR_VmDp_PBzQk","Hindustan Petroleum Corporation Limited","Ground Floor, Mumbai - Nashik Expressway, Lahe","19.5527699","73.3688138"
"ChIJWW2kF8B55zsRwyCMkR_8Rrs","Kartik autocare","H939+59, Lahe","19.5526901","73.3685282"
"ChIJY5tFenx55zsRkWEnl9mXNjs","Hindustan Petroleum Corporation Limited","Ground Floor, Mumbai - Nashik Expressway, Lahe","19.5546483","73.3694616"
"ChIJZUXJwtmD5zsROS7oF_9Ebug","IndianOil Petrol Pump (Kasara)","Kalamgaon, Shahpur, NH 3, Mumbai - Nashik Expressway, कसारा","19.538722","73.346898"
"ChIJbeXWCAyE5zsRi6hyOrk65tQ","HP PETROL PUMP - SHIVRATAN FILLING STATION","Sapgaon Taluka Shahapur, Vashi","19.44630099999999","73.3523738"
"ChIJgZBHqiyF5zsRjww8qLc1twc","Hindustan Petroleum Corporation Limited","Gut No 531/3, near Visva Hotel, Shahpur, Dolkhamb Road, Shapgaon, Thane","19.446192","73.3523147"
"ChIJSdvOPACD5zsRYYy7lLN8jMA","NK Petrol pump","F82V+RH5, Shahapur","19.4520239","73.3439799"
"ChIJl1UKIgCF5zsRmfPyrmF_-Bo","Ekdant petroleum shahapur","F82V+CGR, Maharashtra State Highway 79, Bamane","19.4512583","73.3437983"
"ChIJu6yGSQCR5zsRTmf13hndaTU","Shree Swami samartha gas agency","Gurawali Pada","19.3098802","73.21846590000001"
"ChIJq2APvQWX5zsR2b2qC6bkGMg","Tci Company","Bashir - 7038678800, *Adress* - TCI company behind stelar company, near antariksh office, opp. HP petrol pump, vashere. Kalyan, Padgha","19.3334997","73.1615127"
"ChIJnzy4UV2X5zsRS-YYQ86Q5PE","Hindustan Petroleum Corporation Limited","S No 58/16, Road Sape Padgha Road, Padgha","19.3308659","73.15917689999999"
"ChIJvV3vPQCX5zsReGS157Pxjuc","IndianOil Petrol Pump (Aamane)","Ground Floor SH 46, Bhiwandi, Kalyan-Sape Road, Aamane, Padgha","19.3194645","73.15969679999999"
"ChIJjZUmWwCZ5zsRCQjaAHm8eQs","Bharat Petroleum","2/13/A, Taloli - Padgha Road, Borivali Tarf Rahur","19.3484249","73.15888199999999"
"ChIJxSVH9gGb5zsRVtNsDtXbZ4A","Bharat Petroleum, Petrol Pump -BP-Padga","N H 3 PADGAH, THANA","19.3690133","73.184463"
"ChIJV7y2W-mZ5zsRlsSgo_yTda0","Maruti Automobiles Indian Oil Petrol Pump","Arjunali","19.3590632","73.16355089999999"
"ChIJGx56miGa5zsR-28uETcK8dg","Hindustan Petroleum Corporation Limited","S No 53, near MSEB Power House, NH 3, Mumbai - Nashik Expressway, Padgha","19.3698402","73.1873039"
"ChIJtRH6UyKa5zsRldXBeKXnHa8","Shell","95CR+56X, Agra - Mumbai Highway, Vahuli","19.37048459999999","73.1906161"
"ChIJxd2UqsaZ5zsRlRXccHEcuQs","Varshman Auto Service","Arjunali","19.3628125","73.1670625"
"ChIJCbRVG3uZ5zsR-vikaINC2mE","Hindustan Petroleum Corporation Limited","Ground Floor, NH 3, Bhiwandi, Padgha","19.362833","73.16703199999999"
"ChIJbQnxOzSW5zsREH9hxno2N0s","Hindustan Petroleum Corporation Limited","9 & 10, S No 7, H No 2, 3, 5 to 7, Bhiwandi Bypass Rd, Sonale, Bhiwandi","19.2853676","73.10761900000001"
"ChIJicgnMx6W5zsR9KVRoVUTkVo","Hindustan Petroleum Corporation Limited","Ground Floor, NH 22, near Nisharg Hotel, Ranjnoli","19.2632786","73.0886803"
"ChIJVbY4Zmu95zsRC31e4l4y9ZI","IndianOil Petrol Pump (Babu Ganj Groups)","St Depot, near Bhiwandi, Old, Agra Road, Nizampur, Thane","19.3047011","73.06580749999999"
"ChIJPz_PO2u95zsRruihQGFNXpw","Hindustan Petroleum Corporation Limited","opposite Bhiwandi Scan Centre, S No 66 & 82/P, Old Mumbai-Agra Road, Nizampur, Thane","19.305351","73.065191"
"ChIJg4BICEO95zsRe1wl6RYqfTI","Mahanagar Gas CNG Station","658, Nashik Road, Millat Nagar, Avachit Pada, Bhiwandi","19.3144741","73.0730938"
"ChIJj6ZZXyWW5zsR74DmB_ry0rM","Reliance Petroleum","Survey No 79, 86/171 Bypass, NH 3, Sonale, Bhiwandi","19.2783569","73.0981372"
"ChIJg1KNCgCX5zsRR-YdTilZzMc","CNG JIO PUMP","79, Saravali, Bhiwandi","19.2781613","73.0983372"
"ChIJrfokkCyW5zsRBOWyTdBta0M","Sai Krupa Mini Bharat Gas Services","Shop No 1, Silent Complex Lonavale, Bhadwad Gaon, Mumbai","19.28761579999999","73.0945127"
"ChIJyUsoBou95zsRLRdYcXuQHao","IndianOil Petrol Pump (Saravali)","Ranjnoli Kalyan Road, Dandekarwadi, Bhiwandi","19.268331","73.083985"
"ChIJX4rlUoC95zsRcAbOFqYIh9c","Mahanagar Gas CNG Station","CNG pump, Mumbai - Nashik Expressway","19.2682593","73.0838302"
"ChIJSTgEhh6W5zsRJrJdE-JQ3Ak","MNGL CNG Pump","736R+GCF, Sapna Industrial Estate, Saravali, Gove","19.2613195","73.0910406"
"ChIJr_nAdhyW5zsRBSo0mpnhIdg","Bharat Petroleum","India","19.2588479","73.0933975"
"ChIJgcFf1wSW5zsRulvoXV5mjV8","Mahanagar Gas CNG Station Kanhaiya","124/4, NEAR RITU HYUNDAI,GOVE, VILLAGE, Bhiwandi","19.2546685","73.09634299999999"
"ChIJGyjmrFOX5zsRWy5l0Jx-dts","Jayshree Enterprise","7442+3W8, Thane","19.2551699","73.10233579999999"
"ChIJafLjtXCX5zsR_PzBuIG2VeY","IndianOil Petrol Pump (Sonale Village)","Lock No 21011, Mumbai Nashik Highway NH 3, Dandekarwadi, Valshind","19.2974241","73.1097496"
"ChIJK3bf8jCX5zsRChJ8fgHhVR8","IndianOil Petrol Pump (Saravali)","Lock 11031, Kalyan - Bhiwandi Road, Saravali, Kalyan","19.253204","73.098078"
"ChIJRzhy1QiW5zsRfCm1hCVlcCw","Reliance Petrol Pump","7422+2XX, NH 222, Kongaon","19.25","73.102475"
"ChIJ17FhB0y95zsRJZRAsaFmRtg","Zishan Enterprises","Ground Floor, Ahbab Hotel, HN.1777, Bhiwandi","19.2923683","73.07086869999999"
"ChIJzWR_ohaX5zsRnRL2zQvRGi8","Valshind NTI","Taluka, भिवंडी","19.303777","73.109079"
"ChIJk9yjmGO95zsRPj_lgMPTn9Y","Satyam Automobiles","Shop No.14, Gaibi Nagar Bhiwandi, Bhiwandi","19.2925078","73.0705921"
"ChIJsTFZ1lW45zsRnzzwSiy6-e4","Chheda Service Station BPCL Petrol Pump","near Johnson Garden, Lal Bahadur Shastri Marg, Sambhaji Nagar, Mulund West, Mumbai","19.17778","72.943679"
"ChIJt-dPxwW55zsR3OYlDioCwZY","AIKI AUTO Cng Pump","B-27, SG Barve Road, Neheru Nagar, Wagle Industrial Estate, Thane West, Thane","19.1939447","72.95338989999999"
"ChIJS7IssB255zsR5nNKyNTtl74","Bharat Petroleum","Nandanvan Industrial Estate, D/11, Lal Bahadur Shastri Marg, Louis Wadi, Thane West, Thane","19.1875579","72.9616995"
"ChIJt8asOiu_5zsRQzJ4FHt1nIQ","Hindustan Petroleum Corporation Limited","opposite Green Word, Plot No 130, Digha Naka, TTC MIDC, Vitawa, Navi Mumbai","19.184651","72.99402100000002"
"ChIJC2yhzD255zsRM3py_dGmMQI","Mahanagar Gas CNG Station","Khopat Road, Khopat, Thane West, Thane","19.2023766","72.9726207"
"ChIJYwHKntq95zsRG2DAFBmGJAM","Anjur Service Centre","3, Agra - Mumbai Highway, Thane West, Bhiwandi","19.1957353","72.96187189999999"
"ChIJbTiVQce55zsRcEqLQfSEEYk","Shell","Service Road, Thane","19.195491","72.963081"
"ChIJmd2nHQC55zsRYtniEjcyCgM","KOWTHALAM ADONI ROAD","5XW4+WJV, Ambica Nagar, Wagle Industrial Estate, Estat, Thane","19.1973555","72.95653779999999"
"ChIJw4f4oOa55zsR3UzvHIHqX3s","Namdev Nipurt","Shop 04, Teen Perto Pump 26, Thane","19.1939618","72.9704826"
"ChIJed5KkCG55zsRMaLYhxviwLw","BEST TYRE SERVICE","oppojit teen petrol pump, Tulasi Chambers, B/H, Lal Bahadur Shastri Marg, Thane West, Thane","19.1933681","72.97023229999999"
"ChIJxQKJciK55zsRLcN42xzBjn8","Hindustan Petroleum Corporation Limited","No 356, Agra - Mumbai Highway, Naupada, Thane","19.193261","72.970421"
"ChIJs8AfzuS55zsRcLZmOG8L_PA","IndianOil Petrol Pump (Thane West)","Lock No 22005, Plot No 122a, Lal Bahadur Shastri Marg, Naupada, Thane","19.1895","72.96530000000001"
"ChIJEV-YDiK55zsRrZZDlaq7G18","Radhakishan Lalchand HP Petrol Pump","Teen Petrol Pump, Naupada, Thane","19.1928872","72.9702849"
"ChIJe8zbEPS_5zsRJ-GeCjcRcZE","IndianOil Petrol Pump (Thane West)","No A/93, COCO MIDC, Road Number 16, Wagle Industrial Estate, Thane","19.1939396","72.9535659"
"ChIJcZBDGwC55zsRVTHMi2Y-m28","Mahanagar Gas CNG","near Sanjay Gandhi Market, No 33 Ambewadi, near Sanjay Gandhi Market, Road Number 33, Indira Nagar, Wagle Industrial Estate, Thane West, Thane","19.204586","72.95193309999999"
"ChIJ9eOLbfG55zsRDyhkcytnD28","Sandeep Gavelkar Pump","02 22, Shop 02, Kisan Nagar Road, Thane","19.1938754","72.9503014"
"ChIJcRWbUAC55zsRRy551Z2JKz4","MGL Wagle Estate , Modern","6X32+VMC, Road Number 33, Karvalo Nagar, Thane West, Thane","19.2046996","72.9516515"
"ChIJy3mDw7655zsRe12JnUVl62E","MAHANAGAR CNG WAGLE ESTATE","Road Number 22, Neheru Nagar, Shree Nagar, Thane West, Thane","19.19348","72.94956239999999"
"ChIJo8EogAG55zsRRKe8Zziupxs","Bharat Petroleum Corporation ltd","Bpcl PETROL pump, opposite manorpada, Lal Bahadur Shastri Marg, Uthalsar, Thane West, Thane","19.2028694","72.97594099999999"
"ChIJ-a4M1P-45zsR34ODJmECqn0","Hindustan Petroleum Corporation Limited","Ground Floor, BR Road Junction, near Santoshi Mata Mandir, Lal Bahadur Shastri Marg, Mulund West, Mumbai","19.183467","72.94873299999999"
"ChIJI1CjtMfH5zsReHZV7RXOn_E","IndianOil Petrol Pump (Vikhroli West)","opposite Godrej & Company, LBS Marg, opposite Godrej & Company, Agra - Mumbai Highway, Vikhroli West, Mumbai","19.1023956","72.9195445"
"ChIJ2yfwv87H5zsRYwyBVuoXL6I","Bharat Petroleum Corporation ltd","Lal Bahadur Shastri Marg, Ghatkopar East, Mumbai","19.09568","72.9151"
"ChIJ87tx1M3H5zsR875hVRXztSU","Hindustan Petroleum Corporation Limited","No B, 6, Lal Bahadur Shastri Marg, Ghatkopar West, Mumbai","19.0939579","72.9132956"
"ChIJq8zX9na45zsRPhC_KuR23dA","Hindustan Petroleum Corporation Limited","Ground Floor, opposite Jai Hind Oil Mills, Lal Bahadur Shastri Marg, Bhandup West, Mumbai","19.1396151","72.9309356"
"ChIJM1oruHC45zsRMsciKVEaCxk","Bharat Petroleum Corporation ltd","Janta Market, near Neptune Magnet Mall, Agra Road, Bhandup West, Mumbai","19.1429679","72.9330401"
"ChIJBdfkmoDI5zsRs3ygbA7QgMs","Hindustan Petroleum Corporation Limited","Ground Floor, Kerawala Estate Agra Road, Lal Bahadur Shastri Marg, Ghatkopar West, Mumbai","19.0860454","72.8950107"
"ChIJU1WHpaTH5zsRUfSbNhmq7A4","Hindustan Petroleum Corporation Limited","near Railway Station, Ground Floor LBS Marg, near Railway Station, Agra - Mumbai Highway, Vikhroli East, Mumbai","19.1104477","72.925591"
"ChIJ3SA6scfH5zsRE5P7q8XE7sA","IndianOil","TALUKA-KURLA, Vikhroli West, Mumbai","19.1024466","72.9199649"
"ChIJ6bi_f1XH5zsRlB7EA-aGfds","Alfa Oil","Shop No.3, Vikhroli Park Site, Anangarh, Mumbai","19.1071313","72.9143796"
"ChIJg0FTz2rH5zsRAj3F9PZ9KdU","Bharat Petroleum Corporation ltd","Telephone Exchange, Ground Floor Powai Rd Junction, Agra Road, near Powai, Lal Bahadur Shastri Marg, Mumbai","19.124919","72.92495389999999"
"ChIJ1TySWQDH5zsR2RGE8lBi4GU","Shell","4WGC+JFF, Jogeshwari - Vikhroli Link Road, IIT Area, Powai, Mumbai","19.1265645","72.921168"
"ChIJA88jDHLH5zsR_IQ_N1AUE0s","Shell Petrol Pump","2, Jogeshwari - Vikhroli Link Road, Vikhroli East, Mumbai","19.126639","72.92121999999999"
"ChIJSRyOwfHH5zsRqIOXK2JtEXw","IndianOil Petrol Pump (Powai)","Dixant Bhavan, opposite IIT, Adi Shankaracharya Marg, Powai, Mumbai","19.1239521","72.915139"
"ChIJ-72I8vHH5zsRCrXKGSzVNQU","Bhawani Petrol Pump","IIT Main Gate Skywalk, Jogeshwari - Vikhroli Link Road, Tirandaz, Powai, Mumbai","19.1243196","72.914974"
"ChIJhfTfXRnH5zsRSkujU9Ys1GA","Police Fuel Station Bharat Petroleum","opposite Ramabai Nagar, Eastern Express Highway, Pant Nagar, Railway Police Colony, Ghatkopar East, Mumbai","19.0795448","72.9164627"
"ChIJlftsR4TH5zsRamLYnHk8LDE","Samyak Hp Gas Services","Shop no 1, Vasant Rao Naik Road, Ghatkopar, Ramabai Ambedkar Nagar, Mumbai","19.0783926","72.9164375"
"ChIJDydlgdXH5zsRxVpIdqbA3qE","Sagar Oil Center","3VRX+3MJ, Chirag Nagar, Ghatkopar West, Mumbai","19.090224","72.89914100000001"
"ChIJZToCfpbH5zsRVhgCTaRu15g","Bharat gas","3WH6+C3J, Ghatkopar East, Mumbai","19.0785988","72.91014559999999"
"ChIJ7RXZNQvH5zsRcFdW38KNnZg","IndianOil","AB Road, Ghatkopar, Chirag Nagar, Ghatkopar West, Mumbai","19.0871001","72.89971109999999"
"ChIJFd73jy3J5zsRc3pLeICxbHQ","Sai General Store","Shop no.13, Pipe Line Road, Saki Naka, Mumbai","19.1028968","72.8922312"
"ChIJAZkSV2fO5zsRWAx-0exCgZ8","IndianOil Petrol Pump (Jacob Circle)","next to Kasturba Hospital, Sane Guruji Marg, next to Kasturba Hospital, Arthur Road, Agripada, Mumbai","18.98524129999999","72.8308533"
"ChIJw6XdfF_O5zsRP1An_zs3U-I","Hindustan Petroleum Corporation Limited","next to Creative Industrial Estate, Ground Floor, Sitaram Mill Compound NM Joshi Marg, next to Creative Industrial Estate, Delisle Road, Mumbai","18.988625","72.831255"
"ChIJ4Uj281bO5zsR29Sa8BdvCPk","Bharat Petroleum Corporation ltd","near Fire Brigade, 1st Avenue Boundary Rd, near Fire Brigade, West, Cotton Green East, Sewri, Mumbai","18.9867526","72.8438681"
"ChIJx6Jbt1LO5zsR12uQb4lkikM","LAXMI ENTERPRISES (BPCL)","XVJ2+5C8, Signal Hill Avenue, Brick Bunder Tank Road, Reay Road, Mumbai","18.980417","72.8510861"
"ChIJDz9Q6RvP5zsRYjNBBo2VpMo","Petrol Pump","Eastern Freeway, Pratiksha Nagar, BPCL Terminal, Wadala, Mumbai","19.00739279999999","72.85866539999999"
"ChIJOQAP7-XO5zsR6hWMTMXOY0U","Hindustan Petroleum Corporation Limited","Ground Floor, Saint Xavier Street, Parel, Mumbai","19.006042","72.8406546"
