place_id,name,address,latitude,longitude
"ChIJSbFJOlsBDTkRElSokgEoE5c","IndianOil","District Centre 1, Plot No 1/A/3, Sector 10, Rohini, New Delhi","28.7162842","77.1176122"
"ChIJjd8bRk4BDTkR_l-47flCpiM","Bharat Petroleum, Petrol Pump -M.L.Sethi Service Station","Sector 5, Rohini, Delhi","28.7181079","77.1104007"
"ChIJI4VqQ_YDDTkRc_ySOb8zUoM","IndianOil","S18, Site No 2, Road No 43, Service Centre, Road, Pitampura, New Delhi","28.6887307","77.1047244"
"ChIJUVxaIvsDDTkROdYA4ANhRF8","IndianOil","near JAIPUR GOLDEN HOSPITAL, Outer Ring Road, Mangol Puri, near JAIPUR GOLDEN HOSPITAL, Rohini, New Delhi","28.6970115","77.11263509999999"
"ChIJLfZKwQIEDTkRvuesI7qJ-U8","IndianOil","Mongolpur, Sector 1, Rohini, Khurd","28.7013349","77.0919067"
"ChIJE-ZKt04BDTkRIv1JAozAQwE","IndianOil","Metro Station, No 3/B4, Distict Centre 1, near Rithala, Rohini, New Delhi","28.71961","77.1003616"
"ChIJafh5Bv4DDTkRTz2U7fB5GCE","Hindustan Petroleum Corporation Limited","Ground Floor, Community Centre, Sector 3, Rohini, New Delhi","28.7039993","77.1079105"
"ChIJdT4t06wGDTkRqMKkkY5ABcM","IndianOil","No A2, Local Community Centre, Sector 5, Rohini, New Delhi","28.7121742","77.1025433"
"ChIJKcu6C_gDDTkRoIwK7Tz4RJg","IndianOil","near marble Market, Ground Floor, Outer Ring Road Mangolpuri, near marble Market, Sector 2, Rohini, Delhi","28.6940717","77.102746"
"ChIJcTmCXJUDDTkR4xDCGIjtrHc","Bharat Petroleum, Petrol Pump -Sanjeev Filling Station","Mangalam Place, Delhi","28.7007988","77.115183"
"ChIJ8U5zuxoEDTkRTpFS3XIt0Ws","Indraprastha Gas Limited CNG Station","adjoining IBP Petrol Pump, Outer Ring Road, adjoining IBP Petrol Pump, near Mangolpuri Crossing, New Delhi","28.6905472","77.0975954"
"ChIJiR1qfAkEDTkRmADseX-jTFQ","Delta Petroleum","Ba-64, Pitampura, Outer Ring Road, Mangolpuri Industrial Area Phase II, Phase 2, Pocket A, Industrial Area, Mangolpuri, Delhi","28.6868129","77.0991409"
"ChIJAcjyLhEEDTkRLNDEk39np1k","IndianOil","Lock, 650, Mangolpuri Road, Industrial Area, New Delhi","28.6876856","77.0854864"
"ChIJZcI-bbUGDTkRDerttQMW9B0","igl cng pump","P3HX+362, Paul Colony, Rithala, Rohini, Delhi","28.72763309999999","77.0980131"
"ChIJ-fdPC2gBDTkRK6CPsJvC_Uw","Hindustan Petroleum Corporation Limited","Community Centre, near Telephone Exchange, Sector 9, New Delhi","28.7182071","77.1268388"
"ChIJ8SUmzRIEDTkRGbtQlYUOJjg","IndianOil","No 8/1, Mile Stone, Rohtak Road, Mianwali Nagar, New Delhi","28.6798355","77.08897019999999"
"ChIJwc8x5HcEDTkR_X0Ai1RnD8k","Bharat Petroleum Anil filling station","F-15,22,1st Floor,Ansal Utility Commercial Centre,Opp Jwala Heri, Market, Road Number 30, Friends Tower, A 2B Block, Paschim Vihar, Delhi","28.6705188","77.1023277"
"ChIJd1xboDABDTkRTmR04x4jdI4","IndianOil","No E4, Lock, Code I/379, near Garg Trade Centre, Sector 11, Rohini, New Delhi","28.7349274","77.1138939"
"ChIJ6YQadWoBDTkRYUQwniZqty8","IndianOil","Ground Floor, District Center, opposite White House Apartment, 2, Sector 13, New Delhi","28.7248505","77.12600069999999"
"ChIJB_QM44UDDTkR1E4RRQOaiyE","Indraprastha Gas Limited CNG Station","Out Ring Road, Near Milansaar Appartment, Dda Mig Flats, New Delhi","28.6759886","77.0944815"
"ChIJI1E-VzADDTkRAs4E5x2K9-w","IndianOil","Ring Road, Naraina Industrial Area Phase 1, New Delhi","28.6247671","77.1343701"
"ChIJWfxv_2kDDTkRONsLKlxsDiA","BPCL - Welcome Autos only petrol pump","Block V, Rajouri Garden, New Delhi","28.6372227","77.1196889"
"ChIJq6qqFVIDDTkR8eS1fUsZVF8","Indraprastha Gas Limited CNG Station","near Junk Market, Phase -2, Mayapuri, NEW DELHI","28.6188891","77.1127126"
"ChIJMTgtgVwDDTkRklDsimSM3FI","Indraprastha Gas Limited CNG Station","near DDU Hospital, C/o SAKSHAM (BPCL), Beriwala Bagh,, Hari Nagar, near DDU Hospital, New Delhi","28.6306991","77.1112787"
"ChIJN4ux8VADDTkRUWcghWh9X5c","IndianOil","Lock No 363, near Hari Nagar Depot, Jail Road, Janakpuri, New Delhi","28.62332889999999","77.1016211"
"ChIJf7ZQEacEDTkRhRzSBwKejb4","IndianOil","Ground Floor, Block L, adjacent to OM Sweets, Hari Nagar, New Delhi","28.6275732","77.1006617"
"ChIJIT0unxkdDTkRW82z72CFigw","Hindustan Petroleum Corporation Limited","near RR Hospital, Dhaula Kuan Enclave I, Dhaula Kuan, New Delhi","28.59026","77.15751"
"ChIJwXk4XK8EDTkRlg1oEpXzNGM","Hindustan Petroleum Corporation Limited","near Delhi Haat, Block C, Janakpuri, New Delhi","28.62268","77.09561"
"ChIJI1cZa3MDDTkR3Nf07l3AATk","IndianOil","Lock No 988, Lock Code I/390 Bijwasan, Raja Garden Ring Road, Tagore Garden Extension, New Delhi","28.653112","77.1237349"
"ChIJwUAtWhYdDTkRg22_0S3leCQ","Hindustan Petroleum Corporation Limited","Ground Floor, Metro Station Dhaula Kuan, Delhi Gurugram Road, Crossing, Dhaula Kuan, New Delhi","28.5928372","77.1637908"
"ChIJHz6ViQIDDTkRCmEhU7om05A","Hindustan Petroleum Corporation Limited","Ground Floor, Metro Station, near Kirti Nagar, Kirti Nagar, New Delhi","28.653682","77.1473965"
"ChIJXxNbMPsCDTkRbzjukWK34Kc","Indraprastha Gas Limited CNG Station","opp. by Shadipur Depot, Sardar Patel Road, opp. by Shadipur Depot, Patel Road, Patel Nagar, New Delhi","28.652421","77.156206"
"ChIJaasTMfsCDTkRMu3pvUXcqZw","IndianOil","DTC Bus Depot, opposite Shadipur, Patel Road, New Delhi","28.6525902","77.15596339999999"
"ChIJOQtKTnEDDTkR30p55dCwGP4","BPCL AUTO CARE With CNG Felling","B - 31, Block B, B-30, Vishal Cinema Road, Shivaji Place, Vishal Enclave, Tagore Garden Extension, New Delhi","28.6535629","77.11892399999999"
"ChIJ0VYFrL8CDTkR3M7B0xIxpms","IndianOil","near Npl Pusa Institute, Dr KS Krishnan Road, near Npl Pusa Institute, Pusa Road, New Delhi","28.63939","77.17393"
"ChIJJ-9BUAADDTkR_dTH1TvMKdY","Hindustan Petroleum Corporation Limited","near Police Station, 4/6, Shivaji Marg, Motinagar, New Delhi","28.66021369999999","77.1464302"
"ChIJayARBGUdDTkRlZQoFOw5Z_M","Indraprastha Gas Limited CNG Station","Sanmartin Marg Near By Taj Palace Hotel, Chanakyapuri, New Delhi","28.59173119999999","77.1757456"
"ChIJaVGCAkUDDTkReuXAEvhYSOM","Narina Vihar cb188 Sahil service center","189, Block CB, Naraina Village, Naraina, New Delhi","28.6239005","77.1342581"
"ChIJYfyIeAADDTkRBmWmrsw542g","ASC GAS AGENCY","J48J+J2V, Kirby Place, Delhi Cantonment, New Delhi","28.6166063","77.1300404"
"ChIJG5xiw9AcDTkRoNu5JovBpU4","IGL CNG Station Brar Square","near Army College Of Medical Science, Ring Road, Brar Square, Delhi Cantonment, New Delhi","28.6066166","77.1416733"
"ChIJj0X8pwQZDTkRvsGqIm9Co0Y","Hindustan Petroleum Corporation Limited","Ground Floor, Mehrauli-Gurgaon Road, Sector 17C, Gurugram","28.476711","77.066541"
"ChIJYeJrLOQYDTkR5Gt7v3-BJd4","Haryana City Gas CNG Station","Near Near HUDA City Center Metro Station, August Kranti Marg, Sector 29, Gurugram","28.4635142","77.0733094"
"ChIJ00QJN2QfDTkRFib7Vu7uNds","Bharat Petroleum, Petrol Pump -Shri Ram Fuel Centre","Mehrauli-Gurgaon Road, Sikanderpur, Gurugram","28.482508","77.1030363"
"ChIJSUzX7VUYDTkRerzmun1vS4Q","Bharat Petroleum","Delhi - Jaipur Expressway, Block A, Sector 30, Gurugram","28.465562","77.0556369"
"ChIJ7_wwzYIZDTkRzxNFVBH848o","Hindustan Petroleum Corporation Limited","Ground Floor, near Tau Devi Lal Park, Sector 23A, Gurugram","28.50453669999999","77.05440949999999"
"ChIJYV4InFoYDTkRDF7SsyJjaYM","Haryana City Gas CNG Station","Delhi - Jaipur Expressway, Sector 15 Part 2, Gurugram","28.4580247","77.04713"
"ChIJGUFk7VoYDTkRKyZonNFDqwE","Cng Pump sec 15","14, Delhi - Jaipur Expressway, LIG Colony, Sector 31, Gurugram","28.4563465","77.0470625"
"ChIJkwLJ9rcYDTkRBbnSd_tVJQY","Bharat Petroleum Retail Outlet","141, Saint Thomas Marg, DLF Phase 5, Sector 43, Gurugram","28.449704","77.09149719999999"
"ChIJO8DzUiYZDTkRlBB3Dl1ZIoE","Bharat Petroleum, Petrol Pump -Jawala Service Station","Delhi - Jaipur Expressway, Sector 31, Gurugram","28.45586579999999","77.04639900000001"
"ChIJlWegzOAbDTkR6XqthgtsRJk","IGL KAPASHERA","Nera Mcd Toll, Delhi Gurgaon Border, near Chetak Logicstic, opp. Surya Vihar, KAPASHERA, NEW DELHI","28.520952","77.08228"
"ChIJIQqd2x8bDTkRqvqXaJ6gcrk","Bharat Petroleum, Petrol Pump -Jaipur Golden Tpt.Co.Ltd.","BORDER, Kapas Hera, New Delhi","28.5222258","77.0819688"
"ChIJ74Up6uYbDTkRxSKiGXBb0S8","Naveen Gas Services","1188, Gali Number 12, Kapas Hera Extension, Kapas Hera, New Delhi","28.5229353","77.0782625"
"ChIJs7-bMcoZDTkRIqBQutcQjeg","Hindustan Petroleum Corporation Limited","Ground Floor, Sector Road, Sector 12A, Gurugram","28.472691","77.03096099999999"
"ChIJo44tZogZDTkRzwROTiSomYc","IndianOil","near Ansal Plaza, opposite Sector 23, Sector 1, Palam Vihar, Gurugram","28.5129539","77.0435676"
"ChIJ6ZPHmrsYDTkRExoPBfdhzs4","SKN-HCG CNG Station","Sector 52A, Gurugram","28.4422851","77.08596949999999"
"ChIJx3sSpMUZDTkRdM_ade68XR4","Bharat Petrol Pump","LT Atul Kataria Marg, Part- 6, Masani Village, Sector 6, Gurugram","28.4805719","77.0253108"
"ChIJDeq4n-sYDTkRWCnKwb7H68g","Haryana City Gas CNG Station","44, Institutional Area, Prem Puri, Sector 32, Gurugram","28.45215809999999","77.0752005"
"ChIJvbugwQ8ZDTkRPMm8zdy1ovI","Ola Electric Mobility Swapping Station","F3PF+M79, Lane Number 6, Sector 18, Gurugram","28.4866682","77.0732402"
"ChIJtWuyNEgZDTkRuLtm-0oSJRY","IndianOil","tehsil, near bus stop, Rd tauru Goela, mewat, Tauru, Gurugram","28.4881634","77.070118"
"ChIJAQAAAAcZDTkR5v2pbAgdsYs","Rajan Autocare","Sector 17 C, Fifaco Chowk, Mahadhari, Mahadhari, Gurugram","28.4767312","77.0665204"
"ChIJBRRxo5ojDTkR3TxQMuelLtk","Hindustan Petroleum Corporation Limited","Ground Floor, near Police Post, Badshahpur Sohna Road, Bhondsi, Gurugram","28.346201","77.067391"
"ChIJIQWwvJojDTkRkQNA5pWaDj0","Raghav Fuels","Vill, Badshahpur Sohna Road, Bhondsi, Gurugram","28.3459487","77.06771189999999"
"ChIJ8RWFxzcjDTkRQTROH5TQITc","Bharat Petroleum Petrol Pump , GROVER PETROMART","VILLAGE BHONDSITEHSIL, Sohna - Gurgaon Road, Gurugram","28.3395234","77.0681833"
"ChIJSfsF0xslDTkR1HPlxLz61pw","Hindustan Petroleum Corporation Limited","Ground Floor, Toll Plaza, near Ghamroj, Sohna - Gurgaon Road, Ghamroj","28.3301705","77.0678655"
"ChIJbd_9GlgjDTkRWksujzz72BY","IndianOil","Ground Floor, Sohna - Gurgaon Road, Fazilpur, Gurugram","28.3651955","77.059997"
"ChIJN1jlF10kDTkRmk4rd7QlVgc","Indraprastha Gas Limited CNG Station","8368+5HF, Badshahpur Sohna Road, Alipur","28.3104358","77.0664139"
"ChIJnShZFF0kDTkR7uTYPZpd8y4","IndianOil","Sohna - Gurgaon Road, Alipur","28.3089449","77.06628309999999"
"ChIJM9duN9kjDTkRLsDGfAX5RJU","COCO BP BADSHAHPUR","92HV+J47, Aklimpur - Teekli Road, Gurugram","28.379037","77.042794"
"ChIJs89CWgAlDTkRlxmqdWluIE0","Jio BP Petrol Pump","8358+8JR, Alipur","28.3085015","77.0665001"
"ChIJz6eKV1skDTkRO8W6pBSYBnA","Hindustan Petroleum Corporation Limited","Ground Floor, Sohna - Gurgaon Road, Alipur","28.30475999999999","77.06724"
"ChIJq2oiwyUmDTkRwjOWRh1l0AU","Hindustan Petroleum Corporation Limited","MDR 133 Ballabgarh Pali Dhoj, Sohna Road, Sohna","28.254584","77.135401"
"ChIJcxZ7dWIvDTkRAvzM6YvFiTI","Pawan saini","RO ON, Palwal - Sohna Road, Sohna","28.242108","77.072135"
"ChIJ-05pfFMpDTkRbhh9MvdrBok","Bharat Petroleum, Petrol Pump -Om Filling Station","VILLAGE NUNERA, GURGAON","28.2427341","77.1202234"
"ChIJ8WZLnfAnDTkRGXSURR4aJRY","C. S. FUELS KHARODA","747G+296, Unnamed Road, Kharoda","28.2625262","77.1258795"
"ChIJ7bnJpT0nDTkRl1syTWpkok8","IndianOil","Ground Floor Sonha, Km Stone, near 2 Km to 4, Lake Road, Damdma","28.2663331","77.0915594"
"ChIJX_Kp5GEvDTkR0q1nQUfbMj4","IndianOil","Ground Floor, Palwal - Sohna Road, Bhirauti, Gurugram","28.2420283","77.07431679999999"
"ChIJrYpXcQAvDTkRMl_PeeXXZqs","CNG","near Sani Mandir, 10, near Sani Mandir, Gahlot Vihar, Durga Colony, Sohna","28.2417464","77.07435459999999"
"ChIJeba3mYklDTkRZT6MVPscDao","IndianOil","Delhi – Alwar Road, Sohna","28.244454","77.0724637"
"ChIJiZdL_WElDTkR4QzbXX9uPVk","Bharat Petroleum, Petrol Pump -Raghunanadan Service Station","Badshahpur Sohna Road, Sector 38, Gurugram","28.2567809","77.0695017"
"ChIJw5RJKAAnDTkRzvu2rHKq6fM","Hindustan Petroleum Corporation Limited","Ground Floor, Sher Shah Marg, opposite Hanuman Mandir, Permit Lane, Abhepur","28.2876287","77.10785070000001"
"ChIJ8UgNAREvDTkRhnjkq1Xxa3U","CNG machanic Faruk","63Q9+CQW, National Highway 248A, ITI Colony, Sohna","28.238625","77.06944299999999"
"ChIJbaUSewAnDTkRHmVrCAY8ABc","Ch.kishan lal filling station & CNG pump","748X+6JM, Nimot","28.2655906","77.1490474"
"ChIJp7WjTwAnDTkRKtRTy4hUVSM","REYANSHI FILLING STATION","74Q4+Q7X, Abhepur","28.2896042","77.10591889999999"
"ChIJhbBvK5glDTkRUVKkXo6H-xg","Raghunandan Filling Station","7369+Q3C, Sohna Rural","28.2619421","77.06765279999999"
"ChIJ6Q5MpmQvDTkRkmk7vzKCH7I","IndianOil","Ground Floor, Tel Exchange, opposite Sohna Road, Bhirawati","28.2358802","77.0690718"
"ChIJJwH3oaIlDTkRjDQkXlx5-8I","IndianOil","Ground Floor, near GD Goenka School, Sohna - Gurgaon Road, Bhirawati","28.2648275","77.0666444"
"ChIJ9a8fTAAlDTkR887lMRCqXhM","Govardhan hp","Ashiyan T1, behind Ashiana Mulberry, Sohna","28.27158","77.06681999999999"
"ChIJnQs_ehAvDTkRZc27gJJDuMA","IndianOil","Ground Floor Sohna Alwar Road, National Highway 248A, Sohna","28.2302723","77.0666431"
"ChIJq6qqusorDTkRkd8ww5INwDs","IndianOil","Ground Floor Mindkola, Nuh Rd, Chhainsa, Palwal","28.13337599999999","77.156795"
"ChIJEb9Ns0kqDTkRciLxy89vuvw","Prasad filling station Petrol Pump","45M4+9VC, Palwal","28.1334348","77.15712789999999"
"ChIJ80nqQHIqDTkRZs16vVgnPp8","IndianOil","Ground Floor Mandkola, Palwal, Chhainsa","28.133678","77.184738"
"ChIJgbpyYpArDTkR2rGQv7HazvY","SAHEED RAMPAL FILL. STATION","45M5+2CH, Major District Road 132, Nuh","28.1325688","77.1586172"
"ChIJO8Z5bI8rDTkRyeuquC8rDt4","Hindustan Petroleum Corporation Limited","Ground Floor, Mandkola","28.13276979999999","77.1644774"
"ChIJu70XD3crDTkRaFJ2iTL2Y4I","IndianOil","Ground Floor, Sohna Mindkola Road Gangoli, Nuh, Bhirawati","28.15191","77.121895"
"ChIJF-cG5X0rDTkRpmm9P0VXgPA","Bharat Petroleum, Petrol Pump -Shaheed Rampal Filling Station","MINDKOLA,PALWAL NUH RD,MEW, PALWAL","28.1325957","77.16684529999999"
"ChIJ8yjfiVkpDTkRP0i4yXc3h5k","IndianOil","Ground Floor, Nuh, Sohna-Mandkola Road, Kherli Dausa","28.1600967","77.115999"
"ChIJ-TS9ZQDVcjkR4aSvO2vHPmQ","M/s PRA GAS, CNG Station","24GF+W78, Jaisinghpur","28.0272833","77.1232164"
"ChIJ22suHQDVcjkRK076Cdl0YuM","PRA GAS","Usman Market, near Bay, 112, Nuh Hodal Road, Village, Chilavli, Nuh","28.027545","77.1231233"
"ChIJNcS08_rVcjkRXSsXBOTg18A","Essar Petrol Pump","24M7+2G3, Nuh Hodal Road, Jaisinghpur","28.0325001","77.1138064"
"ChIJCyOsQADVcjkRj8q6jCjhOoI","Hindustan Petroleum Corporation Limited","MDR No 132, Nuh Hodal Road, Tajpur","28.0342526","77.1090718"
"ChIJVbHFslDVcjkRdtYyZebqvYo","IndianOil","Ground Floor, NHAI Rest Area, Delhi - Mumbai Expressway, Tajpur","28.0356006","77.11937329999999"
"ChIJn-TvJ3LVcjkRNgWXR273_5U","Rest Area & Facility","24PC+49, Tajpur","28.0353458","77.1209644"
"ChIJVbdlPgDVcjkRpTLAanrkHmY","IndianOil","Ground Floor, NHAI Rest Area, Delhi - Mumbai Expressway, Tajpur","28.0354477","77.1208023"
"ChIJr0KTs2bVcjkRRKqk4SiEgX8","Hindustan Petroleum Corporation Limited","Ground Floor, Nuh Hodal Road, Thekra","28.0164153","77.14134349999999"
"ChIJfajigwDVcjkRRZEIXaEhc1E","Satish HP Filling Station","Shop no 30, Filling Station, Thekarka","28.0163217","77.141845"
"ChIJyUlxZlvVcjkRS28V9-OBvM8","HP Pump","Shop no, near by Mewat Hospital, 27 Rd, Thekda Mode, Nuh","28.01580109999999","77.14345469999999"
"ChIJMd_I4n3TcjkRX18tv_6Q1Io","IndianOil","MU No 173, Khata No 1833, 1820, Nuh Hodal Road, Ujina","28.042713","77.094773"
"ChIJUWDO8kXTcjkR1LtpDSWqvT0","ESSAR Petrol Pump, Ujina","Ujina","28.0474831","77.08663709999999"
"ChIJQ7co_9jTcjkRIUELmM6C2WI","Bharat Petroleum, Petrol Pump -Vimal Filling Station","UJHINA,NUH HODAL RD,MEWAT, MEWAT","28.0477684","77.0855579"
"ChIJFecqV0nXcjkRP4LhN8rLNyE","IndianOil","Ground Floor Pinangwa, Punhana, Luhinga kalan","27.8953961","77.10873269999999"
"ChIJVXQwGCLRcjkRZuQLpCY6kuk","Hindustan Petroleum Corporation Limited","Ground Floor, Badkali Punhana Road Ferozpur Jhirka, Marora","27.909423","77.064881"
"ChIJT8gxmTPRcjkRut1iQGznnxs","Shri Om Fuel Point","W372+MP, Marora","27.9138896","77.0518056"
"ChIJa2-GJW_RcjkRtuWPKjlkFZ4","Hindustan Petroleum Corporation Limited","Ground Floor, Badkali Punhana Road, Punhana, Pinangwan","27.90168899999999","77.094594"
"ChIJ6a6qocnQcjkRjo5A-TjbAeY","IndianOil","Ground Floor, Punhana, Berkeley Road, Lohinga Kalan, Pinangwan","27.902136","77.095123"
"ChIJabn67S3XcjkRjtxgXh3gILQ","Hindustan Petroleum Corporation Limited","Ground Floor, Punhana, Rehpuwa","27.9213369","77.1127283"
"ChIJo2YG2oTRcjkRYdel_wErvbE","Badarpur filling station","Vill. Badarpur, bhadas sikrawa, Road, Badkali","27.9470407","77.0431662"
"ChIJEQi2xpDRcjkRqM0nciwa2iU","Bharat Petroleum","W2WV+V7Q, Major District Road 135","27.9472027","77.04322049999999"
"ChIJF5ShH-fXcjkRGuAtZY5tzuk","Lalaram Tanvar filling station","V4P3+9R8, Pinangwan","27.8859216","77.1045654"
"ChIJXwmV9YnDcjkRYWa5Ujz_yV8","Reliance Petrol Pump","QW9W+HV5, Firozpur Jhirka","27.7688965","76.9472323"
"ChIJ_Qw8EgDDcjkRdjeL3_iL_C0","Adani CNG station","PXQM+FM, Maholi","27.7388178","76.9846385"
"ChIJ5-iEHV7PbzkR0zl6eeTmkls","IndianOil","No 69/9 Rhs, Delhi - Mumbai Expressway, Gurugram","27.7388398","76.9845622"
"ChIJwQjO55DDcjkRWekpMc-7EfI","petrol pump","PXQM+C8H, Firozpur Jhirka","27.7385681","76.9833538"
"ChIJOZAjJADDcjkRTw-pS-2y874","Jagat dhaba","PXQM+78, Maholi","27.7381762","76.9832953"
"ChIJjwQxTwTDcjkRyWOi0s8Fx1Y","Shiv filling station","Q262+W3C, Ghata Shamasabad","27.7623121","77.00012629999999"
"ChIJlfTMOFHDcjkRPH4CnjuFYQQ","Numbardar Fuel Station","QX7X+J45, State Highway 22, Ghata Shamasabad","27.7641937","76.99665879999999"
"ChIJRUTSjLbDcjkRks7rysvnSEU","D E F TRUCK URIYA PUMP","near by Royal Restaurant Eistideam Ke Samne, Shop No 12, Bharatpur Man Road, near by Royal Restaurant Eistideam Ke Samne, Alipur, Ferozepur Jhirka","27.7722939","76.97840459999999"
"ChIJ769Z7ifFcjkRJsv1qtrkuZE","SRL FILLING STATION","State Highway 22, Kameda","27.7733532","76.9754267"
"ChIJu00usoLEcjkR2DSPpumnfr4","Hindustan Petroleum Corporation Limited","Ground Floor Firozpur Jhirka, Kaman Road, Kameda","27.773574","76.975585"
"ChIJgaMeDQDDcjkR7M9iB8Ou1BI","ansar D E F youria wale","QW2W+H82, Hasanpur Bilonda","27.7513869","76.9457772"
"ChIJVb1oc1NJDTkRUO6HYaPdooA","IndianOil","Ground Floor SH 13, Alwar Road, Agon, Firozpur Jhirka","27.7515989","76.945714"
"ChIJFf6zvwPDcjkRHE00yrCQCy0","Om Auto Parts","near by Court, Shop No 36 Delhi Alwar Road Ferojpur Jhirka, near by Court, Nuh","27.7464579","76.9412601"
"ChIJZd9vkOvDcjkRGSTnUddxhZo","IndianOil","Ground Floor, near Pathkori, And, Gurgaon Alwar Road, Aharwan, Rawli","27.7338134","76.9427925"
"ChIJTfJa-_DdcjkRo0RYuHzawf4","Hindustan Petroleum Corporation Limited","Ground Floor Basaimeo, Ferozpur Jhirka, Bewan","27.7601907","77.0305018"
"ChIJDeVRnZXccjkRLs8UOnUQKSg","Bharat Petroleum","Q25M+7MV, State Highway 22, Dhaulet","27.7582274","77.0341634"
"ChIJCc9HbwDFcjkRMlyTf6ZexgM","Kameda Bharat","QXFC+Q8M, Kameda","27.7744706","76.9707869"
"ChIJcds1Z47pcjkRXb1XBRt1rdQ","Karan Singh kirana stor and restorent","JWHR+QJR, Rasgan","27.6294865","76.94151649999999"
"ChIJZzpBr2HpcjkR-TTCYM2Sl2k","जिया ई-मित्र","MW5V+M85, Golki","27.6591428","76.9433468"
"ChIJG0GZhL7pcjkRJ82Oeb5o_IE","Bharat Petroleum, Petrol Pump -Mahindra Filling Station","DOHA,GGN ALWAR RD,MEWAT, MEWAT","27.6713938","76.9530654"
"ChIJtQEDkbXpcjkRrj4qhoOaiVc","IndianOil","Ground Floor Kolgaon, Ferozepur Jhirka,Agon, Gurugram","27.6731001","76.9478001"
"ChIJoWAz94PDcjkR6Hz751RriZA","Hasan Khan","Nkn K, MXM8 2RCGG Mhsn","27.6825603","76.9670084"
"ChIJy5HKPcDDcjkRj_hHaAuv5qk","JABIR KHAN","JABIR 5255, JABIR 5255, Agon","27.6835182","76.9658025"
"ChIJ81kJIADtcjkR8z2AZ7qG3qQ","HP Petrol pump","GV26+99, Bhayari","27.50145719999999","76.8609592"
"ChIJG8HvfQDtcjkRCC8WkrjJpUg","Petrol pump","GV25+XX3, Bhayari","27.502402","76.85961739999999"
"ChIJh9gG1CvzcjkR74Ol5b6fmSs","IndianOil","Ground Floor, Bharatpur Road, Barodameo","27.4792871","76.8787155"
"ChIJozEc7_LscjkRX-dgJByVgd0","IndianOil","Ground Floor, Milkpur","27.5524343","76.8625854"
"ChIJYRPnGoPycjkR8aJ2dvv89XQ","IndianOil","Ground Floor, SH 14, Barodameo","27.4820067","76.8626127"
"ChIJ--_ZGq2NcjkRUH1GMwCzPj8","Nangal tappa fuel station","CQPC+MW5, Nangal Tappa","27.4366471","76.772351"
"ChIJBdWnUE9_cjkRcpTYG_0Rzlw","IndianOil","Ground Floor Nagal, Ramgarh, Alwar, Badla","27.4370166","76.7721644"
"ChIJPVBSu26LcjkRdLbnIqjElqE","IndianOil","Ground Floor, Laxmangarh Malakhera Road, Chimravali Sikh, Bedar, Alwar","27.3627291","76.78072519999999"
"ChIJvw7JTk2LcjkRpbOZmNp_zS8","Bharat Petroleum, Petrol Pump -Parasnath Filling Station","MAUJPUR ALWAR, Alwar","27.3628089","76.7964969"
"ChIJsbOROcCLcjkRaWxn6gIv-jg","IGNITE ENERGY STATION","ON SH-44, TEHSIL- LAXMANGARH, Maujpur","27.3641679","76.8216591"
"ChIJzSEwbbhmcjkRkNdvajqQxjc","Hindustan Petroleum Corporation Limited","Ground Floor, Reni","27.181942","76.738177"
"ChIJrVdRJgBlcjkRXhRooGZ6RI8","HP Petrol pump","Petrol pump at, Delhi - Mumbai Expressway","27.11826789999999","76.6635639"
"ChIJu2oW8ABxcjkRWQ1LL70P_ws","Bharat Petroleum, Petrol Pump -Harsh Kisan Service Center","KESHOPURA DAUSA, DAUSA","27.0881684","76.63438119999999"
"ChIJN3NwAQBvcjkR8BNZlzw4VNM","Nayara petrol pump","3PW3+4WF, Dubbi","27.0953096","76.70479040000001"
"ChIJ1VfpGwB1cjkRUe2ZkiTEVlA","Kandoli kalalakhoh","WF75+2M9, Kalakho","26.91253720000001","76.4592275"
"ChIJs9Zz-DL1bTkRzHXCpuN_V98","Hindustan Petroleum Corporation Limited","Ground Floor, Garh Road, Bhandarej","26.8983783","76.41906660000001"
"ChIJSdvxa4SLbTkRs8cUv4Lv2aQ","Gurjar Filling Station","Mitrapura","26.9113724","76.40738309999999"
"ChIJgyzTEV51cjkR-wIXIRYgrAo","Bharat Petroleum","India","26.9150186","76.4613373"
"ChIJWcIVA8yLbTkRIRVgR8kTKoQ","IndianOil","W94R+WM5, NH 11, Agra-Jaipur Road, Dausa","26.9080488","76.3937332"
"ChIJ42EOgBF1cjkRUFmRuAPsytM","Bharat Petroleum, Petrol Pump -Arihant Petroleum (Nrl)","KALAKHO DAUSA, Dausa","26.9190384","76.4755546"
"ChIJF6ITG3-LbTkRwpVi_oaRt2w","Tata motors def yuriya narasi GURJAR","Dausa","26.9087702","76.39155240000001"
"ChIJpU8U5U_1bTkRDRrjDoDSqKo","ESSAR - गजानंद फिलिंग स्टेशन भाण्डारेज","Dausa","26.8796346","76.4436563"
"ChIJdeQH53_6bTkRlmaD7DdYJ84","IndianOil","Ground Floor NH 11A ,Dausa Lalsot Rd, Rahuwas, Chharda, Dausa","26.692972","76.31741699999999"
"ChIJz8gQDLr3bTkRyAKha_--GW8","Parsadi lal Suresh meena","to, Chhareda Road, Rahuwas","26.7383463","76.3493869"
"ChIJ49uYOQDxbTkRLuc_fdPweVk","Chudiyawas","P79W+5VR, Nichooniya","26.7179805","76.2971463"
"ChIJf9V35GL7bTkRMUvadOcBWJo","Hindustan Petroleum Corporation Limited","Ground Floor, SH 24, Didwana","26.602681","76.304008"
"ChIJ0xEXAXj8bTkRhW2YoIIzeWA","Hindustan Petroleum Corporation Limited","CH No 34/960 to 35 NH 11 A, Lalsot","26.603095","76.328848"
"ChIJAb7Tp8XkbTkRojpUdTEq8cI","Pachwara Filling Station","J7G4+WW9, State Highway 24, Ramgarh Pachwara","26.6272859","76.2573524"
"ChIJE3MVKtL7bTkRhF7hLsFMX50","Hindustan Petroleum Corporation Limited","Ground Floor, NH 148A, Salempura","26.6467216","76.3225233"
"ChIJW1b0Rnz8bTkRcW2dAEt31KQ","HP PETROL PUMP - NARDYA FILLING STATION","Village Deedwana SH-24 Tehsil Lalsot, Jaipur","26.594398","76.321227"
"ChIJv9eWLgAPbjkR0L4igHEy0iw","Jio BP petrol pump 2","965X+9MF, Thari","26.3584256","76.2491841"
"ChIJM08keQAPbjkRJxHBg-PSrWg","Jio BP petrol pump 1","9752+97, Thari","26.3588986","76.2506291"
"ChIJBY8FkbgPbjkRiYkMbwaFKAk","IndianOil","Ground Floor Lalsot Rdbonli, Sawaimadhopur, Baroni","26.3322848","76.25511329999999"
"ChIJ127YbsUPbjkRGzBwrm7CMVA","Ambay Filling Station","Kasba Bonli","26.3295746","76.2372342"
"ChIJs_1UHfMFbjkRUlHDbt9qPiY","Hindustan Petroleum Corporation Limited","Khasra No 326, Jastana Road, बौंली","26.338299","76.272959"
"ChIJ7-wbI9YRbjkRcQdyDwDjZVY","Hindustan Petroleum Corporation Limited","Khasra No 1387, Jastana Road, बौंली","26.314101","76.21760100000002"
"ChIJf_oxltQRbjkRFTggvTOpKIc","MR. JITENDRA SAINI","Jatawti","26.2398991","76.2467533"
"ChIJS40w7_ARbjkRkq1AXycpYcY","IndianOil","Unnamed Road, Hindupura","26.2443563","76.23824870000001"
"ChIJlQ5ZyssRbjkRbzrsfQR-CKA","Choudhary Petroleum Ksk","1642, CHOUDHARY PETROLEUM KSK BAS TORDA, Bonli","26.2540819","76.2045622"
"ChIJRWxy-egXbjkRnsIRYpCgabk","IndianOil","Ground Floor, Bhagwatgarh","26.1462647","76.2510132"
"ChIJ0RgJz0olbjkRNRdeywA5D3o","IndianOil","Ground Floor, Alapur, Sawai Madhopur Road, Kushtala","25.9703619","76.2716769"
"ChIJ3QaKwlAlbjkR-iPdNiaBH2Q","IndianOil","Ground Floor, Dhumon Kalan","26.0281171","76.2782507"
"ChIJyTcaXzwlbjkRdNSdcoIC1vs","IndianOil","Ground Floor, Dhumon Kalan","26.028608","76.278554"
"ChIJQx-VLgAlbjkRzKZqNdOi8Ls","Kapil Filling Station","X7CH+FM, Jaisapura","25.9711944","76.2791944"
"ChIJ2ULaeaUxbjkRA22RZtXFNco","Hindustan Petroleum Corporation Limited","Khasra No 386, 387, Lalsot - Kota Mega Highway, Bagawda","25.8866522","76.233733"
"ChIJQWz6VOoxbjkR8nCVr7IJf_c","Essar Oil Petrol Pump","V68C+GW5, Khijoori","25.8662712","76.222368"
"ChIJ5e6QlaEzbjkRUC4xP4EIIO0","IndianOil","Ground Floor, Lalsot Kota Mega Highway Indergarh, Lalpura, Antarda","25.765801","76.184401"
"ChIJbx4EUpjMbzkRpM4FF94VMz4","IndianOil","Ground Floor, Indergarh","25.7296926","76.1877745"
"ChIJ11VM8v3PbzkRQa1bn5ry284","IndianOil","Ground Floor, Amli, Badakhera","25.5783846","76.23152429999999"
"ChIJfXrLLYXFbzkRA1yD9EfIVco","Hindustan Petroleum Corporation Limited","Khasra No 66, SH 33, Laban","25.561214","76.21529799999999"
"ChIJ_8Llu3DNbzkRgcqMFzSPgfA","IndianOil","Ground Floor Mega, Lalsot - Kota Mega Highway, Lakheri","25.6251568","76.191982"
"ChIJyUpX-AnCbzkRu1yfI1TvjFU","IndianOil","Near, 8 line, Mandawara","25.3855436","76.1956207"
"ChIJt6tadADDbzkR1RHqoLsXhzg","Jio BP Petrol pump","C6Q4+W42, Kunethiya","25.4396236","76.2040093"
"ChIJW_gqcADDbzkRVdeSKh60D1g","BP DME 352 Petrol pump ⛽","C6Q4+V39, Ramnagar","25.4396524","76.20523190000002"
